[
  {
    "id": "qa_1_001",
    "source": "0f2eac764c8d04d8d13d8a999342d106.pdf",
    "page_numbers": [
      9
    ],
    "table_idx": 0,
    "question": "According to the table, what rating did Cross Rhythms give to Fallen?",
    "answer": "Cross Rhythms gave Fallen a rating of 9 out of 10 stars.",
    "retrieved_chunks": [
      "Source Rating\nCross Rhythms\n[123]"
    ],
    "retrieved_context": "| Source               | Rating                  |\n|:---------------------|:------------------------|\n| Cross Rhythms        | ⭐⭐⭐⭐⭐⭐⭐⭐⭐[123] |"
  },
  {
    "id": "qa_1_002",
    "source": "0f2eac764c8d04d8d13d8a999342d106.pdf",
    "page_numbers": [
      9
    ],
    "table_idx": 0,
    "question": "Based on the table, what were the ratings given to Fallen by AllMusic and Blender respectively?",
    "answer": "According to the table, AllMusic gave Fallen a rating of 5 out of 5 stars, while Blender gave it a rating of 2 out of 5 stars.",
    "retrieved_chunks": [
      "Source Rating\nAllMusic\n[89]\nBlender\n[122]"
    ],
    "retrieved_context": "| Source               | Rating                  |\n|:---------------------|:------------------------|\n| AllMusic             | ⭐⭐⭐⭐⭐[89]          |\n| Blender              | ⭐⭐☆☆☆[122]            |"
  },
  {
    "id": "qa_1_003",
    "source": "0f2eac764c8d04d8d13d8a999342d106.pdf",
    "page_numbers": [
      9
    ],
    "table_idx": 0,
    "question": "According to the table, which sources gave Fallen a grade of B-?",
    "answer": "Entertainment Weekly and The Village Voice both gave Fallen a grade of B-.",
    "retrieved_chunks": [
      "Source Rating\nEntertainment Weekly B−[90]\nThe Village Voice B−[92]"
    ],
    "retrieved_context": "| Source               | Rating                  |\n|:---------------------|:------------------------|\n| Entertainment Weekly | B−[90]                  |\n| The Village Voice    | B−[92]                  |"
  },
  {
    "id": "qa_1_004",
    "source": "0f2eac764c8d04d8d13d8a999342d106.pdf",
    "page_numbers": [
      9
    ],
    "table_idx": 0,
    "question": "What rating did Spin give Fallen, and what was Melissa Maerz's opinion of the album?",
    "answer": "Spin gave Fallen a rating of 2 out of 5 stars, and Melissa Maerz of Spin stated that \"Nu metal gets a powdering of Andrew Lloyd Webber theatrics as Lee aces her piano A-levels, adds a string section, and tackles capital letter issues – God ('Tourniquet'), Love ('Going Under'), and Death ('Bring Me To Life') – with the grandeur they deserve.\"",
    "retrieved_chunks": [
      "Source Rating\nSpin\n[60]",
      "Billboard's Christa Titus called the album a \"highly polished, hook-filled affair.\"[124] Melissa Maerz of Spin\ngave it four out of five stars: \"Nu metal gets a powdering of Andrew Lloyd Webber theatrics as Lee aces her\npiano A-levels, adds a string section, and tackles capital letter issues – God ('Tourniquet'), Love ('Going\nUnder'), and Death ('Bring Me To Life') – with the grandeur they deserve.\"[60]"
    ],
    "retrieved_context": "| Source               | Rating                  |\n|:---------------------|:------------------------|\n| Spin                 | ⭐⭐☆☆☆[60]             |"
  },
  {
    "id": "qa_1_005",
    "source": "0f2eac764c8d04d8d13d8a999342d106.pdf",
    "page_numbers": [
      9
    ],
    "table_idx": 0,
    "question": "Based on the table, which sources gave Fallen a rating of 3 out of 5 stars?",
    "answer": "The Austin Chronicle, Billboard, and Rolling Stone all gave Fallen a rating of 3 out of 5 stars.",
    "retrieved_chunks": [
      "Source Rating\nThe Austin Chronicle\n[93]\nBillboard\n[63]\nRolling Stone\n[76]"
    ],
    "retrieved_context": "| Source               | Rating                  |\n|:---------------------|:------------------------|\n| The Austin Chronicle | ⭐⭐⭐☆☆[93]            |\n| Billboard            | ⭐⭐⭐☆☆[63]            |\n| Rolling Stone        | ⭐⭐⭐☆☆[76]            |"
  },
  {
    "id": "qa_6_001",
    "source": "0f2eac764c8d04d8d13d8a999342d106.pdf",
    "page_numbers": [
      14
    ],
    "table_idx": 0,
    "question": "In 2006, what were the chart positions for the Belgian Midprice Albums (Ultratop Flanders) and Belgian Midprice Albums (Ultratop Wallonia)?",
    "answer": "In 2006, the Belgian Midprice Albums (Ultratop Flanders) chart position was 32, while the Belgian Midprice Albums (Ultratop Wallonia) chart position was 24.",
    "retrieved_chunks": [],
    "retrieved_context": "| Chart (2006)                                     |   Position |\n|:-------------------------------------------------|-----------:|\n| Belgian Midprice Albums (Ultratop Flanders)[225] |         32 |\n| Belgian Midprice Albums (Ultratop Wallonia)[226] |         24 |\n| UK Albums (OCC)[227]                             |        191 |\n| US Catalog Albums (Billboard)[228]               |         45 |"
  },
  {
    "id": "qa_6_002",
    "source": "0f2eac764c8d04d8d13d8a999342d106.pdf",
    "page_numbers": [
      14
    ],
    "table_idx": 0,
    "question": "According to the 2006 chart positions, which album had the lowest position: Belgian Midprice Albums (Ultratop Flanders), Belgian Midprice Albums (Ultratop Wallonia), UK Albums (OCC), or US Catalog Albums (Billboard)?",
    "answer": "In 2006, the UK Albums (OCC) had a chart position of 191, which is the lowest position compared to the other charts listed in the table.",
    "retrieved_chunks": [],
    "retrieved_context": "| Chart (2006)                                     |   Position |\n|:-------------------------------------------------|-----------:|\n| Belgian Midprice Albums (Ultratop Flanders)[225] |         32 |\n| Belgian Midprice Albums (Ultratop Wallonia)[226] |         24 |\n| UK Albums (OCC)[227]                             |        191 |\n| US Catalog Albums (Billboard)[228]               |         45 |"
  },
  {
    "id": "qa_6_003",
    "source": "0f2eac764c8d04d8d13d8a999342d106.pdf",
    "page_numbers": [
      14
    ],
    "table_idx": 0,
    "question": "What position did the US Catalog Albums (Billboard) chart reach in 2006?",
    "answer": "The US Catalog Albums (Billboard) chart reached position 45 in 2006.",
    "retrieved_chunks": [],
    "retrieved_context": "| Chart (2006)                                     |   Position |\n|:-------------------------------------------------|-----------:|\n| Belgian Midprice Albums (Ultratop Flanders)[225] |         32 |\n| Belgian Midprice Albums (Ultratop Wallonia)[226] |         24 |\n| UK Albums (OCC)[227]                             |        191 |\n| US Catalog Albums (Billboard)[228]               |         45 |"
  },
  {
    "id": "qa_6_004",
    "source": "0f2eac764c8d04d8d13d8a999342d106.pdf",
    "page_numbers": [
      14
    ],
    "table_idx": 0,
    "question": "In 2006, which chart had a higher position: the Belgian Midprice Albums (Ultratop Wallonia) or the UK Albums (OCC)?",
    "answer": "The Belgian Midprice Albums (Ultratop Wallonia) chart had a position of 24 in 2006, while the UK Albums (OCC) chart had a position of 191 in the same year; therefore, the Belgian Midprice Albums (Ultratop Wallonia) chart had a higher position.",
    "retrieved_chunks": [],
    "retrieved_context": "| Chart (2006)                                     |   Position |\n|:-------------------------------------------------|-----------:|\n| Belgian Midprice Albums (Ultratop Flanders)[225] |         32 |\n| Belgian Midprice Albums (Ultratop Wallonia)[226] |         24 |\n| UK Albums (OCC)[227]                             |        191 |\n| US Catalog Albums (Billboard)[228]               |         45 |"
  },
  {
    "id": "qa_6_005",
    "source": "0f2eac764c8d04d8d13d8a999342d106.pdf",
    "page_numbers": [
      14
    ],
    "table_idx": 0,
    "question": "What were the US Catalog Albums (Billboard) chart positions in 2006, 2007 and 2008?",
    "answer": "The US Catalog Albums (Billboard) chart positions were 45 in 2006, 22 in 2007 and 36 in 2008.",
    "retrieved_chunks": [],
    "retrieved_context": "| Chart (2006)                                     |   Position |\n|:-------------------------------------------------|-----------:|\n| Belgian Midprice Albums (Ultratop Flanders)[225] |         32 |\n| Belgian Midprice Albums (Ultratop Wallonia)[226] |         24 |\n| UK Albums (OCC)[227]                             |        191 |\n| US Catalog Albums (Billboard)[228]               |         45 |"
  },
  {
    "id": "qa_11_001",
    "source": "0f2eac764c8d04d8d13d8a999342d106.pdf",
    "page_numbers": [
      14
    ],
    "table_idx": 0,
    "question": "What position did the album 'Fallen' reach on the US Catalog Albums (Billboard) chart in 2007, and how does it compare to its position in 2006?",
    "answer": "In 2007, the album 'Fallen' reached position 22 on the US Catalog Albums (Billboard) chart. In 2006, it reached position 45 on the same chart.",
    "retrieved_chunks": [
      "US Catalog Albums (Billboard)[228]45\n2007 year-end chart performance for Fallen\nChart (2007) Position\nUS Catalog Albums (Billboard)[229]22"
    ],
    "retrieved_context": "| Chart(2007)                     |   Position |\n|:--------------------------------|-----------:|\n| USCatalogAlbums(Billboard)[229] |         22 |"
  },
  {
    "id": "qa_11_002",
    "source": "0f2eac764c8d04d8d13d8a999342d106.pdf",
    "page_numbers": [
      14
    ],
    "table_idx": 0,
    "question": "Which chart, US Catalog Albums (Billboard) or US Billboard 200, is listed in the table, and for what years are they mentioned in the surrounding context?",
    "answer": "The US Catalog Albums (Billboard) chart is listed in the table for the year 2007, while the US Billboard 200 chart is mentioned in the context for the year 2003, 2004 and 2009.",
    "retrieved_chunks": [
      "US Billboard 200[178]19European Albums (Billboard)[211]5\nFinnish Albums (Musiikkituottajat)[212]16\nFrench Albums (SNEP)[213]20\nGerman Albums (Offizielle Top\n100)[214]10\nHungarian Albums (MAHASZ)[215]87\nItalian Albums (FIMI)[216]41\nNew Zealand Albums (RMNZ)[217]14\nPortuguese Albums (AFP)[218]5\nSwedish Albums\n(Sverigetopplistan)[219]39\nSwedish Albums & Compilations\n(Sverigetopplistan)[220]50\nSwiss Albums (Schweizer\nHitparade)[221]15\nUK Albums (OCC)[222]59\nUS Billboard 200[223]6\nWorldwide Albums (IFPI)[224]43\n2006 year-end chart performance for Fallen\nChart (2006) Position\nBelgian Midprice Albums (Ultratop\nFlanders)[225]32\nBelgian Midprice Albums (Ultratop\nWallonia)[226]24\nUK Albums (OCC)[227]191\nUS Catalog Albums (Billboard)[228]45\n2007 year-end chart performance for Fallen\nChart (2007) Position\nUS Catalog Albums (Billboard)[229]22\n2008 year-end chart performance for Fallen\nChart (2008) Position\nUS Catalog Albums (Billboard)[230]36"
    ],
    "retrieved_context": "| Chart(2007)                     |   Position |\n|:--------------------------------|-----------:|\n| USCatalogAlbums(Billboard)[229] |         22 |"
  },
  {
    "id": "qa_11_003",
    "source": "0f2eac764c8d04d8d13d8a999342d106.pdf",
    "page_numbers": [
      14
    ],
    "table_idx": 0,
    "question": "What was the US Catalog Albums (Billboard) chart position for the album 'Fallen' in 2007, and how did it compare to its position in 2008?",
    "answer": "In 2007, the US Catalog Albums (Billboard) chart position for 'Fallen' was 22. In 2008, the US Catalog Albums (Billboard) chart position for 'Fallen' was 36.",
    "retrieved_chunks": [
      "US Catalog Albums (Billboard)[228]45\n2007 year-end chart performance for Fallen\nChart (2007) Position\nUS Catalog Albums (Billboard)[229]22\n2008 year-end chart performance for Fallen\nChart (2008) Position\nUS Catalog Albums (Billboard)[230]36"
    ],
    "retrieved_context": "| Chart(2007)                     |   Position |\n|:--------------------------------|-----------:|\n| USCatalogAlbums(Billboard)[229] |         22 |"
  },
  {
    "id": "qa_11_004",
    "source": "0f2eac764c8d04d8d13d8a999342d106.pdf",
    "page_numbers": [
      14
    ],
    "table_idx": 0,
    "question": "What was the chart position of the album 'Fallen' on the US Catalog Albums (Billboard) in 2007, and how does that compare to its highest position on the Australian Albums (ARIA) chart in 2003?",
    "answer": "The album 'Fallen' reached position 22 on the US Catalog Albums (Billboard) chart in 2007, while it achieved position 1 on the Australian Albums (ARIA) chart in 2003.",
    "retrieved_chunks": [
      "Australian Albums (ARIA)[140]1\nAustralian Heavy Rock & Metal\nAlbums (ARIA)[141]1\nAustrian Albums (Ö3 Austria)[142]1\nBelgian Albums (Ultratop Flanders)[143]3\nBelgian Albums (Ultratop Wallonia)[144]4\nCanadian Albums (Billboard)[145]1Year-end charts [edit]\n2003 year-end chart performance for Fallen\nChart (2003) Position\nArgentine Albums (CAPIF)[179]13\nAustralian Albums (ARIA)[180]15",
      "US Catalog Albums (Billboard)[228]45\n2007 year-end chart performance for Fallen\nChart (2007) Position\nUS Catalog Albums (Billboard)[229]22"
    ],
    "retrieved_context": "| Chart(2007)                     |   Position |\n|:--------------------------------|-----------:|\n| USCatalogAlbums(Billboard)[229] |         22 |"
  },
  {
    "id": "qa_11_005",
    "source": "0f2eac764c8d04d8d13d8a999342d106.pdf",
    "page_numbers": [
      14
    ],
    "table_idx": 0,
    "question": "What was the US Catalog Albums (Billboard) chart position for the album 'Fallen' in 2007, and how does it compare to the UK Albums (OCC) chart position for 'Fallen' in 2006?",
    "answer": "The album 'Fallen' reached position 22 on the US Catalog Albums (Billboard) chart in 2007. In the same year, the UK Albums (OCC) chart position for 'Fallen' was 191.",
    "retrieved_chunks": [
      "UK Albums (OCC)[227]191\nUS Catalog Albums (Billboard)[228]45\n2007 year-end chart performance for Fallen\nChart (2007) Position\nUS Catalog Albums (Billboard)[229]22"
    ],
    "retrieved_context": "| Chart(2007)                     |   Position |\n|:--------------------------------|-----------:|\n| USCatalogAlbums(Billboard)[229] |         22 |"
  },
  {
    "id": "qa_16_001",
    "source": "0f2eac764c8d04d8d13d8a999342d106.pdf",
    "page_numbers": [
      14
    ],
    "table_idx": 0,
    "question": "What position did the album 'Fallen' reach on the US Catalog Albums (Billboard) chart in 2008?",
    "answer": "In 2008, the album 'Fallen' reached position 36 on the US Catalog Albums (Billboard) chart.",
    "retrieved_chunks": [
      "US Top Catalog Albums (Billboard)[172]1\nUS Top Hard Rock Albums\n(Billboard)[173]18\nUS Top Rock Albums (Billboard)[174]30\nMonthly charts\nMonthly chart performance for Fallen\nChart (2004)Peak\nposition\nRussian Albums (NFPF)[175]3\nDecade-end charts\n2000s decade-end chart performance for\nFallen\nChart (2000–2009)Position\nAustralian Albums (ARIA)[176]15\nUK Albums (OCC)[177]87\nUS Billboard 200[178]19European Albums (Billboard)[211]5\nFinnish Albums (Musiikkituottajat)[212]16\nFrench Albums (SNEP)[213]20\nGerman Albums (Offizielle Top\n100)[214]10\nHungarian Albums (MAHASZ)[215]87\nItalian Albums (FIMI)[216]41\nNew Zealand Albums (RMNZ)[217]14\nPortuguese Albums (AFP)[218]5\nSwedish Albums\n(Sverigetopplistan)[219]39\nSwedish Albums & Compilations\n(Sverigetopplistan)[220]50\nSwiss Albums (Schweizer\nHitparade)[221]15\nUK Albums (OCC)[222]59\nUS Billboard 200[223]6\nWorldwide Albums (IFPI)[224]43\n2006 year-end chart performance for Fallen\nChart (2006) Position\nBelgian Midprice Albums (Ultratop\nFlanders)[225]32\nBelgian Midprice Albums (Ultratop\nWallonia)[226]24\nUK Albums (OCC)[227]191\nUS Catalog Albums (Billboard)[228]45\n2007 year-end chart performance for Fallen\nChart (2007) Position\nUS Catalog Albums (Billboard)[229]22\n2008 year-end chart performance for Fallen\nChart (2008) Position\nUS Catalog Albums (Billboard)[230]36"
    ],
    "retrieved_context": "| Chart(2008)                        |   Position |\n|:-----------------------------------|-----------:|\n| US Catalog Albums (Billboard)[230] |         36 |"
  },
  {
    "id": "qa_16_002",
    "source": "0f2eac764c8d04d8d13d8a999342d106.pdf",
    "page_numbers": [
      14
    ],
    "table_idx": 0,
    "question": "According to the table, which chart is listed for the album 'Fallen' in 2008?",
    "answer": "The US Catalog Albums (Billboard) is the only chart listed in the provided table.",
    "retrieved_chunks": [
      "US Top Catalog Albums (Billboard)[172]1\nUS Top Hard Rock Albums\n(Billboard)[173]18\nUS Top Rock Albums (Billboard)[174]30\nMonthly charts\nMonthly chart performance for Fallen\nChart (2004)Peak\nposition\nRussian Albums (NFPF)[175]3\nDecade-end charts\n2000s decade-end chart performance for\nFallen\nChart (2000–2009)Position\nAustralian Albums (ARIA)[176]15\nUK Albums (OCC)[177]87\nUS Billboard 200[178]19European Albums (Billboard)[211]5\nFinnish Albums (Musiikkituottajat)[212]16\nFrench Albums (SNEP)[213]20\nGerman Albums (Offizielle Top\n100)[214]10\nHungarian Albums (MAHASZ)[215]87\nItalian Albums (FIMI)[216]41\nNew Zealand Albums (RMNZ)[217]14\nPortuguese Albums (AFP)[218]5\nSwedish Albums\n(Sverigetopplistan)[219]39\nSwedish Albums & Compilations\n(Sverigetopplistan)[220]50\nSwiss Albums (Schweizer\nHitparade)[221]15\nUK Albums (OCC)[222]59\nUS Billboard 200[223]6\nWorldwide Albums (IFPI)[224]43\n2006 year-end chart performance for Fallen\nChart (2006) Position\nBelgian Midprice Albums (Ultratop\nFlanders)[225]32\nBelgian Midprice Albums (Ultratop\nWallonia)[226]24\nUK Albums (OCC)[227]191\nUS Catalog Albums (Billboard)[228]45\n2007 year-end chart performance for Fallen\nChart (2007) Position\nUS Catalog Albums (Billboard)[229]22\n2008 year-end chart performance for Fallen\nChart (2008) Position\nUS Catalog Albums (Billboard)[230]36"
    ],
    "retrieved_context": "| Chart(2008)                        |   Position |\n|:-----------------------------------|-----------:|\n| US Catalog Albums (Billboard)[230] |         36 |"
  },
  {
    "id": "qa_16_003",
    "source": "0f2eac764c8d04d8d13d8a999342d106.pdf",
    "page_numbers": [
      14
    ],
    "table_idx": 0,
    "question": "How does the position of 'Fallen' on the US Catalog Albums (Billboard) chart in 2008 compare to its position in 2007?",
    "answer": "The album 'Fallen' reached position 36 on the US Catalog Albums (Billboard) chart in 2008, while in 2007 it reached position 22 on the US Catalog Albums (Billboard) chart.",
    "retrieved_chunks": [
      "US Top Catalog Albums (Billboard)[172]1\nUS Top Hard Rock Albums\n(Billboard)[173]18\nUS Top Rock Albums (Billboard)[174]30\nMonthly charts\nMonthly chart performance for Fallen\nChart (2004)Peak\nposition\nRussian Albums (NFPF)[175]3\nDecade-end charts\n2000s decade-end chart performance for\nFallen\nChart (2000–2009)Position\nAustralian Albums (ARIA)[176]15\nUK Albums (OCC)[177]87\nUS Billboard 200[178]19European Albums (Billboard)[211]5\nFinnish Albums (Musiikkituottajat)[212]16\nFrench Albums (SNEP)[213]20\nGerman Albums (Offizielle Top\n100)[214]10\nHungarian Albums (MAHASZ)[215]87\nItalian Albums (FIMI)[216]41\nNew Zealand Albums (RMNZ)[217]14\nPortuguese Albums (AFP)[218]5\nSwedish Albums\n(Sverigetopplistan)[219]39\nSwedish Albums & Compilations\n(Sverigetopplistan)[220]50\nSwiss Albums (Schweizer\nHitparade)[221]15\nUK Albums (OCC)[222]59\nUS Billboard 200[223]6\nWorldwide Albums (IFPI)[224]43\n2006 year-end chart performance for Fallen\nChart (2006) Position\nBelgian Midprice Albums (Ultratop\nFlanders)[225]32\nBelgian Midprice Albums (Ultratop\nWallonia)[226]24\nUK Albums (OCC)[227]191\nUS Catalog Albums (Billboard)[228]45\n2007 year-end chart performance for Fallen\nChart (2007) Position\nUS Catalog Albums (Billboard)[229]22\n2008 year-end chart performance for Fallen\nChart (2008) Position\nUS Catalog Albums (Billboard)[230]36"
    ],
    "retrieved_context": "| Chart(2008)                        |   Position |\n|:-----------------------------------|-----------:|\n| US Catalog Albums (Billboard)[230] |         36 |"
  },
  {
    "id": "qa_16_004",
    "source": "0f2eac764c8d04d8d13d8a999342d106.pdf",
    "page_numbers": [
      14
    ],
    "table_idx": 0,
    "question": "How does the 2008 position of 'Fallen' on the US Catalog Albums (Billboard) chart compare to its peak position on the US Top Catalog Albums chart?",
    "answer": "The album 'Fallen' reached position 36 on the US Catalog Albums (Billboard) chart in 2008, which is lower than its peak position of 1 on the US Top Catalog Albums chart.",
    "retrieved_chunks": [
      "US Top Catalog Albums (Billboard)[172]1\nUS Top Hard Rock Albums\n(Billboard)[173]18\nUS Top Rock Albums (Billboard)[174]30\nMonthly charts\nMonthly chart performance for Fallen\nChart (2004)Peak\nposition\nRussian Albums (NFPF)[175]3\nDecade-end charts\n2000s decade-end chart performance for\nFallen\nChart (2000–2009)Position\nAustralian Albums (ARIA)[176]15\nUK Albums (OCC)[177]87\nUS Billboard 200[178]19European Albums (Billboard)[211]5\nFinnish Albums (Musiikkituottajat)[212]16\nFrench Albums (SNEP)[213]20\nGerman Albums (Offizielle Top\n100)[214]10\nHungarian Albums (MAHASZ)[215]87\nItalian Albums (FIMI)[216]41\nNew Zealand Albums (RMNZ)[217]14\nPortuguese Albums (AFP)[218]5\nSwedish Albums\n(Sverigetopplistan)[219]39\nSwedish Albums & Compilations\n(Sverigetopplistan)[220]50\nSwiss Albums (Schweizer\nHitparade)[221]15\nUK Albums (OCC)[222]59\nUS Billboard 200[223]6\nWorldwide Albums (IFPI)[224]43\n2006 year-end chart performance for Fallen\nChart (2006) Position\nBelgian Midprice Albums (Ultratop\nFlanders)[225]32\nBelgian Midprice Albums (Ultratop\nWallonia)[226]24\nUK Albums (OCC)[227]191\nUS Catalog Albums (Billboard)[228]45\n2007 year-end chart performance for Fallen\nChart (2007) Position\nUS Catalog Albums (Billboard)[229]22\n2008 year-end chart performance for Fallen\nChart (2008) Position\nUS Catalog Albums (Billboard)[230]36"
    ],
    "retrieved_context": "| Chart(2008)                        |   Position |\n|:-----------------------------------|-----------:|\n| US Catalog Albums (Billboard)[230] |         36 |"
  },
  {
    "id": "qa_16_005",
    "source": "0f2eac764c8d04d8d13d8a999342d106.pdf",
    "page_numbers": [
      14
    ],
    "table_idx": 0,
    "question": "In 2008, 'Fallen' was at position 36 on the US Catalog Albums chart; what was its best position on the US Billboard 200 chart?",
    "answer": "While the album 'Fallen' reached position 36 on the US Catalog Albums (Billboard) chart in 2008, it also achieved a peak position of 3 on the US Billboard 200 chart.",
    "retrieved_chunks": [
      "US Top Catalog Albums (Billboard)[172]1\nUS Top Hard Rock Albums\n(Billboard)[173]18\nUS Top Rock Albums (Billboard)[174]30\nMonthly charts\nMonthly chart performance for Fallen\nChart (2004)Peak\nposition\nRussian Albums (NFPF)[175]3\nDecade-end charts\n2000s decade-end chart performance for\nFallen\nChart (2000–2009)Position\nAustralian Albums (ARIA)[176]15\nUK Albums (OCC)[177]87\nUS Billboard 200[178]19European Albums (Billboard)[211]5\nFinnish Albums (Musiikkituottajat)[212]16\nFrench Albums (SNEP)[213]20\nGerman Albums (Offizielle Top\n100)[214]10\nHungarian Albums (MAHASZ)[215]87\nItalian Albums (FIMI)[216]41\nNew Zealand Albums (RMNZ)[217]14\nPortuguese Albums (AFP)[218]5\nSwedish Albums\n(Sverigetopplistan)[219]39\nSwedish Albums & Compilations\n(Sverigetopplistan)[220]50\nSwiss Albums (Schweizer\nHitparade)[221]15\nUK Albums (OCC)[222]59\nUS Billboard 200[223]6\nWorldwide Albums (IFPI)[224]43\n2006 year-end chart performance for Fallen\nChart (2006) Position\nBelgian Midprice Albums (Ultratop\nFlanders)[225]32\nBelgian Midprice Albums (Ultratop\nWallonia)[226]24\nUK Albums (OCC)[227]191\nUS Catalog Albums (Billboard)[228]45\n2007 year-end chart performance for Fallen\nChart (2007) Position\nUS Catalog Albums (Billboard)[229]22\n2008 year-end chart performance for Fallen\nChart (2008) Position\nUS Catalog Albums (Billboard)[230]36"
    ],
    "retrieved_context": "| Chart(2008)                        |   Position |\n|:-----------------------------------|-----------:|\n| US Catalog Albums (Billboard)[230] |         36 |"
  },
  {
    "id": "qa_21_001",
    "source": "0f2eac764c8d04d8d13d8a999342d106.pdf",
    "page_numbers": [
      16,
      17
    ],
    "table_idx": 0,
    "question": "According to the table, what are the release dates, formats, labels, and catalog numbers for the album \"Fallen\" in the United States?",
    "answer": "The album \"Fallen\" was released in the United States on March 4, 2003, with catalog number 60150-13063-2 under the label Wind-up, and again on May 21, 2013, as a Remastered LP (black and purple) with catalog number 60150-13359-1, also under Wind-up.",
    "retrieved_chunks": [
      "France[262]October 5, 2009\nJapan[264]October 12, 2011Limited edition CD reissueEMI TOCP-54276\nUnited States[260]May 21, 2013Remastered LP (black and\npurple)Wind-up60150-13359-\n1",
      "Release history [edit]\nRegion Date Format Label Catalog\nUnited States[260]March 4, 2003\nCD · digital downloadWind-up60150-13063-\n2"
    ],
    "retrieved_context": "| Region              | Date               | Format                           | Label          | Catalog       |\n|:--------------------|:-------------------|:---------------------------------|:---------------|:--------------|\n| United States[260]  | March 4, 2003      |                                  | Wind-up        | 60150-13063-2 |\n| Canada[261]         | April 1, 2003      |                                  | Wind-up        | EK 91746      |\n| Austria[262]        | April 28, 2003     | CD · digital download            | Wind-up · Epic | WIN 510879 2  |\n| Germany[262]        | April 28, 2003     | CD · digital download            | Wind-up · Epic | WIN 687043 2  |\n| United Kingdom[262] | April 28, 2003     | CD · digital download            | Wind-up · Epic | 510879200     |\n| Australia[263]      | May 19, 2003       |                                  |                | 510879200     |\n| France[262]         | May 20, 2003       |                                  |                | WIN 510879 2  |\n| Japan[264]          | July 7, 2003       |                                  | Sony           | EICP-253      |\n| Japan[264]          | September 9, 2003  | Limited edition CD+DVD           | Sony           | EICP-242      |\n| Austria[262]        | January 26, 2004   | CD reissue                       | Wind-up · Epic | WIN 510879 9  |\n| Germany[262]        | February 4, 2004   |                                  | Wind-up · Epic | WIN 510879 9  |\n| France[262]         | February 4, 2004   |                                  | Wind-up · Epic | WIN 510879 9  |\n| United Kingdom[262] | February 23, 2004  |                                  | Wind-up · Epic | WIN 510879 9  |\n| Austria[262]        | September 25, 2009 |                                  | Wind-up · EMI  | WIN 687043 2  |\n| Germany[262]        | September 28, 2009 |                                  | Wind-up · EMI  | WIN 687043 2  |\n| United Kingdom[262] | September 28, 2009 |                                  | Wind-up · EMI  | WIN 687043 2  |\n| France[262]         | October 5, 2009    |                                  |                |               |\n| Japan[264]          | October 12, 2011   | Limited edition CD reissue       | EMI            | TOCP-54276    |\n| United States[260]  | May 21, 2013       | Remastered LP (black and purple) | Wind-up        | 60150-13359-1 |"
  },
  {
    "id": "qa_21_002",
    "source": "0f2eac764c8d04d8d13d8a999342d106.pdf",
    "page_numbers": [
      16,
      17
    ],
    "table_idx": 0,
    "question": "According to the table, what are the different release dates, formats, labels, and catalog numbers for the album \"Fallen\" in Austria?",
    "answer": "The album \"Fallen\" was released in Austria three times: April 28, 2003 (CD · digital download, Wind-up · Epic, WIN 510879 2), January 26, 2004 (CD reissue, Wind-up · Epic, WIN 510879 9), and September 25, 2009 (Wind-up · EMI, WIN 687043 2).",
    "retrieved_chunks": [
      "Release history [edit]\nRegion Date Format Label Catalog\nUnited States[260]March 4, 2003\nCD · digital downloadWind-up60150-13063-\n2\nCanada[261]April 1, 2003\nWind-up ·\nEpicEK 91746\nAustria[262]\nApril 28, 2003WIN 510879 2\nGermany[262]\nUnited\nKingdom[262]WIN 687043 2\nAustralia[263]May 19, 2003 510879200\nFrance[262]May 20, 2003 WIN 510879 2\nJapan[264]July 7, 2003\nSonyEICP-253\nSeptember 9, 2003Limited edition CD+DVD EICP-242\nAustria[262]\nJanuary 26, 2004CD reissue\nWind-up ·\nEpicWIN 510879 9Germany[262]\nFrance[262]February 4, 2004\nUnited\nKingdom[262]February 23, 2004\nAustria[262]September 25,\n2009Wind-up ·\nEMIWIN 687043 2"
    ],
    "retrieved_context": "| Region              | Date               | Format                           | Label          | Catalog       |\n|:--------------------|:-------------------|:---------------------------------|:---------------|:--------------|\n| United States[260]  | March 4, 2003      |                                  | Wind-up        | 60150-13063-2 |\n| Canada[261]         | April 1, 2003      |                                  | Wind-up        | EK 91746      |\n| Austria[262]        | April 28, 2003     | CD · digital download            | Wind-up · Epic | WIN 510879 2  |\n| Germany[262]        | April 28, 2003     | CD · digital download            | Wind-up · Epic | WIN 687043 2  |\n| United Kingdom[262] | April 28, 2003     | CD · digital download            | Wind-up · Epic | 510879200     |\n| Australia[263]      | May 19, 2003       |                                  |                | 510879200     |\n| France[262]         | May 20, 2003       |                                  |                | WIN 510879 2  |\n| Japan[264]          | July 7, 2003       |                                  | Sony           | EICP-253      |\n| Japan[264]          | September 9, 2003  | Limited edition CD+DVD           | Sony           | EICP-242      |\n| Austria[262]        | January 26, 2004   | CD reissue                       | Wind-up · Epic | WIN 510879 9  |\n| Germany[262]        | February 4, 2004   |                                  | Wind-up · Epic | WIN 510879 9  |\n| France[262]         | February 4, 2004   |                                  | Wind-up · Epic | WIN 510879 9  |\n| United Kingdom[262] | February 23, 2004  |                                  | Wind-up · Epic | WIN 510879 9  |\n| Austria[262]        | September 25, 2009 |                                  | Wind-up · EMI  | WIN 687043 2  |\n| Germany[262]        | September 28, 2009 |                                  | Wind-up · EMI  | WIN 687043 2  |\n| United Kingdom[262] | September 28, 2009 |                                  | Wind-up · EMI  | WIN 687043 2  |\n| France[262]         | October 5, 2009    |                                  |                |               |\n| Japan[264]          | October 12, 2011   | Limited edition CD reissue       | EMI            | TOCP-54276    |\n| United States[260]  | May 21, 2013       | Remastered LP (black and purple) | Wind-up        | 60150-13359-1 |"
  },
  {
    "id": "qa_21_003",
    "source": "0f2eac764c8d04d8d13d8a999342d106.pdf",
    "page_numbers": [
      16,
      17
    ],
    "table_idx": 0,
    "question": "What are the release dates, formats, labels, and catalog numbers for the album \"Fallen\" in Germany?",
    "answer": "The album \"Fallen\" was released in Germany on April 28, 2003 (CD · digital download, Wind-up · Epic, WIN 687043 2), February 4, 2004 (Wind-up · Epic, WIN 510879 9), and September 28, 2009 (Wind-up · EMI, WIN 687043 2).",
    "retrieved_chunks": [
      "Release history [edit]\nRegion Date Format Label Catalog\nUnited States[260]March 4, 2003\nCD · digital downloadWind-up60150-13063-\n2\nCanada[261]April 1, 2003\nWind-up ·\nEpicEK 91746\nAustria[262]\nApril 28, 2003WIN 510879 2\nGermany[262]\nUnited\nKingdom[262]WIN 687043 2\nAustralia[263]May 19, 2003 510879200\nFrance[262]May 20, 2003 WIN 510879 2\nJapan[264]July 7, 2003\nSonyEICP-253\nSeptember 9, 2003Limited edition CD+DVD EICP-242\nAustria[262]\nJanuary 26, 2004CD reissue\nWind-up ·\nEpicWIN 510879 9Germany[262]\nFrance[262]February 4, 2004\nUnited\nKingdom[262]February 23, 2004\nAustria[262]September 25,\n2009Wind-up ·\nEMIWIN 687043 2\nGermany[262]\nUnited\nKingdom[262]September 28,\n2009"
    ],
    "retrieved_context": "| Region              | Date               | Format                           | Label          | Catalog       |\n|:--------------------|:-------------------|:---------------------------------|:---------------|:--------------|\n| United States[260]  | March 4, 2003      |                                  | Wind-up        | 60150-13063-2 |\n| Canada[261]         | April 1, 2003      |                                  | Wind-up        | EK 91746      |\n| Austria[262]        | April 28, 2003     | CD · digital download            | Wind-up · Epic | WIN 510879 2  |\n| Germany[262]        | April 28, 2003     | CD · digital download            | Wind-up · Epic | WIN 687043 2  |\n| United Kingdom[262] | April 28, 2003     | CD · digital download            | Wind-up · Epic | 510879200     |\n| Australia[263]      | May 19, 2003       |                                  |                | 510879200     |\n| France[262]         | May 20, 2003       |                                  |                | WIN 510879 2  |\n| Japan[264]          | July 7, 2003       |                                  | Sony           | EICP-253      |\n| Japan[264]          | September 9, 2003  | Limited edition CD+DVD           | Sony           | EICP-242      |\n| Austria[262]        | January 26, 2004   | CD reissue                       | Wind-up · Epic | WIN 510879 9  |\n| Germany[262]        | February 4, 2004   |                                  | Wind-up · Epic | WIN 510879 9  |\n| France[262]         | February 4, 2004   |                                  | Wind-up · Epic | WIN 510879 9  |\n| United Kingdom[262] | February 23, 2004  |                                  | Wind-up · Epic | WIN 510879 9  |\n| Austria[262]        | September 25, 2009 |                                  | Wind-up · EMI  | WIN 687043 2  |\n| Germany[262]        | September 28, 2009 |                                  | Wind-up · EMI  | WIN 687043 2  |\n| United Kingdom[262] | September 28, 2009 |                                  | Wind-up · EMI  | WIN 687043 2  |\n| France[262]         | October 5, 2009    |                                  |                |               |\n| Japan[264]          | October 12, 2011   | Limited edition CD reissue       | EMI            | TOCP-54276    |\n| United States[260]  | May 21, 2013       | Remastered LP (black and purple) | Wind-up        | 60150-13359-1 |"
  },
  {
    "id": "qa_21_004",
    "source": "0f2eac764c8d04d8d13d8a999342d106.pdf",
    "page_numbers": [
      16,
      17
    ],
    "table_idx": 0,
    "question": "Based on the table and additional text, what were the release dates, formats, labels, and catalog numbers for the album \"Fallen\" in the United Kingdom, and what were its sales and certification?",
    "answer": "The album \"Fallen\" had three releases in the United Kingdom: April 28, 2003 (CD · digital download, Wind-up · Epic, 510879200), February 23, 2004 (Wind-up · Epic, WIN 510879 9), and September 28, 2009 (Wind-up · EMI, WIN 687043 2). According to the text, the album sold 1,352,806 units in the UK and was certified 4x Platinum.",
    "retrieved_chunks": [
      "Release history [edit]\nRegion Date Format Label Catalog\nUnited States[260]March 4, 2003\nCD · digital downloadWind-up60150-13063-\n2\nCanada[261]April 1, 2003\nWind-up ·\nEpicEK 91746\nAustria[262]\nApril 28, 2003WIN 510879 2\nGermany[262]\nUnited\nKingdom[262]WIN 687043 2\nAustralia[263]May 19, 2003 510879200\nFrance[262]May 20, 2003 WIN 510879 2\nJapan[264]July 7, 2003\nSonyEICP-253\nSeptember 9, 2003Limited edition CD+DVD EICP-242\nAustria[262]\nJanuary 26, 2004CD reissue\nWind-up ·\nEpicWIN 510879 9Germany[262]\nFrance[262]February 4, 2004\nUnited\nKingdom[262]February 23, 2004\nAustria[262]September 25,\n2009Wind-up ·\nEMIWIN 687043 2\nGermany[262]\nUnited\nKingdom[262]September 28,\n2009",
      "Switzerland (IFPI Switzerland)[256]2× Platinum80,000^\nUnited Kingdom (BPI)[258]4× Platinum1,352,806[257]\nUnited States (RIAA)[101]Diamond10,000,000‡"
    ],
    "retrieved_context": "| Region              | Date               | Format                           | Label          | Catalog       |\n|:--------------------|:-------------------|:---------------------------------|:---------------|:--------------|\n| United States[260]  | March 4, 2003      |                                  | Wind-up        | 60150-13063-2 |\n| Canada[261]         | April 1, 2003      |                                  | Wind-up        | EK 91746      |\n| Austria[262]        | April 28, 2003     | CD · digital download            | Wind-up · Epic | WIN 510879 2  |\n| Germany[262]        | April 28, 2003     | CD · digital download            | Wind-up · Epic | WIN 687043 2  |\n| United Kingdom[262] | April 28, 2003     | CD · digital download            | Wind-up · Epic | 510879200     |\n| Australia[263]      | May 19, 2003       |                                  |                | 510879200     |\n| France[262]         | May 20, 2003       |                                  |                | WIN 510879 2  |\n| Japan[264]          | July 7, 2003       |                                  | Sony           | EICP-253      |\n| Japan[264]          | September 9, 2003  | Limited edition CD+DVD           | Sony           | EICP-242      |\n| Austria[262]        | January 26, 2004   | CD reissue                       | Wind-up · Epic | WIN 510879 9  |\n| Germany[262]        | February 4, 2004   |                                  | Wind-up · Epic | WIN 510879 9  |\n| France[262]         | February 4, 2004   |                                  | Wind-up · Epic | WIN 510879 9  |\n| United Kingdom[262] | February 23, 2004  |                                  | Wind-up · Epic | WIN 510879 9  |\n| Austria[262]        | September 25, 2009 |                                  | Wind-up · EMI  | WIN 687043 2  |\n| Germany[262]        | September 28, 2009 |                                  | Wind-up · EMI  | WIN 687043 2  |\n| United Kingdom[262] | September 28, 2009 |                                  | Wind-up · EMI  | WIN 687043 2  |\n| France[262]         | October 5, 2009    |                                  |                |               |\n| Japan[264]          | October 12, 2011   | Limited edition CD reissue       | EMI            | TOCP-54276    |\n| United States[260]  | May 21, 2013       | Remastered LP (black and purple) | Wind-up        | 60150-13359-1 |"
  },
  {
    "id": "qa_21_005",
    "source": "0f2eac764c8d04d8d13d8a999342d106.pdf",
    "page_numbers": [
      16,
      17
    ],
    "table_idx": 0,
    "question": "According to the table and the additional text, what are the release dates, formats, labels, and catalog numbers for the album \"Fallen\" in Japan, and what was its certification?",
    "answer": "In Japan, the album \"Fallen\" was released on July 7, 2003, under the Sony label with catalog number EICP-253, and again on September 9, 2003, as a Limited edition CD+DVD under the Sony label with catalog number EICP-242 and a third time on October 12, 2011 as Limited edition CD reissue under the EMI label with catalog number TOCP-54276. The album was certified Platinum by RIAJ.",
    "retrieved_chunks": [
      "Release history [edit]\nRegion Date Format Label Catalog\nUnited States[260]March 4, 2003\nCD · digital downloadWind-up60150-13063-\n2\nCanada[261]April 1, 2003\nWind-up ·\nEpicEK 91746\nAustria[262]\nApril 28, 2003WIN 510879 2\nGermany[262]\nUnited\nKingdom[262]WIN 687043 2\nAustralia[263]May 19, 2003 510879200\nFrance[262]May 20, 2003 WIN 510879 2\nJapan[264]July 7, 2003\nSonyEICP-253\nSeptember 9, 2003Limited edition CD+DVD EICP-242\nAustria[262]\nJanuary 26, 2004CD reissue\nWind-up ·\nEpicWIN 510879 9Germany[262]\nFrance[262]February 4, 2004\nUnited\nKingdom[262]February 23, 2004\nAustria[262]September 25,\n2009Wind-up ·\nEMIWIN 687043 2\nGermany[262]\nUnited\nKingdom[262]September 28,\n2009",
      "Japan (RIAJ)[244]Platinum 250,000^\nMexico (AMPROFON)[245]Platinum+Gold225,000^\nNetherlands (NVPI)[246]Platinum 80,000^\nNew Zealand (RMNZ)[247]5× Platinum75,000^",
      "France[262]October 5, 2009\nJapan[264]October 12, 2011Limited edition CD reissueEMI TOCP-54276\nUnited States[260]May 21, 2013Remastered LP (black and\npurple)Wind-up60150-13359-\n1"
    ],
    "retrieved_context": "| Region              | Date               | Format                           | Label          | Catalog       |\n|:--------------------|:-------------------|:---------------------------------|:---------------|:--------------|\n| United States[260]  | March 4, 2003      |                                  | Wind-up        | 60150-13063-2 |\n| Canada[261]         | April 1, 2003      |                                  | Wind-up        | EK 91746      |\n| Austria[262]        | April 28, 2003     | CD · digital download            | Wind-up · Epic | WIN 510879 2  |\n| Germany[262]        | April 28, 2003     | CD · digital download            | Wind-up · Epic | WIN 687043 2  |\n| United Kingdom[262] | April 28, 2003     | CD · digital download            | Wind-up · Epic | 510879200     |\n| Australia[263]      | May 19, 2003       |                                  |                | 510879200     |\n| France[262]         | May 20, 2003       |                                  |                | WIN 510879 2  |\n| Japan[264]          | July 7, 2003       |                                  | Sony           | EICP-253      |\n| Japan[264]          | September 9, 2003  | Limited edition CD+DVD           | Sony           | EICP-242      |\n| Austria[262]        | January 26, 2004   | CD reissue                       | Wind-up · Epic | WIN 510879 9  |\n| Germany[262]        | February 4, 2004   |                                  | Wind-up · Epic | WIN 510879 9  |\n| France[262]         | February 4, 2004   |                                  | Wind-up · Epic | WIN 510879 9  |\n| United Kingdom[262] | February 23, 2004  |                                  | Wind-up · Epic | WIN 510879 9  |\n| Austria[262]        | September 25, 2009 |                                  | Wind-up · EMI  | WIN 687043 2  |\n| Germany[262]        | September 28, 2009 |                                  | Wind-up · EMI  | WIN 687043 2  |\n| United Kingdom[262] | September 28, 2009 |                                  | Wind-up · EMI  | WIN 687043 2  |\n| France[262]         | October 5, 2009    |                                  |                |               |\n| Japan[264]          | October 12, 2011   | Limited edition CD reissue       | EMI            | TOCP-54276    |\n| United States[260]  | May 21, 2013       | Remastered LP (black and purple) | Wind-up        | 60150-13359-1 |"
  },
  {
    "id": "1",
    "source": "table_data.pdf",
    "page_numbers": [
      28
    ],
    "table_idx": 0,
    "question": "Which studio album from the table includes the singles \"Bring Me to Life\", \"Going Under\", and \"My Immortal\"?",
    "answer": "The studio album 'Fallen' has the singles \"Bring Me to Life\", \"Going Under\", and \"My Immortal\".",
    "retrieved_chunks": [],
    "retrieved_context": "| Studio albums                                                                                                                            | Fallen·The Open Door·Evanescence·Synthesis·The Bitter Truth                                                                                              |                                                                                                                                  |\n| Singles                                                                                                                                  | \"Bring Me to Life\"·\"Going Under\"·\"My Immortal\"·\"Everybody's Fool\"· \"Call Me When You're Sober\"·\"Lithium\"·\"Sweet Sacrifice\"·\"Good Enough\"·\"What You Want\" |                                                                                                                                  |"
  },
  {
    "id": "2",
    "source": "table_data.pdf",
    "page_numbers": [
      28
    ],
    "table_idx": 0,
    "question": "According to the table, are \"My Heart Is Broken\", \"Lost in Paradise\", and \"Imperfection\" categorized as 'Other songs', 'Singles' or 'Studio albums'?",
    "answer": "\"My Heart Is Broken\", \"Lost in Paradise\", and \"Imperfection\" are listed as 'Other songs' in the table.",
    "retrieved_chunks": [],
    "retrieved_context": "| Other songs                                                                                                                              | \"My Heart Is Broken\" · \"Lost in Paradise\" · \"Imperfection\" · \"The Chain\" · \"Wasted on You\" · \"The Game Is Over\" · \"Use My Voice\"                         | \"My Heart Is Broken\" · \"Lost in Paradise\" · \"Imperfection\" · \"The Chain\" · \"Wasted on You\" · \"The Game Is Over\" · \"Use My Voice\" |"
  },
  {
    "id": "3",
    "source": "table_data.pdf",
    "page_numbers": [
      29
    ],
    "table_idx": 0,
    "question": "Based on the additional text, what was the ranking of the album 'Fallen' in terms of best-selling albums of 2004?",
    "answer": "'Fallen' was the eighth-bestselling album of 2004.",
    "retrieved_chunks": [
      "Fallen has sold more than 17 million units worldwide, with 10 million in the US, since its 2003\nrelease.[127][101] The album debuted at number seven on the Billboard 200, with more than 141,000 copies\nsold in its first week,[128] Fallen was the eighth-bestselling album of 2004[129] and the nineteenth-bestselling\nalbum of the 2000s.[130]"
    ],
    "retrieved_context": "| Studio albums                                                                                                                            | Fallen·The Open Door·Evanescence·Synthesis·The Bitter Truth                                                                                              |                                                                                                                                  |"
  },
  {
    "id": "4",
    "source": "table_data.pdf",
    "page_numbers": [
      28
    ],
    "table_idx": 0,
    "question": "What tours are listed in the table for Evanescence?",
    "answer": "The tours listed in the table are Evanescence Tour, Synthesis Live, and Worlds Collide.",
    "retrieved_chunks": [],
    "retrieved_context": "| Tours                                                                                                                                    | Evanescence Tour · Synthesis Live · Worlds Collide                                                                                                       | Evanescence Tour · Synthesis Live · Worlds Collide                                                                               |"
  },
  {
    "id": "5",
    "source": "table_data.pdf",
    "page_numbers": [
      28
    ],
    "table_idx": 0,
    "question": "According to the table, how is 'Lost Whispers' categorized: as a studio album, a live album, or a compilation?",
    "answer": "According to the table, 'Lost Whispers' is categorized as a compilation album.",
    "retrieved_chunks": [],
    "retrieved_context": "| Compilations                                                                                                                             | Lost Whispers                                                                                                                                            |                                                                                                                                  |"
  },
  {
    "id": "qa_31_001",
    "source": "5b85b2aeded2bfc01d42838cf6dcf14f.pdf",
    "page_numbers": [
      14,
      15
    ],
    "table_idx": 0,
    "question": "What periods did Umbro serve as the kit manufacturer for Manchester United?",
    "answer": "Umbro was the kit manufacturer from 1945 to 1975, and again from 1992 to 2000.",
    "retrieved_chunks": [
      "An official partner of the club,\nTurkish Airlines, in Manchester United\nlivery\nPeriodKit\nmanufacturerShirt sponsor\n(chest)Shirt sponsor\n(sleeve)Shirt sponsor (back)\n1945–\n1975Umbro— — —The core strength of Manchester United's global brand is often",
      "1975–\n1980Admiral\n1980–\n1982\nAdidas\n1982–\n1992 Sharp\nElectronics[177]1992–\n2000\nUmbro\n2000–\n2002\nVodafone[177]\n2002–\n2006\nNike2006–\n2010AIG[177]\n2010–\n2014Aon[177]\n2014–\n2015\nChevrolet[177]2015–\n2018\nAdidas2018–\n2021\nKohler\n2021–\n2022\nTeamViewer\n2022–\n2024\nDXC Technology\n2024– SnapdragonMicrosoft Copilot+ PC\n(League Cup)\nIn an initial five-year deal worth £500,000, Sharp Electronics became the club's first shirt sponsor at the"
    ],
    "retrieved_context": "| Period     | Kit manufacturer   | Shirt sponsor (chest)   | Shirt sponsor (sleeve)   | Shirt sponsor (back)               |\n|:-----------|:-------------------|:------------------------|:-------------------------|:-----------------------------------|\n| 1945–1975  | Umbro              | —                       | —                        | —                                  |\n| 1975– 1980 | Admiral            | Admiral                 | Admiral                  | Admiral                            |\n| 1980– 1982 | Adidas             | Adidas                  | Adidas                   | Adidas                             |\n| 1982– 1992 | Adidas             | Sharp Electronics[177]  | Sharp Electronics[177]   | Sharp Electronics[177]             |\n| 1992– 2000 | Umbro              | Umbro                   | Umbro                    | Umbro                              |},\n  {\"answer\":\"Adidas was the kit manufacturer from 2015-2018, with Chevrolet as the shirt sponsor (chest), Chevrolet as the shirt sponsor (sleeve) and Chevrolet as the shirt sponsor (back).\",\"id\":\"qa_31_002\",\"page_numbers\":[14,15],\"question\":\"Between 2015 and 2018, who was the kit manufacturer and what were the shirt sponsors (chest, sleeve, and back)?\",\"retrieved_chunks\":[\"An official partner of the club,\\nTurkish Airlines, in Manchester United\\nlivery\\nPeriodKit\\nmanufacturerShirt sponsor\\n(chest)Shirt sponsor\\n(sleeve)Shirt sponsor (back)\\n1945–\\n1975Umbro— — —The core strength of Manchester United's global brand is often\",\"1975–\\n1980Admiral\\n1980–\\n1982\\nAdidas\\n1982–\\n1992 Sharp\\nElectronics[177]1992–\\n2000\\nUmbro\\n2000–\\n2002\\nVodafone[177]\\n2002–\\n2006\\nNike2006–\\n2010AIG[177]\\n2010–\\n2014Aon[177]\\n2014–\\n2015\\nChevrolet[177]2015–\\n2018\\nAdidas2018–\\n2021\\nKohler\\n2021–\\n2022\\nTeamViewer\\n2022–\\n2024\\nDXC Technology\\n2024– SnapdragonMicrosoft Copilot+ PC\\n(League Cup)\\nIn an initial five-year deal worth £500,000, Sharp Electronics became the club's first shirt sponsor at the\"],\"retrieved_context\":\"| Period     | Kit manufacturer   | Shirt sponsor (chest)   | Shirt sponsor (sleeve)   | Shirt sponsor (back)               |\\n|:-----------|:-------------------|:------------------------|:-------------------------|:-----------------------------------|\\n| 1945–1975  | Umbro              | —                       | —                        | —                                  |\\n| 1975– 1980 | Admiral            | Admiral                 | Admiral                  | Admiral                            |\\n| 1980– 1982 | Adidas             | Adidas                  | Adidas                   | Adidas                             |\\n| 1982– 1992 | Adidas             | Sharp Electronics[177]  | Sharp Electronics[177]   | Sharp Electronics[177]             |\\n| 1992– 2000 | Umbro              | Umbro                   | Umbro                    | Umbro                              |\\n| 2000– 2002 | Nike               | Vodafone[177]           | Vodafone[177]            | Vodafone[177]                      |\\n| 2002– 2006 | Nike               | Nike                    | Nike                     | Nike                               |\\n| 2006– 2010 | Nike               | AIG[177]                | AIG[177]                 | AIG[177]                           |\\n| 2010– 2014 | Nike               | Aon[177]                | Aon[177]                 | Aon[177]                           |\\n| 2014– 2015 | Adidas             | Chevrolet[177]          | Chevrolet[177]           | Chevrolet[177]                     |\\n| 2015– 2018 | Adidas             | Chevrolet[177]          | Chevrolet[177]           | Chevrolet[177]                     |\n  {\"answer\":\"For the period 2022-2024, the kit manufacturer was Adidas, the shirt sponsor (chest) was Snapdragon, the shirt sponsor (sleeve) was DXC Technology, and the shirt sponsor (back) was also DXC Technology.\",\"id\":\"qa_31_003\",\"page_numbers\":[14,15],\"question\":\"What were the kit manufacturer and shirt sponsors (chest, sleeve, and back) for the period 2022-2024?\",\"retrieved_chunks\":[\"An official partner of the club,\\nTurkish Airlines, in Manchester United\\nlivery\\nPeriodKit\\nmanufacturerShirt sponsor\\n(chest)Shirt sponsor\\n(sleeve)Shirt sponsor (back)\\n1945–\\n1975Umbro— — —The core strength of Manchester United's global brand is often\",\"1975–\\n1980Admiral\\n1980–\\n1982\\nAdidas\\n1982–\\n1992 Sharp\\nElectronics[177]1992–\\n2000\\nUmbro\\n2000–\\n2002\\nVodafone[177]\\n2002–\\n2006\\nNike2006–\\n2010AIG[177]\\n2010–\\n2014Aon[177]\\n2014–\\n2015\\nChevrolet[177]2015–\\n2018\\nAdidas2018–\\n2021\\nKohler\\n2021–\\n2022\\nTeamViewer\\n2022–\\n2024\\nDXC Technology\\n2024– SnapdragonMicrosoft Copilot+ PC\\n(League Cup)\\nIn an initial five-year deal worth £500,000, Sharp Electronics became the club's first shirt sponsor at the\"],\"retrieved_context\":\"| Period     | Kit manufacturer   | Shirt sponsor (chest)   | Shirt sponsor (sleeve)   | Shirt sponsor (back)               |\\n|:-----------|:-------------------|:------------------------|:-------------------------|:-----------------------------------|\\n| 1945–1975  | Umbro              | —                       | —                        | —                                  |\\n| 1975– 1980 | Admiral            | Admiral                 | Admiral                  | Admiral                            |\\n| 1980– 1982 | Adidas             | Adidas                  | Adidas                   | Adidas                             |\\n| 1982– 1992 | Adidas             | Sharp Electronics[177]  | Sharp Electronics[177]   | Sharp Electronics[177]             |\\n| 1992– 2000 | Umbro              | Umbro                   | Umbro                    | Umbro                              |\\n| 2000– 2002 | Nike               | Vodafone[177]           | Vodafone[177]            | Vodafone[177]                      |\\n| 2002– 2006 | Nike               | Nike                    | Nike                     | Nike                               |\\n| 2006– 2010 | Nike               | AIG[177]                | AIG[177]                 | AIG[177]                           |\\n| 2010– 2014 | Nike               | Aon[177]                | Aon[177]                 | Aon[177]                           |\\n| 2014– 2015 | Adidas             | Chevrolet[177]          | Chevrolet[177]           | Chevrolet[177]                     |\\n| 2015– 2018 | Adidas             | Chevrolet[177]          | Chevrolet[177]           | Chevrolet[177]                     |\\n| 2018– 2021 | Adidas             | TeamViewer              | Kohler                   | Kohler                             |\\n| 2021– 2022 | Adidas             | TeamViewer              | TeamViewer               | TeamViewer                         |\\n| 2022– 2024 | Adidas             | Snapdragon              | DXC Technology           | DXC Technology                     |\n  {\"answer\":\"Sharp Electronics was the shirt sponsor (chest, sleeve, and back) from 1982 to 1992. According to the additional context, in an initial five-year deal worth £500,000, Sharp Electronics became the club's first shirt sponsor at the beginning of the 1982–83 season.\",\"id\":\"qa_31_004\",\"page_numbers\":[14,15],\"question\":\"During which period was Sharp Electronics the shirt sponsor (chest, sleeve, and back), and according to the context, what was significant about this sponsorship?\",\"retrieved_chunks\":[\"An official partner of the club,\\nTurkish Airlines, in Manchester United\\nlivery\\nPeriodKit\\nmanufacturerShirt sponsor\\n(chest)Shirt sponsor\\n(sleeve)Shirt sponsor (back)\\n1945–\\n1975Umbro— — —The core strength of Manchester United's global brand is often\",\"1975–\\n1980Admiral\\n1980–\\n1982\\nAdidas\\n1982–\\n1992 Sharp\\nElectronics[177]1992–\\n2000\\nUmbro\\n2000–\\n2002\\nVodafone[177]\\n2002–\\n2006\\nNike2006–\\n2010AIG[177]\\n2010–\\n2014Aon[177]\\n2014–\\n2015\\nChevrolet[177]2015–\\n2018\\nAdidas2018–\\n2021\\nKohler\\n2021–\\n2022\\nTeamViewer\\n2022–\\n2024\\nDXC Technology\\n2024– SnapdragonMicrosoft Copilot+ PC\\n(League Cup)\\nIn an initial five-year deal worth £500,000, Sharp Electronics became the club's first shirt sponsor at the\"],\"retrieved_context\":\"| Period     | Kit manufacturer   | Shirt sponsor (chest)   | Shirt sponsor (sleeve)   | Shirt sponsor (back)               |\\n|:-----------|:-------------------|:------------------------|:-------------------------|:-----------------------------------|\\n| 1945–1975  | Umbro              | —                       | —                        | —                                  |\\n| 1975– 1980 | Admiral            | Admiral                 | Admiral                  | Admiral                            |\\n| 1980– 1982 | Adidas             | Adidas                  | Adidas                   | Adidas                             |\\n| 1982– 1992 | Adidas             | Sharp Electronics[177]  | Sharp Electronics[177]   | Sharp Electronics[177]             |\\n| 1992– 2000 | Umbro              | Umbro                   | Umbro                    | Umbro                              |\\n| 2000– 2002 | Nike               | Vodafone[177]           | Vodafone[177]            | Vodafone[177]                      |\\n| 2002– 2006 | Nike               | Nike                    | Nike                     | Nike                               |\\n| 2006– 2010 | Nike               | AIG[177]                | AIG[177]                 | AIG[177]                           |\\n| 2010– 2014 | Nike               | Aon[177]                | Aon[177]                 | Aon[177]                           |\\n| 2014– 2015 | Adidas             | Chevrolet[177]          | Chevrolet[177]           | Chevrolet[177]                     |\\n| 2015– 2018 | Adidas             | Chevrolet[177]          | Chevrolet[177]           | Chevrolet[177]                     |\\n| 2018– 2021 | Adidas             | TeamViewer              | Kohler                   | Kohler                             |\\n| 2021– 2022 | Adidas             | TeamViewer              | TeamViewer               | TeamViewer                         |\\n| 2022– 2024 | Adidas             | Snapdragon              | DXC Technology           | DXC Technology                     |\n  {\"answer\":\"Snapdragon is listed as the shirt sponsor (chest) from 2022-2024 and 2024 onwards. According to additional context, Manchester United's Snapdragon shirt sponsorship deal has been extended by two years until 2029.\",\"id\":\"qa_31_005\",\"page_numbers\":[14,15],\"question\":\"For which periods is Snapdragon listed as the shirt sponsor (chest), and according to the additional context, what is the status of their sponsorship deal?\",\"retrieved_chunks\":[\"An official partner of the club,\\nTurkish Airlines, in Manchester United\\nlivery\\nPeriodKit\\nmanufacturerShirt sponsor\\n(chest)Shirt sponsor\\n(sleeve)Shirt sponsor (back)\\n1945–\\n1975Umbro— — —The core strength of Manchester United's global brand is often\",\"1975–\\n1980Admiral\\n1980–\\n1982\\nAdidas\\n1982–\\n1992 Sharp\\nElectronics[177]1992–\\n2000\\nUmbro\\n2000–\\n2002\\nVodafone[177]\\n2002–\\n2006\\nNike2006–\\n2010AIG[177]\\n2010–\\n2014Aon[177]\\n2014–\\n2015\\nChevrolet[177]2015–\\n2018\\nAdidas2018–\\n2021\\nKohler\\n2021–\\n2022\\nTeamViewer\\n2022–\\n2024\\nDXC Technology\\n2024– SnapdragonMicrosoft Copilot+ PC\\n(League Cup)\\nIn an initial five-year deal worth £500,000, Sharp Electronics became the club's first shirt sponsor at the\",\"201. ^ Crafton, Adam (15 August 2024). \\"
  },
  {
    "id": "qa_32_001",
    "source": "5b85b2aeded2bfc01d42838cf6dcf14f.pdf",
    "page_numbers": [
      21
    ],
    "table_idx": 0,
    "question": "Which Manchester United award was inaugurated first, the Sir Matt Busby Player of the Year, the Denzil Haroun Reserve Team Player of the Year, or the Jimmy Murphy Young Player of the Year?",
    "answer": "The Sir Matt Busby Player of the Year award was inaugurated in 1987–88, while the Denzil Haroun Reserve Team Player of the Year and the Jimmy Murphy Young Player of the Year awards were both inaugurated in 1989–90.",
    "retrieved_chunks": [
      "Ruben Amorim is the head coach of\nManchester United.Team First team U21s[a]U18s\nAwardSir Matt Busby\nPlayer of the YearPlayers' Player\nof the YearDenzil Haroun Reserve\nTeam Player of the YearJimmy Murphy Young\nPlayer of the Year\nInaugurated1987–88 2005–06 1989–90 1989–90\nHolder\n(2023–24)\n Bruno\nFernandes[254]\n Diogo\nDalot[255]\n Elyh Harrison[256]\n Ethan\nWheatley[257]\na. ^ U-23s (2016–2022)\nCoaching staff\nPosition Staff\nHead coach\n  Ruben Amorim[258]\nAssistant head coach\n Carlos\nFernandes[259]\nFirst-team coaches\n Adélio Cândido\n Emanuel Ferro\n Darren Fletcher\n Andreas\nGeorgson[260]\nGoalkeeping coach\n  Jorge Vital\nAssistant goalkeeping coach\n  Craig Mawson[261]\nHead of sports medicine\n  Gary O'Driscoll[262]\nSenior first-team doctor\n  Jim Moxon\nHead physiotherapist\n  Jordan Reece\nFirst-team physiotherapists\n Ibrahim Kerem\n Andy Walling\nHead of physical performance\n  Ed Leng[263]\nPhysical performance coach\n  Paulo Barreira\nFitness coaches\n Charlie Owen\n Paulo Gaudino[264]\nFirst-team strength and power coach\n  Michael Clegg[265]\nFirst-team sports scientist\n  Michael Eglon\nDirector of academy\n  Nick Cox[266]"
    ],
    "retrieved_context": "| Team             | First team                        |                             | [a]<br>U21s                                   | U18s                                  |\n|:-----------------|:----------------------------------|:----------------------------|:----------------------------------------------|:--------------------------------------|\n| Award            | Sir Matt Busby Player of the Year | Players' Player of the Year | Denzil Haroun Reserve Team Player of the Year | Jimmy Murphy Young Player of the Year |\n| Inaugurated      | 1987–88                           | 2005–06                     | 1989–90                                       | 1989–90                               |\n| Holder (2023–24) | Bruno Fernandes[254]              | Diogo Dalot[255]            | Elyh Harrison[256]                            | Ethan Wheatley[257]                   |"
  },
  {
    "id": "qa_32_002",
    "source": "5b85b2aeded2bfc01d42838cf6dcf14f.pdf",
    "page_numbers": [
      21
    ],
    "table_idx": 0,
    "question": "Who were the holders of the Sir Matt Busby Player of the Year, Players' Player of the Year, Denzil Haroun Reserve Team Player of the Year, and Jimmy Murphy Young Player of the Year awards for the 2023-24 season?",
    "answer": "In 2023-24, Bruno Fernandes held the Sir Matt Busby Player of the Year award, Diogo Dalot held the Players' Player of the Year award, Elyh Harrison held the Denzil Haroun Reserve Team Player of the Year award, and Ethan Wheatley held the Jimmy Murphy Young Player of the Year award.",
    "retrieved_chunks": [
      "Ruben Amorim is the head coach of\nManchester United.Team First team U21s[a]U18s\nAwardSir Matt Busby\nPlayer of the YearPlayers' Player\nof the YearDenzil Haroun Reserve\nTeam Player of the YearJimmy Murphy Young\nPlayer of the Year\nInaugurated1987–88 2005–06 1989–90 1989–90\nHolder\n(2023–24)\n Bruno\nFernandes[254]\n Diogo\nDalot[255]\n Elyh Harrison[256]\n Ethan\nWheatley[257]\na. ^ U-23s (2016–2022)\nCoaching staff\nPosition Staff\nHead coach\n  Ruben Amorim[258]\nAssistant head coach\n Carlos\nFernandes[259]\nFirst-team coaches\n Adélio Cândido\n Emanuel Ferro\n Darren Fletcher\n Andreas\nGeorgson[260]\nGoalkeeping coach\n  Jorge Vital\nAssistant goalkeeping coach\n  Craig Mawson[261]\nHead of sports medicine\n  Gary O'Driscoll[262]\nSenior first-team doctor\n  Jim Moxon\nHead physiotherapist\n  Jordan Reece\nFirst-team physiotherapists\n Ibrahim Kerem\n Andy Walling\nHead of physical performance\n  Ed Leng[263]\nPhysical performance coach\n  Paulo Barreira\nFitness coaches\n Charlie Owen\n Paulo Gaudino[264]\nFirst-team strength and power coach\n  Michael Clegg[265]\nFirst-team sports scientist\n  Michael Eglon\nDirector of academy\n  Nick Cox[266]"
    ],
    "retrieved_context": "| Team             | First team                        |                             | [a]<br>U21s                                   | U18s                                  |\n|:-----------------|:----------------------------------|:----------------------------|:----------------------------------------------|:--------------------------------------|\n| Award            | Sir Matt Busby Player of the Year | Players' Player of the Year | Denzil Haroun Reserve Team Player of the Year | Jimmy Murphy Young Player of the Year |\n| Inaugurated      | 1987–88                           | 2005–06                     | 1989–90                                       | 1989–90                               |\n| Holder (2023–24) | Bruno Fernandes[254]              | Diogo Dalot[255]            | Elyh Harrison[256]                            | Ethan Wheatley[257]                   |"
  },
  {
    "id": "qa_32_003",
    "source": "5b85b2aeded2bfc01d42838cf6dcf14f.pdf",
    "page_numbers": [
      21
    ],
    "table_idx": 0,
    "question": "Which current award holder is on loan at Walsall until 30 June 2025, and what award do they hold?",
    "answer": "Ethan Wheatley, who is the holder of the Jimmy Murphy Young Player of the Year award for 2023-24, is currently on loan at Walsall until 30 June 2025.",
    "retrieved_chunks": [
      "Ruben Amorim is the head coach of\nManchester United.Team First team U21s[a]U18s\nAwardSir Matt Busby\nPlayer of the YearPlayers' Player\nof the YearDenzil Haroun Reserve\nTeam Player of the YearJimmy Murphy Young\nPlayer of the Year\nInaugurated1987–88 2005–06 1989–90 1989–90\nHolder\n(2023–24)\n Bruno\nFernandes[254]\n Diogo\nDalot[255]\n Elyh Harrison[256]\n Ethan\nWheatley[257]\na. ^ U-23s (2016–2022)\nCoaching staff\nPosition Staff\nHead coach\n  Ruben Amorim[258]\nAssistant head coach\n Carlos\nFernandes[259]\nFirst-team coaches\n Adélio Cândido\n Emanuel Ferro\n Darren Fletcher\n Andreas\nGeorgson[260]\nGoalkeeping coach\n  Jorge Vital\nAssistant goalkeeping coach\n  Craig Mawson[261]\nHead of sports medicine\n  Gary O'Driscoll[262]\nSenior first-team doctor\n  Jim Moxon\nHead physiotherapist\n  Jordan Reece\nFirst-team physiotherapists\n Ibrahim Kerem\n Andy Walling\nHead of physical performance\n  Ed Leng[263]\nPhysical performance coach\n  Paulo Barreira\nFitness coaches\n Charlie Owen\n Paulo Gaudino[264]\nFirst-team strength and power coach\n  Michael Clegg[265]\nFirst-team sports scientist\n  Michael Eglon\nDirector of academy\n  Nick Cox[266]",
      "No.Pos.Nation Player\n1GK\n TURAltay Bayındır\n2DF\n SWEVictor Lindelöf\n3DF\n MARNoussair Mazraoui\n4DF\n NEDMatthijs de Ligt\n5DF\n ENGHarry Maguire\n6DF\n ARGLisandro Martínez\n7MF\n ENGMason Mount\n8MF\n PORBruno Fernandes (captain)\n9FW\n DENRasmus Højlund\n11FW\n NEDJoshua Zirkzee\n13DF\n DENPatrick Dorgu\n14MF\n DENChristian Eriksen\n15DF\n FRALeny Yoro\n16MF\n CIVAmad DialloNo.Pos.Nation Player\n17FW\n ARGAlejandro Garnacho\n18MF\n BRACasemiro\n20DF\n PORDiogo Dalot\n22GK\n ENGTom Heaton\n23DF\n ENGLuke Shaw\n24GK\n CMRAndré Onana\n25MF\n URUManuel Ugarte\n26DF\n ENGAyden Heaven\n35DF\n NIRJonny Evans\n37MF\n ENGKobbie Mainoo\n41DF\n ENGHarry Amass\n43MF\n ENGToby Collyer\n55DF\n ENGTyler Fredricson\n56FW\n DENChido Obi\nOut on loan\nNote: Flags indicate national team as defined under FIFA eligibility rules; some limited exceptions apply. Players may hold more\nthan one non-FIFA nationality.\nNo.Pos.Nation Player\n10FW\n ENGMarcus Rashford (at Aston\nVilla until 30 June\n2025)[237]\n12DF\n NEDTyrell Malacia (at PSV\nEindhoven until 30 June\n2025)[238]\n21FW\n BRAAntony (at Real Betis until\n30 June 2025)[239]No.Pos.Nation Player\n36FW\n ENGEthan Wheatley (at\nWalsall until 30 June\n2025)[240]\n44MF\n ENGDan Gore (at Rotherham\nuntil 30 June 2025)[241]\n—FW\n ENGJadon Sancho (at\nChelsea until 30 June\n2025)[242]\nUnder-21s and Academy\nMain article: Manchester United F.C. Under-21s and Academy\nAs of 4 February 2025[243][244]"
    ],
    "retrieved_context": "| Team             | First team                        |                             | [a]<br>U21s                                   | U18s                                  |\n|:-----------------|:----------------------------------|:----------------------------|:----------------------------------------------|:--------------------------------------|\n| Award            | Sir Matt Busby Player of the Year | Players' Player of the Year | Denzil Haroun Reserve Team Player of the Year | Jimmy Murphy Young Player of the Year |\n| Inaugurated      | 1987–88                           | 2005–06                     | 1989–90                                       | 1989–90                               |\n| Holder (2023–24) | Bruno Fernandes[254]              | Diogo Dalot[255]            | Elyh Harrison[256]                            | Ethan Wheatley[257]                   |"
  },
  {
    "id": "qa_32_004",
    "source": "5b85b2aeded2bfc01d42838cf6dcf14f.pdf",
    "page_numbers": [
      21
    ],
    "table_idx": 0,
    "question": "Which two awards were inaugurated in the same year: Denzil Haroun Reserve Team Player of the Year, Jimmy Murphy Young Player of the Year, or Players' Player of the Year?",
    "answer": "The Denzil Haroun Reserve Team Player of the Year and the Jimmy Murphy Young Player of the Year awards were both inaugurated in the same year, 1989-90.",
    "retrieved_chunks": [
      "Ruben Amorim is the head coach of\nManchester United.Team First team U21s[a]U18s\nAwardSir Matt Busby\nPlayer of the YearPlayers' Player\nof the YearDenzil Haroun Reserve\nTeam Player of the YearJimmy Murphy Young\nPlayer of the Year\nInaugurated1987–88 2005–06 1989–90 1989–90\nHolder\n(2023–24)\n Bruno\nFernandes[254]\n Diogo\nDalot[255]\n Elyh Harrison[256]\n Ethan\nWheatley[257]\na. ^ U-23s (2016–2022)\nCoaching staff\nPosition Staff\nHead coach\n  Ruben Amorim[258]\nAssistant head coach\n Carlos\nFernandes[259]\nFirst-team coaches\n Adélio Cândido\n Emanuel Ferro\n Darren Fletcher\n Andreas\nGeorgson[260]\nGoalkeeping coach\n  Jorge Vital\nAssistant goalkeeping coach\n  Craig Mawson[261]\nHead of sports medicine\n  Gary O'Driscoll[262]\nSenior first-team doctor\n  Jim Moxon\nHead physiotherapist\n  Jordan Reece\nFirst-team physiotherapists\n Ibrahim Kerem\n Andy Walling\nHead of physical performance\n  Ed Leng[263]\nPhysical performance coach\n  Paulo Barreira\nFitness coaches\n Charlie Owen\n Paulo Gaudino[264]\nFirst-team strength and power coach\n  Michael Clegg[265]\nFirst-team sports scientist\n  Michael Eglon\nDirector of academy\n  Nick Cox[266]"
    ],
    "retrieved_context": "| Team             | First team                        |                             | [a]<br>U21s                                   | U18s                                  |\n|:-----------------|:----------------------------------|:----------------------------|:----------------------------------------------|:--------------------------------------|\n| Award            | Sir Matt Busby Player of the Year | Players' Player of the Year | Denzil Haroun Reserve Team Player of the Year | Jimmy Murphy Young Player of the Year |\n| Inaugurated      | 1987–88                           | 2005–06                     | 1989–90                                       | 1989–90                               |\n| Holder (2023–24) | Bruno Fernandes[254]              | Diogo Dalot[255]            | Elyh Harrison[256]                            | Ethan Wheatley[257]                   |"
  },
  {
    "id": "qa_32_005",
    "source": "5b85b2aeded2bfc01d42838cf6dcf14f.pdf",
    "page_numbers": [
      21
    ],
    "table_idx": 0,
    "question": "According to the list of under-21s and academy players, what number is Elyh Harrison, the 2023-24 holder of the Denzil Haroun Reserve Team Player of the Year award?",
    "answer": "Elyh Harrison, who is the 2023-24 holder of the Denzil Haroun Reserve Team Player of the Year award, is listed as number 50 in the list of under-21s and academy players.",
    "retrieved_chunks": [
      "Ruben Amorim is the head coach of\nManchester United.Team First team U21s[a]U18s\nAwardSir Matt Busby\nPlayer of the YearPlayers' Player\nof the YearDenzil Haroun Reserve\nTeam Player of the YearJimmy Murphy Young\nPlayer of the Year\nInaugurated1987–88 2005–06 1989–90 1989–90\nHolder\n(2023–24)\n Bruno\nFernandes[254]\n Diogo\nDalot[255]\n Elyh Harrison[256]\n Ethan\nWheatley[257]\na. ^ U-23s (2016–2022)\nCoaching staff\nPosition Staff\nHead coach\n  Ruben Amorim[258]\nAssistant head coach\n Carlos\nFernandes[259]\nFirst-team coaches\n Adélio Cândido\n Emanuel Ferro\n Darren Fletcher\n Andreas\nGeorgson[260]\nGoalkeeping coach\n  Jorge Vital\nAssistant goalkeeping coach\n  Craig Mawson[261]\nHead of sports medicine\n  Gary O'Driscoll[262]\nSenior first-team doctor\n  Jim Moxon\nHead physiotherapist\n  Jordan Reece\nFirst-team physiotherapists\n Ibrahim Kerem\n Andy Walling\nHead of physical performance\n  Ed Leng[263]\nPhysical performance coach\n  Paulo Barreira\nFitness coaches\n Charlie Owen\n Paulo Gaudino[264]\nFirst-team strength and power coach\n  Michael Clegg[265]\nFirst-team sports scientist\n  Michael Eglon\nDirector of academy\n  Nick Cox[266]",
      "List of under-21s and academy players with articles\nNote: Flags indicate national team as defined under FIFA eligibility rules; some limited exceptions apply. Players may hold more\nthan one non-FIFA nationality.\nNo.Pos.Nation Player\n42MF\n MLISékou Koné\n47MF\n ENGTommy Rowe (player-coach)\n48GK\n ENGHubert Graczyk\n50GK\n ENGElyh Harrison\n63MF\n GIBJames Scanlon\n64MF\n IRLJack Moorhouse\n66DF\n ENGHabeeb Ogunneye\nOut on loan\nNote: Flags indicate national team as defined under FIFA eligibility rules; some limited exceptions apply. Players may hold more\nthan one non-FIFA nationality.\nNo.Pos.Nation Player\n40GK\n CZERadek Vítek (at Blau-\nWeiß Linz until 30 June\n2025)[245]\n49FW\n ENGEthan Ennis (at\nDoncaster Rovers until\n30 June 2025)[246]\n51DF\n ENGRhys Bennett (at\nFleetwood Town until\n30 June 2025)[247]\n52FW\n ENGJoe Hugill (at Carlisle\nUnited until 30 June\n2025)[248]\n53MF\n ENGSam Mather (at\nTranmere Rovers until\n30 June 2025)[249]No.Pos.Nation Player\n54DF\n SCOLouis Jackson (at Tranmere\nRovers until 30 June\n2025)[249]\n60DF\n ENGSonny Aljofree (at\nAccrington Stanley until 30\nJune 2025)[250]\n67DF\n ENGJames Nolan (at Inverness\nCaledonian Thistle until 30\nJune 2025)[251]\n68DF\n SCOJack Kingdon (at Rochdale\nuntil 30 June 2025)[252]\n73FW\n ENGEthan Williams (at\nCheltenham Town until 30\nJune 2025)[253]\nPlayer of the Year awards"
    ],
    "retrieved_context": "| Team             | First team                        |                             | [a]<br>U21s                                   | U18s                                  |\n|:-----------------|:----------------------------------|:----------------------------|:----------------------------------------------|:--------------------------------------|\n| Award            | Sir Matt Busby Player of the Year | Players' Player of the Year | Denzil Haroun Reserve Team Player of the Year | Jimmy Murphy Young Player of the Year |\n| Inaugurated      | 1987–88                           | 2005–06                     | 1989–90                                       | 1989–90                               |\n| Holder (2023–24) | Bruno Fernandes[254]              | Diogo Dalot[255]            | Elyh Harrison[256]                            | Ethan Wheatley[257]                   |"
  },
  {
    "id": "qa_37_001",
    "source": "5b85b2aeded2bfc01d42838cf6dcf14f.pdf",
    "page_numbers": [
      24
    ],
    "table_idx": 0,
    "question": "Based on the table and the context provided, who are the two primary shareholders of Manchester United and what are their respective share percentages as of December 2024?",
    "answer": "The Glazer Family, through Red Football Shareholder Limited, holds the majority of shares at 63.3%, while Sir Jim Ratcliffe, through Ineos, holds 28.94% as of December 2024, after increasing his initial 25% stake.",
    "retrieved_chunks": [
      "of the horse Rock of Gibraltar, Magnier and McManus attempted to have Ferguson removed from\nhis position as manager, and the board responded by approaching investors to attempt to reduce the\nIrishmen's majority.[210]\nGlazer ownership\nSee also: Glazer ownership of Manchester United\nIn May 2005, Malcolm Glazer purchased the 28.7 per cent stake held by McManus and Magnier, thus\nacquiring a controlling interest through his investment vehicle Red Football Ltd in a highly leveraged\ntakeover valuing the club at approximately £800 million (then approx. $1.5 billion).[211] Once the purchase\nwas complete, the club was taken off the stock exchange.[212] Much of the takeover money was borrowed\nby the Glazers; the debts were transferred to the club. As a result, the club went from being debt-free to\nbeing saddled with debts of £540 million, at interest rates of between 7% and 20%.[15][213][214]\nIn July 2006, the club announced a £660 million debt refinancing package, resulting in a 30 per cent\nreduction in annual interest payments to £62 million a year.[215][216] In January 2010, with debts of\n£716.5 million ($1.17 billion),[217] Manchester United further refinanced through a bond issue worth\n£504 million, enabling them to pay off most of the £509 million owed to international banks.[218] The annual\ninterest payable on the bonds – which were to mature on 1 February 2017 – is approximately £45 million per\nannum.[219] Despite restructuring, the club's debt prompted protests from fans on 23 January 2010, at Old\nTrafford and the club's Trafford Training Centre.[220][221] Supporter groups encouraged match-going fans to\nwear green and gold, the colours of Newton Heath. On 30 January, reports emerged that the Manchester\nUnited Supporters' Trust had held meetings with a group of wealthy fans, dubbed the \"Red Knights\", with\nplans to buying out the Glazers' controlling interest.[222] The club's debts reached a high of £777 million in\nJune 2007.[223]\nIn August 2011, the Glazers were believed to have approached Credit Suisse in preparation for a $1 billion\n(approx. £600 million) initial public offering (IPO) on the Singapore stock exchange that would value the club",
      "Management\nOwnership\nPerson / PeopleAssociated companySharesRef.\nGlazer FamilyRed Football Shareholder Limited63.3%[269]\nSir Jim RatcliffeIneos 28.94%\nManchester United plc\nPosition Name[270][271]\nExecutive co-chairmenAvram Glazer\nJoel Glazer\nChief executive officer Omar Berrada\nChief operating officer Collette Roche[272]\nChief financial officer Roger Bell\nChief communications officer Toby Craig\nChief business officer Marc Armstrong\nGeneral counsel Martin Mosley\nChief of international football relationsJean-Claude Blanc\nDirectorsAvram Glazer\nJoel Glazer\nKevin Glazer\nBryan Glazer\nDarcie Glazer Kassewitz\nEdward Glazer\nJohn Reece\nRob Nevin\nIndependent directorsRobert Leitão\nJohn Hooks\nManchester United Football Club\nOffice Name\nLife president Martin Edwards[273]",
      "at more than £2 billion;[224] however, in July 2012, the club announced plans to list its IPO on the New York\nStock Exchange instead.[225] Shares were originally set to go on sale for between $16 and $20 each, but the\nprice was cut to $14 by the launch of the IPO on 10 August, following negative comments from Wall Street\nanalysts and Facebook's disappointing stock market debut in May. Even after the cut, Manchester United\nwas valued at $2.3 billion, making it the most valuable football club in the world.[226]\nThe New York Stock Exchange allows for different shareholders to enjoy different voting rights over the club.\nShares offered to the public (\"Class A\") had 10 times lesser voting rights than shares retained by the Glazers\n(\"Class B\").[227] Initially in 2012, only 10% of shares were offered to the public.[228] As of 2019, the Glazers\nretain ultimate control over the club, with over 70% of shares, and even higher voting power.[229]\nIn 2012, The Guardian estimated that the club had paid a total of over £500 million in debt interest and other\nfees on behalf of the Glazers,[230] and in 2019, reported that the total sum paid by the club for such fees had\nrisen to £1 billion.[214] At the end of 2019, the club had a net debt of nearly £400 million.[231]\nIn 2023, the Glazers began soliciting bids for the sale of the club, and several bids were received. Sir Jim\nRatcliffe, who owns Ineos, and Hamad bin Jassim bin Jaber Al Thani, a Qatari sheikh, were the only bidders\nwho had publicly declared their interest in a controlling share of the club.[232] In March 2023, Finnish\nentrepreneur Thomas Zilliacus also made his interest in Manchester United public.[233]\nOn 24 December 2023, it was announced that Ratcliffe had purchased 25 per cent of Manchester United,\nand that his Ineos Sport company was taking control of football operations.[234] Ratcliffe's shareholdings\nincreased to 28.94% in December 2024. The Glazers remain as majority shareholders.[235]"
    ],
    "retrieved_context": "| Person / People   | Associated company               | Shares   | Ref.   |\n|:------------------|:---------------------------------|:---------|:-------|\n| Glazer Family     | Red Football Shareholder Limited | 63.3%    | [269]  |\n| Sir Jim Ratcliffe | Ineos                            | 28.94%   |        |"
  },
  {
    "id": "qa_37_002",
    "source": "5b85b2aeded2bfc01d42838cf6dcf14f.pdf",
    "page_numbers": [
      24
    ],
    "table_idx": 0,
    "question": "According to the table, which ownership stake has a reference associated with it, and which does not?",
    "answer": "The Glazer Family's ownership stake is associated with reference [269], while Sir Jim Ratcliffe's stake does not have a reference in the provided table.",
    "retrieved_chunks": [
      "Management\nOwnership\nPerson / PeopleAssociated companySharesRef.\nGlazer FamilyRed Football Shareholder Limited63.3%[269]\nSir Jim RatcliffeIneos 28.94%\nManchester United plc\nPosition Name[270][271]\nExecutive co-chairmenAvram Glazer\nJoel Glazer\nChief executive officer Omar Berrada\nChief operating officer Collette Roche[272]\nChief financial officer Roger Bell\nChief communications officer Toby Craig\nChief business officer Marc Armstrong\nGeneral counsel Martin Mosley\nChief of international football relationsJean-Claude Blanc\nDirectorsAvram Glazer\nJoel Glazer\nKevin Glazer\nBryan Glazer\nDarcie Glazer Kassewitz\nEdward Glazer\nJohn Reece\nRob Nevin\nIndependent directorsRobert Leitão\nJohn Hooks\nManchester United Football Club\nOffice Name\nLife president Martin Edwards[273]"
    ],
    "retrieved_context": "| Person / People   | Associated company               | Shares   | Ref.   |\n|:------------------|:---------------------------------|:---------|:-------|\n| Glazer Family     | Red Football Shareholder Limited | 63.3%    | [269]  |\n| Sir Jim Ratcliffe | Ineos                            | 28.94%   |        |"
  },
  {
    "id": "qa_37_003",
    "source": "5b85b2aeded2bfc01d42838cf6dcf14f.pdf",
    "page_numbers": [
      24
    ],
    "table_idx": 0,
    "question": "What percentage of shares does the Glazer family own, and through which company do they hold these shares?",
    "answer": "The Glazer family owns 63.3% of the shares through Red Football Shareholder Limited.",
    "retrieved_chunks": [
      "Management\nOwnership\nPerson / PeopleAssociated companySharesRef.\nGlazer FamilyRed Football Shareholder Limited63.3%[269]\nSir Jim RatcliffeIneos 28.94%\nManchester United plc\nPosition Name[270][271]\nExecutive co-chairmenAvram Glazer\nJoel Glazer\nChief executive officer Omar Berrada\nChief operating officer Collette Roche[272]\nChief financial officer Roger Bell\nChief communications officer Toby Craig\nChief business officer Marc Armstrong\nGeneral counsel Martin Mosley\nChief of international football relationsJean-Claude Blanc\nDirectorsAvram Glazer\nJoel Glazer\nKevin Glazer\nBryan Glazer\nDarcie Glazer Kassewitz\nEdward Glazer\nJohn Reece\nRob Nevin\nIndependent directorsRobert Leitão\nJohn Hooks\nManchester United Football Club\nOffice Name\nLife president Martin Edwards[273]"
    ],
    "retrieved_context": "| Person / People   | Associated company               | Shares   | Ref.   |\n|:------------------|:---------------------------------|:---------|:-------|\n| Glazer Family     | Red Football Shareholder Limited | 63.3%    | [269]  |\n| Sir Jim Ratcliffe | Ineos                            | 28.94%   |        |"
  },
  {
    "id": "qa_37_004",
    "source": "5b85b2aeded2bfc01d42838cf6dcf14f.pdf",
    "page_numbers": [
      24
    ],
    "table_idx": 0,
    "question": "What percentage of shares does Sir Jim Ratcliffe own in Manchester United, and through which company does he own them? Also, how did he acquire these shares according to the context?",
    "answer": "Sir Jim Ratcliffe owns 28.94% of the shares through Ineos, which, according to the context, resulted from increasing his initial purchase of 25% of Manchester United in December 2023.",
    "retrieved_chunks": [
      "Management\nOwnership\nPerson / PeopleAssociated companySharesRef.\nGlazer FamilyRed Football Shareholder Limited63.3%[269]\nSir Jim RatcliffeIneos 28.94%\nManchester United plc\nPosition Name[270][271]\nExecutive co-chairmenAvram Glazer\nJoel Glazer\nChief executive officer Omar Berrada\nChief operating officer Collette Roche[272]\nChief financial officer Roger Bell\nChief communications officer Toby Craig\nChief business officer Marc Armstrong\nGeneral counsel Martin Mosley\nChief of international football relationsJean-Claude Blanc\nDirectorsAvram Glazer\nJoel Glazer\nKevin Glazer\nBryan Glazer\nDarcie Glazer Kassewitz\nEdward Glazer\nJohn Reece\nRob Nevin\nIndependent directorsRobert Leitão\nJohn Hooks\nManchester United Football Club\nOffice Name\nLife president Martin Edwards[273]",
      "In 2023, the Glazers began soliciting bids for the sale of the club, and several bids were received. Sir Jim\nRatcliffe, who owns Ineos, and Hamad bin Jassim bin Jaber Al Thani, a Qatari sheikh, were the only bidders\nwho had publicly declared their interest in a controlling share of the club.[232] In March 2023, Finnish\nentrepreneur Thomas Zilliacus also made his interest in Manchester United public.[233]\nOn 24 December 2023, it was announced that Ratcliffe had purchased 25 per cent of Manchester United,\nand that his Ineos Sport company was taking control of football operations.[234] Ratcliffe's shareholdings\nincreased to 28.94% in December 2024. The Glazers remain as majority shareholders.[235]"
    ],
    "retrieved_context": "| Person / People   | Associated company               | Shares   | Ref.   |\n|:------------------|:---------------------------------|:---------|:-------|\n| Glazer Family     | Red Football Shareholder Limited | 63.3%    | [269]  |\n| Sir Jim Ratcliffe | Ineos                            | 28.94%   |        |"
  },
  {
    "id": "qa_37_005",
    "source": "5b85b2aeded2bfc01d42838cf6dcf14f.pdf",
    "page_numbers": [
      24
    ],
    "table_idx": 0,
    "question": "According to the table, what percentage of shares does the Glazer Family hold? Does the additional context suggest this percentage has remained constant over time?",
    "answer": "While the table shows that the Glazer Family, via Red Football Shareholder Limited, holds 63.3% of the shares, the additional context indicates that as of 2019, they retained over 70% of shares and even higher voting power, suggesting their control has fluctuated over time.",
    "retrieved_chunks": [
      "Management\nOwnership\nPerson / PeopleAssociated companySharesRef.\nGlazer FamilyRed Football Shareholder Limited63.3%[269]\nSir Jim RatcliffeIneos 28.94%\nManchester United plc\nPosition Name[270][271]\nExecutive co-chairmenAvram Glazer\nJoel Glazer\nChief executive officer Omar Berrada\nChief operating officer Collette Roche[272]\nChief financial officer Roger Bell\nChief communications officer Toby Craig\nChief business officer Marc Armstrong\nGeneral counsel Martin Mosley\nChief of international football relationsJean-Claude Blanc\nDirectorsAvram Glazer\nJoel Glazer\nKevin Glazer\nBryan Glazer\nDarcie Glazer Kassewitz\nEdward Glazer\nJohn Reece\nRob Nevin\nIndependent directorsRobert Leitão\nJohn Hooks\nManchester United Football Club\nOffice Name\nLife president Martin Edwards[273]",
      "The New York Stock Exchange allows for different shareholders to enjoy different voting rights over the club.\nShares offered to the public (\"Class A\") had 10 times lesser voting rights than shares retained by the Glazers\n(\"Class B\").[227] Initially in 2012, only 10% of shares were offered to the public.[228] As of 2019, the Glazers\nretain ultimate control over the club, with over 70% of shares, and even higher voting power.[229]"
    ],
    "retrieved_context": "| Person / People   | Associated company               | Shares   | Ref.   |\n|:------------------|:---------------------------------|:---------|:-------|\n| Glazer Family     | Red Football Shareholder Limited | 63.3%    | [269]  |\n| Sir Jim Ratcliffe | Ineos                            | 28.94%   |        |"
  },
  {
    "id": "qa_42_001",
    "source": "5b85b2aeded2bfc01d42838cf6dcf14f.pdf",
    "page_numbers": [
      24
    ],
    "table_idx": 0,
    "question": "Which individuals simultaneously serve as both Executive co-chairmen and Directors?",
    "answer": "Avram Glazer and Joel Glazer hold positions as both Executive co-chairmen and Directors within Manchester United.",
    "retrieved_chunks": [
      "272. ^ \"The appointment of Collette Roche at Manchester United is a step forward for football – a game blighted by\nsexism\". inews.com. iNews. 19 April 2018. Archived from the original on 18 August 2018. Retrieved\n18 August 2018.\n273. ^ Gardner, Neil (8 October 2009). \"Martin Edwards voices concerns over Manchester United's future\". The\nTimes. London. Archived from the original on 14 August 2011. Retrieved 11 June 2010.\n274. ^ \"Sir Alex Ferguson latest: Manager retires but will remain a director\". The Independent. 8 May 2013.\nArchived from the original on 3 February 2020. Retrieved 20 November 2019.\n275. ^ \"Jason Wilcox appointed as Technical Director\". Manchester United. 19 April 2024. Archived from the\noriginal on 19 April 2024. Retrieved 19 April 2024.\n276. ^ \"Manchester United appoint Christopher Vivell as full-time director of recruitment\". The New York Times. 25\nFebruary 2025. Retrieved 25 February 2025.\n277. ^ \"Harrison appointed director of football operations\". Manchester United. 17 February 2023. Archived from\nthe original on 17 February 2023. Retrieved 17 February 2023.\n278. ^ \"Manchester United appoint new performance director with Premier League experience\".\nwww.strettynews.com. Stretty News. 5 September 2024. Retrieved 5 September 2024.\n279. ^ \"Manchester United appoint Rebecca Britain as club secretary\". Manchester Evening News. 29 March 2018.\nArchived from the original on 5 August 2018. Retrieved 5 August 2018.\n280. ^ Bloomfield, Craig (13 August 2015). \"Which club has won the most trophies in Europe? The most successful\nclubs from the best leagues revealed\". talkSPORT. Archived from the original on 16 October 2015. Retrieved\n30 October 2015.\n281. ^ Shury & Landamore (2005), p. 8.\n282. ^ \"On This Day: United's Historic 'Double Double'\". Manchester United. 11 May 2020. Archived from the\noriginal on 17 May 2020. Retrieved 13 May 2020.\n283. ^ \"Manchester United win the UEFA Europa League\". Manchester United. 24 May 2017. Archived from the\noriginal on 1 June 2018. Retrieved 26 May 2017.\n284. ^ \"Europa League final: Manchester United on the brink of unique achievement no other English club could ever\nmatch\". talkSPORT. 23 May 2017. Archived from the original on 27 May 2017. Retrieved 28 May 2017.\n285. ^ McNulty, Phil (3 June 2023). \"Manchester City 2–1 Manchester United: Ilkay Gundogan double settles 2023 FA\nCup final\". BBC Sport. London. Archived from the original on 2 June 2023. Retrieved 3 June 2023.\n286. ^ Rice, Simon (20 May 2010). \"Treble treble: The teams that won the treble\". The Independent. London.\nArchived from the original on 11 December 2012. Retrieved 14 July 2010.\n287. ^ Wigmore, Tim. \"Why Do Manchester United Still Not Have a Women's Team?\". Bleacher Report. Archived\nfrom the original on 9 November 2020. Retrieved 20 August 2019.\n288. ^ Leighton, Tony (21 February 2005). \"United abandon women's game to focus on youth\". The Guardian.\nArchived from the original on 9 March 2021. Retrieved 21 August 2019.\nFurther reading\nAndrews, David L., ed. (2004). Manchester United: A Thematic Study. London: Routledge. ISBN 978-0-\n415-33333-7.\nBarnes, Justyn; Bostock, Adam; Butler, Cliff; Ferguson, Jim; Meek, David; Mitten, Andy; Pilger, Sam;\nTaylor, Frank OBE; Tyrrell, Tom (2001) [1998]. The Official Manchester United Illustrated Encyclopedia\n(3rd ed.). London: Manchester United Books. ISBN 978-0-233-99964-7."
    ],
    "retrieved_context": "| Position                                  | Name[270][271]          |\n|:------------------------------------------|:------------------------|\n| Executive co-chairmen                     | Avram Glazer            |\n| Executive co-chairmen                     | Joel Glazer             |\n| Chief executive officer                   | Omar Berrada            |\n| Chief operating officer                   | Collette Roche[272]     |\n| Chief financial officer                   | Roger Bell              |\n| Chief communications officer              | Toby Craig              |\n| Chief business officer                    | Marc Armstrong          |\n| General counsel                           | Martin Mosley           |\n| Chief of international football relations | Jean-Claude Blanc       |\n| Directors                                 | Avram Glazer            |\n| Directors                                 | Joel Glazer             |\n| Directors                                 | Kevin Glazer            |\n| Directors                                 | Bryan Glazer            |\n| Directors                                 | Darcie Glazer Kassewitz |\n| Directors                                 | Edward Glazer           |\n| Directors                                 | John Reece              |\n| Directors                                 | Rob Nevin               |\n| Independent directors                     | Robert Leitão           |\n| Independent directors                     | John Hooks              |"
  },
  {
    "id": "qa_42_002",
    "source": "5b85b2aeded2bfc01d42838cf6dcf14f.pdf",
    "page_numbers": [
      24
    ],
    "table_idx": 0,
    "question": "Who is the Chief Operating Officer?",
    "answer": "Collette Roche holds the position of Chief Operating Officer.",
    "retrieved_chunks": [
      "272. ^ \"The appointment of Collette Roche at Manchester United is a step forward for football – a game blighted by\nsexism\". inews.com. iNews. 19 April 2018. Archived from the original on 18 August 2018. Retrieved\n18 August 2018.\n273. ^ Gardner, Neil (8 October 2009). \"Martin Edwards voices concerns over Manchester United's future\". The\nTimes. London. Archived from the original on 14 August 2011. Retrieved 11 June 2010.\n274. ^ \"Sir Alex Ferguson latest: Manager retires but will remain a director\". The Independent. 8 May 2013.\nArchived from the original on 3 February 2020. Retrieved 20 November 2019.\n275. ^ \"Jason Wilcox appointed as Technical Director\". Manchester United. 19 April 2024. Archived from the\noriginal on 19 April 2024. Retrieved 19 April 2024.\n276. ^ \"Manchester United appoint Christopher Vivell as full-time director of recruitment\". The New York Times. 25\nFebruary 2025. Retrieved 25 February 2025.\n277. ^ \"Harrison appointed director of football operations\". Manchester United. 17 February 2023. Archived from\nthe original on 17 February 2023. Retrieved 17 February 2023.\n278. ^ \"Manchester United appoint new performance director with Premier League experience\".\nwww.strettynews.com. Stretty News. 5 September 2024. Retrieved 5 September 2024.\n279. ^ \"Manchester United appoint Rebecca Britain as club secretary\". Manchester Evening News. 29 March 2018.\nArchived from the original on 5 August 2018. Retrieved 5 August 2018.\n280. ^ Bloomfield, Craig (13 August 2015). \"Which club has won the most trophies in Europe? The most successful\nclubs from the best leagues revealed\". talkSPORT. Archived from the original on 16 October 2015. Retrieved\n30 October 2015.\n281. ^ Shury & Landamore (2005), p. 8.\n282. ^ \"On This Day: United's Historic 'Double Double'\". Manchester United. 11 May 2020. Archived from the\noriginal on 17 May 2020. Retrieved 13 May 2020.\n283. ^ \"Manchester United win the UEFA Europa League\". Manchester United. 24 May 2017. Archived from the\noriginal on 1 June 2018. Retrieved 26 May 2017.\n284. ^ \"Europa League final: Manchester United on the brink of unique achievement no other English club could ever\nmatch\". talkSPORT. 23 May 2017. Archived from the original on 27 May 2017. Retrieved 28 May 2017.\n285. ^ McNulty, Phil (3 June 2023). \"Manchester City 2–1 Manchester United: Ilkay Gundogan double settles 2023 FA\nCup final\". BBC Sport. London. Archived from the original on 2 June 2023. Retrieved 3 June 2023.\n286. ^ Rice, Simon (20 May 2010). \"Treble treble: The teams that won the treble\". The Independent. London.\nArchived from the original on 11 December 2012. Retrieved 14 July 2010.\n287. ^ Wigmore, Tim. \"Why Do Manchester United Still Not Have a Women's Team?\". Bleacher Report. Archived\nfrom the original on 9 November 2020. Retrieved 20 August 2019.\n288. ^ Leighton, Tony (21 February 2005). \"United abandon women's game to focus on youth\". The Guardian.\nArchived from the original on 9 March 2021. Retrieved 21 August 2019.\nFurther reading\nAndrews, David L., ed. (2004). Manchester United: A Thematic Study. London: Routledge. ISBN 978-0-\n415-33333-7.\nBarnes, Justyn; Bostock, Adam; Butler, Cliff; Ferguson, Jim; Meek, David; Mitten, Andy; Pilger, Sam;\nTaylor, Frank OBE; Tyrrell, Tom (2001) [1998]. The Official Manchester United Illustrated Encyclopedia\n(3rd ed.). London: Manchester United Books. ISBN 978-0-233-99964-7."
    ],
    "retrieved_context": "| Position                                  | Name[270][271]          |\n|:------------------------------------------|:------------------------|\n| Executive co-chairmen                     | Avram Glazer            |\n| Executive co-chairmen                     | Joel Glazer             |\n| Chief executive officer                   | Omar Berrada            |\n| Chief operating officer                   | Collette Roche[272]     |\n| Chief financial officer                   | Roger Bell              |\n| Chief communications officer              | Toby Craig              |\n| Chief business officer                    | Marc Armstrong          |\n| General counsel                           | Martin Mosley           |\n| Chief of international football relations | Jean-Claude Blanc       |\n| Directors                                 | Avram Glazer            |\n| Directors                                 | Joel Glazer             |\n| Directors                                 | Kevin Glazer            |\n| Directors                                 | Bryan Glazer            |\n| Directors                                 | Darcie Glazer Kassewitz |\n| Directors                                 | Edward Glazer           |\n| Directors                                 | John Reece              |\n| Directors                                 | Rob Nevin               |\n| Independent directors                     | Robert Leitão           |\n| Independent directors                     | John Hooks              |"
  },
  {
    "id": "qa_42_003",
    "source": "5b85b2aeded2bfc01d42838cf6dcf14f.pdf",
    "page_numbers": [
      24
    ],
    "table_idx": 0,
    "question": "Who are the Independent directors?",
    "answer": "Robert Leitão and John Hooks are listed as Independent directors.",
    "retrieved_chunks": [
      "272. ^ \"The appointment of Collette Roche at Manchester United is a step forward for football – a game blighted by\nsexism\". inews.com. iNews. 19 April 2018. Archived from the original on 18 August 2018. Retrieved\n18 August 2018.\n273. ^ Gardner, Neil (8 October 2009). \"Martin Edwards voices concerns over Manchester United's future\". The\nTimes. London. Archived from the original on 14 August 2011. Retrieved 11 June 2010.\n274. ^ \"Sir Alex Ferguson latest: Manager retires but will remain a director\". The Independent. 8 May 2013.\nArchived from the original on 3 February 2020. Retrieved 20 November 2019.\n275. ^ \"Jason Wilcox appointed as Technical Director\". Manchester United. 19 April 2024. Archived from the\noriginal on 19 April 2024. Retrieved 19 April 2024.\n276. ^ \"Manchester United appoint Christopher Vivell as full-time director of recruitment\". The New York Times. 25\nFebruary 2025. Retrieved 25 February 2025.\n277. ^ \"Harrison appointed director of football operations\". Manchester United. 17 February 2023. Archived from\nthe original on 17 February 2023. Retrieved 17 February 2023.\n278. ^ \"Manchester United appoint new performance director with Premier League experience\".\nwww.strettynews.com. Stretty News. 5 September 2024. Retrieved 5 September 2024.\n279. ^ \"Manchester United appoint Rebecca Britain as club secretary\". Manchester Evening News. 29 March 2018.\nArchived from the original on 5 August 2018. Retrieved 5 August 2018.\n280. ^ Bloomfield, Craig (13 August 2015). \"Which club has won the most trophies in Europe? The most successful\nclubs from the best leagues revealed\". talkSPORT. Archived from the original on 16 October 2015. Retrieved\n30 October 2015.\n281. ^ Shury & Landamore (2005), p. 8.\n282. ^ \"On This Day: United's Historic 'Double Double'\". Manchester United. 11 May 2020. Archived from the\noriginal on 17 May 2020. Retrieved 13 May 2020.\n283. ^ \"Manchester United win the UEFA Europa League\". Manchester United. 24 May 2017. Archived from the\noriginal on 1 June 2018. Retrieved 26 May 2017.\n284. ^ \"Europa League final: Manchester United on the brink of unique achievement no other English club could ever\nmatch\". talkSPORT. 23 May 2017. Archived from the original on 27 May 2017. Retrieved 28 May 2017.\n285. ^ McNulty, Phil (3 June 2023). \"Manchester City 2–1 Manchester United: Ilkay Gundogan double settles 2023 FA\nCup final\". BBC Sport. London. Archived from the original on 2 June 2023. Retrieved 3 June 2023.\n286. ^ Rice, Simon (20 May 2010). \"Treble treble: The teams that won the treble\". The Independent. London.\nArchived from the original on 11 December 2012. Retrieved 14 July 2010.\n287. ^ Wigmore, Tim. \"Why Do Manchester United Still Not Have a Women's Team?\". Bleacher Report. Archived\nfrom the original on 9 November 2020. Retrieved 20 August 2019.\n288. ^ Leighton, Tony (21 February 2005). \"United abandon women's game to focus on youth\". The Guardian.\nArchived from the original on 9 March 2021. Retrieved 21 August 2019.\nFurther reading\nAndrews, David L., ed. (2004). Manchester United: A Thematic Study. London: Routledge. ISBN 978-0-\n415-33333-7.\nBarnes, Justyn; Bostock, Adam; Butler, Cliff; Ferguson, Jim; Meek, David; Mitten, Andy; Pilger, Sam;\nTaylor, Frank OBE; Tyrrell, Tom (2001) [1998]. The Official Manchester United Illustrated Encyclopedia\n(3rd ed.). London: Manchester United Books. ISBN 978-0-233-99964-7."
    ],
    "retrieved_context": "| Position                                  | Name[270][271]          |\n|:------------------------------------------|:------------------------|\n| Executive co-chairmen                     | Avram Glazer            |\n| Executive co-chairmen                     | Joel Glazer             |\n| Chief executive officer                   | Omar Berrada            |\n| Chief operating officer                   | Collette Roche[272]     |\n| Chief financial officer                   | Roger Bell              |\n| Chief communications officer              | Toby Craig              |\n| Chief business officer                    | Marc Armstrong          |\n| General counsel                           | Martin Mosley           |\n| Chief of international football relations | Jean-Claude Blanc       |\n| Directors                                 | Avram Glazer            |\n| Directors                                 | Joel Glazer             |\n| Directors                                 | Kevin Glazer            |\n| Directors                                 | Bryan Glazer            |\n| Directors                                 | Darcie Glazer Kassewitz |\n| Directors                                 | Edward Glazer           |\n| Directors                                 | John Reece              |\n| Directors                                 | Rob Nevin               |\n| Independent directors                     | Robert Leitão           |\n| Independent directors                     | John Hooks              |"
  },
  {
    "id": "qa_42_004",
    "source": "5b85b2aeded2bfc01d42838cf6dcf14f.pdf",
    "page_numbers": [
      24
    ],
    "table_idx": 0,
    "question": "Based on the table, who is the Chief executive officer of Manchester United?",
    "answer": "Omar Berrada is the Chief executive officer of Manchester United.",
    "retrieved_chunks": [
      "272. ^ \"The appointment of Collette Roche at Manchester United is a step forward for football – a game blighted by\nsexism\". inews.com. iNews. 19 April 2018. Archived from the original on 18 August 2018. Retrieved\n18 August 2018.\n273. ^ Gardner, Neil (8 October 2009). \"Martin Edwards voices concerns over Manchester United's future\". The\nTimes. London. Archived from the original on 14 August 2011. Retrieved 11 June 2010.\n274. ^ \"Sir Alex Ferguson latest: Manager retires but will remain a director\". The Independent. 8 May 2013.\nArchived from the original on 3 February 2020. Retrieved 20 November 2019.\n275. ^ \"Jason Wilcox appointed as Technical Director\". Manchester United. 19 April 2024. Archived from the\noriginal on 19 April 2024. Retrieved 19 April 2024.\n276. ^ \"Manchester United appoint Christopher Vivell as full-time director of recruitment\". The New York Times. 25\nFebruary 2025. Retrieved 25 February 2025.\n277. ^ \"Harrison appointed director of football operations\". Manchester United. 17 February 2023. Archived from\nthe original on 17 February 2023. Retrieved 17 February 2023.\n278. ^ \"Manchester United appoint new performance director with Premier League experience\".\nwww.strettynews.com. Stretty News. 5 September 2024. Retrieved 5 September 2024.\n279. ^ \"Manchester United appoint Rebecca Britain as club secretary\". Manchester Evening News. 29 March 2018.\nArchived from the original on 5 August 2018. Retrieved 5 August 2018.\n280. ^ Bloomfield, Craig (13 August 2015). \"Which club has won the most trophies in Europe? The most successful\nclubs from the best leagues revealed\". talkSPORT. Archived from the original on 16 October 2015. Retrieved\n30 October 2015.\n281. ^ Shury & Landamore (2005), p. 8.\n282. ^ \"On This Day: United's Historic 'Double Double'\". Manchester United. 11 May 2020. Archived from the\noriginal on 17 May 2020. Retrieved 13 May 2020.\n283. ^ \"Manchester United win the UEFA Europa League\". Manchester United. 24 May 2017. Archived from the\noriginal on 1 June 2018. Retrieved 26 May 2017.\n284. ^ \"Europa League final: Manchester United on the brink of unique achievement no other English club could ever\nmatch\". talkSPORT. 23 May 2017. Archived from the original on 27 May 2017. Retrieved 28 May 2017.\n285. ^ McNulty, Phil (3 June 2023). \"Manchester City 2–1 Manchester United: Ilkay Gundogan double settles 2023 FA\nCup final\". BBC Sport. London. Archived from the original on 2 June 2023. Retrieved 3 June 2023.\n286. ^ Rice, Simon (20 May 2010). \"Treble treble: The teams that won the treble\". The Independent. London.\nArchived from the original on 11 December 2012. Retrieved 14 July 2010.\n287. ^ Wigmore, Tim. \"Why Do Manchester United Still Not Have a Women's Team?\". Bleacher Report. Archived\nfrom the original on 9 November 2020. Retrieved 20 August 2019.\n288. ^ Leighton, Tony (21 February 2005). \"United abandon women's game to focus on youth\". The Guardian.\nArchived from the original on 9 March 2021. Retrieved 21 August 2019.\nFurther reading\nAndrews, David L., ed. (2004). Manchester United: A Thematic Study. London: Routledge. ISBN 978-0-\n415-33333-7.\nBarnes, Justyn; Bostock, Adam; Butler, Cliff; Ferguson, Jim; Meek, David; Mitten, Andy; Pilger, Sam;\nTaylor, Frank OBE; Tyrrell, Tom (2001) [1998]. The Official Manchester United Illustrated Encyclopedia\n(3rd ed.). London: Manchester United Books. ISBN 978-0-233-99964-7."
    ],
    "retrieved_context": "| Position                                  | Name[270][271]          |\n|:------------------------------------------|:------------------------|\n| Executive co-chairmen                     | Avram Glazer            |\n| Executive co-chairmen                     | Joel Glazer             |\n| Chief executive officer                   | Omar Berrada            |\n| Chief operating officer                   | Collette Roche[272]     |\n| Chief financial officer                   | Roger Bell              |\n| Chief communications officer              | Toby Craig              |\n| Chief business officer                    | Marc Armstrong          |\n| General counsel                           | Martin Mosley           |\n| Chief of international football relations | Jean-Claude Blanc       |\n| Directors                                 | Avram Glazer            |\n| Directors                                 | Joel Glazer             |\n| Directors                                 | Kevin Glazer            |\n| Directors                                 | Bryan Glazer            |\n| Directors                                 | Darcie Glazer Kassewitz |\n| Directors                                 | Edward Glazer           |\n| Directors                                 | John Reece              |\n| Directors                                 | Rob Nevin               |\n| Independent directors                     | Robert Leitão           |\n| Independent directors                     | John Hooks              |"
  },
  {
    "id": "qa_42_005",
    "source": "5b85b2aeded2bfc01d42838cf6dcf14f.pdf",
    "page_numbers": [
      24
    ],
    "table_idx": 0,
    "question": "Based on the listed directors, and the ownership information, what percentage of shares do the directors or their associated companies hold?",
    "answer": "While the table lists several directors including Avram Glazer and Joel Glazer, the provided text indicates that as of December 2024, the Glazer Family, through Red Football Shareholder Limited, holds 63.3% of the shares. Additionally, Sir Jim Ratcliffe through Ineos holds 28.94% of the shares.",
    "retrieved_chunks": [
      "272. ^ \"The appointment of Collette Roche at Manchester United is a step forward for football – a game blighted by\nsexism\". inews.com. iNews. 19 April 2018. Archived from the original on 18 August 2018. Retrieved\n18 August 2018.\n273. ^ Gardner, Neil (8 October 2009). \"Martin Edwards voices concerns over Manchester United's future\". The\nTimes. London. Archived from the original on 14 August 2011. Retrieved 11 June 2010.\n274. ^ \"Sir Alex Ferguson latest: Manager retires but will remain a director\". The Independent. 8 May 2013.\nArchived from the original on 3 February 2020. Retrieved 20 November 2019.\n275. ^ \"Jason Wilcox appointed as Technical Director\". Manchester United. 19 April 2024. Archived from the\noriginal on 19 April 2024. Retrieved 19 April 2024.\n276. ^ \"Manchester United appoint Christopher Vivell as full-time director of recruitment\". The New York Times. 25\nFebruary 2025. Retrieved 25 February 2025.\n277. ^ \"Harrison appointed director of football operations\". Manchester United. 17 February 2023. Archived from\nthe original on 17 February 2023. Retrieved 17 February 2023.\n278. ^ \"Manchester United appoint new performance director with Premier League experience\".\nwww.strettynews.com. Stretty News. 5 September 2024. Retrieved 5 September 2024.\n279. ^ \"Manchester United appoint Rebecca Britain as club secretary\". Manchester Evening News. 29 March 2018.\nArchived from the original on 5 August 2018. Retrieved 5 August 2018.\n280. ^ Bloomfield, Craig (13 August 2015). \"Which club has won the most trophies in Europe? The most successful\nclubs from the best leagues revealed\". talkSPORT. Archived from the original on 16 October 2015. Retrieved\n30 October 2015.\n281. ^ Shury & Landamore (2005), p. 8.\n282. ^ \"On This Day: United's Historic 'Double Double'\". Manchester United. 11 May 2020. Archived from the\noriginal on 17 May 2020. Retrieved 13 May 2020.\n283. ^ \"Manchester United win the UEFA Europa League\". Manchester United. 24 May 2017. Archived from the\noriginal on 1 June 2018. Retrieved 26 May 2017.\n284. ^ \"Europa League final: Manchester United on the brink of unique achievement no other English club could ever\nmatch\". talkSPORT. 23 May 2017. Archived from the original on 27 May 2017. Retrieved 28 May 2017.\n285. ^ McNulty, Phil (3 June 2023). \"Manchester City 2–1 Manchester United: Ilkay Gundogan double settles 2023 FA\nCup final\". BBC Sport. London. Archived from the original on 2 June 2023. Retrieved 3 June 2023.\n286. ^ Rice, Simon (20 May 2010). \"Treble treble: The teams that won the treble\". The Independent. London.\nArchived from the original on 11 December 2012. Retrieved 14 July 2010.\n287. ^ Wigmore, Tim. \"Why Do Manchester United Still Not Have a Women's Team?\". Bleacher Report. Archived\nfrom the original on 9 November 2020. Retrieved 20 August 2019.\n288. ^ Leighton, Tony (21 February 2005). \"United abandon women's game to focus on youth\". The Guardian.\nArchived from the original on 9 March 2021. Retrieved 21 August 2019.\nFurther reading\nAndrews, David L., ed. (2004). Manchester United: A Thematic Study. London: Routledge. ISBN 978-0-\n415-33333-7.\nBarnes, Justyn; Bostock, Adam; Butler, Cliff; Ferguson, Jim; Meek, David; Mitten, Andy; Pilger, Sam;\nTaylor, Frank OBE; Tyrrell, Tom (2001) [1998]. The Official Manchester United Illustrated Encyclopedia\n(3rd ed.). London: Manchester United Books. ISBN 978-0-233-99964-7."
    ],
    "retrieved_context": "| Position                                  | Name[270][271]          |\n|:------------------------------------------|:------------------------|\n| Executive co-chairmen                     | Avram Glazer            |\n| Executive co-chairmen                     | Joel Glazer             |\n| Chief executive officer                   | Omar Berrada            |\n| Chief operating officer                   | Collette Roche[272]     |\n| Chief financial officer                   | Roger Bell              |\n| Chief communications officer              | Toby Craig              |\n| Chief business officer                    | Marc Armstrong          |\n| General counsel                           | Martin Mosley           |\n| Chief of international football relations | Jean-Claude Blanc       |\n| Directors                                 | Avram Glazer            |\n| Directors                                 | Joel Glazer             |\n| Directors                                 | Kevin Glazer            |\n| Directors                                 | Bryan Glazer            |\n| Directors                                 | Darcie Glazer Kassewitz |\n| Directors                                 | Edward Glazer           |\n| Directors                                 | John Reece              |\n| Directors                                 | Rob Nevin               |\n| Independent directors                     | Robert Leitão           |\n| Independent directors                     | John Hooks              |"
  },
  {
    "id": "qa_47_001",
    "source": "5b85b2aeded2bfc01d42838cf6dcf14f.pdf",
    "page_numbers": [
      41
    ],
    "table_idx": 0,
    "question": "According to the table, what are the home stadiums Manchester United has used throughout its history, and is there any mention of a potential new stadium?",
    "answer": "Manchester United has had multiple home stadiums throughout its history, including North Road (1878–1893), Bank Street (1893–1910), Old Trafford (1910–present), and Maine Road (1945–1949). There is also mention of a potential new stadium.",
    "retrieved_chunks": [
      "| Home stadium                                                                    | North Road (1878–1893) · Bank Street (1893–1910) · Old Trafford (1910–present) · Maine Road (1945–1949) · Stretford End · Sir Matt Busby Way · New Trafford Stadium (potential new stadium)                                                                                                                                                                                        |"
    ],
    "retrieved_context": "| v · t · e                                                                       | Manchester United Football Club                                                                                                                                                                                                                                                                                                                                                    |\n|:--------------------------------------------------------------------------------|:-----------------------------------------------------------------------------------------------------------------------------------------------------------------------------------------------------------------------------------------------------------------------------------------------------------------------------------------------------------------------------------|\n| Players · Managers · Reserves & Academy · Records & statistics · Current season | Players · Managers · Reserves & Academy · Records & statistics · Current season                                                                                                                                                                                                                                                                                                    |\n| History                                                                         | 1878–1945 · 1945–1969 · 1969–1986 · 1986–2013 · Seasons · Europe                                                                                                                                                                                                                                                                                                                   |\n| Munich air disaster                                                             | Munich air disaster · Busby Babes · United (2011 film)                                                                                                                                                                                                                                                                                                                             |\n| Home stadium                                                                    | North Road (1878–1893) · Bank Street (1893–1910) · Old Trafford (1910–present) · Maine Road (1945–1949) · Stretford End · Sir Matt Busby Way · New Trafford Stadium (potential new stadium)                                                                                                                                                                                        |\n| Training ground                                                                 | The Cliff · Trafford Training Centre                                                                                                                                                                                                                                                                                                                                               |\n| Manchester United Women                                                         | History · Players · Records & statistics · Leigh Sports Village (2018–present)                                                                                                                                                                                                                                                                                                     |\n| Players                                                                         | 100+ appearances · 25–99 appearances · 1–24 appearances · Captains · Sir Matt Busby Player of the Year                                                                                                                                                                                                                                                                             |\n| Rivalries                                                                       | League record by opponent · Manchester derby · Liverpool rivalry · Leeds United rivalry · Arsenal rivalry                                                                                                                                                                                                                                                                          |\n| Supporters                                                                      | Independent Manchester United Supporters Association · Manchester United Supporters' Trust · Red Army                                                                                                                                                                                                                                                                              |\n| Media                                                                           | MUTV · MU Radio · Inside United · Red Issue · Red News                                                                                                                                                                                                                                                                                                                             |\n| Singles                                                                         | \"Manchester United Calypso\" (1957) · \"Manchester United\" (1976) · \"Glory Glory Man United\" (1983) · \"We All Follow Man United\" (1985) · \"United (We Love You)\" (1993) · \"Come on You Reds\" (1994) · \"We're Gonna Do It Again\" (1995) · \"Move Move Move (The Red Tribe)\" (1996) · \"Lift it High (All About Belief)\" (1999)                                                          |\n| Related articles                                                                | Fergie's Fledglings · United Trinity · F.C. United of Manchester · Glazer ownership (2021 Old Trafford protests) · Mascots · 1915 British football match-fixing scandal · Railway station · Looking for Eric · My Mate Manchester United · The Class of '92 · Sir Alex Ferguson: Never Give In · The United Way · 2007 AS Roma–Manchester United F.C. conflict · Manchester Eagles |\n| Category                                                                        | Category                                                                                                                                                                                                                                                                                                                                                                           |\n| Links to related articles                                                       | Links to related articles                                                                                                                                                                                                                                                                                                                                                          |\n| Authority control databases                                                     | Authority control databases                                                                                                                                                                                                                                                                                                                                                        |\n| International                                                                   | ISNI · VIAF · FAST                                                                                                                                                                                                                                                                                                                                                                 |\n| National                                                                        | Germany · United States · France · BnF data · Japan · Czech Republic · Spain · Sweden · Israel                                                                                                                                                                                                                                                                                     |\n| Artists                                                                         | MusicBrainz                                                                                                                                                                                                                                                                                                                                                                        |\n| Other                                                                           | IdRef                                                                                                                                                                                                                                                                                                                                                                              |"
  },
  {
    "id": "qa_47_002",
    "source": "5b85b2aeded2bfc01d42838cf6dcf14f.pdf",
    "page_numbers": [
      41
    ],
    "table_idx": 0,
    "question": "According to the table, since when has Manchester United Women played at Leigh Sports Village?",
    "answer": "According to the table, Manchester United Women have played at Leigh Sports Village since 2018.",
    "retrieved_chunks": [
      "| Manchester United Women                                                         | History · Players · Records & statistics · Leigh Sports Village (2018–present)                                                                                                                                                                                                                                                                      |"
    ],
    "retrieved_context": "| v · t · e                                                                       | Manchester United Football Club                                                                                                                                                                                                                                                                                                                                                    |\n|:--------------------------------------------------------------------------------|:-----------------------------------------------------------------------------------------------------------------------------------------------------------------------------------------------------------------------------------------------------------------------------------------------------------------------------------------------------------------------------------|\n| Players · Managers · Reserves & Academy · Records & statistics · Current season | Players · Managers · Reserves & Academy · Records & statistics · Current season                                                                                                                                                                                                                                                                                                    |\n| History                                                                         | 1878–1945 · 1945–1969 · 1969–1986 · 1986–2013 · Seasons · Europe                                                                                                                                                                                                                                                                                                                   |\n| Munich air disaster                                                             | Munich air disaster · Busby Babes · United (2011 film)                                                                                                                                                                                                                                                                                                                             |\n| Home stadium                                                                    | North Road (1878–1893) · Bank Street (1893–1910) · Old Trafford (1910–present) · Maine Road (1945–1949) · Stretford End · Sir Matt Busby Way · New Trafford Stadium (potential new stadium)                                                                                                                                                                                        |\n| Training ground                                                                 | The Cliff · Trafford Training Centre                                                                                                                                                                                                                                                                                                                                               |\n| Manchester United Women                                                         | History · Players · Records & statistics · Leigh Sports Village (2018–present)                                                                                                                                                                                                                                                                                                     |\n| Players                                                                         | 100+ appearances · 25–99 appearances · 1–24 appearances · Captains · Sir Matt Busby Player of the Year                                                                                                                                                                                                                                                                             |\n| Rivalries                                                                       | League record by opponent · Manchester derby · Liverpool rivalry · Leeds United rivalry · Arsenal rivalry                                                                                                                                                                                                                                                                          |\n| Supporters                                                                      | Independent Manchester United Supporters Association · Manchester United Supporters' Trust · Red Army                                                                                                                                                                                                                                                                              |\n| Media                                                                           | MUTV · MU Radio · Inside United · Red Issue · Red News                                                                                                                                                                                                                                                                                                                             |\n| Singles                                                                         | \"Manchester United Calypso\" (1957) · \"Manchester United\" (1976) · \"Glory Glory Man United\" (1983) · \"We All Follow Man United\" (1985) · \"United (We Love You)\" (1993) · \"Come on You Reds\" (1994) · \"We're Gonna Do It Again\" (1995) · \"Move Move Move (The Red Tribe)\" (1996) · \"Lift it High (All About Belief)\" (1999)                                                          |\n| Related articles                                                                | Fergie's Fledglings · United Trinity · F.C. United of Manchester · Glazer ownership (2021 Old Trafford protests) · Mascots · 1915 British football match-fixing scandal · Railway station · Looking for Eric · My Mate Manchester United · The Class of '92 · Sir Alex Ferguson: Never Give In · The United Way · 2007 AS Roma–Manchester United F.C. conflict · Manchester Eagles |\n| Category                                                                        | Category                                                                                                                                                                                                                                                                                                                                                                           |\n| Links to related articles                                                       | Links to related articles                                                                                                                                                                                                                                                                                                                                                          |\n| Authority control databases                                                     | Authority control databases                                                                                                                                                                                                                                                                                                                                                        |\n| International                                                                   | ISNI · VIAF · FAST                                                                                                                                                                                                                                                                                                                                                                 |\n| National                                                                        | Germany · United States · France · BnF data · Japan · Czech Republic · Spain · Sweden · Israel                                                                                                                                                                                                                                                                                     |\n| Artists                                                                         | MusicBrainz                                                                                                                                                                                                                                                                                                                                                                        |\n| Other                                                                           | IdRef                                                                                                                                                                                                                                                                                                                                                                              |"
  },
  {
    "id": "qa_47_003",
    "source": "5b85b2aeded2bfc01d42838cf6dcf14f.pdf",
    "page_numbers": [
      41
    ],
    "table_idx": 0,
    "question": "According to the table, what are the training grounds for Manchester United?",
    "answer": "The table lists the training grounds as The Cliff and Trafford Training Centre.",
    "retrieved_chunks": [
      "| Training ground                                                                 | The Cliff · Trafford Training Centre                                                                                                                                                                                                                                                                                                                                               |"
    ],
    "retrieved_context": "| v · t · e                                                                       | Manchester United Football Club                                                                                                                                                                                                                                                                                                                                                    |\n|:--------------------------------------------------------------------------------|:-----------------------------------------------------------------------------------------------------------------------------------------------------------------------------------------------------------------------------------------------------------------------------------------------------------------------------------------------------------------------------------|\n| Players · Managers · Reserves & Academy · Records & statistics · Current season | Players · Managers · Reserves & Academy · Records & statistics · Current season                                                                                                                                                                                                                                                                                                    |\n| History                                                                         | 1878–1945 · 1945–1969 · 1969–1986 · 1986–2013 · Seasons · Europe                                                                                                                                                                                                                                                                                                                   |\n| Munich air disaster                                                             | Munich air disaster · Busby Babes · United (2011 film)                                                                                                                                                                                                                                                                                                                             |\n| Home stadium                                                                    | North Road (1878–1893) · Bank Street (1893–1910) · Old Trafford (1910–present) · Maine Road (1945–1949) · Stretford End · Sir Matt Busby Way · New Trafford Stadium (potential new stadium)                                                                                                                                                                                        |\n| Training ground                                                                 | The Cliff · Trafford Training Centre                                                                                                                                                                                                                                                                                                                                               |\n| Manchester United Women                                                         | History · Players · Records & statistics · Leigh Sports Village (2018–present)                                                                                                                                                                                                                                                                                                     |\n| Players                                                                         | 100+ appearances · 25–99 appearances · 1–24 appearances · Captains · Sir Matt Busby Player of the Year                                                                                                                                                                                                                                                                             |\n| Rivalries                                                                       | League record by opponent · Manchester derby · Liverpool rivalry · Leeds United rivalry · Arsenal rivalry                                                                                                                                                                                                                                                                          |\n| Supporters                                                                      | Independent Manchester United Supporters Association · Manchester United Supporters' Trust · Red Army                                                                                                                                                                                                                                                                              |\n| Media                                                                           | MUTV · MU Radio · Inside United · Red Issue · Red News                                                                                                                                                                                                                                                                                                                             |\n| Singles                                                                         | \"Manchester United Calypso\" (1957) · \"Manchester United\" (1976) · \"Glory Glory Man United\" (1983) · \"We All Follow Man United\" (1985) · \"United (We Love You)\" (1993) · \"Come on You Reds\" (1994) · \"We're Gonna Do It Again\" (1995) · \"Move Move Move (The Red Tribe)\" (1996) · \"Lift it High (All About Belief)\" (1999)                                                          |\n| Related articles                                                                | Fergie's Fledglings · United Trinity · F.C. United of Manchester · Glazer ownership (2021 Old Trafford protests) · Mascots · 1915 British football match-fixing scandal · Railway station · Looking for Eric · My Mate Manchester United · The Class of '92 · Sir Alex Ferguson: Never Give In · The United Way · 2007 AS Roma–Manchester United F.C. conflict · Manchester Eagles |\n| Category                                                                        | Category                                                                                                                                                                                                                                                                                                                                                                           |\n| Links to related articles                                                       | Links to related articles                                                                                                                                                                                                                                                                                                                                                          |\n| Authority control databases                                                     | Authority control databases                                                                                                                                                                                                                                                                                                                                                        |\n| International                                                                   | ISNI · VIAF · FAST                                                                                                                                                                                                                                                                                                                                                                 |\n| National                                                                        | Germany · United States · France · BnF data · Japan · Czech Republic · Spain · Sweden · Israel                                                                                                                                                                                                                                                                                     |\n| Artists                                                                         | MusicBrainz                                                                                                                                                                                                                                                                                                                                                                        |\n| Other                                                                           | IdRef                                                                                                                                                                                                                                                                                                                                                                              |"
  },
  {
    "id": "qa_47_004",
    "source": "5b85b2aeded2bfc01d42838cf6dcf14f.pdf",
    "page_numbers": [
      41
    ],
    "table_idx": 0,
    "question": "Based on the table, what are some of Manchester United's rivalries?",
    "answer": "According to the table, Manchester United's rivalries include Manchester derby, Liverpool rivalry, Leeds United rivalry, and Arsenal rivalry.",
    "retrieved_chunks": [
      "| Rivalries                                                                       | League record by opponent · Manchester derby · Liverpool rivalry · Leeds United rivalry · Arsenal rivalry                                                                                                                                                                                                                                                                          |"
    ],
    "retrieved_context": "| v · t · e                                                                       | Manchester United Football Club                                                                                                                                                                                                                                                                                                                                                    |\n|:--------------------------------------------------------------------------------|:-----------------------------------------------------------------------------------------------------------------------------------------------------------------------------------------------------------------------------------------------------------------------------------------------------------------------------------------------------------------------------------|\n| Players · Managers · Reserves & Academy · Records & statistics · Current season | Players · Managers · Reserves & Academy · Records & statistics · Current season                                                                                                                                                                                                                                                                                                    |\n| History                                                                         | 1878–1945 · 1945–1969 · 1969–1986 · 1986–2013 · Seasons · Europe                                                                                                                                                                                                                                                                                                                   |\n| Munich air disaster                                                             | Munich air disaster · Busby Babes · United (2011 film)                                                                                                                                                                                                                                                                                                                             |\n| Home stadium                                                                    | North Road (1878–1893) · Bank Street (1893–1910) · Old Trafford (1910–present) · Maine Road (1945–1949) · Stretford End · Sir Matt Busby Way · New Trafford Stadium (potential new stadium)                                                                                                                                                                                        |\n| Training ground                                                                 | The Cliff · Trafford Training Centre                                                                                                                                                                                                                                                                                                                                               |\n| Manchester United Women                                                         | History · Players · Records & statistics · Leigh Sports Village (2018–present)                                                                                                                                                                                                                                                                                                     |\n| Players                                                                         | 100+ appearances · 25–99 appearances · 1–24 appearances · Captains · Sir Matt Busby Player of the Year                                                                                                                                                                                                                                                                             |\n| Rivalries                                                                       | League record by opponent · Manchester derby · Liverpool rivalry · Leeds United rivalry · Arsenal rivalry                                                                                                                                                                                                                                                                          |\n| Supporters                                                                      | Independent Manchester United Supporters Association · Manchester United Supporters' Trust · Red Army                                                                                                                                                                                                                                                                              |\n| Media                                                                           | MUTV · MU Radio · Inside United · Red Issue · Red News                                                                                                                                                                                                                                                                                                                             |\n| Singles                                                                         | \"Manchester United Calypso\" (1957) · \"Manchester United\" (1976) · \"Glory Glory Man United\" (1983) · \"We All Follow Man United\" (1985) · \"United (We Love You)\" (1993) · \"Come on You Reds\" (1994) · \"We're Gonna Do It Again\" (1995) · \"Move Move Move (The Red Tribe)\" (1996) · \"Lift it High (All About Belief)\" (1999)                                                          |\n| Related articles                                                                | Fergie's Fledglings · United Trinity · F.C. United of Manchester · Glazer ownership (2021 Old Trafford protests) · Mascots · 1915 British football match-fixing scandal · Railway station · Looking for Eric · My Mate Manchester United · The Class of '92 · Sir Alex Ferguson: Never Give In · The United Way · 2007 AS Roma–Manchester United F.C. conflict · Manchester Eagles |\n| Category                                                                        | Category                                                                                                                                                                                                                                                                                                                                                                           |\n| Links to related articles                                                       | Links to related articles                                                                                                                                                                                                                                                                                                                                                          |\n| Authority control databases                                                     | Authority control databases                                                                                                                                                                                                                                                                                                                                                        |\n| International                                                                   | ISNI · VIAF · FAST                                                                                                                                                                                                                                                                                                                                                                 |\n| National                                                                        | Germany · United States · France · BnF data · Japan · Czech Republic · Spain · Sweden · Israel                                                                                                                                                                                                                                                                                     |\n| Artists                                                                         | MusicBrainz                                                                                                                                                                                                                                                                                                                                                                        |\n| Other                                                                           | IdRef                                                                                                                                                                                                                                                                                                                                                                              |"
  },
  {
    "id": "qa_47_005",
    "source": "5b85b2aeded2bfc01d42838cf6dcf14f.pdf",
    "page_numbers": [
      41
    ],
    "table_idx": 0,
    "question": "According to the table, how is the history of Manchester United divided, and what other elements are listed as part of the club's history?",
    "answer": "According to the table, the history of Manchester United is divided into the following periods: 1878–1945, 1945–1969, 1969–1986, and 1986–2013. Additionally, the table mentions 'Seasons' and 'Europe' as part of the club's history.",
    "retrieved_chunks": [
      "| History                                                                         | 1878–1945 · 1945–1969 · 1969–1986 · 1986–2013 · Seasons · Europe                                                                                                                                                                                                                                                                                                                   |"
    ],
    "retrieved_context": "| v · t · e                                                                       | Manchester United Football Club                                                                                                                                                                                                                                                                                                                                                    |\n|:--------------------------------------------------------------------------------|:-----------------------------------------------------------------------------------------------------------------------------------------------------------------------------------------------------------------------------------------------------------------------------------------------------------------------------------------------------------------------------------|\n| Players · Managers · Reserves & Academy · Records & statistics · Current season | Players · Managers · Reserves & Academy · Records & statistics · Current season                                                                                                                                                                                                                                                                                                    |\n| History                                                                         | 1878–1945 · 1945–1969 · 1969–1986 · 1986–2013 · Seasons · Europe                                                                                                                                                                                                                                                                                                                   |\n| Munich air disaster                                                             | Munich air disaster · Busby Babes · United (2011 film)                                                                                                                                                                                                                                                                                                                             |\n| Home stadium                                                                    | North Road (1878–1893) · Bank Street (1893–1910) · Old Trafford (1910–present) · Maine Road (1945–1949) · Stretford End · Sir Matt Busby Way · New Trafford Stadium (potential new stadium)                                                                                                                                                                                        |\n| Training ground                                                                 | The Cliff · Trafford Training Centre                                                                                                                                                                                                                                                                                                                                               |\n| Manchester United Women                                                         | History · Players · Records & statistics · Leigh Sports Village (2018–present)                                                                                                                                                                                                                                                                                                     |\n| Players                                                                         | 100+ appearances · 25–99 appearances · 1–24 appearances · Captains · Sir Matt Busby Player of the Year                                                                                                                                                                                                                                                                             |\n| Rivalries                                                                       | League record by opponent · Manchester derby · Liverpool rivalry · Leeds United rivalry · Arsenal rivalry                                                                                                                                                                                                                                                                          |\n| Supporters                                                                      | Independent Manchester United Supporters Association · Manchester United Supporters' Trust · Red Army                                                                                                                                                                                                                                                                              |\n| Media                                                                           | MUTV · MU Radio · Inside United · Red Issue · Red News                                                                                                                                                                                                                                                                                                                             |\n| Singles                                                                         | \"Manchester United Calypso\" (1957) · \"Manchester United\" (1976) · \"Glory Glory Man United\" (1983) · \"We All Follow Man United\" (1985) · \"United (We Love You)\" (1993) · \"Come on You Reds\" (1994) · \"We're Gonna Do It Again\" (1995) · \"Move Move Move (The Red Tribe)\" (1996) · \"Lift it High (All About Belief)\" (1999)                                                          |\n| Related articles                                                                | Fergie's Fledglings · United Trinity · F.C. United of Manchester · Glazer ownership (2021 Old Trafford protests) · Mascots · 1915 British football match-fixing scandal · Railway station · Looking for Eric · My Mate Manchester United · The Class of '92 · Sir Alex Ferguson: Never Give In · The United Way · 2007 AS Roma–Manchester United F.C. conflict · Manchester Eagles |\n| Category                                                                        | Category                                                                                                                                                                                                                                                                                                                                                                           |\n| Links to related articles                                                       | Links to related articles                                                                                                                                                                                                                                                                                                                                                          |\n| Authority control databases                                                     | Authority control databases                                                                                                                                                                                                                                                                                                                                                        |\n| International                                                                   | ISNI · VIAF · FAST                                                                                                                                                                                                                                                                                                                                                                 |\n| National                                                                        | Germany · United States · France · BnF data · Japan · Czech Republic · Spain · Sweden · Israel                                                                                                                                                                                                                                                                                     |\n| Artists                                                                         | MusicBrainz                                                                                                                                                                                                                                                                                                                                                                        |\n| Other                                                                           | IdRef                                                                                                                                                                                                                                                                                                                                                                              |"
  },
  {
    "id": "qa_52_001",
    "source": "8dc4e3037bd994e49667a6ce1b94617b.pdf",
    "page_numbers": [
      5
    ],
    "table_idx": 0,
    "question": "According to the table, what was the highest percentage recorded for the Greens, and which institute and date reported it?",
    "answer": "The highest percentage for the Greens was 13.5% on September 1st, according to Allensbach[25].",
    "retrieved_chunks": [
      "Average trend line of poll results from 18 September 2005 to 27 September 2009 with each line\ncorresponding to a political party.\n  CDU/CSU\n  SPD\n  FDP  LINKE\n  GRÜNE\nThe CDU/CSU and FDP, with an average vote share of around 50% in pre-election polling during the weeks\nbefore the election, were clearly ahead of the other traditional coalition partners in Germany, SPD and the\nGreens.[24]\nInstitute DateCDU/CSUSPDGreensFDPThe LeftOthers\nForschungsgruppe\nWahlen[25]18\nSept36%25%10%13%11%5%\nForsa16\nSept37%24%11%12%10%6%\nAllensbach16\nSept36%22.5%12%12.5%12%6%\nForschungsgruppe\nWahlen[25]11 Sept36%23%11%14%11%5%\nInfratest dimap[25]10\nSept35%23%12%14%12%4%\nAllensbach[26]9 Sept35%22.5%13%13%11.5%5%\nForschungsgruppe\nWahlen[25]4 Sept37%23%11%15%10%4%\nEmnid[25]3 Sept34%26%11%14%11%4%\nINFO GmbH[27]2 Sept35%23%12%14%11%4%\nAllensbach[25]1 Sept35.5%23%13.5%14%9.5%4.5%\nGMS[25]24 Aug37%23%13%13%9% 5%\nResults [edit]\nFor results by state and constituency, see Results of the 2009 German federal election.\nSee also: List of members of the 17th Bundestag\nThe Christian Democratic Union (CDU), the Christian Social Union of Bavaria (CSU), and the Free\nDemocratic Party (FDP) were able to form a centre-right government, with Angela Merkel of the CDU\ncontinuing as the chancellor and the leader of the FDP, Guido Westerwelle, becoming foreign minister and\nvice-chancellor.[28]\nThe CDU/CSU received a slightly lower proportion than in the previous election, with the Bavarian CSU\nreceiving its lowest vote share in decades.[29] Overall, the CDU/CSU had their worst vote share in 60"
    ],
    "retrieved_context": "| Institute                   | Date    | CDU/CSU   | SPD   | Greens   | FDP   | The Left   | Others   |\n|:----------------------------|:--------|:----------|:------|:---------|:------|:-----------|:---------|\n| Forschungsgruppe Wahlen[25] | 18 Sept | 36%       | 25%   | 10%      | 13%   | 11%        | 5%       |\n| Forsa                       | 16 Sept | 37%       | 24%   | 11%      | 12%   | 10%        | 6%       |\n| Allensbach                  | 16 Sept | 36%       | 22.5% | 12%      | 12.5% | 12%        | 6%       |\n| Forschungsgruppe Wahlen[25] | 11 Sept | 36%       | 23%   | 11%      | 14%   | 11%        | 5%       |\n| Infratest dimap[25]         | 10 Sept | 35%       | 23%   | 12%      | 14%   | 12%        | 4%       |\n| Allensbach[26]              | 9 Sept  | 35%       | 22.5% | 13%      | 13%   | 11.5%      | 5%       |\n| Forschungsgruppe Wahlen[25] | 4 Sept  | 37%       | 23%   | 11%      | 15%   | 10%        | 4%       |\n| Emnid[25]                   | 3 Sept  | 34%       | 26%   | 11%      | 14%   | 11%        | 4%       |\n| INFO GmbH[27]               | 2 Sept  | 35%       | 23%   | 12%      | 14%   | 11%        | 4%       |\n| Allensbach[25]              | 1 Sept  | 35.5%     | 23%   | 13.5%    | 14%   | 9.5%       | 4.5%     |\n| GMS[25]                     | 24 Aug  | 37%       | 23%   | 13%      | 13%   | 9%         | 5%       |"
  },
  {
    "id": "qa_53_001",
    "source": "8dc4e3037bd994e49667a6ce1b94617b.pdf",
    "page_numbers": [
      9
    ],
    "table_idx": 0,
    "question": "Which state shows the highest percentage of votes for LINKE, and why is this significant in the context of the 2009 election?",
    "answer": "The state with the highest percentage for the LINKE party is Saxony-Anhalt, with 32.4%. This is notable because, according to the document, The Left party won constituency seats outside its traditional stronghold of East Berlin for the first time in this election.",
    "retrieved_chunks": [
      "CandidateGregor Gysi &\nOskar LafontaineJürgen Trittin &\nRenate Künast\nParty Left Greens\nLast election8.7%, 54 seats8.1%, 51 seats\nSeats won 76 68\nSeat change\n  22\n  17\nPopular vote5,155,933 4,643,272\nPercentage 11.9% 10.7%\nSwing\n  3.2 pp\n  2.6 pp\nResults of the election. The main map shows constituency winners, and\nresults for the proportional list seats are shown in the bottom left.\nGovernment before election\nFirst Merkel cabinet\nCDU/CSU–SPDGovernment after election\nSecond Merkel cabinet\nCDU/CSU–FDP\n[show]\n[show]\n[show]\n[show]\n[show]This article is part of a series on the\nPolitics of\nGermany\nConstitution (Basic Law)\nHead of State\nExecutive\nLegislature\nJudiciaryElectoral system [edit]\nAccording to Article 38 of the Basic\nLaw for the Federal Republic of\nGermany, members of the\nBundestag shall be elected in\ngeneral, direct, free, equal, and\nsecret elections; everyone over the\nage of eighteen is entitled to\nvote.[3]\nIn 2008, some modifications to the\nelectoral system were required\nunder an order of the Federal\nConstitutional Court of Germany.\nThe court had found a provision in\nthe Federal Election Law by which\nit was possible for a party to\nexperience a negative vote weight,\nnamely losing seats due to more\nvotes, violated the constitutional\nguarantee of the electoral system\nbeing equal and direct.[4] The court\nallowed three years for these\nchanges, so the 2009 German\nfederal election was not affected.\nThe changes were due by 30 June 2011 but appropriate\nlegislation was not completed by that deadline. A new electoral\nlaw was enacted in late 2011 but was declared\nunconstitutional once again by the Federal Constitutional\nCourt upon lawsuits from the opposition parties and a group of\nsome 4,000 private citizens.[5]\nFour of the five factions in the Bundestag agreed on an\nelectoral reform whereby the number of seats in the\nBundestag will be increased as much as necessary to ensure\nthat any overhang seats are compensated through\napportioned leveling seats, to ensure full proportionality\naccording to the political party's share of party votes at the\nnational level.[6] The Bundestag approved and enacted the\nnew electoral reform in February 2013.[7]",
      "Privacy policyAbout WikipediaDisclaimersContact WikipediaCode of ConductDevelopersStatisticsCookie statement\nMobile viewThis page was last edited on 3 May 2025, at 02:54 (UTC).\nText is available under the Creative Commons Attribution-ShareAlike 4.0 License; additional terms may apply. By using this site, you agree to the\nTerms of Use and Privacy Policy. Wikipedia® is a registered trademark of the Wikimedia Foundation, Inc., a non-profit organization.[show] V · T · E\n[show] V · T · EOpinion poll tracker with data\nOpinion poll tracker with graph and monthly average\nBundestag Election Candidates\nAnalysis of the election by Ingo Schmidt: The German Federal Elections: Centre-Right Wins Majority,\nSocial Democracy Suffers Crushing Defeat, The Left Receives a Boost\n Elections and referendums in Germany\nChancellor candidates of Germany\nCategories: Federal elections in Germany2009 elections in Europe2009 elections in Germany\nAngela MerkelFrank-Walter SteinmeierSeptember 2009 in Germany",
      "2009 German federal election\n 34 languages\nArticleTalk ReadEditView historyTools\n← outgoing members elected members →2009 German federal election\n← 2005 27 September 2009 2013 →\nAll 622 seats in the Bundestag, including 24 overhang seats\n312 seats needed for a majority\nRegistered 62,168,489 (\n 0.5%)\nTurnout 70.8% (\n 6.9 pp)\n \nCandidateAngela MerkelFrank-Walter SteinmeierGuido Westerwelle\nParty CDU/CSU SPD FDP\nLast election35.2%, 226 seats34.2%, 222 seats9.8%, 61 seats\nSeats won 239 146 93\nSeat change\n  13\n  76\n  32\nPopular vote14,658,515 9,990,488 6,316,080\nPercentage33.8% 23.0% 14.6%\nSwing\n  1.4 pp\n  11.2 pp\n  4.8 pp\n From Wikipedia, the free encyclopedia\n(Redirected from German federal election, 2009)\nFederal elections were held in\nGermany on 27 September 2009 to\nelect the members of the 17th\nBundestag.[1]\nThe Christian Democratic Union\n(CDU), its Bavarian sister party, the\nChristian Social Union (CSU), and\nthe Free Democratic Party (FDP)\nwon the election, and the three\nparties formed a new centre-right\ngovernment with Angela Merkel as\nchancellor. While CDU/CSU's\nshare of votes decreased slightly, it\nwas more than compensated by\nthe gains of their \"desired coalition\npartner\", the liberal FDP, that won\nthe strongest result in its history.\nCDU and CSU's former partner in\nthe \"Grand coalition\", the Social\nDemocratic Party (SPD) led by\nFrank-Walter Steinmeier, conceded\ndefeat[2] after dropping by more\nthan 11 percentage points,\nreceiving its hitherto worst result\nsince the end of the Second World\nWar (only undercut in 2017 and\n2025). At 70.8 percent, the voter\nturnout was the lowest in a German\nfederal election since 1949.\nDonateCreate accountLog in\","
    ],
    "retrieved_context": "| State[32] results in %   |   CDU/CSU |   SPD |   FDP |   LINKE |   GRÜNE |   all others |\n|:-------------------------|----------:|------:|------:|--------:|--------:|-------------:|\n| Baden-Württemberg        |      34.5 |  19.3 |  18.8 |     7.2 |    13.9 |          6.3 |\n| Bavaria                  |      42.6 |  16.8 |  14.7 |     6.5 |    10.8 |          8.6 |\n| Berlin                   |      22.8 |  20.2 |  11.5 |    20.2 |    17.4 |          7.9 |\n| Brandenburg              |      23.6 |  25.1 |   9.3 |    28.5 |     6.1 |          7.4 |\n| Bremen                   |      23.9 |  30.3 |  10.6 |    14.2 |    15.4 |          5.6 |\n| Hamburg                  |      27.9 |  27.4 |  13.2 |    11.2 |    15.6 |          4.7 |\n| Hesse                    |      32.2 |  25.6 |  16.6 |     8.5 |    12   |          5.1 |\n| Mecklenburg-Vorpommern   |      33.2 |  16.6 |   9.8 |    29   |     5.5 |          5.9 |\n| Lower Saxony             |      33.2 |  29.3 |  13.3 |     8.6 |    10.7 |          4.9 |\n| North Rhine-Westphalia   |      33.1 |  28.5 |  14.9 |     8.4 |    10.1 |          5   |\n| Rhineland-Palatinate     |      35   |  23.8 |  16.6 |     9.4 |     9.7 |          5.5 |\n| Saarland                 |      30.7 |  24.7 |  11.9 |    21.2 |     6.8 |          4.7 |\n| Saxony                   |      35.6 |  14.6 |  13.3 |    24.5 |     6.7 |          5.3 |\n| Saxony-Anhalt            |      30.1 |  16.9 |  10.3 |    32.4 |     5.1 |          5.2 |\n| Schleswig-Holstein       |      32.2 |  26.8 |  16.3 |     7.9 |    12.7 |          4.1 |\n| Thuringia                |      31.2 |  17.6 |   9.8 |    28.8 |     6   |          6.6 |"
  },
  {
    "id": "qa_53_002",
    "source": "8dc4e3037bd994e49667a6ce1b94617b.pdf",
    "page_numbers": [
      9
    ],
    "table_idx": 0,
    "question": "Which state had the highest percentage of votes for SPD, and which had the highest for CDU/CSU?",
    "answer": "Bremen had the highest percentage for SPD at 30.3%, while Bavaria had the highest percentage for CDU/CSU at 42.6%.",
    "retrieved_chunks": [],
    "retrieved_context": "| State[32] results in %   |   CDU/CSU |   SPD |   FDP |   LINKE |   GRÜNE |   all others |\n|:-------------------------|----------:|------:|------:|--------:|--------:|-------------:|\n| Baden-Württemberg        |      34.5 |  19.3 |  18.8 |     7.2 |    13.9 |          6.3 |\n| Bavaria                  |      42.6 |  16.8 |  14.7 |     6.5 |    10.8 |          8.6 |\n| Berlin                   |      22.8 |  20.2 |  11.5 |    20.2 |    17.4 |          7.9 |\n| Brandenburg              |      23.6 |  25.1 |   9.3 |    28.5 |     6.1 |          7.4 |\n| Bremen                   |      23.9 |  30.3 |  10.6 |    14.2 |    15.4 |          5.6 |\n| Hamburg                  |      27.9 |  27.4 |  13.2 |    11.2 |    15.6 |          4.7 |\n| Hesse                    |      32.2 |  25.6 |  16.6 |     8.5 |    12   |          5.1 |\n| Mecklenburg-Vorpommern   |      33.2 |  16.6 |   9.8 |    29   |     5.5 |          5.9 |\n| Lower Saxony             |      33.2 |  29.3 |  13.3 |     8.6 |    10.7 |          4.9 |\n| North Rhine-Westphalia   |      33.1 |  28.5 |  14.9 |     8.4 |    10.1 |          5   |\n| Rhineland-Palatinate     |      35   |  23.8 |  16.6 |     9.4 |     9.7 |          5.5 |\n| Saarland                 |      30.7 |  24.7 |  11.9 |    21.2 |     6.8 |          4.7 |\n| Saxony                   |      35.6 |  14.6 |  13.3 |    24.5 |     6.7 |          5.3 |\n| Saxony-Anhalt            |      30.1 |  16.9 |  10.3 |    32.4 |     5.1 |          5.2 |\n| Schleswig-Holstein       |      32.2 |  26.8 |  16.3 |     7.9 |    12.7 |          4.1 |\n| Thuringia                |      31.2 |  17.6 |   9.8 |    28.8 |     6   |          6.6 |"
  },
  {
    "id": "qa_53_003",
    "source": "8dc4e3037bd994e49667a6ce1b94617b.pdf",
    "page_numbers": [
      9
    ],
    "table_idx": 0,
    "question": "Which state had the highest percentage of votes in the 'all others' category?",
    "answer": "The state with the highest percentage in the 'all others' category is Bavaria, with 8.6%.",
    "retrieved_chunks": [],
    "retrieved_context": "| State[32] results in %   |   CDU/CSU |   SPD |   FDP |   LINKE |   GRÜNE |   all others |\n|:-------------------------|----------:|------:|------:|--------:|--------:|-------------:|\n| Baden-Württemberg        |      34.5 |  19.3 |  18.8 |     7.2 |    13.9 |          6.3 |\n| Bavaria                  |      42.6 |  16.8 |  14.7 |     6.5 |    10.8 |          8.6 |\n| Berlin                   |      22.8 |  20.2 |  11.5 |    20.2 |    17.4 |          7.9 |\n| Brandenburg              |      23.6 |  25.1 |   9.3 |    28.5 |     6.1 |          7.4 |\n| Bremen                   |      23.9 |  30.3 |  10.6 |    14.2 |    15.4 |          5.6 |\n| Hamburg                  |      27.9 |  27.4 |  13.2 |    11.2 |    15.6 |          4.7 |\n| Hesse                    |      32.2 |  25.6 |  16.6 |     8.5 |    12   |          5.1 |\n| Mecklenburg-Vorpommern   |      33.2 |  16.6 |   9.8 |    29   |     5.5 |          5.9 |\n| Lower Saxony             |      33.2 |  29.3 |  13.3 |     8.6 |    10.7 |          4.9 |\n| North Rhine-Westphalia   |      33.1 |  28.5 |  14.9 |     8.4 |    10.1 |          5   |\n| Rhineland-Palatinate     |      35   |  23.8 |  16.6 |     9.4 |     9.7 |          5.5 |\n| Saarland                 |      30.7 |  24.7 |  11.9 |    21.2 |     6.8 |          4.7 |\n| Saxony                   |      35.6 |  14.6 |  13.3 |    24.5 |     6.7 |          5.3 |\n| Saxony-Anhalt            |      30.1 |  16.9 |  10.3 |    32.4 |     5.1 |          5.2 |\n| Schleswig-Holstein       |      32.2 |  26.8 |  16.3 |     7.9 |    12.7 |          4.1 |\n| Thuringia                |      31.2 |  17.6 |   9.8 |    28.8 |     6   |          6.6 |"
  },
  {
    "id": "qa_53_004",
    "source": "8dc4e3037bd994e49667a6ce1b94617b.pdf",
    "page_numbers": [
      9
    ],
    "table_idx": 0,
    "question": "In Mecklenburg-Vorpommern, what was the percentage of votes for LINKE compared to GRÜNE?",
    "answer": "In Mecklenburg-Vorpommern, the percentage for LINKE was 29.0%, while the percentage for GRÜNE was 5.5%.",
    "retrieved_chunks": [],
    "retrieved_context": "| State[32] results in %   |   CDU/CSU |   SPD |   FDP |   LINKE |   GRÜNE |   all others |\n|:-------------------------|----------:|------:|------:|--------:|--------:|-------------:|\n| Baden-Württemberg        |      34.5 |  19.3 |  18.8 |     7.2 |    13.9 |          6.3 |\n| Bavaria                  |      42.6 |  16.8 |  14.7 |     6.5 |    10.8 |          8.6 |\n| Berlin                   |      22.8 |  20.2 |  11.5 |    20.2 |    17.4 |          7.9 |\n| Brandenburg              |      23.6 |  25.1 |   9.3 |    28.5 |     6.1 |          7.4 |\n| Bremen                   |      23.9 |  30.3 |  10.6 |    14.2 |    15.4 |          5.6 |\n| Hamburg                  |      27.9 |  27.4 |  13.2 |    11.2 |    15.6 |          4.7 |\n| Hesse                    |      32.2 |  25.6 |  16.6 |     8.5 |    12   |          5.1 |\n| Mecklenburg-Vorpommern   |      33.2 |  16.6 |   9.8 |    29   |     5.5 |          5.9 |\n| Lower Saxony             |      33.2 |  29.3 |  13.3 |     8.6 |    10.7 |          4.9 |\n| North Rhine-Westphalia   |      33.1 |  28.5 |  14.9 |     8.4 |    10.1 |          5   |\n| Rhineland-Palatinate     |      35   |  23.8 |  16.6 |     9.4 |     9.7 |          5.5 |\n| Saarland                 |      30.7 |  24.7 |  11.9 |    21.2 |     6.8 |          4.7 |\n| Saxony                   |      35.6 |  14.6 |  13.3 |    24.5 |     6.7 |          5.3 |\n| Saxony-Anhalt            |      30.1 |  16.9 |  10.3 |    32.4 |     5.1 |          5.2 |\n| Schleswig-Holstein       |      32.2 |  26.8 |  16.3 |     7.9 |    12.7 |          4.1 |\n| Thuringia                |      31.2 |  17.6 |   9.8 |    28.8 |     6   |          6.6 |"
  },
  {
    "id": "qa_53_005",
    "source": "8dc4e3037bd994e49667a6ce1b94617b.pdf",
    "page_numbers": [
      9
    ],
    "table_idx": 0,
    "question": "Comparing CDU/CSU and SPD vote percentages in Saxony, how does the CDU/CSU percentage reflect the overall election trend for the party?",
    "answer": "In the state of Saxony, the CDU/CSU received 35.6% of the votes, while the SPD received 14.6%. This is notable because the CDU/CSU's overall vote share was slightly lower than in the previous election.",
    "retrieved_chunks": [
      "Party list election results\nby state: blue denotes\nstates where CDU/CSU had\nthe plurality of votes; purple\ndenotes states where Die\nLinke had the plurality of\nvotes; and pink denotes\nstates where the SPD had\nthe plurality of votes\nParty list results by constituencyyears.[30] In contrast, their preferred coalition partner, the liberal FDP, gained\nnearly 5% points to give it 14.6% of the vote, the best result of its history. The\nbig loser of the election was the SPD, which received its worst result ever in a\nfederal election, receiving only 23% of the total party vote and suffering the\nbiggest percentage loss of any party in German federal election history in 60\nyears. The two other parties represented in the Bundestag, the Left and the\nGreens, both made large gains and received the highest vote share of their\nrespective histories. For the first time, The Left won constituency seats outside\nits traditional stronghold of East Berlin. As a result of the losses by the SPD\nand the gains by the FDP, the alliance of the CDU/CSU and FDP received an\noutright majority of seats, ensuring that Angela Merkel would continue as\nchancellor.\nHad the CDU/CSU and FDP failed to win a majority of seats, possible\nalternative coalitions may have included a continuation of the grand coalition\nof CDU/CSU and SPD. A traffic light coalition (SPD–FDP–Greens) was\nspecifically ruled out by FDP leader Guido Westerwelle.[31]"
    ],
    "retrieved_context": "| State[32] results in %   |   CDU/CSU |   SPD |   FDP |   LINKE |   GRÜNE |   all others |\n|:-------------------------|----------:|------:|------:|--------:|--------:|-------------:|\n| Baden-Württemberg        |      34.5 |  19.3 |  18.8 |     7.2 |    13.9 |          6.3 |\n| Bavaria                  |      42.6 |  16.8 |  14.7 |     6.5 |    10.8 |          8.6 |\n| Berlin                   |      22.8 |  20.2 |  11.5 |    20.2 |    17.4 |          7.9 |\n| Brandenburg              |      23.6 |  25.1 |   9.3 |    28.5 |     6.1 |          7.4 |\n| Bremen                   |      23.9 |  30.3 |  10.6 |    14.2 |    15.4 |          5.6 |\n| Hamburg                  |      27.9 |  27.4 |  13.2 |    11.2 |    15.6 |          4.7 |\n| Hesse                    |      32.2 |  25.6 |  16.6 |     8.5 |    12   |          5.1 |\n| Mecklenburg-Vorpommern   |      33.2 |  16.6 |   9.8 |    29   |     5.5 |          5.9 |\n| Lower Saxony             |      33.2 |  29.3 |  13.3 |     8.6 |    10.7 |          4.9 |\n| North Rhine-Westphalia   |      33.1 |  28.5 |  14.9 |     8.4 |    10.1 |          5   |\n| Rhineland-Palatinate     |      35   |  23.8 |  16.6 |     9.4 |     9.7 |          5.5 |\n| Saarland                 |      30.7 |  24.7 |  11.9 |    21.2 |     6.8 |          4.7 |\n| Saxony                   |      35.6 |  14.6 |  13.3 |    24.5 |     6.7 |          5.3 |\n| Saxony-Anhalt            |      30.1 |  16.9 |  10.3 |    32.4 |     5.1 |          5.2 |\n| Schleswig-Holstein       |      32.2 |  26.8 |  16.3 |     7.9 |    12.7 |          4.1 |\n| Thuringia                |      31.2 |  17.6 |   9.8 |    28.8 |     6   |          6.6 |"
  },
  {
    "id": "qa_58_001",
    "source": "8a1bed9f8c8b3816ce616b0f47932e01.pdf",
    "page_numbers": [
      1,
      2
    ],
    "table_idx": 0,
    "question": "Which film won the Best Danish Film, Best Actor, Best Actress, Best Cinematographer and Bodil Special Award?",
    "answer": "Antichrist won the awards for Best Danish Film, Best Actor (Willem Dafoe), Best Actress (Charlotte Gainsbourg) , Best Cinematographer (Anthony Dod Mantle) and a Special Award to Eidnes Andersen for sound design at the 63rd Bodil Awards.",
    "retrieved_chunks": [
      "63rd Bodil Awards\nDate 21 March 2010\nSite Imperial Cinema,\nCopenhagen\nHosted byLasse Rimmer\nHighlights\nBest Film Antichrist\nBest ActorWillem Dafoe\nAntichrist\nBest ActressCharlotte Gainsbourg\nAntichrist\nMost awardsAntichrist (5)\nMost\nnominationsHeadhunter (5)\n← 62nd · Bodil Awards · 64th →From Wikipedia, the free encyclopedia\nThe 63rd Bodil Awards were held on 21 March 2010 in the\nImperial Cinema in Copenhagen, Denmark, honouring the\nbest national and foreign films of 2009. Lasse Rimmer hosted\nthe event. Lars von Trier's Antichrist was the big winner,\nreceiving both the awards for Best Danish Film, Best Actor\n(Willem Dafoe), Best Actress (Charlotte Gainsbourg), Best\nCinematographer (Anthony Dod Mantle) and a Special Award\nto Eidnes Andersen for sound design. Deliver Us from Evil\nwon both the awards for Best Supporting Actor (Jens\nAndersen (actor) [da]) and Best Supporting Actress (Pernille\nVallentin [da]) while Headhunter which had come to the\nceremony with the most nominations, five in three categories,\nleft empty-handed. The documentary The Invisible Cell about\nThe Blekinge Street Gang won the award for Best\nDocumentary.[1] Carsten Myllerup, Linda Krogsøe Holmberg\nand Jens Mikkelsen received a Bodil Honorary Award for their\nrole in the foundation of the alternative film school Super16.[2]\nWinners [edit]\nBodil Honorary Award – Carsten Myllerup, Linda Krogsøe Holmberg and Jens Mikkelsen\nBest Danish Film Best Danish Documentary\nAntichrist\nApplause\nHeadhunter\nAching Hearts\nOld BoysThe Invisible Cell\nBest Actor Best Actress\nWillem Dafoe – Antichrist Charlotte Gainsbourg – Antichrist\nDonateCreate accountLog in"
    ],
    "retrieved_context": "| Best Danish Film                                                                                                                                               | Best Danish Documentary                                                                                                                                                                  |\n|:---------------------------------------------------------------------------------------------------------------------------------------------------------------|:-----------------------------------------------------------------------------------------------------------------------------------------------------------------------------------------|\n| Antichrist •Applause •Headhunter •Aching Hearts •Old Boys                                                                                                      | The Invisible Cell                                                                                                                                                                       |\n| Best Actor                                                                                                                                                     | Best Actress                                                                                                                                                                             |\n| Willem Dafoe – Antichrist                                                                                                                                      | Charlotte Gainsbourg – Antichrist                                                                                                                                                        |\n| Best Supporting Actor                                                                                                                                          | Best Supporting Actress                                                                                                                                                                  |\n| Jens Andersen (actor) [da] – Deliver Us from Evil Michael Falch – Applause Preben Harris – Headhunter Henning Moritzen – Headhunter Søren Pilmark – Headhunter | Pernille Vallentin [da] – Deliver Us from Evil Sara Hjort [da] – Love & Rage Charlotte Fich – Love & Rage Solbjørg Højfeldt – The Blessing Lea Høyer – Above the Street, Below the Water |\n| Best Cinematographer                                                                                                                                           | Bodil Special Award                                                                                                                                                                      |\n| Anthony Dod Mantle – Antichrist                                                                                                                                | Eidnes Andersen – Antichrist (Sound Design)                                                                                                                                              |\n| Best American Film                                                                                                                                             | Best Non-American Film                                                                                                                                                                   |\n| Up The Hurt Locker Milk Revolutionary Road The Wrestler                                                                                                        | Waltz with Bashir Boy A Il Divo I've Loved You So Long The Class                                                                                                                         |"
  },
  {
    "id": "qa_58_002",
    "source": "8a1bed9f8c8b3816ce616b0f47932e01.pdf",
    "page_numbers": [
      1,
      2
    ],
    "table_idx": 0,
    "question": "According to the table, who won Best Supporting Actress for the films Deliver Us from Evil, Love & Rage, The Blessing, and Above the Street, Below the Water?",
    "answer": "The Best Supporting Actresses for Deliver Us from Evil, Love & Rage, The Blessing, and Above the Street, Below the Water were Pernille Vallentin [da], Sara Hjort [da] & Charlotte Fich, Solbjørg Højfeldt, and Lea Høyer respectively.",
    "retrieved_chunks": [
      "Film portal\nDenmark portal\n[hide] V · T · EKristian Halken – Old Boys\nCyron Melville – Love & Rage\nLars Mikkelsen – HeadhunterLærke Winther Andersen – The Blessing\nStephanie León – Hush Little Baby\nMalou Reymann – Hush Little Baby\nPaprika Steen – Applause\nBest Supporting Actor Best Supporting Actress\nJens Andersen (actor) [da] – Deliver Us from Evil\nMichael Falch – Applause\nPreben Harris – Headhunter\nHenning Moritzen – Headhunter\nSøren Pilmark – HeadhunterPernille Vallentin [da] – Deliver Us from Evil\nSara Hjort [da] – Love & Rage\nCharlotte Fich – Love & Rage\nSolbjørg Højfeldt – The Blessing\nLea Høyer – Above the Street, Below the Water\nBest Cinematographer Bodil Special Award\nAnthony Dod Mantle – Antichrist Eidnes Andersen – Antichrist (Sound Design)\nBest American Film Best Non-American Film\nUp\nThe Hurt Locker\nMilk\nRevolutionary Road\nThe WrestlerWaltz with Bashir\nBoy A\nIl Divo\nI've Loved You So Long\nThe Class\nSee also [edit]\n2010 Robert Awards\nReferences [edit]\n1. ^ \"\"Antichrist\" årets bedste film\". TV2. Retrieved 1 March 2012.\n2. ^ \"Æres-Bodil til Super16\" (in Danish). Super16. Archived from the original on 9 February 2015. Retrieved\n1 March 2012.\nExternal links [edit]\nOfficial website\nBodil Awards\nMerit awardsDanish Film · English Language Film · Non-English Language Film · Documentary ·\nLeading Actor · Leading Actress · Supporting Actor · Supporting Actress\nSpecial awardsCinematographer · Honorary Award · Special Award"
    ],
    "retrieved_context": "| Best Supporting Actor                                                                                                                                          | Best Supporting Actress                                                                                                                                                                  |\n| Jens Andersen (actor) [da] – Deliver Us from Evil Michael Falch – Applause Preben Harris – Headhunter Henning Moritzen – Headhunter Søren Pilmark – Headhunter | Pernille Vallentin [da] – Deliver Us from Evil Sara Hjort [da] – Love & Rage Charlotte Fich – Love & Rage Solbjørg Højfeldt – The Blessing Lea Høyer – Above the Street, Below the Water |"
  },
  {
    "id": "qa_58_003",
    "source": "8a1bed9f8c8b3816ce616b0f47932e01.pdf",
    "page_numbers": [
      1,
      2
    ],
    "table_idx": 0,
    "question": "Which films were nominated for Best Danish Film, and which of these received the most nominations overall at the 63rd Bodil Awards?",
    "answer": "The films nominated for Best Danish Film include Antichrist, Applause, Headhunter, Aching Hearts, and Old Boys. Headhunter received the most nominations with five, but did not win any awards.",
    "retrieved_chunks": [
      "63rd Bodil Awards\nDate 21 March 2010\nSite Imperial Cinema,\nCopenhagen\nHosted byLasse Rimmer\nHighlights\nBest Film Antichrist\nBest ActorWillem Dafoe\nAntichrist\nBest ActressCharlotte Gainsbourg\nAntichrist\nMost awardsAntichrist (5)\nMost\nnominationsHeadhunter (5)\n← 62nd · Bodil Awards · 64th →From Wikipedia, the free encyclopedia\nThe 63rd Bodil Awards were held on 21 March 2010 in the\nImperial Cinema in Copenhagen, Denmark, honouring the\nbest national and foreign films of 2009. Lasse Rimmer hosted\nthe event. Lars von Trier's Antichrist was the big winner,\nreceiving both the awards for Best Danish Film, Best Actor\n(Willem Dafoe), Best Actress (Charlotte Gainsbourg), Best\nCinematographer (Anthony Dod Mantle) and a Special Award\nto Eidnes Andersen for sound design. Deliver Us from Evil\nwon both the awards for Best Supporting Actor (Jens\nAndersen (actor) [da]) and Best Supporting Actress (Pernille\nVallentin [da]) while Headhunter which had come to the\nceremony with the most nominations, five in three categories,\nleft empty-handed. The documentary The Invisible Cell about\nThe Blekinge Street Gang won the award for Best\nDocumentary.[1] Carsten Myllerup, Linda Krogsøe Holmberg\nand Jens Mikkelsen received a Bodil Honorary Award for their\nrole in the foundation of the alternative film school Super16.[2]\nWinners [edit]\nBodil Honorary Award – Carsten Myllerup, Linda Krogsøe Holmberg and Jens Mikkelsen\nBest Danish Film Best Danish Documentary\nAntichrist\nApplause\nHeadhunter\nAching Hearts\nOld BoysThe Invisible Cell\nBest Actor Best Actress\nWillem Dafoe – Antichrist Charlotte Gainsbourg – Antichrist\nDonateCreate accountLog in"
    ],
    "retrieved_context": "| Best Danish Film                                                                                                                                               | Best Danish Documentary                                                                                                                                                                  |\n|:---------------------------------------------------------------------------------------------------------------------------------------------------------------|:-----------------------------------------------------------------------------------------------------------------------------------------------------------------------------------------|\n| Antichrist •Applause •Headhunter •Aching Hearts •Old Boys                                                                                                      | The Invisible Cell                                                                                                                                                                       |"
  },
  {
    "id": "qa_58_004",
    "source": "8a1bed9f8c8b3816ce616b0f47932e01.pdf",
    "page_numbers": [
      1,
      2
    ],
    "table_idx": 0,
    "question": "What were the nominees for Best American Film and Best Non-American Film?",
    "answer": "The Best American Films were Up, The Hurt Locker, Milk, Revolutionary Road, and The Wrestler, while the Best Non-American Films included Waltz with Bashir, Boy A, Il Divo, I've Loved You So Long, and The Class.",
    "retrieved_chunks": [
      "Film portal\nDenmark portal\n[hide] V · T · EKristian Halken – Old Boys\nCyron Melville – Love & Rage\nLars Mikkelsen – HeadhunterLærke Winther Andersen – The Blessing\nStephanie León – Hush Little Baby\nMalou Reymann – Hush Little Baby\nPaprika Steen – Applause\nBest Supporting Actor Best Supporting Actress\nJens Andersen (actor) [da] – Deliver Us from Evil\nMichael Falch – Applause\nPreben Harris – Headhunter\nHenning Moritzen – Headhunter\nSøren Pilmark – HeadhunterPernille Vallentin [da] – Deliver Us from Evil\nSara Hjort [da] – Love & Rage\nCharlotte Fich – Love & Rage\nSolbjørg Højfeldt – The Blessing\nLea Høyer – Above the Street, Below the Water\nBest Cinematographer Bodil Special Award\nAnthony Dod Mantle – Antichrist Eidnes Andersen – Antichrist (Sound Design)\nBest American Film Best Non-American Film\nUp\nThe Hurt Locker\nMilk\nRevolutionary Road\nThe WrestlerWaltz with Bashir\nBoy A\nIl Divo\nI've Loved You So Long\nThe Class\nSee also [edit]\n2010 Robert Awards\nReferences [edit]\n1. ^ \"\"Antichrist\" årets bedste film\". TV2. Retrieved 1 March 2012.\n2. ^ \"Æres-Bodil til Super16\" (in Danish). Super16. Archived from the original on 9 February 2015. Retrieved\n1 March 2012.\nExternal links [edit]\nOfficial website\nBodil Awards\nMerit awardsDanish Film · English Language Film · Non-English Language Film · Documentary ·\nLeading Actor · Leading Actress · Supporting Actor · Supporting Actress\nSpecial awardsCinematographer · Honorary Award · Special Award"
    ],
    "retrieved_context": "| Best American Film                                                                                                                                             | Best Non-American Film                                                                                                                                                                   |\n| Up The Hurt Locker Milk Revolutionary Road The Wrestler                                                                                                        | Waltz with Bashir Boy A Il Divo I've Loved You So Long The Class                                                                                                                         |"
  },
  {
    "id": "qa_58_005",
    "source": "8a1bed9f8c8b3816ce616b0f47932e01.pdf",
    "page_numbers": [
      1,
      2
    ],
    "table_idx": 0,
    "question": "For what film and category did Eidnes Andersen and Anthony Dod Mantle win their awards?",
    "answer": "Eidnes Andersen won the Bodil Special Award for Antichrist for Sound Design, and Anthony Dod Mantle won Best Cinematographer for Antichrist.",
    "retrieved_chunks": [
      "Film portal\nDenmark portal\n[hide] V · T · EKristian Halken – Old Boys\nCyron Melville – Love & Rage\nLars Mikkelsen – HeadhunterLærke Winther Andersen – The Blessing\nStephanie León – Hush Little Baby\nMalou Reymann – Hush Little Baby\nPaprika Steen – Applause\nBest Supporting Actor Best Supporting Actress\nJens Andersen (actor) [da] – Deliver Us from Evil\nMichael Falch – Applause\nPreben Harris – Headhunter\nHenning Moritzen – Headhunter\nSøren Pilmark – HeadhunterPernille Vallentin [da] – Deliver Us from Evil\nSara Hjort [da] – Love & Rage\nCharlotte Fich – Love & Rage\nSolbjørg Højfeldt – The Blessing\nLea Høyer – Above the Street, Below the Water\nBest Cinematographer Bodil Special Award\nAnthony Dod Mantle – Antichrist Eidnes Andersen – Antichrist (Sound Design)\nBest American Film Best Non-American Film\nUp\nThe Hurt Locker\nMilk\nRevolutionary Road\nThe WrestlerWaltz with Bashir\nBoy A\nIl Divo\nI've Loved You So Long\nThe Class\nSee also [edit]\n2010 Robert Awards\nReferences [edit]\n1. ^ \"\"Antichrist\" årets bedste film\". TV2. Retrieved 1 March 2012.\n2. ^ \"Æres-Bodil til Super16\" (in Danish). Super16. Archived from the original on 9 February 2015. Retrieved\n1 March 2012.\nExternal links [edit]\nOfficial website\nBodil Awards\nMerit awardsDanish Film · English Language Film · Non-English Language Film · Documentary ·\nLeading Actor · Leading Actress · Supporting Actor · Supporting Actress\nSpecial awardsCinematographer · Honorary Award · Special Award"
    ],
    "retrieved_context": "| Best Cinematographer                                                                                                                                           | Bodil Special Award                                                                                                                                                                      |\n| Anthony Dod Mantle – Antichrist                                                                                                                                | Eidnes Andersen – Antichrist (Sound Design)                                                                                                                                              |"
  },
  {
    "id": "qa_21_001",
    "source": "b014b8ca3c8ee543b655c29747cc6090.pdf",
    "page_numbers": [
      6,
      7
    ],
    "table_idx": 0,
    "question": "According to the table, in what year did Mary Elizabeth McGlynn work as an ADR director for Appleseed, and what is the source?",
    "answer": "In 2004, Mary Elizabeth McGlynn was the ADR director for Appleseed, as indicated by the source Press[2].",
    "retrieved_chunks": [
      "2004Appleseed ADR directorPress[2]"
    ],
    "retrieved_context": "|   Year | Title                                             | Role                                         | Crew role,<br>notes   | Source[13]   |\n|-------:|:--------------------------------------------------|:---------------------------------------------|:----------------------|:-------------|\n|   2004 | Appleseed                                         |                                              | ADR director          | Press[2]     |"
  },
  {
    "id": "qa_21_002",
    "source": "b014b8ca3c8ee543b655c29747cc6090.pdf",
    "page_numbers": [
      6,
      7
    ],
    "table_idx": 0,
    "question": "Based on the table, which roles did Mary Elizabeth McGlynn voice under the name Melissa Williamson, and in which titles?",
    "answer": "Mary Elizabeth McGlynn voiced Queen Hera in Armageddon (1997) and Kanna Kirishima in Sakura Wars: The Movie (2003) under the name Melissa Williamson, as indicated by the source CA.",
    "retrieved_chunks": [
      "1997Armageddon Queen Hera As Melissa\nWilliamsonCA",
      "2003Sakura Wars: The Movie Kanna KirishimaAs Melissa\nWilliamsonCA"
    ],
    "retrieved_context": "|   Year | Title                                             | Role                                         | Crew role,<br>notes   | Source[13]   |\n|-------:|:--------------------------------------------------|:---------------------------------------------|:----------------------|:-------------|\n|   1997 | Armageddon                                        | Queen Hera                                   | As Melissa Williamson | CA           |\n|   2003 | Sakura Wars: The Movie                            | Kanna Kirishima                              | As Melissa Williamson | CA           |"
  },
  {
    "id": "qa_21_003",
    "source": "b014b8ca3c8ee543b655c29747cc6090.pdf",
    "page_numbers": [
      6,
      7
    ],
    "table_idx": 0,
    "question": "According to the table, in what movie released in 2015 did Mary Elizabeth McGlynn work as a voice director and which characters did she voice?",
    "answer": "In 2015, Mary Elizabeth McGlynn was the voice director for The Last: Naruto the Movie, and she also voiced Mei Terumi, Head Maid, Kurenai Yuhi, and Katsuyu, according to source [14].",
    "retrieved_chunks": [
      "2015The Last: Naruto the MovieMei Terumi, Head Maid,\nKurenai Yuhi, KatsuyuVoice director[14]"
    ],
    "retrieved_context": "|   Year | Title                                             | Role                                         | Crew role,<br>notes   | Source[13]   |\n|-------:|:--------------------------------------------------|:---------------------------------------------|:----------------------|:-------------|\n|   2015 | The Last: Naruto the Movie                        | Mei Terumi, Head Maid, Kurenai Yuhi, Katsuyu | Voice director        | [14]         |"
  },
  {
    "id": "qa_21_004",
    "source": "b014b8ca3c8ee543b655c29747cc6090.pdf",
    "page_numbers": [
      6,
      7
    ],
    "table_idx": 0,
    "question": "In which Ghost in the Shell movie did Mary Elizabeth McGlynn voice Major Motoko Kusanagi, and what award did she win for voicing the same character in another Ghost in the Shell series?",
    "answer": "Mary Elizabeth McGlynn voiced Major Motoko Kusanagi in Ghost in the Shell 2: Innocence in 2004, as indicated by source [32]. She also won the 2007 American Anime Award for Best Actress for her role as Major Motoko Kusanagi in Ghost in the Shell: Stand Alone Complex.",
    "retrieved_chunks": [
      "2004Ghost in the Shell 2: InnocenceMajor Motoko Kusanagi[32]",
      "McGlynn won the 2007 American Anime Award for Best Actress for her role as Major Motoko Kusanagi in\nGhost in the Shell: Stand Alone Complex.[7][8]"
    ],
    "retrieved_context": "|   Year | Title                                             | Role                                         | Crew role,<br>notes   | Source[13]   |\n|-------:|:--------------------------------------------------|:---------------------------------------------|:----------------------|:-------------|\n|   2004 | Ghost in the Shell 2: Innocence                   | Major Motoko Kusanagi                        |                       | [32]         |"
  },
  {
    "id": "qa_21_005",
    "source": "b014b8ca3c8ee543b655c29747cc6090.pdf",
    "page_numbers": [
      6,
      7
    ],
    "table_idx": 0,
    "question": "Based on the table, in which Naruto Shippuden movies did Mary Elizabeth McGlynn participate, and what were her roles in those movies?",
    "answer": "Mary Elizabeth McGlynn was involved in two Naruto Shippuden movies: in 2009 as voice director for Naruto Shippuden the Movie, and in 2010 as the voice of Queen Seram in Naruto Shippuden the Movie: The Lost Tower.",
    "retrieved_chunks": [
      "2009Naruto Shippuden the Movie Voice director[33]",
      "2010Naruto Shippuden the Movie:\nThe Lost TowerQueen Seram[15]"
    ],
    "retrieved_context": "|   Year | Title                                             | Role                                         | Crew role,<br>notes   | Source[13]   |\n|-------:|:--------------------------------------------------|:---------------------------------------------|:----------------------|:-------------|\n|   2009 | Naruto Shippuden the Movie                        |                                              | Voice director        | [33]         |\n|   2010 | Naruto Shippuden the Movie: The Lost Tower        | Queen Seram                                  |                       | [15]         |"
  },
  {
    "id": "qa_291_001",
    "source": "b014b8ca3c8ee543b655c29747cc6090.pdf",
    "page_numbers": [
      9,
      10
    ],
    "table_idx": 0,
    "question": "In which years did Mary Elizabeth McGlynn perform as a singer in live-action films, and which of these films cites source [2]?",
    "answer": "In 2006 and 2011, Mary Elizabeth McGlynn was credited as Singer in both Silent Hill and Julia X 3D, with Silent Hill having source [2].",
    "retrieved_chunks": [
      "Mary Elizabeth McGlynn\n 16 languages\nArticleTalk ReadEditView historyTools\nMary Elizabeth McGlynn\nMcGlynn at the 2018 Phoenix Comic Fest\nBorn October 16, 1966 (age 58)\nNewark, New Jersey, US[1]\nOther namesMelissa Williamson[2][3]\nOccupationsVoice actress · ADR director ·\nsinger\nYears active1981–present\nSpousesDaran Norris  (m. 1988; div. 2012) \nSteve Blum  (m. 2017) \nMusical career\nGenresPop rock · alternative rock\nInstrument(s)Vocals, guitar\nLabelsKonami Music Entertainment\nWebsitewww.maryemcglynn.comFrom Wikipedia, the free encyclopedia\nMary Elizabeth McGlynn (born October 16, 1966)[4] is an\nAmerican voice actress, ADR director, and singer, best known\nfor her role as Motoko Kusanagi in the Ghost in the Shell\nseries. She is also known for her involvement in music\nproduction in multiple games from the Silent Hill series, and\nher extensive English-language dubbing of various anime,\nanimated films, and video games, including the English\nadaptation of the television series Cowboy Bebop.\nCareer [edit]\nMcGlynn's voice roles in anime include Lieutenant Matilda in\nthe Mobile Suit Gundam I (1981), Motoko Kusanagi (Ghost in\nthe Shell: Stand Alone Complex), Kurenai Yuhi, Mei Terumi,\nKatsuyu, and Koharu Utatane (from the Naruto series),\nCornelia li Britannia (Code Geass), and the most recent,\nQueen Metalia on Sailor Moon Crystal.\nShe does voice acting in video games such as Maria and Mary\nShepherd-Sunderland in the HD collection version of Silent Hill\n2 and Nina Williams from the Tekken series. She has worked\nin cartoons, with roles such as Dr. Maheswaran in Steven\nUniverse and Steven Universe Future, Abigail Brand in The\nAvengers: Earth's Mightiest Heroes, Dynamite Watkins and\nMiss Quantum on OK KO! Let's Be Heroes, Governor Arihnda\nPryce in Star Wars Rebels and Coach Brunt in Carmen\nSandiego. In addition to her experiences with directing English\ndubs of anime shows, she also served as a dialogue and voice\ndirector for Rapunzel's Tangled Adventure, Penn Zero: Part-\nTime Hero, She-Ra and the Princesses of Power, Dogs in\nSpace, and Dragon Age: Absolution. She contributed to the\nSilent Hill movie adaptation and Dance Dance Revolution\nDonateCreate accountLog in"
    ],
    "retrieved_context": "|   Year | Title                      | Role             | Crew role, notes                 | Source   |\n|-------:|:---------------------------|:-----------------|:---------------------------------|:---------|\n|   1992 | Down the Shore             | Brigitte         | Episode: \"A Tale of Two Houses\"  |          |\n|   1993 | Quantum Leap               | Sue Anne Winters | Episode: \"Memphis Melody\"        |          |\n|   1994 | Walker, Texas Ranger       | Merrilee Summers | Episode: \"Right Man, Wrong Time\" |          |\n|   1995 | Xena: Warrior Princess     | Pandora          | Episode: \"Cradle of Hope\"        |          |\n|   1996 | Murder, She Wrote          | Karen Reisner    | Episode: \"Mrs. Parker's Revenge\" |          |\n|   1997 | Sister, Sister             | Dr. Wilcox       | Episode: \"Two's Company\"         | [47]     |\n|   1998 | Star Trek: Voyager         | Daelen           | Episode: \"Vis a Vis\"             |          |\n|   2006 | Silent Hill                | Singer           | Singer                           | [2]      |\n|   2008 | Adventures in Voice Acting | Herself          | Herself                          | [48]     |\n|   2011 | Julia X 3D                 | Singer           | Singer                           | [2]      |"
  },
  {
    "id": "qa_291_002",
    "source": "b014b8ca3c8ee543b655c29747cc6090.pdf",
    "page_numbers": [
      9,
      10
    ],
    "table_idx": 0,
    "question": "What role did Mary Elizabeth McGlynn play in Star Trek: Voyager in 1998, and what was the episode title?",
    "answer": "In 1998, Mary Elizabeth McGlynn played Daelen in Star Trek: Voyager, in the episode \"Vis a Vis\".",
    "retrieved_chunks": [
      "Mary Elizabeth McGlynn\n 16 languages\nArticleTalk ReadEditView historyTools\nMary Elizabeth McGlynn\nMcGlynn at the 2018 Phoenix Comic Fest\nBorn October 16, 1966 (age 58)\nNewark, New Jersey, US[1]\nOther namesMelissa Williamson[2][3]\nOccupationsVoice actress · ADR director ·\nsinger\nYears active1981–present\nSpousesDaran Norris  (m. 1988; div. 2012) \nSteve Blum  (m. 2017) \nMusical career\nGenresPop rock · alternative rock\nInstrument(s)Vocals, guitar\nLabelsKonami Music Entertainment\nWebsitewww.maryemcglynn.comFrom Wikipedia, the free encyclopedia\nMary Elizabeth McGlynn (born October 16, 1966)[4] is an\nAmerican voice actress, ADR director, and singer, best known\nfor her role as Motoko Kusanagi in the Ghost in the Shell\nseries. She is also known for her involvement in music\nproduction in multiple games from the Silent Hill series, and\nher extensive English-language dubbing of various anime,\nanimated films, and video games, including the English\nadaptation of the television series Cowboy Bebop.\nCareer [edit]\nMcGlynn's voice roles in anime include Lieutenant Matilda in\nthe Mobile Suit Gundam I (1981), Motoko Kusanagi (Ghost in\nthe Shell: Stand Alone Complex), Kurenai Yuhi, Mei Terumi,\nKatsuyu, and Koharu Utatane (from the Naruto series),\nCornelia li Britannia (Code Geass), and the most recent,\nQueen Metalia on Sailor Moon Crystal.\nShe does voice acting in video games such as Maria and Mary\nShepherd-Sunderland in the HD collection version of Silent Hill\n2 and Nina Williams from the Tekken series. She has worked\nin cartoons, with roles such as Dr. Maheswaran in Steven\nUniverse and Steven Universe Future, Abigail Brand in The\nAvengers: Earth's Mightiest Heroes, Dynamite Watkins and\nMiss Quantum on OK KO! Let's Be Heroes, Governor Arihnda\nPryce in Star Wars Rebels and Coach Brunt in Carmen\nSandiego. In addition to her experiences with directing English\ndubs of anime shows, she also served as a dialogue and voice\ndirector for Rapunzel's Tangled Adventure, Penn Zero: Part-\nTime Hero, She-Ra and the Princesses of Power, Dogs in\nSpace, and Dragon Age: Absolution. She contributed to the\nSilent Hill movie adaptation and Dance Dance Revolution\nDonateCreate accountLog in"
    ],
    "retrieved_context": "|   Year | Title                      | Role             | Crew role, notes                 | Source   |\n|-------:|:---------------------------|:-----------------|:---------------------------------|:---------|\n|   1992 | Down the Shore             | Brigitte         | Episode: \"A Tale of Two Houses\"  |          |\n|   1993 | Quantum Leap               | Sue Anne Winters | Episode: \"Memphis Melody\"        |          |\n|   1994 | Walker, Texas Ranger       | Merrilee Summers | Episode: \"Right Man, Wrong Time\" |          |\n|   1995 | Xena: Warrior Princess     | Pandora          | Episode: \"Cradle of Hope\"        |          |\n|   1996 | Murder, She Wrote          | Karen Reisner    | Episode: \"Mrs. Parker's Revenge\" |          |\n|   1997 | Sister, Sister             | Dr. Wilcox       | Episode: \"Two's Company\"         | [47]     |\n|   1998 | Star Trek: Voyager         | Daelen           | Episode: \"Vis a Vis\"             |          |\n|   2006 | Silent Hill                | Singer           | Singer                           | [2]      |\n|   2008 | Adventures in Voice Acting | Herself          | Herself                          | [48]     |\n|   2011 | Julia X 3D                 | Singer           | Singer                           | [2]      |"
  },
  {
    "id": "qa_291_003",
    "source": "b014b8ca3c8ee543b655c29747cc6090.pdf",
    "page_numbers": [
      9,
      10
    ],
    "table_idx": 0,
    "question": "In what episode of Murder, She Wrote did Mary Elizabeth McGlynn play Karen Reisner, and in what year did it air?",
    "answer": "Mary Elizabeth McGlynn played Karen Reisner in the \"Mrs. Parker's Revenge\" episode of Murder, She Wrote in 1996.",
    "retrieved_chunks": [
      "Mary Elizabeth McGlynn\n 16 languages\nArticleTalk ReadEditView historyTools\nMary Elizabeth McGlynn\nMcGlynn at the 2018 Phoenix Comic Fest\nBorn October 16, 1966 (age 58)\nNewark, New Jersey, US[1]\nOther namesMelissa Williamson[2][3]\nOccupationsVoice actress · ADR director ·\nsinger\nYears active1981–present\nSpousesDaran Norris  (m. 1988; div. 2012) \nSteve Blum  (m. 2017) \nMusical career\nGenresPop rock · alternative rock\nInstrument(s)Vocals, guitar\nLabelsKonami Music Entertainment\nWebsitewww.maryemcglynn.comFrom Wikipedia, the free encyclopedia\nMary Elizabeth McGlynn (born October 16, 1966)[4] is an\nAmerican voice actress, ADR director, and singer, best known\nfor her role as Motoko Kusanagi in the Ghost in the Shell\nseries. She is also known for her involvement in music\nproduction in multiple games from the Silent Hill series, and\nher extensive English-language dubbing of various anime,\nanimated films, and video games, including the English\nadaptation of the television series Cowboy Bebop.\nCareer [edit]\nMcGlynn's voice roles in anime include Lieutenant Matilda in\nthe Mobile Suit Gundam I (1981), Motoko Kusanagi (Ghost in\nthe Shell: Stand Alone Complex), Kurenai Yuhi, Mei Terumi,\nKatsuyu, and Koharu Utatane (from the Naruto series),\nCornelia li Britannia (Code Geass), and the most recent,\nQueen Metalia on Sailor Moon Crystal.\nShe does voice acting in video games such as Maria and Mary\nShepherd-Sunderland in the HD collection version of Silent Hill\n2 and Nina Williams from the Tekken series. She has worked\nin cartoons, with roles such as Dr. Maheswaran in Steven\nUniverse and Steven Universe Future, Abigail Brand in The\nAvengers: Earth's Mightiest Heroes, Dynamite Watkins and\nMiss Quantum on OK KO! Let's Be Heroes, Governor Arihnda\nPryce in Star Wars Rebels and Coach Brunt in Carmen\nSandiego. In addition to her experiences with directing English\ndubs of anime shows, she also served as a dialogue and voice\ndirector for Rapunzel's Tangled Adventure, Penn Zero: Part-\nTime Hero, She-Ra and the Princesses of Power, Dogs in\nSpace, and Dragon Age: Absolution. She contributed to the\nSilent Hill movie adaptation and Dance Dance Revolution\nDonateCreate accountLog in"
    ],
    "retrieved_context": "|   Year | Title                      | Role             | Crew role, notes                 | Source   |\n|-------:|:---------------------------|:-----------------|:---------------------------------|:---------|\n|   1992 | Down the Shore             | Brigitte         | Episode: \"A Tale of Two Houses\"  |          |\n|   1993 | Quantum Leap               | Sue Anne Winters | Episode: \"Memphis Melody\"        |          |\n|   1994 | Walker, Texas Ranger       | Merrilee Summers | Episode: \"Right Man, Wrong Time\" |          |\n|   1995 | Xena: Warrior Princess     | Pandora          | Episode: \"Cradle of Hope\"        |          |\n|   1996 | Murder, She Wrote          | Karen Reisner    | Episode: \"Mrs. Parker's Revenge\" |          |\n|   1997 | Sister, Sister             | Dr. Wilcox       | Episode: \"Two's Company\"         | [47]     |\n|   1998 | Star Trek: Voyager         | Daelen           | Episode: \"Vis a Vis\"             |          |\n|   2006 | Silent Hill                | Singer           | Singer                           | [2]      |\n|   2008 | Adventures in Voice Acting | Herself          | Herself                          | [48]     |\n|   2011 | Julia X 3D                 | Singer           | Singer                           | [2]      |"
  },
  {
    "id": "qa_291_004",
    "source": "b014b8ca3c8ee543b655c29747cc6090.pdf",
    "page_numbers": [
      9,
      10
    ],
    "table_idx": 0,
    "question": "Which role played by Mary Elizabeth McGlynn has source [47] cited in the table, and what was the episode title?",
    "answer": "Mary Elizabeth McGlynn's role as Dr. Wilcox in Sister, Sister, specifically the episode \"Two's Company\", is marked with source [47].",
    "retrieved_chunks": [
      "Mary Elizabeth McGlynn\n 16 languages\nArticleTalk ReadEditView historyTools\nMary Elizabeth McGlynn\nMcGlynn at the 2018 Phoenix Comic Fest\nBorn October 16, 1966 (age 58)\nNewark, New Jersey, US[1]\nOther namesMelissa Williamson[2][3]\nOccupationsVoice actress · ADR director ·\nsinger\nYears active1981–present\nSpousesDaran Norris  (m. 1988; div. 2012) \nSteve Blum  (m. 2017) \nMusical career\nGenresPop rock · alternative rock\nInstrument(s)Vocals, guitar\nLabelsKonami Music Entertainment\nWebsitewww.maryemcglynn.comFrom Wikipedia, the free encyclopedia\nMary Elizabeth McGlynn (born October 16, 1966)[4] is an\nAmerican voice actress, ADR director, and singer, best known\nfor her role as Motoko Kusanagi in the Ghost in the Shell\nseries. She is also known for her involvement in music\nproduction in multiple games from the Silent Hill series, and\nher extensive English-language dubbing of various anime,\nanimated films, and video games, including the English\nadaptation of the television series Cowboy Bebop.\nCareer [edit]\nMcGlynn's voice roles in anime include Lieutenant Matilda in\nthe Mobile Suit Gundam I (1981), Motoko Kusanagi (Ghost in\nthe Shell: Stand Alone Complex), Kurenai Yuhi, Mei Terumi,\nKatsuyu, and Koharu Utatane (from the Naruto series),\nCornelia li Britannia (Code Geass), and the most recent,\nQueen Metalia on Sailor Moon Crystal.\nShe does voice acting in video games such as Maria and Mary\nShepherd-Sunderland in the HD collection version of Silent Hill\n2 and Nina Williams from the Tekken series. She has worked\nin cartoons, with roles such as Dr. Maheswaran in Steven\nUniverse and Steven Universe Future, Abigail Brand in The\nAvengers: Earth's Mightiest Heroes, Dynamite Watkins and\nMiss Quantum on OK KO! Let's Be Heroes, Governor Arihnda\nPryce in Star Wars Rebels and Coach Brunt in Carmen\nSandiego. In addition to her experiences with directing English\ndubs of anime shows, she also served as a dialogue and voice\ndirector for Rapunzel's Tangled Adventure, Penn Zero: Part-\nTime Hero, She-Ra and the Princesses of Power, Dogs in\nSpace, and Dragon Age: Absolution. She contributed to the\nSilent Hill movie adaptation and Dance Dance Revolution\nDonateCreate accountLog in"
    ],
    "retrieved_context": "|   Year | Title                      | Role             | Crew role, notes                 | Source   |\n|-------:|:---------------------------|:-----------------|:---------------------------------|:---------|\n|   1992 | Down the Shore             | Brigitte         | Episode: \"A Tale of Two Houses\"  |          |\n|   1993 | Quantum Leap               | Sue Anne Winters | Episode: \"Memphis Melody\"        |          |\n|   1994 | Walker, Texas Ranger       | Merrilee Summers | Episode: \"Right Man, Wrong Time\" |          |\n|   1995 | Xena: Warrior Princess     | Pandora          | Episode: \"Cradle of Hope\"        |          |\n|   1996 | Murder, She Wrote          | Karen Reisner    | Episode: \"Mrs. Parker's Revenge\" |          |\n|   1997 | Sister, Sister             | Dr. Wilcox       | Episode: \"Two's Company\"         | [47]     |\n|   1998 | Star Trek: Voyager         | Daelen           | Episode: \"Vis a Vis\"             |          |\n|   2006 | Silent Hill                | Singer           | Singer                           | [2]      |\n|   2008 | Adventures in Voice Acting | Herself          | Herself                          | [48]     |\n|   2011 | Julia X 3D                 | Singer           | Singer                           | [2]      |"
  },
  {
    "id": "qa_291_005",
    "source": "b014b8ca3c8ee543b655c29747cc6090.pdf",
    "page_numbers": [
      9,
      10
    ],
    "table_idx": 0,
    "question": "Which role did Mary Elizabeth McGlynn play before her appearance as Pandora in Xena: Warrior Princess's \"Cradle of Hope\" episode in 1995, including the title and episode?",
    "answer": "Mary Elizabeth McGlynn played Sue Anne Winters in the \"Memphis Melody\" episode of Quantum Leap in 1993, prior to her role as Pandora in the \"Cradle of Hope\" episode of Xena: Warrior Princess in 1995.",
    "retrieved_chunks": [
      "Mary Elizabeth McGlynn\n 16 languages\nArticleTalk ReadEditView historyTools\nMary Elizabeth McGlynn\nMcGlynn at the 2018 Phoenix Comic Fest\nBorn October 16, 1966 (age 58)\nNewark, New Jersey, US[1]\nOther namesMelissa Williamson[2][3]\nOccupationsVoice actress · ADR director ·\nsinger\nYears active1981–present\nSpousesDaran Norris  (m. 1988; div. 2012) \nSteve Blum  (m. 2017) \nMusical career\nGenresPop rock · alternative rock\nInstrument(s)Vocals, guitar\nLabelsKonami Music Entertainment\nWebsitewww.maryemcglynn.comFrom Wikipedia, the free encyclopedia\nMary Elizabeth McGlynn (born October 16, 1966)[4] is an\nAmerican voice actress, ADR director, and singer, best known\nfor her role as Motoko Kusanagi in the Ghost in the Shell\nseries. She is also known for her involvement in music\nproduction in multiple games from the Silent Hill series, and\nher extensive English-language dubbing of various anime,\nanimated films, and video games, including the English\nadaptation of the television series Cowboy Bebop.\nCareer [edit]\nMcGlynn's voice roles in anime include Lieutenant Matilda in\nthe Mobile Suit Gundam I (1981), Motoko Kusanagi (Ghost in\nthe Shell: Stand Alone Complex), Kurenai Yuhi, Mei Terumi,\nKatsuyu, and Koharu Utatane (from the Naruto series),\nCornelia li Britannia (Code Geass), and the most recent,\nQueen Metalia on Sailor Moon Crystal.\nShe does voice acting in video games such as Maria and Mary\nShepherd-Sunderland in the HD collection version of Silent Hill\n2 and Nina Williams from the Tekken series. She has worked\nin cartoons, with roles such as Dr. Maheswaran in Steven\nUniverse and Steven Universe Future, Abigail Brand in The\nAvengers: Earth's Mightiest Heroes, Dynamite Watkins and\nMiss Quantum on OK KO! Let's Be Heroes, Governor Arihnda\nPryce in Star Wars Rebels and Coach Brunt in Carmen\nSandiego. In addition to her experiences with directing English\ndubs of anime shows, she also served as a dialogue and voice\ndirector for Rapunzel's Tangled Adventure, Penn Zero: Part-\nTime Hero, She-Ra and the Princesses of Power, Dogs in\nSpace, and Dragon Age: Absolution. She contributed to the\nSilent Hill movie adaptation and Dance Dance Revolution\nDonateCreate accountLog in"
    ],
    "retrieved_context": "|   Year | Title                      | Role             | Crew role, notes                 | Source   |\n|-------:|:---------------------------|:-----------------|:---------------------------------|:---------|\n|   1992 | Down the Shore             | Brigitte         | Episode: \"A Tale of Two Houses\"  |          |\n|   1993 | Quantum Leap               | Sue Anne Winters | Episode: \"Memphis Melody\"        |          |\n|   1994 | Walker, Texas Ranger       | Merrilee Summers | Episode: \"Right Man, Wrong Time\" |          |\n|   1995 | Xena: Warrior Princess     | Pandora          | Episode: \"Cradle of Hope\"        |          |\n|   1996 | Murder, She Wrote          | Karen Reisner    | Episode: \"Mrs. Parker's Revenge\" |          |\n|   1997 | Sister, Sister             | Dr. Wilcox       | Episode: \"Two's Company\"         | [47]     |\n|   1998 | Star Trek: Voyager         | Daelen           | Episode: \"Vis a Vis\"             |          |\n|   2006 | Silent Hill                | Singer           | Singer                           | [2]      |\n|   2008 | Adventures in Voice Acting | Herself          | Herself                          | [48]     |\n|   2011 | Julia X 3D                 | Singer           | Singer                           | [2]      |"
  },
  {
    "id": "1",
    "source": "b014b8ca3c8ee543b655c29747cc6090.pdf",
    "page_numbers": [
      12
    ],
    "table_idx": 0,
    "question": "Based on the table and the additional text, what is one of the media categories related to Silent Hill that Mary Elizabeth McGlynn has contributed to?",
    "answer": "Mary Elizabeth McGlynn was involved in music production for the Silent Hill series and also did voice acting for Maria and Mary Shepherd-Sunderland in the HD collection version of Silent Hill 2.",
    "retrieved_chunks": [
      "Mary Elizabeth McGlynn\n 16 languages\nArticleTalk ReadEditView historyTools\nMary Elizabeth McGlynn\nMcGlynn at the 2018 Phoenix Comic Fest\nBorn October 16, 1966 (age 58)\nNewark, New Jersey, US[1]\nOther namesMelissa Williamson[2][3]\nOccupationsVoice actress · ADR director ·\nsinger\nYears active1981–present\nSpousesDaran Norris  (m. 1988; div. 2012) \nSteve Blum  (m. 2017) \nMusical career\nGenresPop rock · alternative rock\nInstrument(s)Vocals, guitar\nLabelsKonami Music Entertainment\nWebsitewww.maryemcglynn.comFrom Wikipedia, the free encyclopedia\nMary Elizabeth McGlynn (born October 16, 1966)[4] is an\nAmerican voice actress, ADR director, and singer, best known\nfor her role as Motoko Kusanagi in the Ghost in the Shell\nseries. She is also known for her involvement in music\nproduction in multiple games from the Silent Hill series, and\nher extensive English-language dubbing of various anime,\nanimated films, and video games, including the English\nadaptation of the television series Cowboy Bebop.\nCareer [edit]\nMcGlynn's voice roles in anime include Lieutenant Matilda in\nthe Mobile Suit Gundam I (1981), Motoko Kusanagi (Ghost in\nthe Shell: Stand Alone Complex), Kurenai Yuhi, Mei Terumi,\nKatsuyu, and Koharu Utatane (from the Naruto series),\nCornelia li Britannia (Code Geass), and the most recent,\nQueen Metalia on Sailor Moon Crystal.\nShe does voice acting in video games such as Maria and Mary\nShepherd-Sunderland in the HD collection version of Silent Hill\n2 and Nina Williams from the Tekken series. She has worked\nin cartoons, with roles such as Dr. Maheswaran in Steven\nUniverse and Steven Universe Future, Abigail Brand in The\nAvengers: Earth's Mightiest Heroes, Dynamite Watkins and\nMiss Quantum on OK KO! Let's Be Heroes, Governor Arihnda\nPryce in Star Wars Rebels and Coach Brunt in Carmen\nSandiego. In addition to her experiences with directing English\ndubs of anime shows, she also served as a dialogue and voice\ndirector for Rapunzel's Tangled Adventure, Penn Zero: Part-\nTime Hero, She-Ra and the Princesses of Power, Dogs in\nSpace, and Dragon Age: Absolution. She contributed to the\nSilent Hill movie adaptation and Dance Dance Revolution\nDonateCreate accountLog in"
    ],
    "retrieved_context": "| v · t · e Silent Hill [hide]       |                                    |                                                                                                                          |\n|:-----------------------------------|:-----------------------------------|:-------------------------------------------------------------------------------------------------------------------------|\n| Games                              | Main series                        | Silent Hill (Shattered Memories) · 2 (remake) · 3 · 4: The Room · Origins · Homecoming · Downpour · f                    |\n| Games                              | Other                              | The Arcade · Orphan · The Escape · HD Collection · Book of Memories · P.T. · Silent Hills (canceled) · The Short Message |\n| Characters                         | Characters                         | Heather Mason · James Sunderland · Pyramid Head                                                                          |\n| Media                              | Media                              | Comics · Films (Silent Hill · Revelation · Return to Silent Hill)                                                        |\n| Category                           | Category                           | Category                                                                                                                 |\n| Authority control databases [hide] | Authority control databases [hide] | Authority control databases [hide]                                                                                       |"
  },
  {
    "id": "2",
    "source": "b014b8ca3c8ee543b655c29747cc6090.pdf",
    "page_numbers": [
      12
    ],
    "table_idx": 0,
    "question": "According to the table, what games are included in the main series of Silent Hill?",
    "answer": "The main series of Silent Hill games includes 'Silent Hill (Shattered Memories)', '2 (remake)', '3', '4: The Room', 'Origins', 'Homecoming', 'Downpour', and 'f'.",
    "retrieved_chunks": [],
    "retrieved_context": "| v · t · e Silent Hill [hide]       |                                    |                                                                                                                          |\n|:-----------------------------------|:-----------------------------------|:-------------------------------------------------------------------------------------------------------------------------|\n| Games                              | Main series                        | Silent Hill (Shattered Memories) · 2 (remake) · 3 · 4: The Room · Origins · Homecoming · Downpour · f                    |\n| Games                              | Other                              | The Arcade · Orphan · The Escape · HD Collection · Book of Memories · P.T. · Silent Hills (canceled) · The Short Message |\n| Characters                         | Characters                         | Heather Mason · James Sunderland · Pyramid Head                                                                          |\n| Media                              | Media                              | Comics · Films (Silent Hill · Revelation · Return to Silent Hill)                                                        |\n| Category                           | Category                           | Category                                                                                                                 |\n| Authority control databases [hide] | Authority control databases [hide] | Authority control databases [hide]                                                                                       |"
  },
  {
    "id": "3",
    "source": "b014b8ca3c8ee543b655c29747cc6090.pdf",
    "page_numbers": [
      12
    ],
    "table_idx": 0,
    "question": "Based on the table, what games are categorized as 'Other' within the Silent Hill series?",
    "answer": "The 'Other' games in the Silent Hill series include 'The Arcade', 'Orphan', 'The Escape', 'HD Collection', 'Book of Memories', 'P.T.', 'Silent Hills (canceled)', and 'The Short Message'.",
    "retrieved_chunks": [],
    "retrieved_context": "| v · t · e Silent Hill [hide]       |                                    |                                                                                                                          |\n|:-----------------------------------|:-----------------------------------|:-------------------------------------------------------------------------------------------------------------------------|\n| Games                              | Main series                        | Silent Hill (Shattered Memories) · 2 (remake) · 3 · 4: The Room · Origins · Homecoming · Downpour · f                    |\n| Games                              | Other                              | The Arcade · Orphan · The Escape · HD Collection · Book of Memories · P.T. · Silent Hills (canceled) · The Short Message |\n| Characters                         | Characters                         | Heather Mason · James Sunderland · Pyramid Head                                                                          |\n| Media                              | Media                              | Comics · Films (Silent Hill · Revelation · Return to Silent Hill)                                                        |\n| Category                           | Category                           | Category                                                                                                                 |\n| Authority control databases [hide] | Authority control databases [hide] | Authority control databases [hide]                                                                                       |"
  },
  {
    "id": "4",
    "source": "b014b8ca3c8ee543b655c29747cc6090.pdf",
    "page_numbers": [
      12
    ],
    "table_idx": 0,
    "question": "According to the table, what films are listed as part of the 'Media' category for Silent Hill?",
    "answer": "The films listed under the 'Media' category for Silent Hill are 'Silent Hill', 'Revelation', and 'Return to Silent Hill'.",
    "retrieved_chunks": [],
    "retrieved_context": "| v · t · e Silent Hill [hide]       |                                    |                                                                                                                          |\n|:-----------------------------------|:-----------------------------------|:-------------------------------------------------------------------------------------------------------------------------|\n| Games                              | Main series                        | Silent Hill (Shattered Memories) · 2 (remake) · 3 · 4: The Room · Origins · Homecoming · Downpour · f                    |\n| Games                              | Other                              | The Arcade · Orphan · The Escape · HD Collection · Book of Memories · P.T. · Silent Hills (canceled) · The Short Message |\n| Characters                         | Characters                         | Heather Mason · James Sunderland · Pyramid Head                                                                          |\n| Media                              | Media                              | Comics · Films (Silent Hill · Revelation · Return to Silent Hill)                                                        |\n| Category                           | Category                           | Category                                                                                                                 |\n| Authority control databases [hide] | Authority control databases [hide] | Authority control databases [hide]                                                                                       |"
  },
  {
    "id": "5",
    "source": "b014b8ca3c8ee543b655c29747cc6090.pdf",
    "page_numbers": [
      12
    ],
    "table_idx": 0,
    "question": "Based on the table, which characters are specifically listed as being part of the Silent Hill series?",
    "answer": "Heather Mason, James Sunderland, and Pyramid Head are listed as characters in the Silent Hill series.",
    "retrieved_chunks": [],
    "retrieved_context": "| v · t · e Silent Hill [hide]       |                                    |                                                                                                                          |\n|:-----------------------------------|:-----------------------------------|:-------------------------------------------------------------------------------------------------------------------------|\n| Games                              | Main series                        | Silent Hill (Shattered Memories) · 2 (remake) · 3 · 4: The Room · Origins · Homecoming · Downpour · f                    |\n| Games                              | Other                              | The Arcade · Orphan · The Escape · HD Collection · Book of Memories · P.T. · Silent Hills (canceled) · The Short Message |\n| Characters                         | Characters                         | Heather Mason · James Sunderland · Pyramid Head                                                                          |\n| Media                              | Media                              | Comics · Films (Silent Hill · Revelation · Return to Silent Hill)                                                        |\n| Category                           | Category                           | Category                                                                                                                 |\n| Authority control databases [hide] | Authority control databases [hide] | Authority control databases [hide]                                                                                       |"
  },
  {
    "id": "qa_78_001",
    "source": "2c98e99a08ec5392d50e60370d871319.pdf",
    "page_numbers": [
      1
    ],
    "table_idx": 0,
    "question": "According to the table, what nomination did Denzel Washington receive at the AACTA International Awards and when was the ceremony?",
    "answer": "Denzel Washington received a nomination for Best Actor at the AACTA International Awards on January 8, 2017.",
    "retrieved_chunks": [
      "List of accolades received by Fences (film)\n 1 language\nArticleTalk ReadEditView historyTools\nList of accolades received by Fences\nDenzel Washington and Viola Davis received several\nawards and nominations for their performance in the film\nAccolades\nTotal number of awards and nominations\nTotals 29 96\nReferencesFrom Wikipedia, the free encyclopedia\nFences is a 2016 American drama film directed by\nDenzel Washington and written by August Wilson.\nStarring Washington, Viola Davis, Jovan Adepo and\nStephen McKinley Henderson, the film focuses on a\nman and his life, family, and job.[1] The film began a\nlimited release on December 16, 2016, before opening\nwide on December 25.[2] The film was released to\nuniversal acclaim, with Rotten Tomatoes listing an\napproval rating of 93%, based on 207 reviews, with an\naverage rating of 7.7/10,[3] and Metacritic listing a\nscore of 79 out of 100, based on 48 reviews.[4]\nFences won the Academy Award for Best Supporting\nActress and the British Academy Film Award for Best\nActress in a Supporting Role for Davis.[5] The film won\nBest Supporting Actress for Davis and was nominated\nfor Best Picture, Best Director, Best Actor for\nWashington, Best Acting Ensemble and Best Adapted\nScreenplay at Critics' Choice Awards.[6] The film won Best Supporting Actress – Motion Picture for Davis\nand was nominated for Best Actor – Motion Picture Drama for Washington at Golden Globe Awards.[7] The\nfilm received four nominations at Satellite Awards, including Best Film, Best Director, Best Actor for\nWashington and Best Supporting Actress for Davis.[8]\nAccolades [edit]\nAwardDate of\nceremonyCategory Recipient(s)ResultRef.\nAACTA\nInternational\nAwardsJanuary 8,\n2017Best Actor Denzel WashingtonNominated\n[9]\nBest Supporting ActressViola Davis Nominated\nAARP Annual\nMovies forFebruary 6,\n2017Best Actor Denzel WashingtonWon[10]\nDonateCreate accountLog in"
    ],
    "retrieved_context": "| Denzel Washington and Viola Davis received several<br>awards and nominations for their performance in the film   |    |    |\n|:-----------------------------------------------------------------------------------------------------------------|:---|:---|"
  },
  {
    "id": "qa_78_002",
    "source": "2c98e99a08ec5392d50e60370d871319.pdf",
    "page_numbers": [
      1
    ],
    "table_idx": 0,
    "question": "According to the table, which award did Viola Davis win at the Black Reel Awards and when was the ceremony held?",
    "answer": "Viola Davis won the Best Supporting Actress award at the Black Reel Awards on February 16, 2017.",
    "retrieved_chunks": [
      "Black Reel\nAwardsFebruary 16,\n2017Outstanding FilmTodd Black, Scott\nRudin and Denzel\nWashingtonNominated\n[20]Outstanding DirectorDenzel WashingtonNominated\nOutstanding Actor Denzel WashingtonWon\nOutstanding Supporting\nActorJovan Adepo Nominated\nStephen McKinley\nHendersonNominated\nOutstanding Supporting\nActressViola Davis Won\nOutstanding Screenplay,\nAdapted or OriginalAugust Wilson Nominated\nOutstanding EnsembleThe cast of FencesNominated\nOutstanding\nBreakthrough\nPerformance, MaleJovan Adepo Nominated\nOutstanding Original\nScoreMarcelo Zarvos Nominated"
    ],
    "retrieved_context": "| Denzel Washington and Viola Davis received several<br>awards and nominations for their performance in the film   |    |    |\n|:-----------------------------------------------------------------------------------------------------------------|:---|:---|"
  },
  {
    "id": "qa_78_003",
    "source": "2c98e99a08ec5392d50e60370d871319.pdf",
    "page_numbers": [
      1
    ],
    "table_idx": 0,
    "question": "Based on the additional text, for which award was August Wilson nominated at the Writers Guild of America Awards, and when was the ceremony?",
    "answer": "August Wilson was nominated for Best Adapted Screenplay at the Writers Guild of America Awards, with the ceremony held on February 19, 2017.",
    "retrieved_chunks": [
      "Best Adapted ScreenplayAugust Wilson Nominated\nWriters Guild of\nAmerica AwardsFebruary 19,\n2017Best Adapted ScreenplayAugust Wilson Nominated[46]"
    ],
    "retrieved_context": "| Denzel Washington and Viola Davis received several<br>awards and nominations for their performance in the film   |    |    |\n|:-----------------------------------------------------------------------------------------------------------------|:---|:---|"
  },
  {
    "id": "qa_78_004",
    "source": "2c98e99a08ec5392d50e60370d871319.pdf",
    "page_numbers": [
      1
    ],
    "table_idx": 0,
    "question": "According to the table, what awards did Denzel Washington and Viola Davis win at the NAACP Image Awards, and when was the ceremony held?",
    "answer": "Denzel Washington won Outstanding Actor and Viola Davis won Outstanding Supporting Actress at the NAACP Image Awards ceremony held on February 11, 2017.",
    "retrieved_chunks": [
      "NAACP Image\nAwardsFebruary 11,\n2017Outstanding Motion\nPictureFences Nominated\n[31]Outstanding Actor in a\nMotion PictureDenzel WashingtonWon\nOutstanding Supporting\nActress in a Motion\nPictureViola Davis Won"
    ],
    "retrieved_context": "| Denzel Washington and Viola Davis received several<br>awards and nominations for their performance in the film   |    |    |\n|:-----------------------------------------------------------------------------------------------------------------|:---|:---|"
  },
  {
    "id": "qa_78_005",
    "source": "2c98e99a08ec5392d50e60370d871319.pdf",
    "page_numbers": [
      1
    ],
    "table_idx": 0,
    "question": "According to the table, what were the results of Denzel Washington and Viola Davis' nominations at the Dorian Awards, and when did the awards take place?",
    "answer": "Denzel Washington was nominated for Best Actor at the Dorian Awards, but Viola Davis won Film Performance of the Year — Actress at the same awards on January 26, 2017.",
    "retrieved_chunks": [
      "Dorian AwardsJanuary 26,\n2017Film Performance of the\nYear — ActorDenzel WashingtonNominated\n[24]\nFilm Performance of the\nYear — ActressViola Davis Won"
    ],
    "retrieved_context": "| Denzel Washington and Viola Davis received several<br>awards and nominations for their performance in the film   |    |    |\n|:-----------------------------------------------------------------------------------------------------------------|:---|:---|"
  },
  {
    "id": "qa_83_001",
    "source": "0c92f65db928c431023f59603039aa1e.pdf",
    "page_numbers": [],
    "table_idx": 0,
    "question": "According to the table, what does the symbol '‡' indicate?",
    "answer": "The symbol '‡' in the table indicates the winner of the Academy Award for Best Actress.",
    "retrieved_chunks": [],
    "retrieved_context": "|    | Table key                      |\n|:---|:-------------------------------|\n| ‡  | Indicates the winner           |\n| †  | Indicates a posthumous nominee |"
  },
  {
    "id": "qa_83_002",
    "source": "0c92f65db928c431023f59603039aa1e.pdf",
    "page_numbers": [],
    "table_idx": 0,
    "question": "What does the symbol '†' signify in the table?",
    "answer": "The table indicates that the symbol '†' signifies a posthumous nominee.",
    "retrieved_chunks": [],
    "retrieved_context": "|    | Table key                      |\n|:---|:-------------------------------|\n| ‡  | Indicates the winner           |\n| †  | Indicates a posthumous nominee |"
  },
  {
    "id": "qa_83_003",
    "source": "0c92f65db928c431023f59603039aa1e.pdf",
    "page_numbers": [],
    "table_idx": 0,
    "question": "How many Academy Awards for Best Actress has Frances McDormand won, according to the text?",
    "answer": "Based on the provided text, Frances McDormand has won 3 Academy Awards for Best Actress.",
    "retrieved_chunks": [],
    "retrieved_context": "|    | Table key                      |\n|:---|:-------------------------------|\n| ‡  | Indicates the winner           |\n| †  | Indicates a posthumous nominee |"
  },
  {
    "id": "qa_83_004",
    "source": "0c92f65db928c431023f59603039aa1e.pdf",
    "page_numbers": [],
    "table_idx": 0,
    "question": "Which actress has the most nominations for Best Actress, and how many wins does she have?",
    "answer": "According to the text, Katharine Hepburn has the most nominations with 12 and 4 wins.",
    "retrieved_chunks": [],
    "retrieved_context": "|    | Table key                      |\n|:---|:-------------------------------|\n| ‡  | Indicates the winner           |\n| †  | Indicates a posthumous nominee |"
  },
  {
    "id": "qa_83_005",
    "source": "0c92f65db928c431023f59603039aa1e.pdf",
    "page_numbers": [],
    "table_idx": 0,
    "question": "Which actress won for Johnny Belinda and was the first winner to utilize ASL?",
    "answer": "According to the text, Jane Wyman won for Johnny Belinda (1948) and was the first winner to utilize ASL.",
    "retrieved_chunks": [],
    "retrieved_context": "|    | Table key                      |\n|:---|:-------------------------------|\n| ‡  | Indicates the winner           |\n| †  | Indicates a posthumous nominee |"
  },
  {
    "id": "qa_88_001",
    "source": "0c92f65db928c431023f59603039aa1e.pdf",
    "page_numbers": [
      2
    ],
    "table_idx": 0,
    "question": "In 1927/28, for which films did Janet Gaynor win the Best Actress award?",
    "answer": "Janet Gaynor won the award for Best Actress for her roles in 7th Heaven, Street Angel, and Sunrise: A Song of Two Humans.",
    "retrieved_chunks": [
      "Janet Gaynor was\nthe inaugural\nwinner, for three\nfilms: 7th Heaven\n(1927), Street\nAngel (1928), and\nSunrise: A Song of\nTwo Humans\n(1927)."
    ],
    "retrieved_context": "| Year                   | Actress          | Role(s)            | Film                          | Ref.   |\n|:-----------------------|:-----------------|:-------------------|:------------------------------|:-------|\n| 1927/28 (1st)          | Janet Gaynor ‡   | Diane              | 7th Heaven                    | [6]    |\n| 1927/28 (1st)          | Janet Gaynor ‡   | Angela             | Street Angel                  | [6]    |\n| 1927/28 (1st)          | Janet Gaynor ‡   | The Wife           | Sunrise: A Song of Two Humans | [6]    | "
  },
  {
    "id": "qa_88_002",
    "source": "0c92f65db928c431023f59603039aa1e.pdf",
    "page_numbers": [
      2
    ],
    "table_idx": 0,
    "question": "Which actresses were nominated for playing the role of Leslie Crosbie in the film 'The Letter', according to the table and additional text?",
    "answer": "Jeanne Eagels, nominated for her role as Leslie Crosbie in 'The Letter' in 1928/29, and Bette Davis, who also played Leslie Crosbie in 'The Letter' in 1940.",
    "retrieved_chunks": [
      "Ginger Rogers\nwon for Kitty Foyle\n(1940).\nJoan Fontaine\nwon for Suspicion\n(1941).\nGreer Garson won\nfor Mrs. Miniver\n(1942).\nJennifer Jones\nwon for The Song\nof Bernadette\n(1943).\nIngrid Bergman\nwon twice, for\nGaslight (1944)\nand Anastasia\n(1956).Greta GarboNina Yakushova\n\"Ninotchka\" IvanoffNinotchka\nGreer GarsonKatherine BridgesGoodbye, Mr. Chips\n1940s [edit]\nYearActress Role(s) Film Ref.\n1940\n(13th)Ginger Rogers ‡Kitty Foyle Kitty Foyle\n[18]Bette DavisLeslie Crosbie The Letter",
      "Multiple character nominations [edit]\nThe following were nominated for their portrayals of the same fictional or non-fictional character in separate\nfilms (including variations of the original).\nBillie Holiday from Lady Sings the Blues (Diana Ross, 1972) and The United States vs. Billie Holiday (Andra\nDay, 2021)\nJosephine \"Jo\" March from Little Women (Winona Ryder, 1994) and Little Women (Saoirse Ronan, 2019)\nLeslie Crosbie from The Letter (Jeanne Eagels, 1929) and The Letter (Bette Davis, 1940)"
    ],
    "retrieved_context": "| Year                   | Actress          | Role(s)            | Film                          | Ref.   |\n|:-----------------------|:-----------------|:-------------------|:------------------------------|:-------|\n| 1928/29 (2nd) [note 1] | Jeanne Eagels †  | Leslie Crosbie     | The Letter                    | [7]    |"
  },
  {
    "id": "qa_88_003",
    "source": "0c92f65db928c431023f59603039aa1e.pdf",
    "page_numbers": [
      2
    ],
    "table_idx": 0,
    "question": "In what film and role was Louise Dresser nominated in 1927/28?",
    "answer": "In 1927/28, Louise Dresser was nominated for her role as Mrs. Pleznik in the film A Ship Comes In.",
    "retrieved_chunks": [],
    "retrieved_context": "| Year                   | Actress          | Role(s)            | Film                          | Ref.   |\n|:-----------------------|:-----------------|:-------------------|:------------------------------|:-------|\n| 1927/28 (1st)          | Louise Dresser   | Mrs. Pleznik       | A Ship Comes In               | [6]    |"
  },
  {
    "id": "qa_88_004",
    "source": "0c92f65db928c431023f59603039aa1e.pdf",
    "page_numbers": [
      2
    ],
    "table_idx": 0,
    "question": "What roles and films earned Gloria Swanson nominations in the years listed in the table?",
    "answer": "In 1927/28, Gloria Swanson was nominated for her role as Sadie Thompson in the film Sadie Thompson, and in 1929/30, she was nominated for her role as Marion Donnell in The Trespasser.",
    "retrieved_chunks": [],
    "retrieved_context": "| Year                   | Actress          | Role(s)            | Film                          | Ref.   |\n|:-----------------------|:-----------------|:-------------------|:------------------------------|:-------|\n| 1927/28 (1st)          | Gloria Swanson   | Sadie Thompson     | Sadie Thompson                | [6]    |"
  },
  {
    "id": "qa_88_005",
    "source": "0c92f65db928c431023f59603039aa1e.pdf",
    "page_numbers": [
      2
    ],
    "table_idx": 0,
    "question": "Which actress won an award for her role in Coquette, and in what year?",
    "answer": "Mary Pickford won for Coquette in 1928/29.",
    "retrieved_chunks": [
      "Mary Pickford won\nfor Coquette\n(1929)."
    ],
    "retrieved_context": "| Year                   | Actress          | Role(s)            | Film                          | Ref.   |\n|:-----------------------|:-----------------|:-------------------|:------------------------------|:-------|\n| 1928/29 (2nd) [note 1] | Mary Pickford ‡  | Norma Besant       | Coquette                      | [7]    |"
  },
  {
    "id": "qa_837_001",
    "source": "0c92f65db928c431023f59603039aa1e.pdf",
    "page_numbers": [
      5,
      6,
      7
    ],
    "table_idx": 0,
    "question": "Which actresses won the Best Actress award in the years 1940, 1941, 1942, and 1943, and for which films did they win?",
    "answer": "In 1940, Ginger Rogers won for Kitty Foyle. In 1941, Joan Fontaine won for Suspicion. In 1942, Greer Garson won for Mrs. Miniver. In 1943, Jennifer Jones won for The Song of Bernadette.",
    "retrieved_chunks": [
      "Ginger Rogers\nwon for Kitty Foyle\n(1940).\nJoan Fontaine\nwon for Suspicion\n(1941).\nGreer Garson won\nfor Mrs. Miniver\n(1942).\nJennifer Jones\nwon for The Song\nof Bernadette\n(1943).Greta GarboNina Yakushova\n\"Ninotchka\" IvanoffNinotchka\nGreer GarsonKatherine BridgesGoodbye, Mr. Chips\n1940s [edit]\nYearActress Role(s) Film Ref.\n1940\n(13th)Ginger Rogers ‡Kitty Foyle Kitty Foyle\n[18]Bette DavisLeslie Crosbie The Letter\nJoan FontaineThe Second Mrs. de\nWinterRebecca\nKatharine\nHepburnTracy Lord The Philadelphia Story\nMartha ScottEmily Webb Our Town\n1941\n(14th)Joan Fontaine ‡Lina McLaidlaw\nAysgarthSuspicion\n[19]Bette DavisRegina GiddensThe Little Foxes\nOlivia de\nHavillandEmmy Brown Hold Back the Dawn\nGreer GarsonEdna Gladney Blossoms in the Dust\nBarbara\nStanwyckKatherine\n\"Sugarpuss\" O'SheaBall of Fire\n1942\n(15th)Greer Garson ‡Kay Miniver Mrs. Miniver\n[20]Bette DavisCharlotte Vale Now, Voyager\nKatharine\nHepburnTess Harding Woman of the Year\nRosalind RussellRuth SherwoodMy Sister Eileen\nTeresa WrightEleanor Twitchell\nGehrigThe Pride of the Yankees\n1943\n(16th)Jennifer Jones\n‡Bernadette\nSoubirousThe Song of Bernadette[21]\nJean ArthurConstance \"Connie\"\nMilliganThe More the Merrier\nIngrid BergmanMaría For Whom the Bell Tolls\nJoan FontaineTessa Sanger The Constant Nymph"
    ],
    "retrieved_context": "| Year        | Actress               | Role(s)                      | Film                           | Ref.                           |\n|:------------|:----------------------|:-----------------------------|:-------------------------------|:-------------------------------|\n| 1940 (13th) | Ginger Rogers ‡       | Kitty Foyle                  | Kitty Foyle                    | [18]                           |\n| 1941 (14th) | Joan Fontaine ‡       | Lina McLaidlaw Aysgarth      | Suspicion                      | [19]                           |\n| 1942 (15th) | Greer Garson ‡        | Kay Miniver                  | Mrs. Miniver                   | [20]                           |\n| 1943 (16th) | Jennifer Jones ‡      | Bernadette Soubirous         | The Song of Bernadette         | [21]                           |"
  },
  {
    "id": "qa_837_002",
    "source": "0c92f65db928c431023f59603039aa1e.pdf",
    "page_numbers": [
      5,
      6,
      7
    ],
    "table_idx": 0,
    "question": "For which films was Bette Davis nominated for Best Actress between 1940 and 1944?",
    "answer": "Bette Davis was nominated in 1940 for The Letter, in 1941 for The Little Foxes, in 1942 for Now, Voyager, and in 1944 for Mr. Skeffington.",
    "retrieved_chunks": [
      "Ginger Rogers\nwon for Kitty Foyle\n(1940).\nJoan Fontaine\nwon for Suspicion\n(1941).\nGreer Garson won\nfor Mrs. Miniver\n(1942).\nJennifer Jones\nwon for The Song\nof Bernadette\n(1943).\nIngrid Bergman\nwon twice, for\nGaslight (1944)\nand Anastasia\n(1956).Greta GarboNina Yakushova\n\"Ninotchka\" IvanoffNinotchka\nGreer GarsonKatherine BridgesGoodbye, Mr. Chips\n1940s [edit]\nYearActress Role(s) Film Ref.\n1940\n(13th)Ginger Rogers ‡Kitty Foyle Kitty Foyle\n[18]Bette DavisLeslie Crosbie The Letter\nJoan FontaineThe Second Mrs. de\nWinterRebecca\nKatharine\nHepburnTracy Lord The Philadelphia Story\nMartha ScottEmily Webb Our Town\n1941\n(14th)Joan Fontaine ‡Lina McLaidlaw\nAysgarthSuspicion\n[19]Bette DavisRegina GiddensThe Little Foxes\nOlivia de\nHavillandEmmy Brown Hold Back the Dawn\nGreer GarsonEdna Gladney Blossoms in the Dust\nBarbara\nStanwyckKatherine\n\"Sugarpuss\" O'SheaBall of Fire\n1942\n(15th)Greer Garson ‡Kay Miniver Mrs. Miniver\n[20]Bette DavisCharlotte Vale Now, Voyager\nKatharine\nHepburnTess Harding Woman of the Year\nRosalind RussellRuth SherwoodMy Sister Eileen\nTeresa WrightEleanor Twitchell\nGehrigThe Pride of the Yankees\n1943\n(16th)Jennifer Jones\n‡Bernadette\nSoubirousThe Song of Bernadette[21]\nJean ArthurConstance \"Connie\"\nMilliganThe More the Merrier\nIngrid BergmanMaría For Whom the Bell Tolls\nJoan FontaineTessa Sanger The Constant Nymph\n1944\n(17th)Ingrid Bergman\n‡Paula Alquist AntonGaslight\n[22]Claudette ColbertAnne Hilton Since You Went Away\nBette DavisFanny Trellis Mr. Skeffington\nGreer GarsonSusie \"Sparrow\"\nParkingtonMrs. Parkington\nBarbara\nStanwyckPhyllis DietrichsonDouble Indemnity"
    ],
    "retrieved_context": "| Year        | Actress               | Role(s)                      | Film                           | Ref.                           |\n|:------------|:----------------------|:-----------------------------|:-------------------------------|:-------------------------------|\n| 1940 (13th) | Bette Davis           | Leslie Crosbie               | The Letter                     | [18]                           |\n| 1941 (14th) | Bette Davis           | Regina Giddens               | The Little Foxes               | [19]                           |\n| 1942 (15th) | Bette Davis           | Charlotte Vale               | Now, Voyager                   | [20]                           |\n| 1944 (17th) | Bette Davis           | Fanny Trellis                | Mr. Skeffington                | Mr. Skeffington                |"
  },
  {
    "id": "qa_837_003",
    "source": "0c92f65db928c431023f59603039aa1e.pdf",
    "page_numbers": [
      5,
      6,
      7
    ],
    "table_idx": 0,
    "question": "According to the table and the additional text, how many times did Olivia de Havilland win the Best Actress award and for which films?",
    "answer": "Olivia de Havilland won twice, for To Each His Own (1946) and The Heiress (1949).",
    "retrieved_chunks": [
      "Joan Crawford\nwon for Mildred\nPierce (1945).\nOlivia de Havilland\nwon twice, for To\nEach His Own\n(1946) and The\nHeiress (1949).\nLoretta Young won\nfor The Farmer's\nDaughter (1947).\nJane Wyman won\nfor Johnny Belinda\n(1948); first winner\nto utilize ASL.Greer GarsonMarie Curie Madame Curie\n1944\n(17th)Ingrid Bergman\n‡Paula Alquist AntonGaslight\n[22]Claudette ColbertAnne Hilton Since You Went Away\nBette DavisFanny Trellis Mr. Skeffington\nGreer GarsonSusie \"Sparrow\"\nParkingtonMrs. Parkington\nBarbara\nStanwyckPhyllis DietrichsonDouble Indemnity\n1945\n(18th)Joan Crawford\n‡Mildred Pierce\nBeragonMildred Pierce\n[23]Ingrid BergmanMary BenedictThe Bells of St. Mary's\nGreer GarsonMary Rafferty The Valley of Decision\nJennifer JonesSingleton / Victoria\nMorlandLove Letters\nGene TierneyEllen Berent HarlandLeave Her to Heaven\n1946\n(19th)Olivia de\nHavilland ‡Josephine \"Jody\"\nNorrisTo Each His Own\n[24]Celia JohnsonLaura Jesson Brief Encounter\nJennifer JonesPearl Chavez Duel in the Sun\nRosalind RussellElizabeth KennySister Kenny\nJane WymanOrry Baxter The Yearling\n1947\n(20th)Loretta Young ‡Katie HolstromThe Farmer's Daughter\n[25]Joan CrawfordLouise Howell Possessed\nSusan HaywardAngelica Evans\nConwaySmash-Up, the Story of a\nWoman\nDorothy McGuireKathy Lacy Gentleman's Agreement\nRosalind RussellLavinia MannonMourning Becomes\nElectra\n1948\n(21st)Jane Wyman ‡Belinda McDonaldJohnny Belinda[26]\nIngrid BergmanJoan of Arc Joan of Arc\nOlivia de\nHavillandVirginia Stuart\nCunninghamThe Snake Pit\nIrene DunneMartha HansonI Remember Mama\n1949\n(22nd)Olivia de\nHavilland ‡Catherine SloperThe Heiress\n[27]Jeanne CrainPatricia \"Pinky\"\nJohnsonPinky\nSusan HaywardEloise Winters My Foolish Heart\nDeborah KerrEvelyn Boult Edward, My Son\nLoretta YoungMargaret Come to the Stable"
    ],
    "retrieved_context": "| Year        | Actress               | Role(s)                      | Film                           | Ref.                           |\n|:------------|:----------------------|:-----------------------------|:-------------------------------|:-------------------------------|\n| 1946 (19th) | Olivia de Havilland ‡ | Josephine \"Jody\" Norris      | To Each His Own                | [24]                           |\n| 1949 (22nd) | Olivia de Havilland ‡ | Catherine Sloper             | The Heiress                    | [27]                           |"
  },
  {
    "id": "qa_837_004",
    "source": "0c92f65db928c431023f59603039aa1e.pdf",
    "page_numbers": [
      5,
      6,
      7
    ],
    "table_idx": 0,
    "question": "How many times was Greer Garson nominated for Best Actress between 1940 and 1945, and for which films?",
    "answer": "Greer Garson was nominated four times between 1940 and 1945. She was nominated in 1941 for Blossoms in the Dust, in 1942 for Mrs. Miniver (winning the award), in 1944 for Mrs. Parkington, and in 1945 for The Valley of Decision.",
    "retrieved_chunks": [
      "Ginger Rogers\nwon for Kitty Foyle\n(1940).\nJoan Fontaine\nwon for Suspicion\n(1941).\nGreer Garson won\nfor Mrs. Miniver\n(1942).\nJennifer Jones\nwon for The Song\nof Bernadette\n(1943).\nIngrid Bergman\nwon twice, for\nGaslight (1944)\nand Anastasia\n(1956).Greta GarboNina Yakushova\n\"Ninotchka\" IvanoffNinotchka\nGreer GarsonKatherine BridgesGoodbye, Mr. Chips\n1940s [edit]\nYearActress Role(s) Film Ref.\n1940\n(13th)Ginger Rogers ‡Kitty Foyle Kitty Foyle\n[18]Bette DavisLeslie Crosbie The Letter\nJoan FontaineThe Second Mrs. de\nWinterRebecca\nKatharine\nHepburnTracy Lord The Philadelphia Story\nMartha ScottEmily Webb Our Town\n1941\n(14th)Joan Fontaine ‡Lina McLaidlaw\nAysgarthSuspicion\n[19]Bette DavisRegina GiddensThe Little Foxes\nOlivia de\nHavillandEmmy Brown Hold Back the Dawn\nGreer GarsonEdna Gladney Blossoms in the Dust\nBarbara\nStanwyckKatherine\n\"Sugarpuss\" O'SheaBall of Fire\n1942\n(15th)Greer Garson ‡Kay Miniver Mrs. Miniver\n[20]Bette DavisCharlotte Vale Now, Voyager\nKatharine\nHepburnTess Harding Woman of the Year\nRosalind RussellRuth SherwoodMy Sister Eileen\nTeresa WrightEleanor Twitchell\nGehrigThe Pride of the Yankees\n1943\n(16th)Jennifer Jones\n‡Bernadette\nSoubirousThe Song of Bernadette[21]\nJean ArthurConstance \"Connie\"\nMilliganThe More the Merrier\nIngrid BergmanMaría For Whom the Bell Tolls\nJoan FontaineTessa Sanger The Constant Nymph\n1944\n(17th)Ingrid Bergman\n‡Paula Alquist AntonGaslight\n[22]Claudette ColbertAnne Hilton Since You Went Away\nBette DavisFanny Trellis Mr. Skeffington\nGreer GarsonSusie \"Sparrow\"\nParkingtonMrs. Parkington\nBarbara\nStanwyckPhyllis DietrichsonDouble Indemnity\n1945\n(18th)Joan Crawford\n‡Mildred Pierce\nBeragonMildred Pierce\n[23]Ingrid BergmanMary BenedictThe Bells of St. Mary's\nGreer GarsonMary Rafferty The Valley of Decision\nJennifer JonesSingleton / Victoria\nMorlandLove Letters\nGene TierneyEllen Berent HarlandLeave Her to Heaven"
    ],
    "retrieved_context": "| Year        | Actress               | Role(s)                      | Film                           | Ref.                           |\n|:------------|:----------------------|:-----------------------------|:-------------------------------|:-------------------------------|\n| 1941 (14th) | Greer Garson          | Edna Gladney                 | Blossoms in the Dust           | [19]                           |\n| 1942 (15th) | Greer Garson ‡        | Kay Miniver                  | Mrs. Miniver                   | [20]                           |\n| 1944 (17th) | Greer Garson          | Susie \"Sparrow\" Parkington   | Mrs. Parkington                | Mrs. Parkington                |\n| 1945 (18th) | Greer Garson          | Mary Rafferty                | The Valley of Decision         | The Valley of Decision         |"
  },
  {
    "id": "qa_837_005",
    "source": "0c92f65db928c431023f59603039aa1e.pdf",
    "page_numbers": [
      5,
      6,
      7
    ],
    "table_idx": 0,
    "question": "Considering Joan Fontaine and Olivia de Havilland are sisters, according to the table, for which films did each win the Best Actress award and in what years?",
    "answer": "Joan Fontaine and Olivia de Havilland are sisters. Joan Fontaine won the Best Actress award for Suspicion in 1941 and Olivia de Havilland won for To Each His Own in 1946 and The Heiress in 1949.",
    "retrieved_chunks": [
      "Ginger Rogers\nwon for Kitty Foyle\n(1940).\nJoan Fontaine\nwon for Suspicion\n(1941).\nGreer Garson won\nfor Mrs. Miniver\n(1942).\nJennifer Jones\nwon for The Song\nof Bernadette\n(1943).\nIngrid Bergman\nwon twice, for\nGaslight (1944)\nand Anastasia\n(1956).Greta GarboNina Yakushova\n\"Ninotchka\" IvanoffNinotchka\nGreer GarsonKatherine BridgesGoodbye, Mr. Chips\n1940s [edit]\nYearActress Role(s) Film Ref.\n1940\n(13th)Ginger Rogers ‡Kitty Foyle Kitty Foyle\n[18]Bette DavisLeslie Crosbie The Letter\nJoan FontaineThe Second Mrs. de\nWinterRebecca\nKatharine\nHepburnTracy Lord The Philadelphia Story\nMartha ScottEmily Webb Our Town\n1941\n(14th)Joan Fontaine ‡Lina McLaidlaw\nAysgarthSuspicion\n[19]Bette DavisRegina GiddensThe Little Foxes\nOlivia de\nHavillandEmmy Brown Hold Back the Dawn\nGreer GarsonEdna Gladney Blossoms in the Dust\nBarbara\nStanwyckKatherine\n\"Sugarpuss\" O'SheaBall of Fire\n1946\n(19th)Olivia de\nHavilland ‡Josephine \"Jody\"\nNorrisTo Each His Own\n[24]Celia JohnsonLaura Jesson Brief Encounter\nJennifer JonesPearl Chavez Duel in the Sun\nRosalind RussellElizabeth KennySister Kenny\nJane WymanOrry Baxter The Yearling\n1949\n(22nd)Olivia de\nHavilland ‡Catherine SloperThe Heiress\n[27]Jeanne CrainPatricia \"Pinky\"\nJohnsonPinky\nSusan HaywardEloise Winters My Foolish Heart\nDeborah KerrEvelyn Boult Edward, My Son\nLoretta YoungMargaret Come to the Stable"
    ],
    "retrieved_context": "| Year        | Actress               | Role(s)                      | Film                           | Ref.                           |\n|:------------|:----------------------|:-----------------------------|:-------------------------------|:-------------------------------|\n| 1941 (14th) | Joan Fontaine ‡       | Lina McLaidlaw Aysgarth      | Suspicion                      | [19]                           |\n| 1946 (19th) | Olivia de Havilland ‡ | Josephine \"Jody\" Norris      | To Each His Own                | [24]                           |\n| 1949 (22nd) | Olivia de Havilland ‡ | Catherine Sloper             | The Heiress                    | [27]                           |"
  },
  {
    "id": "qa_98_001",
    "source": "0c92f65db928c431023f59603039aa1e.pdf",
    "page_numbers": [
      9,
      10,
      11
    ],
    "table_idx": 0,
    "question": "According to the table and the additional text, which actress won the Best Actress award twice in the 1960s, and for which films?",
    "answer": "Elizabeth Taylor won the award for BUtterfield 8 in 1960 and Who's Afraid of Virginia Woolf? in 1966.",
    "retrieved_chunks": [
      "Anna Magnani\nwon for The Rose\nTattoo (1955).\nJoanne Woodward\nwon for The Three\nFaces of Eve\n(1957).\nSusan Hayward\nwon for I Want to\nLive! (1958).\nSimone Signoret\nwon for Room at\nthe Top (1959).\nElizabeth Taylor\nwon twice, for\nBUtterfield 8\n(1960) and Who's\nAfraid of Virginia\nWoolf? (1966).1953\n(26th)Audrey Hepburn\n‡Princess Ann Roman Holiday\n[31]Leslie CaronLili Daurier Lili\nAva GardnerEloise \"Honey Bear\"\nKellyMogambo\nDeborah KerrKaren Holmes From Here to Eternity\nMaggie\nMcNamaraPatty O'Neill The Moon Is Blue\n1954\n(27th)Grace Kelly ‡Georgie Elgin The Country Girl\n[32]Dorothy\nDandridgeCarmen JonesCarmen Jones\nJudy GarlandEsther Victoria\nBlodgett / Vicki\nLesterA Star Is Born\nAudrey HepburnSabrina FairchildSabrina\nJane WymanHelen Phillips Magnificent Obsession\n1955\n(28th)Anna Magnani ‡Serafina Delle RoseThe Rose Tattoo\n[33]Susan HaywardLillian Roth I'll Cry Tomorrow\nKatharine\nHepburnJane Hudson Summertime\nJennifer JonesHan SuyinLove is a Many-\nSplendored Thing\nEleanor ParkerMarjorie LawrenceInterrupted Melody\n1956\n(29th)Ingrid Bergman\n‡Anna Koreff /\nAnastasiaAnastasia\n[34]Carroll BakerBaby Doll MeighanBaby Doll\nKatharine\nHepburnLizzie Curry The Rainmaker\nNancy KellyChristine PenmarkThe Bad Seed\nDeborah KerrAnna LeonowensThe King and I\n1957\n(30th)Joanne\nWoodward ‡Eve White / Eve\nBlack / JaneThe Three Faces of Eve[35]\nDeborah KerrAngelaHeaven Knows, Mr.\nAllison"
    ],
    "retrieved_context": "| Year        | Actress                       | Role(s)                           | Film                             | Ref.   |\n|:------------|:------------------------------|:----------------------------------|:---------------------------------|:-------|\n| 1960 (33rd) | Elizabeth Taylor ‡            | Gloria Wandrous                   | BUtterfield 8                    | [38]   |\n| 1966 (39th) | Elizabeth Taylor ‡            | Martha                            | Who's Afraid of Virginia Woolf?  | [45]   |"
  },
  {
    "id": "qa_98_002",
    "source": "0c92f65db928c431023f59603039aa1e.pdf",
    "page_numbers": [
      9,
      10,
      11
    ],
    "table_idx": 0,
    "question": "Based on the table, which actress won the Best Actress award in both 1967 and 1968, and for which movies?",
    "answer": "Katharine Hepburn won for Guess Who's Coming to Dinner in 1967 and The Lion in Winter in 1968.",
    "retrieved_chunks": [
      "Marie Dressler\nwon for Min and\nBill (1930).\nHelen Hayes won\nfor The Sin of\nMadelon Claudet\n(1931); first\nactress to\ncomplete the\nEGOT.\nKatharine Hepburn\nwon four times,\nfor: Morning Glory\n(1933), Guess\nWho's Coming to\nDinner (1967), The\nLion in Winter\n(1968), and On\nGolden Pond\n(1981)."
    ],
    "retrieved_context": "| Year        | Actress                       | Role(s)                           | Film                             | Ref.   |\n|:------------|:------------------------------|:----------------------------------|:---------------------------------|:-------|\n| 1967 (40th) | Katharine Hepburn ‡           | Christina Drayton                 | Guess Who's Coming to Dinner     | [46]   |\n| 1968 (41st) | Katharine Hepburn ‡ (TIE) [C] | Eleanor of Aquitaine              | The Lion in Winter               | [47]   |"
  },
  {
    "id": "qa_98_003",
    "source": "0c92f65db928c431023f59603039aa1e.pdf",
    "page_numbers": [
      9,
      10,
      11
    ],
    "table_idx": 0,
    "question": "According to the table, which actresses tied for the Best Actress award in 1968?",
    "answer": "In 1968, Katharine Hepburn and Barbra Streisand tied for the Best Actress award.",
    "retrieved_chunks": [],
    "retrieved_context": "| Year        | Actress                       | Role(s)                           | Film                             | Ref.   |\n|:------------|:------------------------------|:----------------------------------|:---------------------------------|:-------|\n| 1968 (41st) | Katharine Hepburn ‡ (TIE) [C] | Eleanor of Aquitaine              | The Lion in Winter               | [47]   |\n| 1968 (41st) | Barbra Streisand ‡ (TIE) [C]  | Fanny Brice                       | Funny Girl                       | [47]   |"
  },
  {
    "id": "qa_98_004",
    "source": "0c92f65db928c431023f59603039aa1e.pdf",
    "page_numbers": [
      9,
      10,
      11
    ],
    "table_idx": 0,
    "question": "Based on the table, was Anne Bancroft nominated and did she win the Best Actress award in 1962, and for which film?",
    "answer": "Anne Bancroft was nominated for Best Actress in 1962 for The Miracle Worker, and she won the award that year.",
    "retrieved_chunks": [
      "Sophia Loren won\nfor Two Women\n(1960); first for a\nnon-English\n(Italian) dialogue\nrole.\nAnne Bancroft\nwon for The\nMiracle Worker\n(1962).\nPatricia Neal won\nfor Hud (1963).\nJulie Andrews won\nfor Mary Poppins\n(1964)."
    ],
    "retrieved_context": "| Year        | Actress                       | Role(s)                           | Film                             | Ref.   |\n|:------------|:------------------------------|:----------------------------------|:---------------------------------|:-------|\n| 1962 (35th) | Anne Bancroft ‡               | Annie Sullivan                    | The Miracle Worker               | [41]   |"
  },
  {
    "id": "qa_98_005",
    "source": "0c92f65db928c431023f59603039aa1e.pdf",
    "page_numbers": [
      9,
      10,
      11
    ],
    "table_idx": 0,
    "question": "According to the table, how many times was Shirley MacLaine nominated for Best Actress in the 1960s, and for which films? Did she win any of those awards?",
    "answer": "Shirley MacLaine was nominated twice in the 1960s for The Apartment in 1960 and Irma La Douce in 1963, but she did not win either time based on the table.",
    "retrieved_chunks": [],
    "retrieved_context": "| Year        | Actress                       | Role(s)                           | Film                             | Ref.   |\n|:------------|:------------------------------|:----------------------------------|:---------------------------------|:-------|\n| 1960 (33rd) | Shirley MacLaine              | Fran Kubelik                      | The Apartment                    | [38]   |\n| 1963 (36th) | Shirley MacLaine              | Irma La Douce                     | Irma la Douce                    | [42]   |"
  },
  {
    "id": "qa_103_001",
    "source": "0c92f65db928c431023f59603039aa1e.pdf",
    "page_numbers": [
      11,
      12,
      13
    ],
    "table_idx": 0,
    "question": "Based on the table, how many times did Glenda Jackson win the Best Actress award and for which films? Does this align with the additional context provided?",
    "answer": "Glenda Jackson won the Best Actress award in 1970 for \"Women in Love\" and again in 1973 for \"A Touch of Class\". She was also nominated in 1971 for \"Sunday Bloody Sunday\". According to the additional text, she won twice.",
    "retrieved_chunks": [
      "Frances\nMcDormand won\nthrice, for Fargo\n(1996), Three\nBillboards Outside\nEbbing, Missouri\n(2017), and\nNomadland\n(2020).\nHelen Hunt won\nfor As Good as It\nGets (1997).\nGwyneth Paltrow\nwon for\nShakespeare in\nLove (1998).\nHilary Swank won\ntwice, for Boys\nDon't Cry (1999)\nand Million Dollar\nBaby (2004).1990s [edit]\nYearActress Role(s) Film Ref.\n1990\n(63rd)Kathy Bates ‡Annie Wilkes Misery\n[69]Anjelica HustonLilly Dillon The Grifters\nJulia RobertsVivian Ward Pretty Woman\nMeryl StreepSuzanne Vale Postcards from the Edge\nJoanne\nWoodwardIndia Bridge Mr. & Mrs. Bridge\n1991\n(64th)Jodie Foster ‡Clarice StarlingThe Silence of the\nLambs\n[70]Geena DavisThelma DickinsonThelma & Louise\nLaura Dern Rose Rambling Rose\nBette MidlerDixie Leonard For the Boys\nSusan SarandonLouise SawyerThelma & Louise\n1992\n(65th)Emma\nThompson ‡Margaret SchlegelHowards End\n[71]Catherine\nDeneuveÉliane DevriesIndochine\nMary McDonnellMay-Alice CulhanePassion Fish\nMichelle PfeifferLouise Irene\n\"Lurene\" HallettLove Field\nSusan SarandonMichaela Murphy\nOdoneLorenzo's Oil\n1993\n(66th)Holly Hunter ‡Ada McGrath The Piano\n[72]Angela BassettAnna Mae Bullock /\nTina TurnerWhat's Love Got to Do\nwith It\nStockard\nChanningLouisa \"Ouisa\"\nKittredgeSix Degrees of\nSeparation\nEmma ThompsonSarah \"Sally\" KentonThe Remains of the Day\nDebra WingerJoy Davidman Shadowlands\n1994\n(67th)Jessica Lange ‡Carly MarshallBlue Sky[73]\nJodie FosterNell Kellty Nell",
      "Glenda Jackson\nJodie Foster 3\nSally Field\n2Vivien Leigh\nLuise Rainer\nEmma Stone\nHilary Swank",
      "Julie Christie won\nDarling (1965).\nBarbra Streisand\nwon for Funny Girl\n(1968), in a tie\nwith Katharine\nHepburn.\nMaggie Smith won\nfor The Prime of\nMiss Jean Brodie\n(1969).\nGlenda Jackson\nwon twice, for\nWomen in Love\n(1970) and A\nTouch of Class\n(1973).Natalie WoodWilma Dean\n\"Deanie\" LoomisSplendor in the Grass",
      "Faye Dunaway\nwon for Network\n(1976).\nDiane Keaton won\nfor Annie Hall\n(1977).\nSally Field won\ntwice, for Norma\nRae (1979) and\nPlaces in the\nHeart (1984).\nSissy Spacek won\nfor Coal Miner's\nDaughter (1980).Ali MacGrawJennifer Cavalleri-\nBarrettLove Story\nSarah MilesRosy Ryan Ryan's Daughter\nCarrie SnodgressBettina \"Tina\" BalserDiary of a Mad Housewife\n1971\n(44th)Jane Fonda ‡Bree Daniels Klute\n[50]Julie ChristieConstance MillerMcCabe & Mrs. Miller\nGlenda JacksonAlex Greville Sunday Bloody Sunday\nVanessa\nRedgraveMary, Queen of\nScotsMary, Queen of Scots\nJanet SuzmanEmpress Alexandra\nof RussiaNicholas and Alexandra\n1972\n(45th)Liza Minnelli ‡Sally Bowles Cabaret\n[51]Diana RossBillie Holiday Lady Sings the Blues\nMaggie SmithAugusta BertramTravels with My Aunt\nCicely TysonRebecca MorganSounder\nLiv UllmannKristina NilssonThe Emigrants\n1973\n(46th)Glenda Jackson\n‡Vickie AllessioA Touch of Class\n[52]Ellen BurstynChris MacNeil The Exorcist\nMarsha MasonMaggie Paul Cinderella Liberty\nBarbra StreisandKatie Morosky The Way We Were\nJoanne\nWoodwardRita WaldenSummer Wishes, Winter\nDreams",
      "4Annette Bening\nJulie Christie\nGlenn Close\nOlivia de Havilland\nGreta Garbo\nGlenda Jackson\nJennifer Jones\nDiane Keaton\nNicole Kidman\nMarsha Mason\nGeraldine Page\nVanessa Redgrave\nRosalind Russell\nBarbara Stanwyck\nKate Winslet\nJoanne Woodward\nJane Wyman"
    ],
    "retrieved_context": "| Year        | Actress                  | Role(s)                        | Film                            | Ref.   |\n|:------------|:-------------------------|:-------------------------------|:--------------------------------|:-------|\n| 1970 (43rd) | Glenda Jackson ‡         | Gudrun Brangwen                | Women in Love                   | [49]   |\n| 1971 (44th) | Glenda Jackson           | Alex Greville                  | Sunday Bloody Sunday            | [50]   |\n| 1973 (46th) | Glenda Jackson ‡         | Vickie Allessio                | A Touch of Class                | [52]   |"
  },
  {
    "id": "qa_103_002",
    "source": "0c92f65db928c431023f59603039aa1e.pdf",
    "page_numbers": [
      11,
      12,
      13
    ],
    "table_idx": 0,
    "question": "Which actress won an award in 1971, and what was the role and film for which she won?",
    "answer": "In 1971, Jane Fonda won for her role as Bree Daniels in \"Klute\".",
    "retrieved_chunks": [
      "Faye Dunaway\nwon for Network\n(1976).\nDiane Keaton won\nfor Annie Hall\n(1977).\nSally Field won\ntwice, for Norma\nRae (1979) and\nPlaces in the\nHeart (1984).\nSissy Spacek won\nfor Coal Miner's\nDaughter (1980).Ali MacGrawJennifer Cavalleri-\nBarrettLove Story\nSarah MilesRosy Ryan Ryan's Daughter\nCarrie SnodgressBettina \"Tina\" BalserDiary of a Mad Housewife\n1971\n(44th)Jane Fonda ‡Bree Daniels Klute\n[50]Julie ChristieConstance MillerMcCabe & Mrs. Miller\nGlenda JacksonAlex Greville Sunday Bloody Sunday\nVanessa\nRedgraveMary, Queen of\nScotsMary, Queen of Scots\nJanet SuzmanEmpress Alexandra\nof RussiaNicholas and Alexandra"
    ],
    "retrieved_context": "| Year        | Actress                  | Role(s)                        | Film                            | Ref.   |\n|:------------|:-------------------------|:-------------------------------|:--------------------------------|:-------|\n| 1971 (44th) | Jane Fonda ‡             | Bree Daniels                   | Klute                           | [50]   |"
  },
  {
    "id": "qa_103_003",
    "source": "0c92f65db928c431023f59603039aa1e.pdf",
    "page_numbers": [
      11,
      12,
      13
    ],
    "table_idx": 0,
    "question": "Which actresses were nominated for their roles in \"The Turning Point\" in 1977?",
    "answer": "In 1977, Anne Bancroft and Shirley MacLaine were both nominated for their roles in \"The Turning Point\".",
    "retrieved_chunks": [
      "Faye Dunaway\nwon for Network\n(1976).\nDiane Keaton won\nfor Annie Hall\n(1977).\nSally Field won\ntwice, for Norma\nRae (1979) and\nPlaces in the\nHeart (1984).\nSissy Spacek won\nfor Coal Miner's\nDaughter (1980).Ali MacGrawJennifer Cavalleri-\nBarrettLove Story\nSarah MilesRosy Ryan Ryan's Daughter\nCarrie SnodgressBettina \"Tina\" BalserDiary of a Mad Housewife\n1971\n(44th)Jane Fonda ‡Bree Daniels Klute\n[50]Julie ChristieConstance MillerMcCabe & Mrs. Miller\nGlenda JacksonAlex Greville Sunday Bloody Sunday\nVanessa\nRedgraveMary, Queen of\nScotsMary, Queen of Scots\nJanet SuzmanEmpress Alexandra\nof RussiaNicholas and Alexandra",
      "Films with multiple Leading Actress nominations [edit]\nWinners are in bold.\nAll About Eve (1950) – Anne Baxter and Bette Davis\nSuddenly, Last Summer (1959) – Katharine Hepburn and Elizabeth Taylor\nThe Turning Point (1977) – Anne Bancroft and Shirley MacLaine\nTerms of Endearment (1983) – Shirley MacLaine and Debra Winger\nThelma & Louise (1991) – Geena Davis and Susan Sarandon"
    ],
    "retrieved_context": "| Year        | Actress                  | Role(s)                        | Film                            | Ref.   |\n|:------------|:-------------------------|:-------------------------------|:--------------------------------|:-------|\n| 1977 (50th) | Anne Bancroft            | Emma Jacklin                   | The Turning Point               | [56]   |\n| 1977 (50th) | Shirley MacLaine         | Deedee Rodgers                 | The Turning Point               | [56]   |"
  },
  {
    "id": "qa_103_004",
    "source": "0c92f65db928c431023f59603039aa1e.pdf",
    "page_numbers": [
      11,
      12,
      13
    ],
    "table_idx": 0,
    "question": "Which actress in the table was nominated for playing Billie Holiday, and has any other actress been nominated for playing the same character according to the additional text?",
    "answer": "Diana Ross, in 1972, was nominated for her portrayal of Billie Holiday in \"Lady Sings the Blues\". Andra Day was also nominated for playing Billie Holiday in \"The United States vs. Billie Holiday\" in 2021.",
    "retrieved_chunks": [
      "Faye Dunaway\nwon for Network\n(1976).\nDiane Keaton won\nfor Annie Hall\n(1977).\nSally Field won\ntwice, for Norma\nRae (1979) and\nPlaces in the\nHeart (1984).\nSissy Spacek won\nfor Coal Miner's\nDaughter (1980).Ali MacGrawJennifer Cavalleri-\nBarrettLove Story\nSarah MilesRosy Ryan Ryan's Daughter\nCarrie SnodgressBettina \"Tina\" BalserDiary of a Mad Housewife\n1971\n(44th)Jane Fonda ‡Bree Daniels Klute\n[50]Julie ChristieConstance MillerMcCabe & Mrs. Miller\nGlenda JacksonAlex Greville Sunday Bloody Sunday\nVanessa\nRedgraveMary, Queen of\nScotsMary, Queen of Scots\nJanet SuzmanEmpress Alexandra\nof RussiaNicholas and Alexandra",
      "Multiple character nominations [edit]\nThe following were nominated for their portrayals of the same fictional or non-fictional character in separate\nfilms (including variations of the original).\nBillie Holiday from Lady Sings the Blues (Diana Ross, 1972) and The United States vs. Billie Holiday (Andra\nDay, 2021)\nJosephine \"Jo\" March from Little Women (Winona Ryder, 1994) and Little Women (Saoirse Ronan, 2019)\nLeslie Crosbie from The Letter (Jeanne Eagels, 1929) and The Letter (Bette Davis, 1940)\nMarilyn Monroe from My Week with Marilyn (Michelle Williams, 2011) and Blonde (Ana de Armas, 2022)\nQueen Elizabeth I from Elizabeth (Cate Blanchett, 1998) and Elizabeth: The Golden Age (Cate Blanchett, 2007)"
    ],
    "retrieved_context": "| Year        | Actress                  | Role(s)                        | Film                            | Ref.   |\n|:------------|:-------------------------|:-------------------------------|:--------------------------------|:-------|\n| 1972 (45th) | Diana Ross               | Billie Holiday                 | Lady Sings the Blues            | [51]   |"
  },
  {
    "id": "qa_103_005",
    "source": "0c92f65db928c431023f59603039aa1e.pdf",
    "page_numbers": [
      11,
      12,
      13
    ],
    "table_idx": 0,
    "question": "For which film was Ingrid Bergman nominated in 1978, and how many nominations does she have in total according to the additional text?",
    "answer": "In 1978, Ingrid Bergman was nominated for her role as Charlotte Andergast in \"Autumn Sonata\". According to the additional text, she has a total of 6 nominations.",
    "retrieved_chunks": [
      "Faye Dunaway\nwon for Network\n(1976).\nDiane Keaton won\nfor Annie Hall\n(1977).\nSally Field won\ntwice, for Norma\nRae (1979) and\nPlaces in the\nHeart (1984).\nSissy Spacek won\nfor Coal Miner's\nDaughter (1980).Ali MacGrawJennifer Cavalleri-\nBarrettLove Story\nSarah MilesRosy Ryan Ryan's Daughter\nCarrie SnodgressBettina \"Tina\" BalserDiary of a Mad Housewife\n1971\n(44th)Jane Fonda ‡Bree Daniels Klute\n[50]Julie ChristieConstance MillerMcCabe & Mrs. Miller\nGlenda JacksonAlex Greville Sunday Bloody Sunday\nVanessa\nRedgraveMary, Queen of\nScotsMary, Queen of Scots\nJanet SuzmanEmpress Alexandra\nof RussiaNicholas and Alexandra",
      "Glenda Jackson\nJodie Foster 3\nSally Field\n2Vivien Leigh\nLuise Rainer\nEmma Stone\nHilary Swank",
      "4Annette Bening\nJulie Christie\nGlenn Close\nOlivia de Havilland\nGreta Garbo\nGlenda Jackson\nJennifer Jones\nDiane Keaton\nNicole Kidman\nMarsha Mason\nGeraldine Page\nVanessa Redgrave\nRosalind Russell\nBarbara Stanwyck\nKate Winslet\nJoanne Woodward\nJane Wyman"
    ],
    "retrieved_context": "| Year        | Actress                  | Role(s)                        | Film                            | Ref.   |\n|:------------|:-------------------------|:-------------------------------|:--------------------------------|:-------|\n| 1978 (51st) | Ingrid Bergman           | Charlotte Andergast            | Autumn Sonata                   | [57]   |"
  },
  {
    "id": "qa_108_001",
    "source": "0c92f65db928c431023f59603039aa1e.pdf",
    "page_numbers": [
      16,
      17
    ],
    "table_idx": 0,
    "question": "According to the table, in what film and role did Susan Sarandon receive a nomination in 1995, and did she have any other nominations that year?",
    "answer": "In 1995, Susan Sarandon was nominated for Best Actress for her role as Helen Prejean in \"Dead Man Walking\". She had two other nominations that year for her roles in \"The Client\" as Regina \"Reggie\" Love and \"Little Women\" as Josephine \"Jo\" March.",
    "retrieved_chunks": [
      "Frances\nMcDormand won\nthrice, for Fargo\n(1996), Three\nBillboards Outside\nEbbing, Missouri\n(2017), and\nNomadland\n(2020).\nHelen Hunt won\nfor As Good as It\nGets (1997).\nGwyneth Paltrow\nwon for\nShakespeare in\nLove (1998).\nHilary Swank won\ntwice, for Boys\nDon't Cry (1999)\nand Million Dollar\nBaby (2004).1990s [edit]\nYearActress Role(s) Film Ref.\n1990\n(63rd)Kathy Bates ‡Annie Wilkes Misery\n[69]Anjelica HustonLilly Dillon The Grifters\nJulia RobertsVivian Ward Pretty Woman\nMeryl StreepSuzanne Vale Postcards from the Edge\nJoanne\nWoodwardIndia Bridge Mr. & Mrs. Bridge\n1991\n(64th)Jodie Foster ‡Clarice StarlingThe Silence of the\nLambs\n[70]Geena DavisThelma DickinsonThelma & Louise\nLaura Dern Rose Rambling Rose\nBette MidlerDixie Leonard For the Boys\nSusan SarandonLouise SawyerThelma & Louise\n1992\n(65th)Emma\nThompson ‡Margaret SchlegelHowards End\n[71]Catherine\nDeneuveÉliane DevriesIndochine\nMary McDonnellMay-Alice CulhanePassion Fish\nMichelle PfeifferLouise Irene\n\"Lurene\" HallettLove Field\nSusan SarandonMichaela Murphy\nOdoneLorenzo's Oil\n1993\n(66th)Holly Hunter ‡Ada McGrath The Piano\n[72]Angela BassettAnna Mae Bullock /\nTina TurnerWhat's Love Got to Do\nwith It\nStockard\nChanningLouisa \"Ouisa\"\nKittredgeSix Degrees of\nSeparation\nEmma ThompsonSarah \"Sally\" KentonThe Remains of the Day\nDebra WingerJoy Davidman Shadowlands\n1994\n(67th)Jessica Lange ‡Carly MarshallBlue Sky[73]\nJodie FosterNell Kellty Nell",
      "Julia Roberts won\nfor Erin Brockovich\n(2000).\nHalle Berry won\nfor Monster's Ball\n(2001); first black\nwinner in this\ncategory.\nNicole Kidman\nwon for The Hours\n(2002).\nCharlize Theron\nwon for Monster\n(2003).Miranda\nRichardsonVivienne Haigh-\nWoodTom & Viv\nWinona RyderJosephine \"Jo\"\nMarchLittle Women\nSusan SarandonRegina \"Reggie\"\nLoveThe Client\n1995\n(68th)Susan Sarandon\n‡Helen PrejeanDead Man Walking\n[74]Elisabeth ShueSera Leaving Las Vegas\nSharon StoneGinger McKennaCasino\nMeryl StreepFrancesca JohnsonThe Bridges of Madison\nCounty\nEmma ThompsonElinor DashwoodSense and Sensibility\n1996\n(69th)Frances\nMcDormand ‡Marge GundersonFargo\n[75]Brenda BlethynCynthia Rose PurleySecrets & Lies\nDiane KeatonBessie WakefieldMarvin's Room\nKristin Scott\nThomasKatharine CliftonThe English Patient\nEmily WatsonBess McNeill Breaking the Waves\n1997\n(70th)Helen Hunt ‡Carol ConnellyAs Good as It Gets\n[76]Helena Bonham\nCarterKate Croy The Wings of the Dove\nJulie ChristiePhyllis Hart Afterglow\nJudi Dench Queen VictoriaMrs Brown\nKate WinsletRose DeWitt\nBukaterTitanic\n1998\n(71st)Gwyneth\nPaltrow ‡Viola de LessepsShakespeare in Love\n[77]Cate BlanchettQueen Elizabeth IElizabeth\nFernanda\nMontenegroIsadora \"Dora\"\nTeixeiraCentral Station\nMeryl StreepKate Gulden One True Thing\nEmily WatsonJacqueline du PréHilary and Jackie"
    ],
    "retrieved_context": "| Year        | Actress              | Role(s)                        | Film                          | Ref.                          |\n|:------------|:---------------------|:-------------------------------|:------------------------------|:------------------------------|\n| 1990 (63rd) | Kathy Bates ‡        | Annie Wilkes                   | Misery                        | [69]                          |\n| 1990 (63rd) | Anjelica Huston      | Lilly Dillon                   | The Grifters                  | [69]                          |\n| 1990 (63rd) | Julia Roberts        | Vivian Ward                    | Pretty Woman                  | [69]                          |\n| 1990 (63rd) | Meryl Streep         | Suzanne Vale                   | Postcards from the Edge       | [69]                          |\n| 1990 (63rd) | Joanne Woodward      | India Bridge                   | Mr. & Mrs. Bridge             | [69]                          |\n| 1991 (64th) | Jodie Foster ‡       | Clarice Starling               | The Silence of the Lambs      | [70]                          |\n| 1991 (64th) | Geena Davis          | Thelma Dickinson               | Thelma & Louise               | [70]                          |\n| 1991 (64th) | Laura Dern           | Rose                           | Rambling Rose                 | [70]                          |\n| 1991 (64th) | Bette Midler         | Dixie Leonard                  | For the Boys                  | [70]                          |\n| 1991 (64th) | Susan Sarandon       | Louise Sawyer                  | Thelma & Louise               | [70]                          |\n| 1992 (65th) | Emma Thompson ‡      | Margaret Schlegel              | Howards End                   | [71]                          |\n| 1992 (65th) | Catherine Deneuve    | Éliane Devries                 | Indochine                     | [71]                          |\n| 1992 (65th) | Mary McDonnell       | May-Alice Culhane              | Passion Fish                  | [71]                          |\n| 1992 (65th) | Michelle Pfeiffer    | Louise Irene \"Lurene\" Hallett  | Love Field                    | [71]                          |\n| 1992 (65th) | Susan Sarandon       | Michaela Murphy Odone          | Lorenzo's Oil                 | [71]                          |\n| 1993 (66th) | Holly Hunter ‡       | Ada McGrath                    | The Piano                     | [72]                          |\n| 1993 (66th) | Angela Bassett       | Anna Mae Bullock / Tina Turner | What's Love Got to Do with It | [72]                          |\n| 1993 (66th) | Stockard Channing    | Louisa \"Ouisa\" Kittredge       | Six Degrees of Separation     | [72]                          |\n| 1993 (66th) | Emma Thompson        | Sarah \"Sally\" Kenton           | The Remains of the Day        | [72]                          |\n| 1993 (66th) | Debra Winger         | Joy Davidman                   | Shadowlands                   | [72]                          |\n| 1994 (67th) | Jessica Lange ‡      | Carly Marshall                 | Blue Sky                      | [73]                          |\n| 1994 (67th) | Jodie Foster         | Nell Kellty                    | Nell                          | [73]                          |\n| 1995 (68th) | Winona Ryder         | Josephine \"Jo\" March           | Little Women                  | Little Women                  |\n| 1995 (68th) | Susan Sarandon       | Regina \"Reggie\" Love           | The Client                    | The Client                    |\n| 1995 (68th) | Susan Sarandon ‡     | Helen Prejean                  | Dead Man Walking              | [74]                          |\n| 1995 (68th) | Elisabeth Shue       | Sera                           | Leaving Las Vegas             | Leaving Las Vegas             |\n| 1995 (68th) | Sharon Stone         | Ginger McKenna                 | Casino                        | Casino                        |\n| 1995 (68th) | Meryl Streep         | Francesca Johnson              | The Bridges of Madison County | The Bridges of Madison County |\n| 1995 (68th) | Emma Thompson        | Elinor Dashwood                | Sense and Sensibility         | Sense and Sensibility         |\n| 1996 (69th) | Frances McDormand ‡  | Marge Gunderson                | Fargo                         | [75]                          |\n| 1996 (69th) | Brenda Blethyn       | Cynthia Rose Purley            | Secrets & Lies                | Secrets & Lies                |\n| 1996 (69th) | Diane Keaton         | Bessie Wakefield               | Marvin's Room                 | Marvin's Room                 |\n| 1996 (69th) | Kristin Scott Thomas | Katharine Clifton              | The English Patient           | The English Patient           |\n| 1996 (69th) | Emily Watson         | Bess McNeill                   | Breaking the Waves            | Breaking the Waves            |\n| 1997 (70th) | Helen Hunt ‡         | Carol Connelly                 | As Good as It Gets            | [76]                          |\n| 1997 (70th) | Helena Bonham Carter | Kate Croy                      | The Wings of the Dove         | The Wings of the Dove         |\n| 1997 (70th) | Julie Christie       | Phyllis Hart                   | Afterglow                     | Afterglow                     |\n| 1997 (70th) | Judi Dench           | Queen Victoria                 | Mrs Brown                     | Mrs Brown                     |\n| 1997 (70th) | Kate Winslet         | Rose DeWitt Bukater            | Titanic                       | Titanic                       |\n| 1998 (71st) | Gwyneth Paltrow ‡    | Viola de Lesseps               | Shakespeare in Love           | [77]                          |\n| 1998 (71st) | Cate Blanchett       | Queen Elizabeth I              | Elizabeth                     | Elizabeth                     |\n| 1998 (71st) | Fernanda Montenegro  | Isadora \"Dora\" Teixeira        | Central Station               | Central Station               |\n| 1998 (71st) | Meryl Streep         | Kate Gulden                    | One True Thing                | One True Thing                |\n| 1998 (71st) | Emily Watson         | Jacqueline du Pré              | Hilary and Jackie             | Hilary and Jackie             |\n| 1999 (72nd) | Annette Bening       | Carolyn Burnham                | American Beauty               | [78]                          |\n| 1999 (72nd) | Janet McTeer         | Mary Jo Walker                 | Tumbleweeds                   | [78]                          |\n| 1999 (72nd) | Julianne Moore       | Sarah Miles                    | The End of the Affair         | [78]                          |\n| 1999 (72nd) | Meryl Streep         | Roberta Guaspari               | Music of the Heart            | [78]                          |"
  },
  {
    "id": "qa_109_001",
    "source": "oscar_actress.pdf",
    "page_numbers": [
      18,
      19
    ],
    "table_idx": 0,
    "question": "According to the table, in which year was Cate Blanchett nominated for playing Queen Elizabeth I in 'Elizabeth: The Golden Age', and what other year did she play the same role in 'Elizabeth'?",
    "answer": "In 2007, Cate Blanchett was nominated for Best Actress for playing Queen Elizabeth I in 'Elizabeth: The Golden Age'. She also played the same role in 'Elizabeth' in 1998.",
    "retrieved_chunks": [
      "Multiple character nominations [edit]\nThe following were nominated for their portrayals of the same fictional or non-fictional character in separate\nfilms (including variations of the original).\nQueen Elizabeth I from Elizabeth (Cate Blanchett, 1998) and Elizabeth: The Golden Age (Cate Blanchett, 2007)",
      "2007\n(80th)Marion Cotillard\n‡Édith Piaf La Vie en Rose\n[86]Cate BlanchettQueen Elizabeth IElizabeth: The Golden\nAge"
    ],
    "retrieved_context": "| Year        | Actress                 | Role(s)                    | Film                                  | Ref.                                  |\n|:------------|:------------------------|:---------------------------|:--------------------------------------|:--------------------------------------|\n| 2007 (80th) | Cate Blanchett          | Queen Elizabeth I          | Elizabeth: The Golden Age             | [86]                                  | "
  },
  {
    "id": "qa_109_002",
    "source": "oscar_actress.pdf",
    "page_numbers": [
      18
    ],
    "table_idx": 0,
    "question": "Which actress won the Best Actress award in 2000, and for what role and film did she win?",
    "answer": "In 2000, Julia Roberts won the Best Actress award for her role as Erin Brockovich in the film of the same name.",
    "retrieved_chunks": [
      "Julia Roberts won\nfor Erin Brockovich\n(2000).",
      "2000\n(73rd)Julia Roberts ‡Erin BrockovichErin Brockovich"
    ],
    "retrieved_context": "| Year        | Actress                 | Role(s)                    | Film                                  | Ref.                                  |\n|:------------|:------------------------|:---------------------------|:--------------------------------------|:--------------------------------------|\n| 2000 (73rd) | Julia Roberts ‡         | Erin Brockovich            | Erin Brockovich                       | [79]                                  |"
  },
  {
    "id": "qa_109_003",
    "source": "oscar_actress.pdf",
    "page_numbers": [
      18,
      19
    ],
    "table_idx": 0,
    "question": "Which actress won the Best Actress award in 2008, and for what role and film? Also, name other films for which she was nominated according to the table.",
    "answer": "Kate Winslet won the Best Actress award in 2008 for her role as Hanna Schmitz in 'The Reader'. She was also nominated in 2004 for 'Eternal Sunshine of the Spotless Mind' and in 2006 for 'Little Children'.",
    "retrieved_chunks": [
      "2004\n(77th)Hilary Swank ‡Maggie FitzgeraldMillion Dollar Baby\n[83]Annette BeningJulia Lambert Being Julia\nCatalina Sandino\nMorenoMaría Álvarez Maria Full of Grace\nImelda StauntonVera Rose DrakeVera Drake\nKate WinsletClementine\nKruczynskiEternal Sunshine of the\nSpotless Mind",
      "2006\n(79th)Helen Mirren ‡Queen Elizabeth IIThe Queen\n[85]Penélope CruzRaimunda Volver\nJudi Dench Barbara CovettNotes on a Scandal\nMeryl StreepMiranda PriestlyThe Devil Wears Prada\nKate WinsletSarah Pierce Little Children",
      "2008\n(81st)Kate Winslet ‡Hanna SchmitzThe Reader[87]"
    ],
    "retrieved_context": "| Year        | Actress                 | Role(s)                    | Film                                  | Ref.                                  |\n|:------------|:------------------------|:---------------------------|:--------------------------------------|:--------------------------------------|\n| 2004 (77th) | Kate Winslet            | Clementine Kruczynski      | Eternal Sunshine of the Spotless Mind | Eternal Sunshine of the Spotless Mind |\n| 2006 (79th) | Kate Winslet            | Sarah Pierce               | Little Children                       | Little Children                       |\n| 2008 (81st) | Kate Winslet ‡          | Hanna Schmitz              | The Reader                            | [87]                                  |"
  },
  {
    "id": "qa_109_004",
    "source": "oscar_actress.pdf",
    "page_numbers": [
      18
    ],
    "table_idx": 0,
    "question": "According to the table, in which years was Judi Dench nominated for Best Actress, and for what roles and films was she nominated in those years?",
    "answer": "In 2001, Judi Dench was nominated for her role as Iris Murdoch in the film 'Iris', and again in 2005 for her role as Laura Forster-Henderson in 'Mrs Henderson Presents', and once more in 2006 for her role as Barbara Covett in 'Notes on a Scandal'.",
    "retrieved_chunks": [
      "2001\n(74th)Halle Berry ‡Leticia MusgroveMonster's Ball\n[80]Judi Dench Iris Murdoch Iris",
      "2005\n(78th)Reese\nWitherspoon ‡June Carter CashWalk the Line\n[84]Judi DenchLaura Forster-\nHendersonMrs Henderson Presents",
      "2006\n(79th)Helen Mirren ‡Queen Elizabeth IIThe Queen\n[85]Penélope CruzRaimunda Volver\nJudi Dench Barbara CovettNotes on a Scandal"
    ],
    "retrieved_context": "| Year        | Actress                 | Role(s)                    | Film                                  | Ref.                                  |\n|:------------|:------------------------|:---------------------------|:--------------------------------------|:--------------------------------------|\n| 2001 (74th) | Judi Dench              | Iris Murdoch               | Iris                                  | [80]                                  |\n| 2005 (78th) | Judi Dench              | Laura Forster- Henderson   | Mrs Henderson Presents                | Mrs Henderson Presents                |\n| 2006 (79th) | Judi Dench              | Barbara Covett             | Notes on a Scandal                    | Notes on a Scandal                    |"
  },
  {
    "id": "qa_109_005",
    "source": "oscar_actress.pdf",
    "page_numbers": [
      18,
      19
    ],
    "table_idx": 0,
    "question": "Based on the table, in which years was Meryl Streep nominated for Best Actress, and for which films? Also, how many total nominations does Meryl Streep have according to the additional text?",
    "answer": "Meryl Streep was nominated in 2006 for 'The Devil Wears Prada' and in 2009 for 'Julie & Julia'. According to the additional text, Meryl Streep has a total of 17 nominations.",
    "retrieved_chunks": [
      "Meryl StreepSister Aloysius\nBeauvierDoubt\n2009\n(82nd)Sandra Bullock\n‡Leigh Anne TuohyThe Blind Side\n[88]Helen MirrenCountess Sophia\nTolstayaThe Last Station\nCarey MulliganJenny Mellor An Education\nGabourey SidibeClaireece \"Precious\"\nJonesPrecious\nMeryl StreepJulia Child Julie & Julia",
      "2006\n(79th)Helen Mirren ‡Queen Elizabeth IIThe Queen\n[85]Penélope CruzRaimunda Volver\nJudi Dench Barbara CovettNotes on a Scandal\nMeryl StreepMiranda PriestlyThe Devil Wears Prada",
      "2 Meryl Streep 17"
    ],
    "retrieved_context": "| Year        | Actress                 | Role(s)                    | Film                                  | Ref.                                  |\n|:------------|:------------------------|:---------------------------|:--------------------------------------|:--------------------------------------|\n| 2006 (79th) | Meryl Streep            | Miranda Priestly           | The Devil Wears Prada                 | The Devil Wears Prada                 |\n| 2009 (82nd) | Meryl Streep            | Julia Child                | Julie & Julia                         | [88]                                  |"
  },
  {
    "id": "qa_114_001",
    "source": "0c92f65db928c431023f59603039aa1e.pdf",
    "page_numbers": [
      22
    ],
    "table_idx": 0,
    "question": "Which actress won in 2022 and what was significant about her win?",
    "answer": "In 2022, Michelle Yeoh won for her role as Evelyn Quan Wang in \"Everything Everywhere All at Once\", becoming the first Southeast Asian winner in this category.",
    "retrieved_chunks": [
      "Jessica Chastain\nwon for The Eyes\nof Tammy Faye\n(2021).\nMichelle Yeoh won\nfor Everything\nEverywhere All at\nOnce (2022); first\nSoutheast Asian\nwinner in this\ncategory.Naomi WattsMaria Bennett The Impossible\n2013\n(86th)Cate Blanchett ‡Jeanette \"Jasmine\"\nFrancisBlue Jasmine\n[92]Amy AdamsSydney Prosser /\nLady Edith GreenslyAmerican Hustle\nSandra BullockRyan Stone Gravity\nJudi Dench Philomena LeePhilomena\nMeryl StreepViolet Weston August: Osage County\n2014\n(87th)Julianne Moore\n‡Alice HowlandStill Alice\n[93]Marion CotillardSandra Bya Two Days, One Night\nFelicity JonesJane Wilde HawkingThe Theory of Everything\nRosamund PikeAmy Elliott-DunneGone Girl\nReese\nWitherspoonCheryl StrayedWild\n2015\n(88th)Brie Larson ‡Joy \"Ma\" NewsomeRoom\n[94]Cate BlanchettCarol Aird Carol\nJennifer\nLawrenceJoy Mangano Joy\nCharlotte\nRamplingKate Mercer 45 Years\nSaoirse RonanEilis Lacey Brooklyn\n2016\n(89th)Emma Stone ‡Mia Dolan La La Land\n[95]Isabelle HuppertMichèle LeblancElle\nRuth NeggaMildred Loving Loving\nNatalie PortmanJacqueline \"Jackie\"\nKennedyJackie\nMeryl StreepFlorence Foster\nJenkinsFlorence Foster Jenkins\n2017\n(90th)Frances\nMcDormand ‡Mildred HayesThree Billboards\nOutside Ebbing,\nMissouri[96]\nSally HawkinsElisa Esposito The Shape of Water\nMargot RobbieTonya Harding I, Tonya"
    ],
    "retrieved_context": "| Year               | Actress             | Role(s)                                 | Film                                 | Ref.   |\n|:-------------------|:--------------------|:----------------------------------------|:-------------------------------------|:-------|\n| 2022 (95th)        | Michelle Yeoh ‡     | Evelyn Quan Wang                        | Everything Everywhere All at Once    | [102]  |"
  },
  {
    "id": "qa_114_002",
    "source": "0c92f65db928c431023f59603039aa1e.pdf",
    "page_numbers": [
      22
    ],
    "table_idx": 0,
    "question": "Which actress was nominated in both the 2020/21 and 2023 awards, and what roles did she play in those years?",
    "answer": "Carey Mulligan was nominated in both 2020/21 and 2023. In 2020/21, she played Cassandra \"Cassie\" Thomas in \"Promising Young Woman\", and in 2023, she played Felicia Montealegre in \"Maestro\".",
    "retrieved_chunks": [],
    "retrieved_context": "| Year               | Actress             | Role(s)                                 | Film                                 | Ref.   |\n|:-------------------|:--------------------|:----------------------------------------|:----------------------------------------|:-------------------------------------|:-------|\n| 2020/21 (93rd)[99] | Carey Mulligan      | Cassandra \"Cassie\" Thomas               | Promising Young Woman                | [100]  |\n| 2023 (96th)        | Carey Mulligan      | Felicia Montealegre                     | Maestro                              | [103]  |"
  },
  {
    "id": "qa_114_003",
    "source": "0c92f65db928c431023f59603039aa1e.pdf",
    "page_numbers": [
      22
    ],
    "table_idx": 0,
    "question": "For the 2024 awards, which role and film was Cynthia Erivo nominated for?",
    "answer": "In 2024, Cynthia Erivo was nominated for playing Elphaba Thropp in \"Wicked\".",
    "retrieved_chunks": [],
    "retrieved_context": "| Year               | Actress             | Role(s)                                 | Film                                 | Ref.   |\n| 2024 (97th)        | Cynthia Erivo       | Elphaba Thropp                          | Wicked                               | [104]  |"
  },
  {
    "id": "qa_114_004",
    "source": "0c92f65db928c431023f59603039aa1e.pdf",
    "page_numbers": [
      22
    ],
    "table_idx": 0,
    "question": "In what year and for what film did Frances McDormand win an award according to the table?",
    "answer": "Frances McDormand won for her role as Fern in Nomadland during the 2020/21 (93rd) awards.",
    "retrieved_chunks": [],
    "retrieved_context": "| Year               | Actress             | Role(s)                                 | Film                                 | Ref.   |\n|:-------------------|:--------------------|:----------------------------------------|:-------------------------------------|:-------|\n| 2020/21 (93rd)[99] | Frances McDormand ‡ | Fern                                    | Nomadland                            | [100]  |"
  },
  {
    "id": "qa_114_005",
    "source": "0c92f65db928c431023f59603039aa1e.pdf",
    "page_numbers": [
      23
    ],
    "table_idx": 0,
    "question": "Based on the additional text, how many times did Emma Stone win and for which films?",
    "answer": "Emma Stone won twice, once for La La Land (2016) and again for Poor Things (2023).",
    "retrieved_chunks": [
      "Julianne Moore\nwon for Still Alice\n(2014).\nBrie Larson won\nfor Room (2015).\nEmma Stone won\ntwice, for La La\nLand (2016) and\nPoor Things\n(2023).\nOlivia Colman won\nfor The Favourite\n(2018).\nRenée Zellweger\nwon for Judy\n(2019).Meryl StreepSister Aloysius\nBeauvierDoubt\n2009\n(82nd)Sandra Bullock\n‡Leigh Anne TuohyThe Blind Side\n[88]Helen MirrenCountess Sophia\nTolstayaThe Last Station\nCarey MulliganJenny Mellor An Education\nGabourey SidibeClaireece \"Precious\"\nJonesPrecious\nMeryl StreepJulia Child Julie & Julia\n2010s [edit]\nYearActress Role(s) Film Ref.\n2010\n(83rd)Natalie Portman\n‡Nina Sayers Black Swan\n[89]Annette BeningDr. Nicole \"Nic\"\nAllgoodThe Kids Are All Right\nNicole KidmanBecca CorbettRabbit Hole\nJennifer\nLawrenceRee Dolly Winter's Bone\nMichelle WilliamsCynthia \"Cindy\"\nHellerBlue Valentine\n2011\n(84th)Meryl Streep ‡Margaret ThatcherThe Iron Lady\n[90]Glenn CloseAlbert Nobbs Albert Nobbs\nViola Davis Aibileen Clark The Help\nRooney MaraLisbeth SalanderThe Girl with the Dragon\nTattoo\nMichelle WilliamsMarilyn MonroeMy Week with Marilyn\n2012\n(85th)Jennifer\nLawrence ‡Tiffany MaxwellSilver Linings Playbook[91]\nJessica ChastainMaya Harris Zero Dark Thirty\nEmmanuelle RivaAnne Laurent Amour\nQuvenzhané\nWallisHushpuppyBeasts of the Southern\nWild"
    ],
    "retrieved_context": "| Year               | Actress             | Role(s)                                 | Film                                 | Ref.   |\n|:-------------------|:--------------------|:----------------------------------------|:-------------------------------------|:-------|\n| 2023 (96th)        | Emma Stone ‡        | Bella Baxter                            | Poor Things                          | [103]  |"
  },
  {
    "id": "qa_495_001",
    "source": "0c92f65db928c431023f59603039aa1e.pdf",
    "page_numbers": [
      23,
      24
    ],
    "table_idx": 0,
    "question": "Which actress in the table has the most wins and how many nominations does she have?",
    "answer": "Katharine Hepburn has the highest number of wins with 4 and also the highest number of nominations with 12.",
    "retrieved_chunks": [
      "Multiple wins and nominations [edit]\nSee also: List of superlative Academy Award winners and nominees § Best Actress in a Leading Role\nThe following individuals won two or more Academy Awards for Best Actress:\nWins ActressNominations\n4Katharine Hepburn 12\n3Frances McDormand3\n2 Meryl Streep 17\nBette Davis 11\nIngrid Bergman\n6\nJane Fonda\nElizabeth Taylor 5\nOlivia de Havilland 4"
    ],
    "retrieved_context": "| Wins           | Actress             | Nominations    |\n|:---------------|:--------------------|:---------------|\n| 4              | Katharine Hepburn   | 12             |\n| 3              | Frances McDormand   | 3              |\n| 2              | Meryl Streep        | 17             |\n| 2              | Bette Davis         | 11             |\n| 2              | Ingrid Bergman      | 6              |\n| 2              | Jane Fonda          | 6              |\n| 2              | Elizabeth Taylor    | 5              |\n| 2              | Olivia de Havilland | 4              |\n| Glenda Jackson | Glenda Jackson      | Glenda Jackson |\n| Jodie Foster   | Jodie Foster        | 3              |\n| Sally Field    | Sally Field         | Sally Field    |\n| Vivien Leigh   | Vivien Leigh        | Vivien Leigh   |\n| Luise Rainer   | Luise Rainer        | 2              |\n| Emma Stone     | Emma Stone          | Emma Stone     |\n| Hilary Swank   | Hilary Swank        | Hilary Swank   |"
  },
  {
    "id": "qa_495_002",
    "source": "0c92f65db928c431023f59603039aa1e.pdf",
    "page_numbers": [
      23,
      24
    ],
    "table_idx": 0,
    "question": "Which actress has the most nominations and how many wins does she have?",
    "answer": "Meryl Streep has the most nominations with 17, despite only having 2 wins.",
    "retrieved_chunks": [
      "Multiple wins and nominations [edit]\nSee also: List of superlative Academy Award winners and nominees § Best Actress in a Leading Role\nThe following individuals won two or more Academy Awards for Best Actress:\nWins ActressNominations\n4Katharine Hepburn 12\n3Frances McDormand3\n2 Meryl Streep 17\nBette Davis 11\nIngrid Bergman\n6\nJane Fonda\nElizabeth Taylor 5\nOlivia de Havilland 4",
      "Main article: List of actors with more than one Academy Award nomination in the acting categories\n§ Most nominations by category (actress)\nThe following individuals received three or more Best Actress nominations:\nNominationsActress\n17 Meryl Streep\n12 Katharine Hepburn\n11 Bette Davis\n7 Greer Garson\n6Ingrid Bergman\nJane Fonda\nDeborah Kerr\nSissy Spacek\n5Anne Bancroft\nCate Blanchett\nEllen Burstyn\nJudi Dench\nIrene Dunne\nSusan Hayward\nAudrey Hepburn\nJessica Lange\nShirley MacLaine\nSusan Sarandon\nNorma Shearer\nElizabeth Taylor"
    ],
    "retrieved_context": "| Wins           | Actress             | Nominations    |\n|:---------------|:--------------------|:---------------|\n| 4              | Katharine Hepburn   | 12             |\n| 3              | Frances McDormand   | 3              |\n| 2              | Meryl Streep        | 17             |\n| 2              | Bette Davis         | 11             |\n| 2              | Ingrid Bergman      | 6              |\n| 2              | Jane Fonda          | 6              |\n| 2              | Elizabeth Taylor    | 5              |\n| 2              | Olivia de Havilland | 4              |\n| Glenda Jackson | Glenda Jackson      | Glenda Jackson |\n| Jodie Foster   | Jodie Foster        | 3              |\n| Sally Field    | Sally Field         | Sally Field    |\n| Vivien Leigh   | Vivien Leigh        | Vivien Leigh   |\n| Luise Rainer   | Luise Rainer        | 2              |\n| Emma Stone     | Emma Stone          | Emma Stone     |\n| Hilary Swank   | Hilary Swank        | Hilary Swank   |"
  },
  {
    "id": "qa_495_003",
    "source": "0c92f65db928c431023f59603039aa1e.pdf",
    "page_numbers": [
      23,
      24
    ],
    "table_idx": 0,
    "question": "Which actresses in the table have exactly 3 nominations?",
    "answer": "Frances McDormand and Jodie Foster both have 3 nominations.",
    "retrieved_chunks": [
      "Multiple wins and nominations [edit]\nSee also: List of superlative Academy Award winners and nominees § Best Actress in a Leading Role\nThe following individuals won two or more Academy Awards for Best Actress:\nWins ActressNominations\n4Katharine Hepburn 12\n3Frances McDormand3\n2 Meryl Streep 17\nBette Davis 11\nIngrid Bergman\n6\nJane Fonda\nElizabeth Taylor 5\nOlivia de Havilland 4"
    ],
    "retrieved_context": "| Wins           | Actress             | Nominations    |\n|:---------------|:--------------------|:---------------|\n| 4              | Katharine Hepburn   | 12             |\n| 3              | Frances McDormand   | 3              |\n| 2              | Meryl Streep        | 17             |\n| 2              | Bette Davis         | 11             |\n| 2              | Ingrid Bergman      | 6              |\n| 2              | Jane Fonda          | 6              |\n| 2              | Elizabeth Taylor    | 5              |\n| 2              | Olivia de Havilland | 4              |\n| Glenda Jackson | Glenda Jackson      | Glenda Jackson |\n| Jodie Foster   | Jodie Foster        | 3              |\n| Sally Field    | Sally Field         | Sally Field    |\n| Vivien Leigh   | Vivien Leigh        | Vivien Leigh   |\n| Luise Rainer   | Luise Rainer        | 2              |\n| Emma Stone     | Emma Stone          | Emma Stone     |\n| Hilary Swank   | Hilary Swank        | Hilary Swank   |"
  },
  {
    "id": "qa_495_004",
    "source": "0c92f65db928c431023f59603039aa1e.pdf",
    "page_numbers": [
      23,
      24
    ],
    "table_idx": 0,
    "question": "Which actresses in the table have the same number of nominations and wins?",
    "answer": "Ingrid Bergman and Jane Fonda both have 6 nominations and 2 wins.",
    "retrieved_chunks": [
      "Multiple wins and nominations [edit]\nSee also: List of superlative Academy Award winners and nominees § Best Actress in a Leading Role\nThe following individuals won two or more Academy Awards for Best Actress:\nWins ActressNominations\n4Katharine Hepburn 12\n3Frances McDormand3\n2 Meryl Streep 17\nBette Davis 11\nIngrid Bergman\n6\nJane Fonda\nElizabeth Taylor 5\nOlivia de Havilland 4"
    ],
    "retrieved_context": "| Wins           | Actress             | Nominations    |\n|:---------------|:--------------------|:---------------|\n| 4              | Katharine Hepburn   | 12             |\n| 3              | Frances McDormand   | 3              |\n| 2              | Meryl Streep        | 17             |\n| 2              | Bette Davis         | 11             |\n| 2              | Ingrid Bergman      | 6              |\n| 2              | Jane Fonda          | 6              |\n| 2              | Elizabeth Taylor    | 5              |\n| 2              | Olivia de Havilland | 4              |\n| Glenda Jackson | Glenda Jackson      | Glenda Jackson |\n| Jodie Foster   | Jodie Foster        | 3              |\n| Sally Field    | Sally Field         | Sally Field    |\n| Vivien Leigh   | Vivien Leigh        | Vivien Leigh   |\n| Luise Rainer   | Luise Rainer        | 2              |\n| Emma Stone     | Emma Stone          | Emma Stone     |\n| Hilary Swank   | Hilary Swank        | Hilary Swank   |"
  },
  {
    "id": "qa_495_005",
    "source": "0c92f65db928c431023f59603039aa1e.pdf",
    "page_numbers": [
      23,
      24
    ],
    "table_idx": 0,
    "question": "Which actress has the same string value for wins and nominations?",
    "answer": "Emma Stone has the same number of wins and nominations, with both being equal to Emma Stone.",
    "retrieved_chunks": [],
    "retrieved_context": "| Wins           | Actress             | Nominations    |\n|:---------------|:--------------------|:---------------|\n| 4              | Katharine Hepburn   | 12             |\n| 3              | Frances McDormand   | 3              |\n| 2              | Meryl Streep        | 17             |\n| 2              | Bette Davis         | 11             |\n| 2              | Ingrid Bergman      | 6              |\n| 2              | Jane Fonda          | 6              |\n| 2              | Elizabeth Taylor    | 5              |\n| 2              | Olivia de Havilland | 4              |\n| Glenda Jackson | Glenda Jackson      | Glenda Jackson |\n| Jodie Foster   | Jodie Foster        | 3              |\n| Sally Field    | Sally Field         | Sally Field    |\n| Vivien Leigh   | Vivien Leigh        | Vivien Leigh   |\n| Luise Rainer   | Luise Rainer        | 2              |\n| Emma Stone     | Emma Stone          | Emma Stone     |\n| Hilary Swank   | Hilary Swank        | Hilary Swank   |"
  },
  {
    "id": "qa_124_001",
    "source": "0c92f65db928c431023f59603039aa1e.pdf",
    "page_numbers": [
      26
    ],
    "table_idx": 0,
    "question": "Who was the oldest winner according to the table, for what film and in what year, and how does that year compare to when Cher won?",
    "answer": "Jessica Tandy won for \"Driving Miss Daisy\" in 1990 at the age of 80, making her the oldest winner. This was one year after Cher won for \"Moonstruck\" in 1987.",
    "retrieved_chunks": [
      "Cher won for\nMoonstruck\n(1987).\nJodie Foster won\ntwice, for The\nAccused (1988)\nand The Silence of\nthe Lambs (1991).\nJessica Tandy won\nfor Driving Miss\nDaisy (1989); this\ncategory's oldest\nwinner, at age 80.",
      "Age superlatives [edit]\nMain article: List of oldest and youngest Academy Award winners and nominees § Best Actress in a\nLeading Role\nRecord Actor Film YearAgeRef.\nOldest WinnerJessica Tandy Driving Miss Daisy199080[105]"
    ],
    "retrieved_context": "| Record           | Actor             | Film                        |   Year |   Age | Ref.   |\n|:-----------------|:------------------|:----------------------------|-------:|------:|:-------|\n| Oldest Winner    | Jessica Tandy     | Driving Miss Daisy          |   1990 |    80 | [105]  |\n| Oldest Nominee   | Emmanuelle Riva   | Amour                       |   2013 |    85 | [105]  |\n| Youngest Winner  | Marlee Matlin     | Children of a Lesser God    |   1987 |    21 | [105]  |\n| Youngest Nominee | Quvenzhané Wallis | Beasts of the Southern Wild |   2013 |     9 | [105]  |"
  },
  {
    "id": "qa_124_002",
    "source": "0c92f65db928c431023f59603039aa1e.pdf",
    "page_numbers": [
      26
    ],
    "table_idx": 0,
    "question": "According to the table, who was the youngest nominee and for what film and in what year, and who won best actress that year?",
    "answer": "The youngest nominee was Quvenzhané Wallis for \"Beasts of the Southern Wild\" in 2013, the same year Cate Blanchett won for \"Blue Jasmine\".",
    "retrieved_chunks": [
      "Cate Blanchett\nwon for Blue\nJasmine (2013).",
      "Age superlatives [edit]\nMain article: List of oldest and youngest Academy Award winners and nominees § Best Actress in a\nLeading Role\nRecord Actor Film YearAgeRef.\nOldest WinnerJessica Tandy Driving Miss Daisy199080[105]\nOldest NomineeEmmanuelle Riva Amour 201385[105]\nYoungest WinnerMarlee MatlinChildren of a Lesser God198721[105]\nYoungest NomineeQuvenzhané WallisBeasts of the Southern Wild20139[105]"
    ],
    "retrieved_context": "| Record           | Actor             | Film                        |   Year |   Age | Ref.   |\n|:-----------------|:------------------|:----------------------------|-------:|------:|:-------|\n| Oldest Winner    | Jessica Tandy     | Driving Miss Daisy          |   1990 |    80 | [105]  |\n| Oldest Nominee   | Emmanuelle Riva   | Amour                       |   2013 |    85 | [105]  |\n| Youngest Winner  | Marlee Matlin     | Children of a Lesser God    |   1987 |    21 | [105]  |\n| Youngest Nominee | Quvenzhané Wallis | Beasts of the Southern Wild |   2013 |     9 | [105]  |"
  },
  {
    "id": "qa_124_003",
    "source": "0c92f65db928c431023f59603039aa1e.pdf",
    "page_numbers": [
      26
    ],
    "table_idx": 0,
    "question": "What age was Emmanuelle Riva when she received her nomination for \"Amour\", and what record did that set?",
    "answer": "Emmanuelle Riva was 85 years old when she was nominated for \"Amour\" in 2013, making her the oldest nominee.",
    "retrieved_chunks": [
      "Age superlatives [edit]\nMain article: List of oldest and youngest Academy Award winners and nominees § Best Actress in a\nLeading Role\nRecord Actor Film YearAgeRef.\nOldest WinnerJessica Tandy Driving Miss Daisy199080[105]\nOldest NomineeEmmanuelle Riva Amour 201385[105]"
    ],
    "retrieved_context": "| Record           | Actor             | Film                        |   Year |   Age | Ref.   |\n|:-----------------|:------------------|:----------------------------|-------:|------:|:-------|\n| Oldest Winner    | Jessica Tandy     | Driving Miss Daisy          |   1990 |    80 | [105]  |\n| Oldest Nominee   | Emmanuelle Riva   | Amour                       |   2013 |    85 | [105]  |\n| Youngest Winner  | Marlee Matlin     | Children of a Lesser God    |   1987 |    21 | [105]  |\n| Youngest Nominee | Quvenzhané Wallis | Beasts of the Southern Wild |   2013 |     9 | [105]  |"
  },
  {
    "id": "qa_124_004",
    "source": "0c92f65db928c431023f59603039aa1e.pdf",
    "page_numbers": [
      26
    ],
    "table_idx": 0,
    "question": "In what year did Marlee Matlin win for \"Children of a Lesser God\" and at what age, and how does that relate to Jessica Tandy's win?",
    "answer": "Marlee Matlin won for \"Children of a Lesser God\" in 1987 at the age of 21, making her the youngest winner, preceding Jessica Tandy who won in 1990.",
    "retrieved_chunks": [
      "Age superlatives [edit]\nMain article: List of oldest and youngest Academy Award winners and nominees § Best Actress in a\nLeading Role\nRecord Actor Film YearAgeRef.\nOldest WinnerJessica Tandy Driving Miss Daisy199080[105]\nYoungest WinnerMarlee MatlinChildren of a Lesser God198721[105]",
      "Jessica Tandy won\nfor Driving Miss\nDaisy (1989); this\ncategory's oldest\nwinner, at age 80."
    ],
    "retrieved_context": "| Record           | Actor             | Film                        |   Year |   Age | Ref.   |\n|:-----------------|:------------------|:----------------------------|-------:|------:|:-------|\n| Oldest Winner    | Jessica Tandy     | Driving Miss Daisy          |   1990 |    80 | [105]  |\n| Oldest Nominee   | Emmanuelle Riva   | Amour                       |   2013 |    85 | [105]  |\n| Youngest Winner  | Marlee Matlin     | Children of a Lesser God    |   1987 |    21 | [105]  |\n| Youngest Nominee | Quvenzhané Wallis | Beasts of the Southern Wild |   2013 |     9 | [105]  |"
  },
  {
    "id": "qa_124_005",
    "source": "0c92f65db928c431023f59603039aa1e.pdf",
    "page_numbers": [
      26
    ],
    "table_idx": 0,
    "question": "Which nominees from the table share the same nomination year, and who won Best Actress that year?",
    "answer": "Both Emmanuelle Riva for \"Amour\" and Quvenzhané Wallis for \"Beasts of the Southern Wild\" were nominated in 2013, the same year Cate Blanchett won for \"Blue Jasmine\".",
    "retrieved_chunks": [
      "Cate Blanchett\nwon for Blue\nJasmine (2013).",
      "Age superlatives [edit]\nMain article: List of oldest and youngest Academy Award winners and nominees § Best Actress in a\nLeading Role\nRecord Actor Film YearAgeRef.\nOldest WinnerJessica Tandy Driving Miss Daisy199080[105]\nOldest NomineeEmmanuelle Riva Amour 201385[105]\nYoungest WinnerMarlee MatlinChildren of a Lesser God198721[105]\nYoungest NomineeQuvenzhané WallisBeasts of the Southern Wild20139[105]"
    ],
    "retrieved_context": "| Record           | Actor             | Film                        |   Year |   Age | Ref.   |\n|:-----------------|:------------------|:----------------------------|-------:|------:|:-------|\n| Oldest Winner    | Jessica Tandy     | Driving Miss Daisy          |   1990 |    80 | [105]  |\n| Oldest Nominee   | Emmanuelle Riva   | Amour                       |   2013 |    85 | [105]  |\n| Youngest Winner  | Marlee Matlin     | Children of a Lesser God    |   1987 |    21 | [105]  |\n| Youngest Nominee | Quvenzhané Wallis | Beasts of the Southern Wild |   2013 |     9 | [105]  |"
  },
  {
    "id": "qa_129_001",
    "source": "7c9914edb06d045afdde4c05e6dfef0d.pdf",
    "page_numbers": [
      2
    ],
    "table_idx": 0,
    "question": "According to the table, who did Raúl Ramírez partner with to win Wimbledon, who were their opponents, and what was the score?",
    "answer": "In 1976, Raúl Ramírez partnered with Brian Gottfried to win Wimbledon, defeating Ross Case and Geoff Masters with a score of 3–6, 6–3, 8–6, 2–6, 7–5. According to the provided text, Raúl Ramírez won Wimbledon in 1976.",
    "retrieved_chunks": [
      "Raúl Ramírez\n 21 languages\nArticleTalk ReadEditView historyTools\nRaúl Ramírez\nFull nameRaúl Carlos Ramírez\nCountry (sports)\n Mexico\nResidenceEnsenada, Baja California,\nMexico\nBorn 20 June 1953 (age 71)\nEnsenada, Baja California,\nMexico\nHeight 1.82 m (6 ft 0 in)\nTurned pro1973 (amateur tour from 1970)\nRetired 1983\nPlays Right-handed (one-handed\nbackhand)\nPrize money$2,217,971\nSingles\nCareer record544–268\nCareer titles19\nHighest rankingNo. 4 (7 November 1976)\nGrand Slam singles results\nFrench OpenSF (1976, 1977)\nWimbledonSF (1976)\nUS Open QF (1978)\nOther tournaments\nTour FinalsSF (1974)\nWCT FinalsQF (1975, 1976, 1978)\nDoubles\nCareer record583–194\nCareer titles60\nHighest rankingNo. 1 (12 April 1976)\nGrand Slam doubles results\nFrench OpenW (1975, 1977)\nWimbledonW (1976)\nUS Open F (1977)From Wikipedia, the free encyclopedia\nFor other people named Raúl Ramírez, see Raúl Ramírez (disambiguation).\nRaúl Ramírez (born 20 June 1953) is a Mexican former professional tennis player.\nHe was active during the 1970s and 1980s. Ramírez was the first player to finish\nfirst in both singles and doubles Grand Prix point standings, accomplishing the feat\nin 1976. He attended and played tennis at the University of Southern California in\nLos Angeles.[1]\nPersonal life [edit]\nRamírez was born in Ensenada, Baja California. In 1981, he married the\nVenezuelan-born former Miss Universe Maritza Sayalero. The couple lives in\nEnsenada and have three children: Rebecca (born 1982), Raúl (born 1984), and\nDaniel Francisco (1989).\nCareer [edit]\nRamirez was ranked as high as World No. 4 (achieving this ranking on 7 November\n1976) and he is one of the all-time leading doubles winners, having spent 62 weeks\nranked World No. 1 in doubles, beginning 12 April 1976. He won 19 singles titles,\nincluding titles at the ATP Masters Series events in Rome (1975) and Monte Carlo\n(1978).\nHe won 60 doubles titles, including Wimbledon (1976), the French Open (1975 &\n'77), and at ATP Masters Series events in Cincinnati (1978), Canada (1976, ’77 &\n’81), Monte Carlo (1979), Paris (1977), and Rome (1974, ’75, ’76 & ’77). He won the\nWCT World Doubles twice in 1975 and 1980. He won the men's singles in the Ojai\nTennis Tournament in 1971.[2]\nHe played tournaments of the two world tennis circuits played at the time, the Grand\nPrix tennis circuit and the World Championship Tennis (WCT). These circuits were\npredecessors of the Association of Tennis Professionals Tour (ATP Tour). In 1975 he\nwon the Grand Prix, the present day equivalent of the Race.\nGrand Slam tournament finals [edit]\nDoubles finals, 7 (3 titles, 4 runners-up) [edit]\nDonateCreate accountLog in"
    ],
    "retrieved_context": "| Result   |   Year | Championship    | Surface   | Partner         | Opponents                    | Score                   |\n|:---------|-------:|:----------------|:----------|:----------------|:-----------------------------|:------------------------|\n| Win      |   1975 | French Open     | Clay      | Brian Gottfried | John Alexander Phil Dent     | 6–4, 2–6, 6–2, 6–4      |\n| Loss     |   1976 | French Open     | Clay      | Brian Gottfried | Fred McNair Sherwood Stewart | 6–7, 3–6, 1–6           |\n| Win      |   1976 | Wimbledon       | Grass     | Brian Gottfried | Ross Case Geoff Masters      | 3–6, 6–3, 8–6, 2–6, 7–5 |\n| Win      |   1977 | French Open (2) | Clay      | Brian Gottfried | Wojciech Fibak Jan Kodeš     | 7–6, 4–6, 6–3, 6–4      |\n| Loss     |   1977 | US Open         | Clay      | Brian Gottfried | Bob Hewitt Frew McMillan     | 4–6, 0–6                |\n| Loss     |   1979 | Wimbledon       | Grass     | Brian Gottfried | Peter Fleming John McEnroe   | 6–4, 4–6, 2–6, 2–6      |\n| Loss     |   1980 | French Open (2) | Clay      | Brian Gottfried | Victor Amaya Hank Pfister    | 6–1, 4–6, 4–6, 3–6      |"
  },
  {
    "id": "qa_129_002",
    "source": "7c9914edb06d045afdde4c05e6dfef0d.pdf",
    "page_numbers": [
      2
    ],
    "table_idx": 0,
    "question": "According to the table, in what year did Raúl Ramírez and Brian Gottfried lose the US Open final, what was the surface, who were their opponents, and what was the score?",
    "answer": "Raúl Ramírez and Brian Gottfried lost the 1977 US Open final on Clay against Bob Hewitt and Frew McMillan with a score of 4–6, 0–6. According to the text, Raúl Ramírez reached the US Open final in 1977.",
    "retrieved_chunks": [
      "Raúl Ramírez\n 21 languages\nArticleTalk ReadEditView historyTools\nRaúl Ramírez\nFull nameRaúl Carlos Ramírez\nCountry (sports)\n Mexico\nResidenceEnsenada, Baja California,\nMexico\nBorn 20 June 1953 (age 71)\nEnsenada, Baja California,\nMexico\nHeight 1.82 m (6 ft 0 in)\nTurned pro1973 (amateur tour from 1970)\nRetired 1983\nPlays Right-handed (one-handed\nbackhand)\nPrize money$2,217,971\nSingles\nCareer record544–268\nCareer titles19\nHighest rankingNo. 4 (7 November 1976)\nGrand Slam singles results\nFrench OpenSF (1976, 1977)\nWimbledonSF (1976)\nUS Open QF (1978)\nOther tournaments\nTour FinalsSF (1974)\nWCT FinalsQF (1975, 1976, 1978)\nDoubles\nCareer record583–194\nCareer titles60\nHighest rankingNo. 1 (12 April 1976)\nGrand Slam doubles results\nFrench OpenW (1975, 1977)\nWimbledonW (1976)\nUS Open F (1977)From Wikipedia, the free encyclopedia\nFor other people named Raúl Ramírez, see Raúl Ramírez (disambiguation).\nRaúl Ramírez (born 20 June 1953) is a Mexican former professional tennis player.\nHe was active during the 1970s and 1980s. Ramírez was the first player to finish\nfirst in both singles and doubles Grand Prix point standings, accomplishing the feat\nin 1976. He attended and played tennis at the University of Southern California in\nLos Angeles.[1]\nPersonal life [edit]\nRamírez was born in Ensenada, Baja California. In 1981, he married the\nVenezuelan-born former Miss Universe Maritza Sayalero. The couple lives in\nEnsenada and have three children: Rebecca (born 1982), Raúl (born 1984), and\nDaniel Francisco (1989).\nCareer [edit]\nRamirez was ranked as high as World No. 4 (achieving this ranking on 7 November\n1976) and he is one of the all-time leading doubles winners, having spent 62 weeks\nranked World No. 1 in doubles, beginning 12 April 1976. He won 19 singles titles,\nincluding titles at the ATP Masters Series events in Rome (1975) and Monte Carlo\n(1978).\nHe won 60 doubles titles, including Wimbledon (1976), the French Open (1975 &\n'77), and at ATP Masters Series events in Cincinnati (1978), Canada (1976, ’77 &\n’81), Monte Carlo (1979), Paris (1977), and Rome (1974, ’75, ’76 & ’77). He won the\nWCT World Doubles twice in 1975 and 1980. He won the men's singles in the Ojai\nTennis Tournament in 1971.[2]\nHe played tournaments of the two world tennis circuits played at the time, the Grand\nPrix tennis circuit and the World Championship Tennis (WCT). These circuits were\npredecessors of the Association of Tennis Professionals Tour (ATP Tour). In 1975 he\nwon the Grand Prix, the present day equivalent of the Race.\nGrand Slam tournament finals [edit]\nDoubles finals, 7 (3 titles, 4 runners-up) [edit]\nDonateCreate accountLog in"
    ],
    "retrieved_context": "| Result   |   Year | Championship    | Surface   | Partner         | Opponents                    | Score                   |\n|:---------|-------:|:----------------|:----------|:----------------|:-----------------------------|:------------------------|\n| Win      |   1975 | French Open     | Clay      | Brian Gottfried | John Alexander Phil Dent     | 6–4, 2–6, 6–2, 6–4      |\n| Loss     |   1976 | French Open     | Clay      | Brian Gottfried | Fred McNair Sherwood Stewart | 6–7, 3–6, 1–6           |\n| Win      |   1976 | Wimbledon       | Grass     | Brian Gottfried | Ross Case Geoff Masters      | 3–6, 6–3, 8–6, 2–6, 7–5 |\n| Win      |   1977 | French Open (2) | Clay      | Brian Gottfried | Wojciech Fibak Jan Kodeš     | 7–6, 4–6, 6–3, 6–4      |\n| Loss     |   1977 | US Open         | Clay      | Brian Gottfried | Bob Hewitt Frew McMillan     | 4–6, 0–6                |\n| Loss     |   1979 | Wimbledon       | Grass     | Brian Gottfried | Peter Fleming John McEnroe   | 6–4, 4–6, 2–6, 2–6      |\n| Loss     |   1980 | French Open (2) | Clay      | Brian Gottfried | Victor Amaya Hank Pfister    | 6–1, 4–6, 4–6, 3–6      |"
  },
  {
    "id": "qa_129_003",
    "source": "7c9914edb06d045afdde4c05e6dfef0d.pdf",
    "page_numbers": [
      2
    ],
    "table_idx": 0,
    "question": "Who was Raúl Ramírez's partner in all the championship matches listed in the table?",
    "answer": "Raúl Ramírez partnered with Brian Gottfried in all the listed matches in the table.",
    "retrieved_chunks": [
      "Raúl Ramírez\n 21 languages\nArticleTalk ReadEditView historyTools\nRaúl Ramírez\nFull nameRaúl Carlos Ramírez\nCountry (sports)\n Mexico\nResidenceEnsenada, Baja California,\nMexico\nBorn 20 June 1953 (age 71)\nEnsenada, Baja California,\nMexico\nHeight 1.82 m (6 ft 0 in)\nTurned pro1973 (amateur tour from 1970)\nRetired 1983\nPlays Right-handed (one-handed\nbackhand)\nPrize money$2,217,971\nSingles\nCareer record544–268\nCareer titles19\nHighest rankingNo. 4 (7 November 1976)\nGrand Slam singles results\nFrench OpenSF (1976, 1977)\nWimbledonSF (1976)\nUS Open QF (1978)\nOther tournaments\nTour FinalsSF (1974)\nWCT FinalsQF (1975, 1976, 1978)\nDoubles\nCareer record583–194\nCareer titles60\nHighest rankingNo. 1 (12 April 1976)\nGrand Slam doubles results\nFrench OpenW (1975, 1977)\nWimbledonW (1976)\nUS Open F (1977)From Wikipedia, the free encyclopedia\nFor other people named Raúl Ramírez, see Raúl Ramírez (disambiguation).\nRaúl Ramírez (born 20 June 1953) is a Mexican former professional tennis player.\nHe was active during the 1970s and 1980s. Ramírez was the first player to finish\nfirst in both singles and doubles Grand Prix point standings, accomplishing the feat\nin 1976. He attended and played tennis at the University of Southern California in\nLos Angeles.[1]\nPersonal life [edit]\nRamírez was born in Ensenada, Baja California. In 1981, he married the\nVenezuelan-born former Miss Universe Maritza Sayalero. The couple lives in\nEnsenada and have three children: Rebecca (born 1982), Raúl (born 1984), and\nDaniel Francisco (1989).\nCareer [edit]\nRamirez was ranked as high as World No. 4 (achieving this ranking on 7 November\n1976) and he is one of the all-time leading doubles winners, having spent 62 weeks\nranked World No. 1 in doubles, beginning 12 April 1976. He won 19 singles titles,\nincluding titles at the ATP Masters Series events in Rome (1975) and Monte Carlo\n(1978).\nHe won 60 doubles titles, including Wimbledon (1976), the French Open (1975 &\n'77), and at ATP Masters Series events in Cincinnati (1978), Canada (1976, ’77 &\n’81), Monte Carlo (1979), Paris (1977), and Rome (1974, ’75, ’76 & ’77). He won the\nWCT World Doubles twice in 1975 and 1980. He won the men's singles in the Ojai\nTennis Tournament in 1971.[2]\nHe played tournaments of the two world tennis circuits played at the time, the Grand\nPrix tennis circuit and the World Championship Tennis (WCT). These circuits were\npredecessors of the Association of Tennis Professionals Tour (ATP Tour). In 1975 he\nwon the Grand Prix, the present day equivalent of the Race.\nGrand Slam tournament finals [edit]\nDoubles finals, 7 (3 titles, 4 runners-up) [edit]\nDonateCreate accountLog in"
    ],
    "retrieved_context": "| Result   |   Year | Championship    | Surface   | Partner         | Opponents                    | Score                   |\n|:---------|-------:|:----------------|:----------|:----------------|:-----------------------------|:------------------------|\n| Win      |   1975 | French Open     | Clay      | Brian Gottfried | John Alexander Phil Dent     | 6–4, 2–6, 6–2, 6–4      |\n| Loss     |   1976 | French Open     | Clay      | Brian Gottfried | Fred McNair Sherwood Stewart | 6–7, 3–6, 1–6           |\n| Win      |   1976 | Wimbledon       | Grass     | Brian Gottfried | Ross Case Geoff Masters      | 3–6, 6–3, 8–6, 2–6, 7–5 |\n| Win      |   1977 | French Open (2) | Clay      | Brian Gottfried | Wojciech Fibak Jan Kodeš     | 7–6, 4–6, 6–3, 6–4      |\n| Loss     |   1977 | US Open         | Clay      | Brian Gottfried | Bob Hewitt Frew McMillan     | 4–6, 0–6                |\n| Loss     |   1979 | Wimbledon       | Grass     | Brian Gottfried | Peter Fleming John McEnroe   | 6–4, 4–6, 2–6, 2–6      |\n| Loss     |   1980 | French Open (2) | Clay      | Brian Gottfried | Victor Amaya Hank Pfister    | 6–1, 4–6, 4–6, 3–6      |"
  },
  {
    "id": "qa_129_004",
    "source": "7c9914edb06d045afdde4c05e6dfef0d.pdf",
    "page_numbers": [
      2
    ],
    "table_idx": 0,
    "question": "Based on the table, how many times did Raúl Ramírez win the French Open and Wimbledon?",
    "answer": "Raúl Ramírez won the French Open twice and Wimbledon once according to the table. The text also states that he won the French Open in 1975 & '77 and Wimbledon in 1976.",
    "retrieved_chunks": [
      "Raúl Ramírez\n 21 languages\nArticleTalk ReadEditView historyTools\nRaúl Ramírez\nFull nameRaúl Carlos Ramírez\nCountry (sports)\n Mexico\nResidenceEnsenada, Baja California,\nMexico\nBorn 20 June 1953 (age 71)\nEnsenada, Baja California,\nMexico\nHeight 1.82 m (6 ft 0 in)\nTurned pro1973 (amateur tour from 1970)\nRetired 1983\nPlays Right-handed (one-handed\nbackhand)\nPrize money$2,217,971\nSingles\nCareer record544–268\nCareer titles19\nHighest rankingNo. 4 (7 November 1976)\nGrand Slam singles results\nFrench OpenSF (1976, 1977)\nWimbledonSF (1976)\nUS Open QF (1978)\nOther tournaments\nTour FinalsSF (1974)\nWCT FinalsQF (1975, 1976, 1978)\nDoubles\nCareer record583–194\nCareer titles60\nHighest rankingNo. 1 (12 April 1976)\nGrand Slam doubles results\nFrench OpenW (1975, 1977)\nWimbledonW (1976)\nUS Open F (1977)From Wikipedia, the free encyclopedia\nFor other people named Raúl Ramírez, see Raúl Ramírez (disambiguation).\nRaúl Ramírez (born 20 June 1953) is a Mexican former professional tennis player.\nHe was active during the 1970s and 1980s. Ramírez was the first player to finish\nfirst in both singles and doubles Grand Prix point standings, accomplishing the feat\nin 1976. He attended and played tennis at the University of Southern California in\nLos Angeles.[1]\nPersonal life [edit]\nRamírez was born in Ensenada, Baja California. In 1981, he married the\nVenezuelan-born former Miss Universe Maritza Sayalero. The couple lives in\nEnsenada and have three children: Rebecca (born 1982), Raúl (born 1984), and\nDaniel Francisco (1989).\nCareer [edit]\nRamirez was ranked as high as World No. 4 (achieving this ranking on 7 November\n1976) and he is one of the all-time leading doubles winners, having spent 62 weeks\nranked World No. 1 in doubles, beginning 12 April 1976. He won 19 singles titles,\nincluding titles at the ATP Masters Series events in Rome (1975) and Monte Carlo\n(1978).\nHe won 60 doubles titles, including Wimbledon (1976), the French Open (1975 &\n'77), and at ATP Masters Series events in Cincinnati (1978), Canada (1976, ’77 &\n’81), Monte Carlo (1979), Paris (1977), and Rome (1974, ’75, ’76 & ’77). He won the\nWCT World Doubles twice in 1975 and 1980. He won the men's singles in the Ojai\nTennis Tournament in 1971.[2]\nHe played tournaments of the two world tennis circuits played at the time, the Grand\nPrix tennis circuit and the World Championship Tennis (WCT). These circuits were\npredecessors of the Association of Tennis Professionals Tour (ATP Tour). In 1975 he\nwon the Grand Prix, the present day equivalent of the Race.\nGrand Slam tournament finals [edit]\nDoubles finals, 7 (3 titles, 4 runners-up) [edit]\nDonateCreate accountLog in"
    ],
    "retrieved_context": "| Result   |   Year | Championship    | Surface   | Partner         | Opponents                    | Score                   |\n|:---------|-------:|:----------------|:----------|:----------------|:-----------------------------|:------------------------|\n| Win      |   1975 | French Open     | Clay      | Brian Gottfried | John Alexander Phil Dent     | 6–4, 2–6, 6–2, 6–4      |\n| Loss     |   1976 | French Open     | Clay      | Brian Gottfried | Fred McNair Sherwood Stewart | 6–7, 3–6, 1–6           |\n| Win      |   1976 | Wimbledon       | Grass     | Brian Gottfried | Ross Case Geoff Masters      | 3–6, 6–3, 8–6, 2–6, 7–5 |\n| Win      |   1977 | French Open (2) | Clay      | Brian Gottfried | Wojciech Fibak Jan Kodeš     | 7–6, 4–6, 6–3, 6–4      |\n| Loss     |   1977 | US Open         | Clay      | Brian Gottfried | Bob Hewitt Frew McMillan     | 4–6, 0–6                |\n| Loss     |   1979 | Wimbledon       | Grass     | Brian Gottfried | Peter Fleming John McEnroe   | 6–4, 4–6, 2–6, 2–6      |\n| Loss     |   1980 | French Open (2) | Clay      | Brian Gottfried | Victor Amaya Hank Pfister    | 6–1, 4–6, 4–6, 3–6      |"
  },
  {
    "id": "qa_129_005",
    "source": "7c9914edb06d045afdde4c05e6dfef0d.pdf",
    "page_numbers": [
      2
    ],
    "table_idx": 0,
    "question": "In which years did Raúl Ramírez and Brian Gottfried play in the French Open, and what were the results?",
    "answer": "The table shows that Raúl Ramírez and Brian Gottfried played in the French Open in 1975, 1976, and 1980. They won in 1975 and 1977, but lost in 1976 and 1980.",
    "retrieved_chunks": [
      "Raúl Ramírez\n 21 languages\nArticleTalk ReadEditView historyTools\nRaúl Ramírez\nFull nameRaúl Carlos Ramírez\nCountry (sports)\n Mexico\nResidenceEnsenada, Baja California,\nMexico\nBorn 20 June 1953 (age 71)\nEnsenada, Baja California,\nMexico\nHeight 1.82 m (6 ft 0 in)\nTurned pro1973 (amateur tour from 1970)\nRetired 1983\nPlays Right-handed (one-handed\nbackhand)\nPrize money$2,217,971\nSingles\nCareer record544–268\nCareer titles19\nHighest rankingNo. 4 (7 November 1976)\nGrand Slam singles results\nFrench OpenSF (1976, 1977)\nWimbledonSF (1976)\nUS Open QF (1978)\nOther tournaments\nTour FinalsSF (1974)\nWCT FinalsQF (1975, 1976, 1978)\nDoubles\nCareer record583–194\nCareer titles60\nHighest rankingNo. 1 (12 April 1976)\nGrand Slam doubles results\nFrench OpenW (1975, 1977)\nWimbledonW (1976)\nUS Open F (1977)From Wikipedia, the free encyclopedia\nFor other people named Raúl Ramírez, see Raúl Ramírez (disambiguation).\nRaúl Ramírez (born 20 June 1953) is a Mexican former professional tennis player.\nHe was active during the 1970s and 1980s. Ramírez was the first player to finish\nfirst in both singles and doubles Grand Prix point standings, accomplishing the feat\nin 1976. He attended and played tennis at the University of Southern California in\nLos Angeles.[1]\nPersonal life [edit]\nRamírez was born in Ensenada, Baja California. In 1981, he married the\nVenezuelan-born former Miss Universe Maritza Sayalero. The couple lives in\nEnsenada and have three children: Rebecca (born 1982), Raúl (born 1984), and\nDaniel Francisco (1989).\nCareer [edit]\nRamirez was ranked as high as World No. 4 (achieving this ranking on 7 November\n1976) and he is one of the all-time leading doubles winners, having spent 62 weeks\nranked World No. 1 in doubles, beginning 12 April 1976. He won 19 singles titles,\nincluding titles at the ATP Masters Series events in Rome (1975) and Monte Carlo\n(1978).\nHe won 60 doubles titles, including Wimbledon (1976), the French Open (1975 &\n'77), and at ATP Masters Series events in Cincinnati (1978), Canada (1976, ’77 &\n’81), Monte Carlo (1979), Paris (1977), and Rome (1974, ’75, ’76 & ’77). He won the\nWCT World Doubles twice in 1975 and 1980. He won the men's singles in the Ojai\nTennis Tournament in 1971.[2]\nHe played tournaments of the two world tennis circuits played at the time, the Grand\nPrix tennis circuit and the World Championship Tennis (WCT). These circuits were\npredecessors of the Association of Tennis Professionals Tour (ATP Tour). In 1975 he\nwon the Grand Prix, the present day equivalent of the Race.\nGrand Slam tournament finals [edit]\nDoubles finals, 7 (3 titles, 4 runners-up) [edit]\nDonateCreate accountLog in"
    ],
    "retrieved_context": "| Result   |   Year | Championship    | Surface   | Partner         | Opponents                    | Score                   |\n|:---------|-------:|:----------------|:----------|:----------------|:-----------------------------|:------------------------|\n| Win      |   1975 | French Open     | Clay      | Brian Gottfried | John Alexander Phil Dent     | 6–4, 2–6, 6–2, 6–4      |\n| Loss     |   1976 | French Open     | Clay      | Brian Gottfried | Fred McNair Sherwood Stewart | 6–7, 3–6, 1–6           |\n| Win      |   1976 | Wimbledon       | Grass     | Brian Gottfried | Ross Case Geoff Masters      | 3–6, 6–3, 8–6, 2–6, 7–5 |\n| Win      |   1977 | French Open (2) | Clay      | Brian Gottfried | Wojciech Fibak Jan Kodeš     | 7–6, 4–6, 6–3, 6–4      |\n| Loss     |   1977 | US Open         | Clay      | Brian Gottfried | Bob Hewitt Frew McMillan     | 4–6, 0–6                |\n| Loss     |   1979 | Wimbledon       | Grass     | Brian Gottfried | Peter Fleming John McEnroe   | 6–4, 4–6, 2–6, 2–6      |\n| Loss     |   1980 | French Open (2) | Clay      | Brian Gottfried | Victor Amaya Hank Pfister    | 6–1, 4–6, 4–6, 3–6      |"
  },
  {
    "id": "qa_134_001",
    "source": "7c9914edb06d045afdde4c05e6dfef0d.pdf",
    "page_numbers": [
      3,
      4
    ],
    "table_idx": 0,
    "question": "Who did Raúl Ramírez partner with to win the French Open in 1975, and what was the score of the match?",
    "answer": "In 1975, Raúl Ramírez and Brian Gottfried won the French Open doubles title, defeating John Alexander and Phil Dent with a score of 6–4, 2–6, 6–2, 6–4.",
    "retrieved_chunks": [
      "Raúl Ramírez\n 21 languages\nArticleTalk ReadEditView historyTools\nRaúl Ramírez\nFull nameRaúl Carlos Ramírez\nCountry (sports)\n Mexico\nResidenceEnsenada, Baja California,\nMexico\nBorn 20 June 1953 (age 71)\nEnsenada, Baja California,\nMexico\nHeight 1.82 m (6 ft 0 in)\nTurned pro1973 (amateur tour from 1970)\nRetired 1983\nPlays Right-handed (one-handed\nbackhand)\nPrize money$2,217,971\nSingles\nCareer record544–268\nCareer titles19\nHighest rankingNo. 4 (7 November 1976)\nGrand Slam singles results\nFrench OpenSF (1976, 1977)\nWimbledonSF (1976)\nUS Open QF (1978)\nOther tournaments\nTour FinalsSF (1974)\nWCT FinalsQF (1975, 1976, 1978)\nDoubles\nCareer record583–194\nCareer titles60\nHighest rankingNo. 1 (12 April 1976)\nGrand Slam doubles results\nFrench OpenW (1975, 1977)\nWimbledonW (1976)\nUS Open F (1977)From Wikipedia, the free encyclopedia\nFor other people named Raúl Ramírez, see Raúl Ramírez (disambiguation).\nRaúl Ramírez (born 20 June 1953) is a Mexican former professional tennis player.\nHe was active during the 1970s and 1980s. Ramírez was the first player to finish\nfirst in both singles and doubles Grand Prix point standings, accomplishing the feat\nin 1976. He attended and played tennis at the University of Southern California in\nLos Angeles.[1]\nPersonal life [edit]\nRamírez was born in Ensenada, Baja California. In 1981, he married the\nVenezuelan-born former Miss Universe Maritza Sayalero. The couple lives in\nEnsenada and have three children: Rebecca (born 1982), Raúl (born 1984), and\nDaniel Francisco (1989).\nCareer [edit]\nRamirez was ranked as high as World No. 4 (achieving this ranking on 7 November\n1976) and he is one of the all-time leading doubles winners, having spent 62 weeks\nranked World No. 1 in doubles, beginning 12 April 1976. He won 19 singles titles,\nincluding titles at the ATP Masters Series events in Rome (1975) and Monte Carlo\n(1978).\nHe won 60 doubles titles, including Wimbledon (1976), the French Open (1975 &\n'77), and at ATP Masters Series events in Cincinnati (1978), Canada (1976, ’77 &\n’81), Monte Carlo (1979), Paris (1977), and Rome (1974, ’75, ’76 & ’77). He won the\nWCT World Doubles twice in 1975 and 1980. He won the men's singles in the Ojai\nTennis Tournament in 1971.[2]\nHe played tournaments of the two world tennis circuits played at the time, the Grand\nPrix tennis circuit and the World Championship Tennis (WCT). These circuits were\npredecessors of the Association of Tennis Professionals Tour (ATP Tour). In 1975 he\nwon the Grand Prix, the present day equivalent of the Race.\nGrand Slam tournament finals [edit]\nDoubles finals, 7 (3 titles, 4 runners-up) [edit]\nDonateCreate accountLog in",
      "ResultYearChampionshipSurface Partner Opponents Score\nWin1975French OpenClay\n  Brian Gottfried\n John Alexander\n Phil Dent6–4, 2–6, 6–2, 6–4"
    ],
    "retrieved_context": "| Result   |   No. |   Year | Tournament                  | Surface   | Partner         | Opponents                             | Score                   |\n|:---------|------:|-------:|:----------------------------|:----------|:----------------|:--------------------------------------|:------------------------|\n| Win      |    16 |   1975 | French Open, Paris          | Clay      | Brian Gottfried | John Alexander Phil Dent              | 6–4, 2–6, 6–2, 6–4      |"
  },
  {
    "id": "qa_134_002",
    "source": "7c9914edb06d045afdde4c05e6dfef0d.pdf",
    "page_numbers": [
      4
    ],
    "table_idx": 0,
    "question": "In what year did Raúl Ramírez and Brian Gottfried lose the French Open final, and who were their opponents and what was the score?",
    "answer": "In 1976, Raúl Ramírez and Brian Gottfried lost in the French Open final to Fred McNair and Sherwood Stewart. The score was 6–7, 3–6, 1–6.",
    "retrieved_chunks": [
      "ResultYearChampionshipSurface Partner Opponents Score\nWin1975French OpenClay\n  Brian Gottfried\n John Alexander\n Phil Dent6–4, 2–6, 6–2, 6–4\nLoss1976French OpenClay\n  Brian Gottfried\n Fred McNair\n Sherwood\nStewart6–7, 3–6, 1–6"
    ],
    "retrieved_context": "| Result   |   No. |   Year | Tournament                  | Surface   | Partner         | Opponents                             | Score                   |\n|:---------|------:|-------:|:----------------------------|:----------|:----------------|:--------------------------------------|:------------------------|\n| Loss     |    13 |   1976 | French Open, Paris          | Clay      | Brian Gottfried | Fred McNair Sherwood Stewart          | 6–7, 3–6, 1–6           |"
  },
  {
    "id": "qa_134_003",
    "source": "7c9914edb06d045afdde4c05e6dfef0d.pdf",
    "page_numbers": [
      4
    ],
    "table_idx": 0,
    "question": "According to the table, who was Raúl Ramírez's partner when he won Wimbledon in 1976, and what was the result against their opponents?",
    "answer": "Raúl Ramírez won Wimbledon in 1976 with Brian Gottfried as his partner, defeating Ross Case and Geoff Masters with a score of 3–6, 6–3, 8–6, 2–6, 7–5.",
    "retrieved_chunks": [
      "ResultYearChampionshipSurface Partner Opponents Score\nWin1976Wimbledon Grass\n  Brian Gottfried\n Ross Case\n Geoff Masters3–6, 6–3, 8–6, 2–6,\n7–5"
    ],
    "retrieved_context": "| Result   |   No. |   Year | Tournament                  | Surface   | Partner         | Opponents                             | Score                   |\n|:---------|------:|-------:|:----------------------------|:----------|:----------------|:--------------------------------------|:------------------------|\n| Win      |    28 |   1976 | Wimbledon, London           | Grass     | Brian Gottfried | Ross Case Geoff Masters               | 3–6, 6–3, 8–6, 2–6, 7–5 |"
  },
  {
    "id": "qa_134_004",
    "source": "7c9914edb06d045afdde4c05e6dfef0d.pdf",
    "page_numbers": [
      3
    ],
    "table_idx": 0,
    "question": "What was the result and score when Raúl Ramírez partnered with Brian Gottfried against Ross Case and Geoff Masters in Los Angeles, U.S. during 1974, and what was the surface?",
    "answer": "In 1974, Raúl Ramírez and Brian Gottfried lost to Ross Case and Geoff Masters at Los Angeles, U.S. The surface was Hard, and the score was 3–6, 2–6.",
    "retrieved_chunks": [
      "Win3.1973New Delhi, India Outdoor\n Jim McManus\n Anand Amritraj\n Vijay Amritraj6–2, 6–4\nWin4.1974Toronto WCT, CanadaCarpet\n  Tony Roche\n Tom Okker\n Marty Riessen6–3, 2–6, 6–4\nWin5.1974Charlotte, U.S. Clay\n  Buster Mottram\n Owen Davidson\n John Newcombe6–3, 1–6, 6–3\nLoss2.1974Hamburg, GermanyClay\n  Brian Gottfried\n Jürgen\nFassbender\n Hans-Jürgen\nPohmann3–6, 4–6, 4–6\nWin6.1974Rome, Italy Clay\n  Brian Gottfried\n Juan Gisbert, Sr.\n Ilie Năstase6–3, 6–2, 6–3\nLoss3.1974Chicago, U.S. Carpet\n  Brian Gottfried\n Tom Gorman\n Marty Riessen6–4, 3–6, 5–7\nWin7.1974South Orange, U.S.Hard\n  Brian Gottfried\n Anand Amritraj\n Vijay Amritraj7–6, 6–7, 7–6\nLoss4.1974Los Angeles, U.S. Hard\n  Brian Gottfried\n Ross Case\n Geoff Masters3–6, 2–6"
    ],
    "retrieved_context": "| Result   |   No. |   Year | Tournament                  | Surface   | Partner         | Opponents                             | Score                   |\n|:---------|------:|-------:|:----------------------------|:----------|:----------------|:--------------------------------------|:------------------------|\n| Loss     |     4 |   1974 | Los Angeles, U.S.           | Hard      | Brian Gottfried | Ross Case Geoff Masters               | 3–6, 2–6                |"
  },
  {
    "id": "qa_134_005",
    "source": "7c9914edb06d045afdde4c05e6dfef0d.pdf",
    "page_numbers": [
      3,
      4
    ],
    "table_idx": 0,
    "question": "When did Raúl Ramírez achieve his highest ranking in both singles and doubles, and did he win Wimbledon in the same year? If so, who was his partner and who did they defeat?",
    "answer": "Raúl Ramírez achieved his highest ranking of No. 4 in singles on 7 November 1976 and No. 1 in doubles on 12 April 1976. In 1976, he partnered with Brian Gottfried to win Wimbledon, defeating Ross Case and Geoff Masters.",
    "retrieved_chunks": [
      "Raúl Ramírez\n 21 languages\nArticleTalk ReadEditView historyTools\nRaúl Ramírez\nFull nameRaúl Carlos Ramírez\nCountry (sports)\n Mexico\nResidenceEnsenada, Baja California,\nMexico\nBorn 20 June 1953 (age 71)\nEnsenada, Baja California,\nMexico\nHeight 1.82 m (6 ft 0 in)\nTurned pro1973 (amateur tour from 1970)\nRetired 1983\nPlays Right-handed (one-handed\nbackhand)\nPrize money$2,217,971\nSingles\nCareer record544–268\nCareer titles19\nHighest rankingNo. 4 (7 November 1976)\nGrand Slam singles results\nFrench OpenSF (1976, 1977)\nWimbledonSF (1976)\nUS Open QF (1978)\nOther tournaments\nTour FinalsSF (1974)\nWCT FinalsQF (1975, 1976, 1978)\nDoubles\nCareer record583–194\nCareer titles60\nHighest rankingNo. 1 (12 April 1976)\nGrand Slam doubles results\nFrench OpenW (1975, 1977)\nWimbledonW (1976)\nUS Open F (1977)From Wikipedia, the free encyclopedia\nFor other people named Raúl Ramírez, see Raúl Ramírez (disambiguation).\nRaúl Ramírez (born 20 June 1953) is a Mexican former professional tennis player.\nHe was active during the 1970s and 1980s. Ramírez was the first player to finish\nfirst in both singles and doubles Grand Prix point standings, accomplishing the feat\nin 1976. He attended and played tennis at the University of Southern California in\nLos Angeles.[1]\nPersonal life [edit]\nRamírez was born in Ensenada, Baja California. In 1981, he married the\nVenezuelan-born former Miss Universe Maritza Sayalero. The couple lives in\nEnsenada and have three children: Rebecca (born 1982), Raúl (born 1984), and\nDaniel Francisco (1989).\nCareer [edit]\nRamirez was ranked as high as World No. 4 (achieving this ranking on 7 November\n1976) and he is one of the all-time leading doubles winners, having spent 62 weeks\nranked World No. 1 in doubles, beginning 12 April 1976. He won 19 singles titles,\nincluding titles at the ATP Masters Series events in Rome (1975) and Monte Carlo\n(1978).\nHe won 60 doubles titles, including Wimbledon (1976), the French Open (1975 &\n'77), and at ATP Masters Series events in Cincinnati (1978), Canada (1976, ’77 &\n’81), Monte Carlo (1979), Paris (1977), and Rome (1974, ’75, ’76 & ’77). He won the\nWCT World Doubles twice in 1975 and 1980. He won the men's singles in the Ojai\nTennis Tournament in 1971.[2]\nHe played tournaments of the two world tennis circuits played at the time, the Grand\nPrix tennis circuit and the World Championship Tennis (WCT). These circuits were\npredecessors of the Association of Tennis Professionals Tour (ATP Tour). In 1975 he\nwon the Grand Prix, the present day equivalent of the Race.\nGrand Slam tournament finals [edit]\nDoubles finals, 7 (3 titles, 4 runners-up) [edit]\nDonateCreate accountLog in",
      "ResultYearChampionshipSurface Partner Opponents Score\nWin1976Wimbledon Grass\n  Brian Gottfried\n Ross Case\n Geoff Masters3–6, 6–3, 8–6, 2–6,\n7–5"
    ],
    "retrieved_context": "| Result   |   No. |   Year | Tournament                  | Surface   | Partner         | Opponents                             | Score                   |\n|:---------|------:|-------:|:----------------------------|:----------|:----------------|:--------------------------------------|:------------------------|\n| Win      |    28 |   1976 | Wimbledon, London           | Grass     | Brian Gottfried | Ross Case Geoff Masters               | 3–6, 6–3, 8–6, 2–6, 7–5 |"
  },
  {
    "id": "qa_139_001",
    "source": "7c9914edb06d045afdde4c05e6dfef0d.pdf",
    "page_numbers": [
      6,
      7
    ],
    "table_idx": 0,
    "question": "In what year did Raúl Ramírez and Brian Gottfried win the Barcelona, Spain tournament, what was the surface, and who did they beat in the final?",
    "answer": "In 1976, Raúl Ramírez partnered with Brian Gottfried to win the Barcelona, Spain tournament on clay against Bob Hewitt and Frew McMillan with a score of 7-6, 6-4.",
    "retrieved_chunks": [
      "Raúl Ramírez\n 21 languages\nArticleTalk ReadEditView historyTools\nRaúl Ramírez\nFull nameRaúl Carlos Ramírez\nCountry (sports)\n Mexico\nResidenceEnsenada, Baja California,\nMexico\nBorn 20 June 1953 (age 71)\nEnsenada, Baja California,\nMexico\nHeight 1.82 m (6 ft 0 in)\nTurned pro1973 (amateur tour from 1970)\nRetired 1983\nPlays Right-handed (one-handed\nbackhand)\nPrize money$2,217,971\nSingles\nCareer record544–268\nCareer titles19\nHighest rankingNo. 4 (7 November 1976)\nGrand Slam singles results\nFrench OpenSF (1976, 1977)\nWimbledonSF (1976)\nUS Open QF (1978)\nOther tournaments\nTour FinalsSF (1974)\nWCT FinalsQF (1975, 1976, 1978)\nDoubles\nCareer record583–194\nCareer titles60\nHighest rankingNo. 1 (12 April 1976)\nGrand Slam doubles results\nFrench OpenW (1975, 1977)\nWimbledonW (1976)\nUS Open F (1977)From Wikipedia, the free encyclopedia\nFor other people named Raúl Ramírez, see Raúl Ramírez (disambiguation).\nRaúl Ramírez (born 20 June 1953) is a Mexican former professional tennis player.\nHe was active during the 1970s and 1980s. Ramírez was the first player to finish\nfirst in both singles and doubles Grand Prix point standings, accomplishing the feat\nin 1976. He attended and played tennis at the University of Southern California in\nLos Angeles.[1]\nPersonal life [edit]\nRamírez was born in Ensenada, Baja California. In 1981, he married the\nVenezuelan-born former Miss Universe Maritza Sayalero. The couple lives in\nEnsenada and have three children: Rebecca (born 1982), Raúl (born 1984), and\nDaniel Francisco (1989).\nCareer [edit]\nRamirez was ranked as high as World No. 4 (achieving this ranking on 7 November\n1976) and he is one of the all-time leading doubles winners, having spent 62 weeks\nranked World No. 1 in doubles, beginning 12 April 1976. He won 19 singles titles,\nincluding titles at the ATP Masters Series events in Rome (1975) and Monte Carlo\n(1978).\nHe won 60 doubles titles, including Wimbledon (1976), the French Open (1975 &\n'77), and at ATP Masters Series events in Cincinnati (1978), Canada (1976, ’77 &\n’81), Monte Carlo (1979), Paris (1977), and Rome (1974, ’75, ’76 & ’77). He won the\nWCT World Doubles twice in 1975 and 1980. He won the men's singles in the Ojai\nTennis Tournament in 1971.[2]\nHe played tournaments of the two world tennis circuits played at the time, the Grand\nPrix tennis circuit and the World Championship Tennis (WCT). These circuits were\npredecessors of the Association of Tennis Professionals Tour (ATP Tour). In 1975 he\nwon the Grand Prix, the present day equivalent of the Race.\nGrand Slam tournament finals [edit]\nDoubles finals, 7 (3 titles, 4 runners-up) [edit]\nDonateCreate accountLog in"
    ],
    "retrieved_context": "| Result   |    |   Year | Tournament                   | Surface   |                 | Stewart                          |                         |\n|:---------|---:|-------:|:-----------------------------|:----------|:----------------|:---------------------------------|:------------------------|\n| Win      | 36 |   1976 | Barcelona, Spain             | Clay      | Brian Gottfried | Bob Hewitt Frew McMillan         | 7–6, 6–4                |"
  },
  {
    "id": "qa_139_002",
    "source": "7c9914edb06d045afdde4c05e6dfef0d.pdf",
    "page_numbers": [
      6,
      7
    ],
    "table_idx": 0,
    "question": "In what year did Raúl Ramírez and Brian Gottfried win the French Open in Paris, what was the surface, and who were their opponents?",
    "answer": "In 1977, Raúl Ramírez and Brian Gottfried won the French Open in Paris on Clay against Wojciech Fibak and Jan Kodeš with a score of 7–6, 4–6, 6–3, 6–4.",
    "retrieved_chunks": [
      "Raúl Ramírez\n 21 languages\nArticleTalk ReadEditView historyTools\nRaúl Ramírez\nFull nameRaúl Carlos Ramírez\nCountry (sports)\n Mexico\nResidenceEnsenada, Baja California,\nMexico\nBorn 20 June 1953 (age 71)\nEnsenada, Baja California,\nMexico\nHeight 1.82 m (6 ft 0 in)\nTurned pro1973 (amateur tour from 1970)\nRetired 1983\nPlays Right-handed (one-handed\nbackhand)\nPrize money$2,217,971\nSingles\nCareer record544–268\nCareer titles19\nHighest rankingNo. 4 (7 November 1976)\nGrand Slam singles results\nFrench OpenSF (1976, 1977)\nWimbledonSF (1976)\nUS Open QF (1978)\nOther tournaments\nTour FinalsSF (1974)\nWCT FinalsQF (1975, 1976, 1978)\nDoubles\nCareer record583–194\nCareer titles60\nHighest rankingNo. 1 (12 April 1976)\nGrand Slam doubles results\nFrench OpenW (1975, 1977)\nWimbledonW (1976)\nUS Open F (1977)From Wikipedia, the free encyclopedia\nFor other people named Raúl Ramírez, see Raúl Ramírez (disambiguation).\nRaúl Ramírez (born 20 June 1953) is a Mexican former professional tennis player.\nHe was active during the 1970s and 1980s. Ramírez was the first player to finish\nfirst in both singles and doubles Grand Prix point standings, accomplishing the feat\nin 1976. He attended and played tennis at the University of Southern California in\nLos Angeles.[1]\nPersonal life [edit]\nRamírez was born in Ensenada, Baja California. In 1981, he married the\nVenezuelan-born former Miss Universe Maritza Sayalero. The couple lives in\nEnsenada and have three children: Rebecca (born 1982), Raúl (born 1984), and\nDaniel Francisco (1989).\nCareer [edit]\nRamirez was ranked as high as World No. 4 (achieving this ranking on 7 November\n1976) and he is one of the all-time leading doubles winners, having spent 62 weeks\nranked World No. 1 in doubles, beginning 12 April 1976. He won 19 singles titles,\nincluding titles at the ATP Masters Series events in Rome (1975) and Monte Carlo\n(1978).\nHe won 60 doubles titles, including Wimbledon (1976), the French Open (1975 &\n'77), and at ATP Masters Series events in Cincinnati (1978), Canada (1976, ’77 &\n’81), Monte Carlo (1979), Paris (1977), and Rome (1974, ’75, ’76 & ’77). He won the\nWCT World Doubles twice in 1975 and 1980. He won the men's singles in the Ojai\nTennis Tournament in 1971.[2]\nHe played tournaments of the two world tennis circuits played at the time, the Grand\nPrix tennis circuit and the World Championship Tennis (WCT). These circuits were\npredecessors of the Association of Tennis Professionals Tour (ATP Tour). In 1975 he\nwon the Grand Prix, the present day equivalent of the Race.\nGrand Slam tournament finals [edit]\nDoubles finals, 7 (3 titles, 4 runners-up) [edit]\nDonateCreate accountLog in"
    ],
    "retrieved_context": "| Result   |    |   Year | Tournament                   | Surface   |                 | Stewart                          |                         |\n|:---------|---:|-------:|:-----------------------------|:----------|:----------------|:---------------------------------|:------------------------|\n| Win      | 39 |   1977 | French Open, Paris           | Clay      | Brian Gottfried | Wojciech Fibak Jan Kodeš         | 7–6, 4–6, 6–3, 6–4      |"
  },
  {
    "id": "qa_139_003",
    "source": "7c9914edb06d045afdde4c05e6dfef0d.pdf",
    "page_numbers": [
      6,
      7
    ],
    "table_idx": 0,
    "question": "In what year did Raúl Ramírez and Brian Gottfried lose the U.S. Open in New York, what was the surface, and who were their opponents?",
    "answer": "In 1977, Raúl Ramírez and Brian Gottfried lost the U.S. Open in New York on Clay against Bob Hewitt and Frew McMillan with a score of 4-6, 0-6.",
    "retrieved_chunks": [
      "Raúl Ramírez\n 21 languages\nArticleTalk ReadEditView historyTools\nRaúl Ramírez\nFull nameRaúl Carlos Ramírez\nCountry (sports)\n Mexico\nResidenceEnsenada, Baja California,\nMexico\nBorn 20 June 1953 (age 71)\nEnsenada, Baja California,\nMexico\nHeight 1.82 m (6 ft 0 in)\nTurned pro1973 (amateur tour from 1970)\nRetired 1983\nPlays Right-handed (one-handed\nbackhand)\nPrize money$2,217,971\nSingles\nCareer record544–268\nCareer titles19\nHighest rankingNo. 4 (7 November 1976)\nGrand Slam singles results\nFrench OpenSF (1976, 1977)\nWimbledonSF (1976)\nUS Open QF (1978)\nOther tournaments\nTour FinalsSF (1974)\nWCT FinalsQF (1975, 1976, 1978)\nDoubles\nCareer record583–194\nCareer titles60\nHighest rankingNo. 1 (12 April 1976)\nGrand Slam doubles results\nFrench OpenW (1975, 1977)\nWimbledonW (1976)\nUS Open F (1977)From Wikipedia, the free encyclopedia\nFor other people named Raúl Ramírez, see Raúl Ramírez (disambiguation).\nRaúl Ramírez (born 20 June 1953) is a Mexican former professional tennis player.\nHe was active during the 1970s and 1980s. Ramírez was the first player to finish\nfirst in both singles and doubles Grand Prix point standings, accomplishing the feat\nin 1976. He attended and played tennis at the University of Southern California in\nLos Angeles.[1]\nPersonal life [edit]\nRamírez was born in Ensenada, Baja California. In 1981, he married the\nVenezuelan-born former Miss Universe Maritza Sayalero. The couple lives in\nEnsenada and have three children: Rebecca (born 1982), Raúl (born 1984), and\nDaniel Francisco (1989).\nCareer [edit]\nRamirez was ranked as high as World No. 4 (achieving this ranking on 7 November\n1976) and he is one of the all-time leading doubles winners, having spent 62 weeks\nranked World No. 1 in doubles, beginning 12 April 1976. He won 19 singles titles,\nincluding titles at the ATP Masters Series events in Rome (1975) and Monte Carlo\n(1978).\nHe won 60 doubles titles, including Wimbledon (1976), the French Open (1975 &\n'77), and at ATP Masters Series events in Cincinnati (1978), Canada (1976, ’77 &\n’81), Monte Carlo (1979), Paris (1977), and Rome (1974, ’75, ’76 & ’77). He won the\nWCT World Doubles twice in 1975 and 1980. He won the men's singles in the Ojai\nTennis Tournament in 1971.[2]\nHe played tournaments of the two world tennis circuits played at the time, the Grand\nPrix tennis circuit and the World Championship Tennis (WCT). These circuits were\npredecessors of the Association of Tennis Professionals Tour (ATP Tour). In 1975 he\nwon the Grand Prix, the present day equivalent of the Race.\nGrand Slam tournament finals [edit]\nDoubles finals, 7 (3 titles, 4 runners-up) [edit]\nDonateCreate accountLog in"
    ],
    "retrieved_context": "| Result   |    |   Year | Tournament                   | Surface   |                 | Stewart                          |                         |\n|:---------|---:|-------:|:-----------------------------|:----------|:----------------|:---------------------------------|:------------------------|\n| Loss     | 17 |   1977 | U.S. Open, New York          | Clay      | Brian Gottfried | Bob Hewitt Frew McMillan         | 4–6, 0–6                |"
  },
  {
    "id": "qa_139_004",
    "source": "7c9914edb06d045afdde4c05e6dfef0d.pdf",
    "page_numbers": [
      6,
      7
    ],
    "table_idx": 0,
    "question": "According to the table and the additional text, what was Raúl Ramírez's highest singles ranking and when did he achieve it, and how long was he ranked No. 1 in doubles?",
    "answer": "In 1976, Raúl Ramírez achieved his highest singles ranking of No. 4 on November 7th and also spent 62 weeks ranked No. 1 in doubles, beginning April 12th.",
    "retrieved_chunks": [
      "Raúl Ramírez\n 21 languages\nArticleTalk ReadEditView historyTools\nRaúl Ramírez\nFull nameRaúl Carlos Ramírez\nCountry (sports)\n Mexico\nResidenceEnsenada, Baja California,\nMexico\nBorn 20 June 1953 (age 71)\nEnsenada, Baja California,\nMexico\nHeight 1.82 m (6 ft 0 in)\nTurned pro1973 (amateur tour from 1970)\nRetired 1983\nPlays Right-handed (one-handed\nbackhand)\nPrize money$2,217,971\nSingles\nCareer record544–268\nCareer titles19\nHighest rankingNo. 4 (7 November 1976)\nGrand Slam singles results\nFrench OpenSF (1976, 1977)\nWimbledonSF (1976)\nUS Open QF (1978)\nOther tournaments\nTour FinalsSF (1974)\nWCT FinalsQF (1975, 1976, 1978)\nDoubles\nCareer record583–194\nCareer titles60\nHighest rankingNo. 1 (12 April 1976)\nGrand Slam doubles results\nFrench OpenW (1975, 1977)\nWimbledonW (1976)\nUS Open F (1977)From Wikipedia, the free encyclopedia\nFor other people named Raúl Ramírez, see Raúl Ramírez (disambiguation).\nRaúl Ramírez (born 20 June 1953) is a Mexican former professional tennis player.\nHe was active during the 1970s and 1980s. Ramírez was the first player to finish\nfirst in both singles and doubles Grand Prix point standings, accomplishing the feat\nin 1976. He attended and played tennis at the University of Southern California in\nLos Angeles.[1]\nPersonal life [edit]\nRamírez was born in Ensenada, Baja California. In 1981, he married the\nVenezuelan-born former Miss Universe Maritza Sayalero. The couple lives in\nEnsenada and have three children: Rebecca (born 1982), Raúl (born 1984), and\nDaniel Francisco (1989).\nCareer [edit]\nRamirez was ranked as high as World No. 4 (achieving this ranking on 7 November\n1976) and he is one of the all-time leading doubles winners, having spent 62 weeks\nranked World No. 1 in doubles, beginning 12 April 1976. He won 19 singles titles,\nincluding titles at the ATP Masters Series events in Rome (1975) and Monte Carlo\n(1978).\nHe won 60 doubles titles, including Wimbledon (1976), the French Open (1975 &\n'77), and at ATP Masters Series events in Cincinnati (1978), Canada (1976, ’77 &\n’81), Monte Carlo (1979), Paris (1977), and Rome (1974, ’75, ’76 & ’77). He won the\nWCT World Doubles twice in 1975 and 1980. He won the men's singles in the Ojai\nTennis Tournament in 1971.[2]\nHe played tournaments of the two world tennis circuits played at the time, the Grand\nPrix tennis circuit and the World Championship Tennis (WCT). These circuits were\npredecessors of the Association of Tennis Professionals Tour (ATP Tour). In 1975 he\nwon the Grand Prix, the present day equivalent of the Race.\nGrand Slam tournament finals [edit]\nDoubles finals, 7 (3 titles, 4 runners-up) [edit]\nDonateCreate accountLog in"
    ],
    "retrieved_context": "| Result   |    |   Year | Tournament                   | Surface   |                 | Stewart                          |                         |\n|:---------|---:|-------:|:-----------------------------|:----------|:----------------|:---------------------------------|:------------------------|\n| Win      | 32 |   1976 | Montreal, Canada             | Hard      | Bob Hewitt      | Juan Gisbert, Sr. Manuel Orantes | 6–2, 6–1                |\n| Win      | 33 |   1976 | Woodlands Doubles, U.S.      | Hard      | Brian Gottfried | Phil Dent Allan Stone            | 6–1, 6–4, 5–7, 7–6      |\n| Win      | 34 |   1976 | Tehran, Iran                 | Clay      | Wojciech Fibak  | Juan Gisbert, Sr. Manuel Orantes | 7–5, 6–1                |\n| Win      | 35 |   1976 | Madrid, Spain                | Clay      | Wojciech Fibak  | Bob Hewitt Frew McMillan         | 4–6, 7–5, 6–3           |\n| Win      | 36 |   1976 | Barcelona, Spain             | Clay      | Brian Gottfried | Bob Hewitt Frew McMillan         | 7–6, 6–4                |\n| Loss     | 14 |   1976 | Vienna, Austria              | Hard (i)  | Brian Gottfried | Bob Hewitt Frew McMillan         | 4–6, 0–4, ret.          |"
  },
  {
    "id": "qa_139_005",
    "source": "7c9914edb06d045afdde4c05e6dfef0d.pdf",
    "page_numbers": [
      6,
      7
    ],
    "table_idx": 0,
    "question": "In what year did Raúl Ramírez and Brian Gottfried win the Rome, Italy tournament, what was the surface, and who did they defeat in the final?",
    "answer": "In 1977, Raúl Ramírez and Brian Gottfried won the Rome, Italy tournament on Clay against Fred McNair and Sherwood Stewart with a score of 6-7, 7-6, 7-5.",
    "retrieved_chunks": [
      "Raúl Ramírez\n 21 languages\nArticleTalk ReadEditView historyTools\nRaúl Ramírez\nFull nameRaúl Carlos Ramírez\nCountry (sports)\n Mexico\nResidenceEnsenada, Baja California,\nMexico\nBorn 20 June 1953 (age 71)\nEnsenada, Baja California,\nMexico\nHeight 1.82 m (6 ft 0 in)\nTurned pro1973 (amateur tour from 1970)\nRetired 1983\nPlays Right-handed (one-handed\nbackhand)\nPrize money$2,217,971\nSingles\nCareer record544–268\nCareer titles19\nHighest rankingNo. 4 (7 November 1976)\nGrand Slam singles results\nFrench OpenSF (1976, 1977)\nWimbledonSF (1976)\nUS Open QF (1978)\nOther tournaments\nTour FinalsSF (1974)\nWCT FinalsQF (1975, 1976, 1978)\nDoubles\nCareer record583–194\nCareer titles60\nHighest rankingNo. 1 (12 April 1976)\nGrand Slam doubles results\nFrench OpenW (1975, 1977)\nWimbledonW (1976)\nUS Open F (1977)From Wikipedia, the free encyclopedia\nFor other people named Raúl Ramírez, see Raúl Ramírez (disambiguation).\nRaúl Ramírez (born 20 June 1953) is a Mexican former professional tennis player.\nHe was active during the 1970s and 1980s. Ramírez was the first player to finish\nfirst in both singles and doubles Grand Prix point standings, accomplishing the feat\nin 1976. He attended and played tennis at the University of Southern California in\nLos Angeles.[1]\nPersonal life [edit]\nRamírez was born in Ensenada, Baja California. In 1981, he married the\nVenezuelan-born former Miss Universe Maritza Sayalero. The couple lives in\nEnsenada and have three children: Rebecca (born 1982), Raúl (born 1984), and\nDaniel Francisco (1989).\nCareer [edit]\nRamirez was ranked as high as World No. 4 (achieving this ranking on 7 November\n1976) and he is one of the all-time leading doubles winners, having spent 62 weeks\nranked World No. 1 in doubles, beginning 12 April 1976. He won 19 singles titles,\nincluding titles at the ATP Masters Series events in Rome (1975) and Monte Carlo\n(1978).\nHe won 60 doubles titles, including Wimbledon (1976), the French Open (1975 &\n'77), and at ATP Masters Series events in Cincinnati (1978), Canada (1976, ’77 &\n’81), Monte Carlo (1979), Paris (1977), and Rome (1974, ’75, ’76 & ’77). He won the\nWCT World Doubles twice in 1975 and 1980. He won the men's singles in the Ojai\nTennis Tournament in 1971.[2]\nHe played tournaments of the two world tennis circuits played at the time, the Grand\nPrix tennis circuit and the World Championship Tennis (WCT). These circuits were\npredecessors of the Association of Tennis Professionals Tour (ATP Tour). In 1975 he\nwon the Grand Prix, the present day equivalent of the Race.\nGrand Slam tournament finals [edit]\nDoubles finals, 7 (3 titles, 4 runners-up) [edit]\nDonateCreate accountLog in"
    ],
    "retrieved_context": "| Result   |    |   Year | Tournament                   | Surface   |                 | Stewart                          |                         |\n|:---------|---:|-------:|:-----------------------------|:----------|:----------------|:---------------------------------|:------------------------|\n| Win      | 38 |   1977 | Rome, Italy                  | Clay      | Brian Gottfried | Fred McNair Sherwood Stewart     | 6–7, 7–6, 7–5           |"
  },
  {
    "id": "qa_144_001",
    "source": "7c9914edb06d045afdde4c05e6dfef0d.pdf",
    "page_numbers": [
      9
    ],
    "table_idx": 0,
    "question": "According to the table, what does 'W' stand for?",
    "answer": "The table uses 'W' to denote a winner.",
    "retrieved_chunks": [
      "[show] V · T · EKey\nW F SFQF#RRRQ#DNQANH\n(W) winner; (F) finalist; (SF) semifinalist; (QF) quarterfinalist; (#R) rounds 4, 3, 2, 1; (RR) round-robin stage; (Q#) qualification round; (DNQ) did not\nqualify; (A) absent; (NH) not held; (SR) strike rate (events won / competed); (W–L) win–loss record."
    ],
    "retrieved_context": "| W   | F   | SF   | QF   | #R   | RR   | Q#   | DNQ   | A   | NH   |\n|:----|:----|:-----|:-----|:-----|:-----|:-----|:------|:----|:-----|\n| W   | F   | SF   | QF   | #R   | RR   | Q#   | DNQ   | A   | NH   |"
  },
  {
    "id": "qa_144_002",
    "source": "7c9914edb06d045afdde4c05e6dfef0d.pdf",
    "page_numbers": [
      9
    ],
    "table_idx": 0,
    "question": "What does the letter 'F' represent in the table?",
    "answer": "According to the table, 'F' stands for finalist.",
    "retrieved_chunks": [
      "[show] V · T · EKey\nW F SFQF#RRRQ#DNQANH\n(W) winner; (F) finalist; (SF) semifinalist; (QF) quarterfinalist; (#R) rounds 4, 3, 2, 1; (RR) round-robin stage; (Q#) qualification round; (DNQ) did not\nqualify; (A) absent; (NH) not held; (SR) strike rate (events won / competed); (W–L) win–loss record."
    ],
    "retrieved_context": "| W   | F   | SF   | QF   | #R   | RR   | Q#   | DNQ   | A   | NH   |\n|:----|:----|:-----|:-----|:-----|:-----|:-----|:------|:----|:-----|\n| W   | F   | SF   | QF   | #R   | RR   | Q#   | DNQ   | A   | NH   |"
  },
  {
    "id": "qa_144_003",
    "source": "7c9914edb06d045afdde4c05e6dfef0d.pdf",
    "page_numbers": [
      9
    ],
    "table_idx": 0,
    "question": "What is the meaning of 'SF' as defined in the table?",
    "answer": "The table indicates that 'SF' represents semifinalist.",
    "retrieved_chunks": [
      "[show] V · T · EKey\nW F SFQF#RRRQ#DNQANH\n(W) winner; (F) finalist; (SF) semifinalist; (QF) quarterfinalist; (#R) rounds 4, 3, 2, 1; (RR) round-robin stage; (Q#) qualification round; (DNQ) did not\nqualify; (A) absent; (NH) not held; (SR) strike rate (events won / competed); (W–L) win–loss record."
    ],
    "retrieved_context": "| W   | F   | SF   | QF   | #R   | RR   | Q#   | DNQ   | A   | NH   |\n|:----|:----|:-----|:-----|:-----|:-----|:-----|:------|:----|:-----|\n| W   | F   | SF   | QF   | #R   | RR   | Q#   | DNQ   | A   | NH   |"
  },
  {
    "id": "qa_144_004",
    "source": "7c9914edb06d045afdde4c05e6dfef0d.pdf",
    "page_numbers": [
      9
    ],
    "table_idx": 0,
    "question": "According to the table, what does 'QF' stand for?",
    "answer": "The table shows that 'QF' stands for quarterfinalist.",
    "retrieved_chunks": [
      "[show] V · T · EKey\nW F SFQF#RRRQ#DNQANH\n(W) winner; (F) finalist; (SF) semifinalist; (QF) quarterfinalist; (#R) rounds 4, 3, 2, 1; (RR) round-robin stage; (Q#) qualification round; (DNQ) did not\nqualify; (A) absent; (NH) not held; (SR) strike rate (events won / competed); (W–L) win–loss record."
    ],
    "retrieved_context": "| W   | F   | SF   | QF   | #R   | RR   | Q#   | DNQ   | A   | NH   |\n|:----|:----|:-----|:-----|:-----|:-----|:-----|:------|:----|:-----|\n| W   | F   | SF   | QF   | #R   | RR   | Q#   | DNQ   | A   | NH   |"
  },
  {
    "id": "qa_144_005",
    "source": "7c9914edb06d045afdde4c05e6dfef0d.pdf",
    "page_numbers": [
      9
    ],
    "table_idx": 0,
    "question": "What does '#R' signify in the table?",
    "answer": "The table indicates that '#R' represents rounds 4, 3, 2, 1.",
    "retrieved_chunks": [
      "[show] V · T · EKey\nW F SFQF#RRRQ#DNQANH\n(W) winner; (F) finalist; (SF) semifinalist; (QF) quarterfinalist; (#R) rounds 4, 3, 2, 1; (RR) round-robin stage; (Q#) qualification round; (DNQ) did not\nqualify; (A) absent; (NH) not held; (SR) strike rate (events won / competed); (W–L) win–loss record."
    ],
    "retrieved_context": "| W   | F   | SF   | QF   | #R   | RR   | Q#   | DNQ   | A   | NH   |\n|:----|:----|:-----|:-----|:-----|:-----|:-----|:------|:----|:-----|\n| W   | F   | SF   | QF   | #R   | RR   | Q#   | DNQ   | A   | NH   |"
  },
  {
    "id": "qa_149_001",
    "source": "b71ccc88bc2b964767ab729ecf95940b.pdf",
    "page_numbers": [
      9
    ],
    "table_idx": 0,
    "question": "In the 2014 FIFA U-20 Women's World Cup, when did Canada play Finland, what was the result, which group were they in, and how many spectators were there?",
    "answer": "On August 8, 2014, Canada defeated Finland 3-2 in Group A, with 20195 spectators.",
    "retrieved_chunks": [
      "field will be supplemented by 17,756 temporary seats to bring its capacity to 45,736 for the event, to satisfy\na FIFA requirement.[1] On February 4, 2024, it was revealed that the stadium would host the opening match\nfor Canada on June 12, 2026. In total, the stadium will host six matches, five in the group stage and one in\nthe knockout rounds.[116]\nList of 2026 FIFA World Cup matches [edit]\nDateTime Team #1 Res.Team #2 RoundAttendance\nJune 12, 2026--:--\n  Canada –B2 Group B\nJune 17, 2026--:--TBD –TBD Group L\nJune 20, 2026--:--TBD –TBD Group E\nJune 23, 2026--:--TBD –TBD Group L\nJune 26, 2026--:--TBD –TBD Group I\nJuly 2, 2026--:--Runner-up Group K–Runner-up Group LRound of 32\nNotable friendlies [edit]\nBMO Field has hosted a number of friendly soccer matches.\nDate Winning TeamResultLosing\nTeamTournamentSpectators\nMay 23, 2007\n  Toronto FC0–0\n  Benfica Club friendly 18,730[117]\nJuly 25, 2007\n  Aston Villa4–2\n Toronto\nFCClub friendly 20,147[118]\nAugust 7, 2009\n Real Madrid5–1\n Toronto\nFCClub friendly 22,089[119]\nSeptember 2,\n2009\n Benfica 3–1\n  Celtic Club friendly 12,403[120]\nMay 23, 2010\n Panathinaikos0–0\n  Benfica Club friendly 10,603[121]\nJuly 22, 2010\n Bolton\nWanderers1–1\n(a.e.t.)\n4–3 (p)\n Toronto\nFCClub friendly 19,507[122]\nAugust 7, 2013\n  Roma 4–1\n Toronto\nFCClub friendly 18,274[123]\nJuly 23, 2014\n Tottenham\nHotspur3–2\n Toronto\nFCClub friendly 22,591[124]\nJuly 25, 2014\n  Olympiacos3–0\n  Milan2014 International\nChampions Cup10,603[125]"
    ],
    "retrieved_context": "| Date            | Winning Team   | Result      | Losing Team   | Tournament     | Spectators   |\n|:----------------|:---------------|:------------|:--------------|:---------------|:-------------|\n| August 5, 2014  | Canada         | 0–1         | Ghana         | Group A        |              |\n| August 5, 2014  | Finland        | 1–2         | North Korea   | Group A        |              |\n| August 8, 2014  | Canada         | 3–2         | Finland       | Group A        | 20195.0      |\n| August 8, 2014  | Ghana          | 0–3         | North Korea   | Group A        | 20195.0      |\n| August 13, 2014 | South Korea    | 2–1         | Mexico        | Group C        |              |\n| August 13, 2014 | Costa Rica     | 0–3         | New Zealand   | Group D        |              |\n| August 16, 2014 | North Korea    | 1–1 (3–1 p) | United States | Quarter-finals |              |"
  },
  {
    "id": "qa_149_002",
    "source": "b71ccc88bc2b964767ab729ecf95940b.pdf",
    "page_numbers": [
      9
    ],
    "table_idx": 0,
    "question": "Based on the table, how many games did North Korea play in Group A during the 2014 FIFA U-20 Women's World Cup, and against which teams? Also did they play any other match in the tournament?",
    "answer": "North Korea played two games in Group A during the 2014 FIFA U-20 Women's World Cup. They won against Finland (2-1) and Ghana (3-0). They also played United States in Quarter-finals.",
    "retrieved_chunks": [
      "field will be supplemented by 17,756 temporary seats to bring its capacity to 45,736 for the event, to satisfy\na FIFA requirement.[1] On February 4, 2024, it was revealed that the stadium would host the opening match\nfor Canada on June 12, 2026. In total, the stadium will host six matches, five in the group stage and one in\nthe knockout rounds.[116]\nList of 2026 FIFA World Cup matches [edit]\nDateTime Team #1 Res.Team #2 RoundAttendance\nJune 12, 2026--:--\n  Canada –B2 Group B\nJune 17, 2026--:--TBD –TBD Group L\nJune 20, 2026--:--TBD –TBD Group E\nJune 23, 2026--:--TBD –TBD Group L\nJune 26, 2026--:--TBD –TBD Group I\nJuly 2, 2026--:--Runner-up Group K–Runner-up Group LRound of 32\nNotable friendlies [edit]\nBMO Field has hosted a number of friendly soccer matches.\nDate Winning TeamResultLosing\nTeamTournamentSpectators\nMay 23, 2007\n  Toronto FC0–0\n  Benfica Club friendly 18,730[117]\nJuly 25, 2007\n  Aston Villa4–2\n Toronto\nFCClub friendly 20,147[118]\nAugust 7, 2009\n Real Madrid5–1\n Toronto\nFCClub friendly 22,089[119]\nSeptember 2,\n2009\n Benfica 3–1\n  Celtic Club friendly 12,403[120]\nMay 23, 2010\n Panathinaikos0–0\n  Benfica Club friendly 10,603[121]\nJuly 22, 2010\n Bolton\nWanderers1–1\n(a.e.t.)\n4–3 (p)\n Toronto\nFCClub friendly 19,507[122]\nAugust 7, 2013\n  Roma 4–1\n Toronto\nFCClub friendly 18,274[123]\nJuly 23, 2014\n Tottenham\nHotspur3–2\n Toronto\nFCClub friendly 22,591[124]\nJuly 25, 2014\n  Olympiacos3–0\n  Milan2014 International\nChampions Cup10,603[125]"
    ],
    "retrieved_context": "| Date            | Winning Team   | Result      | Losing Team   | Tournament     | Spectators   |\n|:----------------|:---------------|:------------|:--------------|:---------------|:-------------|\n| August 5, 2014  | Canada         | 0–1         | Ghana         | Group A        |              |\n| August 5, 2014  | Finland        | 1–2         | North Korea   | Group A        |              |\n| August 8, 2014  | Canada         | 3–2         | Finland       | Group A        | 20195.0      |\n| August 8, 2014  | Ghana          | 0–3         | North Korea   | Group A        | 20195.0      |\n| August 13, 2014 | South Korea    | 2–1         | Mexico        | Group C        |              |\n| August 13, 2014 | Costa Rica     | 0–3         | New Zealand   | Group D        |              |\n| August 16, 2014 | North Korea    | 1–1 (3–1 p) | United States | Quarter-finals |              |"
  },
  {
    "id": "qa_149_003",
    "source": "b71ccc88bc2b964767ab729ecf95940b.pdf",
    "page_numbers": [
      9
    ],
    "table_idx": 0,
    "question": "According to the table, how many spectators attended the August 5, 2014, game between Canada and Ghana in Group A?",
    "answer": "The match between Canada and Ghana on August 5, 2014, in Group A did not have spectator numbers listed.",
    "retrieved_chunks": [
      "field will be supplemented by 17,756 temporary seats to bring its capacity to 45,736 for the event, to satisfy\na FIFA requirement.[1] On February 4, 2024, it was revealed that the stadium would host the opening match\nfor Canada on June 12, 2026. In total, the stadium will host six matches, five in the group stage and one in\nthe knockout rounds.[116]\nList of 2026 FIFA World Cup matches [edit]\nDateTime Team #1 Res.Team #2 RoundAttendance\nJune 12, 2026--:--\n  Canada –B2 Group B\nJune 17, 2026--:--TBD –TBD Group L\nJune 20, 2026--:--TBD –TBD Group E\nJune 23, 2026--:--TBD –TBD Group L\nJune 26, 2026--:--TBD –TBD Group I\nJuly 2, 2026--:--Runner-up Group K–Runner-up Group LRound of 32\nNotable friendlies [edit]\nBMO Field has hosted a number of friendly soccer matches.\nDate Winning TeamResultLosing\nTeamTournamentSpectators\nMay 23, 2007\n  Toronto FC0–0\n  Benfica Club friendly 18,730[117]\nJuly 25, 2007\n  Aston Villa4–2\n Toronto\nFCClub friendly 20,147[118]\nAugust 7, 2009\n Real Madrid5–1\n Toronto\nFCClub friendly 22,089[119]\nSeptember 2,\n2009\n Benfica 3–1\n  Celtic Club friendly 12,403[120]\nMay 23, 2010\n Panathinaikos0–0\n  Benfica Club friendly 10,603[121]\nJuly 22, 2010\n Bolton\nWanderers1–1\n(a.e.t.)\n4–3 (p)\n Toronto\nFCClub friendly 19,507[122]\nAugust 7, 2013\n  Roma 4–1\n Toronto\nFCClub friendly 18,274[123]\nJuly 23, 2014\n Tottenham\nHotspur3–2\n Toronto\nFCClub friendly 22,591[124]\nJuly 25, 2014\n  Olympiacos3–0\n  Milan2014 International\nChampions Cup10,603[125]"
    ],
    "retrieved_context": "| Date            | Winning Team   | Result      | Losing Team   | Tournament     | Spectators   |\n|:----------------|:---------------|:------------|:--------------|:---------------|:-------------|\n| August 5, 2014  | Canada         | 0–1         | Ghana         | Group A        |              |\n| August 5, 2014  | Finland        | 1–2         | North Korea   | Group A        |              |\n| August 8, 2014  | Canada         | 3–2         | Finland       | Group A        | 20195.0      |\n| August 8, 2014  | Ghana          | 0–3         | North Korea   | Group A        | 20195.0      |\n| August 13, 2014 | South Korea    | 2–1         | Mexico        | Group C        |              |\n| August 13, 2014 | Costa Rica     | 0–3         | New Zealand   | Group D        |              |\n| August 16, 2014 | North Korea    | 1–1 (3–1 p) | United States | Quarter-finals |              |"
  },
  {
    "id": "qa_149_004",
    "source": "b71ccc88bc2b964767ab729ecf95940b.pdf",
    "page_numbers": [
      9
    ],
    "table_idx": 0,
    "question": "Based on the table, what were the results of the two matches Canada played in the group stage of the 2014 FIFA U-20 Women's World Cup?",
    "answer": "Canada played two matches in the group stage of the 2014 FIFA U-20 Women's World Cup. They lost to Ghana 0-1 and won against Finland 3-2.",
    "retrieved_chunks": [
      "field will be supplemented by 17,756 temporary seats to bring its capacity to 45,736 for the event, to satisfy\na FIFA requirement.[1] On February 4, 2024, it was revealed that the stadium would host the opening match\nfor Canada on June 12, 2026. In total, the stadium will host six matches, five in the group stage and one in\nthe knockout rounds.[116]\nList of 2026 FIFA World Cup matches [edit]\nDateTime Team #1 Res.Team #2 RoundAttendance\nJune 12, 2026--:--\n  Canada –B2 Group B\nJune 17, 2026--:--TBD –TBD Group L\nJune 20, 2026--:--TBD –TBD Group E\nJune 23, 2026--:--TBD –TBD Group L\nJune 26, 2026--:--TBD –TBD Group I\nJuly 2, 2026--:--Runner-up Group K–Runner-up Group LRound of 32\nNotable friendlies [edit]\nBMO Field has hosted a number of friendly soccer matches.\nDate Winning TeamResultLosing\nTeamTournamentSpectators\nMay 23, 2007\n  Toronto FC0–0\n  Benfica Club friendly 18,730[117]\nJuly 25, 2007\n  Aston Villa4–2\n Toronto\nFCClub friendly 20,147[118]\nAugust 7, 2009\n Real Madrid5–1\n Toronto\nFCClub friendly 22,089[119]\nSeptember 2,\n2009\n Benfica 3–1\n  Celtic Club friendly 12,403[120]\nMay 23, 2010\n Panathinaikos0–0\n  Benfica Club friendly 10,603[121]\nJuly 22, 2010\n Bolton\nWanderers1–1\n(a.e.t.)\n4–3 (p)\n Toronto\nFCClub friendly 19,507[122]\nAugust 7, 2013\n  Roma 4–1\n Toronto\nFCClub friendly 18,274[123]\nJuly 23, 2014\n Tottenham\nHotspur3–2\n Toronto\nFCClub friendly 22,591[124]\nJuly 25, 2014\n  Olympiacos3–0\n  Milan2014 International\nChampions Cup10,603[125]"
    ],
    "retrieved_context": "| Date            | Winning Team   | Result      | Losing Team   | Tournament     | Spectators   |\n|:----------------|:---------------|:------------|:--------------|:---------------|:-------------|\n| August 5, 2014  | Canada         | 0–1         | Ghana         | Group A        |              |\n| August 5, 2014  | Finland        | 1–2         | North Korea   | Group A        |              |\n| August 8, 2014  | Canada         | 3–2         | Finland       | Group A        | 20195.0      |\n| August 8, 2014  | Ghana          | 0–3         | North Korea   | Group A        | 20195.0      |\n| August 13, 2014 | South Korea    | 2–1         | Mexico        | Group C        |              |\n| August 13, 2014 | Costa Rica     | 0–3         | New Zealand   | Group D        |              |\n| August 16, 2014 | North Korea    | 1–1 (3–1 p) | United States | Quarter-finals |              |"
  },
  {
    "id": "qa_149_005",
    "source": "b71ccc88bc2b964767ab729ecf95940b.pdf",
    "page_numbers": [
      9
    ],
    "table_idx": 0,
    "question": "Based on the table, which team won a match in the group stages and also advanced to the quarter-finals in the 2014 FIFA U-20 Women's World Cup?",
    "answer": "In the listed matches of the 2014 FIFA U-20 Women's World Cup, North Korea is the only team that both won a match in group stages and advanced to the quarter-finals.",
    "retrieved_chunks": [
      "field will be supplemented by 17,756 temporary seats to bring its capacity to 45,736 for the event, to satisfy\na FIFA requirement.[1] On February 4, 2024, it was revealed that the stadium would host the opening match\nfor Canada on June 12, 2026. In total, the stadium will host six matches, five in the group stage and one in\nthe knockout rounds.[116]\nList of 2026 FIFA World Cup matches [edit]\nDateTime Team #1 Res.Team #2 RoundAttendance\nJune 12, 2026--:--\n  Canada –B2 Group B\nJune 17, 2026--:--TBD –TBD Group L\nJune 20, 2026--:--TBD –TBD Group E\nJune 23, 2026--:--TBD –TBD Group L\nJune 26, 2026--:--TBD –TBD Group I\nJuly 2, 2026--:--Runner-up Group K–Runner-up Group LRound of 32\nNotable friendlies [edit]\nBMO Field has hosted a number of friendly soccer matches.\nDate Winning TeamResultLosing\nTeamTournamentSpectators\nMay 23, 2007\n  Toronto FC0–0\n  Benfica Club friendly 18,730[117]\nJuly 25, 2007\n  Aston Villa4–2\n Toronto\nFCClub friendly 20,147[118]\nAugust 7, 2009\n Real Madrid5–1\n Toronto\nFCClub friendly 22,089[119]\nSeptember 2,\n2009\n Benfica 3–1\n  Celtic Club friendly 12,403[120]\nMay 23, 2010\n Panathinaikos0–0\n  Benfica Club friendly 10,603[121]\nJuly 22, 2010\n Bolton\nWanderers1–1\n(a.e.t.)\n4–3 (p)\n Toronto\nFCClub friendly 19,507[122]\nAugust 7, 2013\n  Roma 4–1\n Toronto\nFCClub friendly 18,274[123]\nJuly 23, 2014\n Tottenham\nHotspur3–2\n Toronto\nFCClub friendly 22,591[124]\nJuly 25, 2014\n  Olympiacos3–0\n  Milan2014 International\nChampions Cup10,603[125]"
    ],
    "retrieved_context": "| Date            | Winning Team   | Result      | Losing Team   | Tournament     | Spectators   |\n|:----------------|:---------------|:------------|:--------------|:---------------|:-------------|\n| August 5, 2014  | Canada         | 0–1         | Ghana         | Group A        |              |\n| August 5, 2014  | Finland        | 1–2         | North Korea   | Group A        |              |\n| August 8, 2014  | Canada         | 3–2         | Finland       | Group A        | 20195.0      |\n| August 8, 2014  | Ghana          | 0–3         | North Korea   | Group A        | 20195.0      |\n| August 13, 2014 | South Korea    | 2–1         | Mexico        | Group C        |              |\n| August 13, 2014 | Costa Rica     | 0–3         | New Zealand   | Group D        |              |\n| August 16, 2014 | North Korea    | 1–1 (3–1 p) | United States | Quarter-finals |              |"
  },
  {
    "id": "qa_791_001",
    "source": "b71ccc88bc2b964767ab729ecf95940b.pdf",
    "page_numbers": [
      9
    ],
    "table_idx": 0,
    "question": "What was the spectator count for the matches in Group B on July 14, 2015, and how does it compare to the average MLS attendance at BMO Field in 2016?",
    "answer": "Both matches on July 14, 2015, in Group B had 16,674 spectators. This attendance is lower than the average MLS attendance at BMO Field in 2016, which was 26,787.",
    "retrieved_chunks": [
      "MLS [edit]\nSeasonSeason\naverageHighest\ngateLowest\ngate\n200720,13020,52219,123\n200820,12020,46119,657\n200920,34420,90219,843\n201020,45322,10818,394\n201120,26722,45316,313\n201218,68120,07114,623\n201317,63921,70012,627\n201422,08622,59118,269\n201523,45130,22616,382\n201626,78736,04520,011\n201727,39430,58415,175\n201826,62830,79914,823\n201925,04828,98922,651\n2020 26,1711\n20218,422213,1445,026\n202225,42329,13020,809\n202325,31027,89220,701\nNotes:\n1 One Toronto FC home match played at BMO Field before season postponed, moved, and condensed, due\nto COVID-19 pandemic.\n2 Limited capacity for regular season home matches after Match 13 due to COVID-19 pandemic.",
      "| Date          | Winning Team   | Result   | Losing Team   | Tournament   |   Spectators |\n|:--------------|:---------------|:---------|:--------------|:-------------|-------------:|\n| July 14, 2015 | Jamaica        | 1–0      | El Salvador   | Group B      |        16674 |\n| July 14, 2015 | Canada         | 0–0      | Costa Rica    | Group B      |        16674 |"
    ],
    "retrieved_context": "| Date          | Winning Team   | Result   | Losing Team   | Tournament   |   Spectators |\n|:--------------|:---------------|:---------|:--------------|:-------------|-------------:|\n| July 14, 2015 | Jamaica        | 1–0      | El Salvador   | Group B      |        16674 |\n| July 14, 2015 | Canada         | 0–0      | Costa Rica    | Group B      |        16674 |"
  },
  {
    "id": "qa_791_002",
    "source": "b71ccc88bc2b964767ab729ecf95940b.pdf",
    "page_numbers": [
      9
    ],
    "table_idx": 0,
    "question": "According to the table, what was the result of the match between Jamaica and El Salvador on July 14, 2015, and in which group did this match take place?",
    "answer": "On July 14, 2015, Jamaica defeated El Salvador with a score of 1-0 in Group B.",
    "retrieved_chunks": [],
    "retrieved_context": "| Date          | Winning Team   | Result   | Losing Team   | Tournament   |   Spectators |\n|:--------------|:---------------|:---------|:--------------|:-------------|-------------:|\n| July 14, 2015 | Jamaica        | 1–0      | El Salvador   | Group B      |        16674 |\n| July 14, 2015 | Canada         | 0–0      | Costa Rica    | Group B      |        16674 |"
  },
  {
    "id": "qa_791_003",
    "source": "b71ccc88bc2b964767ab729ecf95940b.pdf",
    "page_numbers": [
      9
    ],
    "table_idx": 0,
    "question": "What was the outcome of the match between Canada and Costa Rica on July 14, 2015, and which group were they in?",
    "answer": "On July 14, 2015, Canada played against Costa Rica in Group B, resulting in a draw with a score of 0-0.",
    "retrieved_chunks": [],
    "retrieved_context": "| Date          | Winning Team   | Result   | Losing Team   | Tournament   |   Spectators |\n|:--------------|:---------------|:---------|:--------------|:-------------|-------------:|\n| July 14, 2015 | Jamaica        | 1–0      | El Salvador   | Group B      |        16674 |\n| July 14, 2015 | Canada         | 0–0      | Costa Rica    | Group B      |        16674 |"
  },
  {
    "id": "qa_791_004",
    "source": "b71ccc88bc2b964767ab729ecf95940b.pdf",
    "page_numbers": [
      9
    ],
    "table_idx": 0,
    "question": "What is the relationship between the matches played on July 14, 2015, in terms of spectator count?",
    "answer": "The matches between Jamaica and El Salvador, and Canada and Costa Rica, both took place on the same day, July 14, 2015, and had the same number of spectators, 16,674.",
    "retrieved_chunks": [],
    "retrieved_context": "| Date          | Winning Team   | Result   | Losing Team   | Tournament   |   Spectators |\n|:--------------|:---------------|:---------|:--------------|:-------------|-------------:|\n| July 14, 2015 | Jamaica        | 1–0      | El Salvador   | Group B      |        16674 |\n| July 14, 2015 | Canada         | 0–0      | Costa Rica    | Group B      |        16674 |"
  },
  {
    "id": "qa_791_005",
    "source": "b71ccc88bc2b964767ab729ecf95940b.pdf",
    "page_numbers": [
      9
    ],
    "table_idx": 0,
    "question": "How does the spectator count for the Group B matches on July 14, 2015, compare to the lowest MLS gate at BMO Field in 2015?",
    "answer": "The spectator count of 16,674 for the Group B matches on July 14, 2015, is slightly higher than the lowest gate of 16,382 recorded in 2015 for MLS games at BMO Field.",
    "retrieved_chunks": [
      "MLS [edit]\nSeasonSeason\naverageHighest\ngateLowest\ngate\n200720,13020,52219,123\n200820,12020,46119,657\n200920,34420,90219,843\n201020,45322,10818,394\n201120,26722,45316,313\n201218,68120,07114,623\n201317,63921,70012,627\n201422,08622,59118,269\n201523,45130,22616,382\n201626,78736,04520,011\n201727,39430,58415,175\n201826,62830,79914,823\n201925,04828,98922,651\n2020 26,1711\n20218,422213,1445,026\n202225,42329,13020,809\n202325,31027,89220,701\nNotes:\n1 One Toronto FC home match played at BMO Field before season postponed, moved, and condensed, due\nto COVID-19 pandemic.\n2 Limited capacity for regular season home matches after Match 13 due to COVID-19 pandemic.",
      "| Date          | Winning Team   | Result   | Losing Team   | Tournament   |   Spectators |\n|:--------------|:---------------|:---------|:--------------|:-------------|-------------:|\n| July 14, 2015 | Jamaica        | 1–0      | El Salvador   | Group B      |        16674 |\n| July 14, 2015 | Canada         | 0–0      | Costa Rica    | Group B      |        16674 |"
    ],
    "retrieved_context": "| Date          | Winning Team   | Result   | Losing Team   | Tournament   |   Spectators |\n|:--------------|:---------------|:---------|:--------------|:-------------|-------------:|\n| July 14, 2015 | Jamaica        | 1–0      | El Salvador   | Group B      |        16674 |\n| July 14, 2015 | Canada         | 0–0      | Costa Rica    | Group B      |        16674 |"
  },
  {
    "id": "qa_159_001",
    "source": "b71ccc88bc2b964767ab729ecf95940b.pdf",
    "page_numbers": [
      9
    ],
    "table_idx": 0,
    "question": "Which tournament did Tigres UANL and Toronto FC compete in on September 19, 2018?",
    "answer": "The 2018 Campeones Cup.",
    "retrieved_chunks": [
      "BMO Field set up for Canadian\nfootball during the 104th Grey Cup\nThe stadium's pitch set up for a\nrugby game in June 2013.May 27, 2015\n Manchester City1–0\n Toronto\nFCClub friendly 23,169[126]\nJuly 18, 2015\n Paris Saint-\nGermain3–2\n  Benfica2015 International\nChampions Cup17,843[127]\nCanadian football [edit]\nWith the Argonauts moving to the renovated BMO Field beginning\nwith the 2016 CFL season, the team was awarded on October 1,\n2015, the right to host the 104th Grey Cup at the stadium on\nNovember 27, 2016.[128] On June 11, 2016, the Argonauts played\ntheir first game at the stadium, a preseason (exhibition) game; the\nArgos defeated the Hamilton Tiger-Cats 25–16.[129] On June 23, the\nArgos played their first regular season game at BMO Field; the Ti-\nCats defeated the Argos 42–20.[130] Due to the position of the\nstands, each end zone is only 18 yards deep rather than the standard 20 in Canadian football.\nRugby [edit]\nRugby union [edit]\nBMO Field was a home venue for Canada's national rugby union\nteam. From 2011 to 2016, the team has played at the venue\nregularly.[131][132][133]\nDuring the 2015 Pan American Games, BMO Field hosted the rugby\nsevens competition (soccer events took place at Tim Hortons Field\nin Hamilton). Due to PASO sponsorship regulations, the venue was\nreferred to as \"Exhibition Stadium\" during the event.[134]\nDate AwayScoreHomeAttendance\nAugust 6,\n2011United States \n22–\n28\n Canada10,621\nJune 15,\n2012Italy \n25–\n16\n Canada12,220\nJune 15,\n2013Ireland \n40–\n14\n Canada20,396\nAugust 24,\n2013United States \n11–13\n Canada10,207\nNovember 3,\n2013Māori All\nBlacks \n40–\n15\n Canada22,566"
    ],
    "retrieved_context": "| Date               | Winning Team   | Result   | Losing Team   | Tournament         |   Spectators |\n|:-------------------|:---------------|:---------|:--------------|:-------------------|-------------:|\n| September 19, 2018 | Tigres UANL    | 3–1      | Toronto FC    | 2018 Campeones Cup |        14823 |"
  },
  {
    "id": "qa_159_002",
    "source": "b71ccc88bc2b964767ab729ecf95940b.pdf",
    "page_numbers": [
      9
    ],
    "table_idx": 0,
    "question": "What was the result of the September 19, 2018, match between Tigres UANL and Toronto FC?",
    "answer": "Tigres UANL won with a score of 3-1.",
    "retrieved_chunks": [
      "field will be supplemented by 17,756 temporary seats to bring its capacity to 45,736 for the event, to satisfy\na FIFA requirement.[1] On February 4, 2024, it was revealed that the stadium would host the opening match\nfor Canada on June 12, 2026. In total, the stadium will host six matches, five in the group stage and one in\nthe knockout rounds.[116]\nList of 2026 FIFA World Cup matches [edit]\nDateTime Team #1 Res.Team #2 RoundAttendance\nJune 12, 2026--:--\n  Canada –B2 Group B\nJune 17, 2026--:--TBD –TBD Group L\nJune 20, 2026--:--TBD –TBD Group E\nJune 23, 2026--:--TBD –TBD Group L\nJune 26, 2026--:--TBD –TBD Group I\nJuly 2, 2026--:--Runner-up Group K–Runner-up Group LRound of 32\nNotable friendlies [edit]\nBMO Field has hosted a number of friendly soccer matches.\nDate Winning TeamResultLosing\nTeamTournamentSpectators\nMay 23, 2007\n  Toronto FC0–0\n  Benfica Club friendly 18,730[117]\nJuly 25, 2007\n  Aston Villa4–2\n Toronto\nFCClub friendly 20,147[118]\nAugust 7, 2009\n Real Madrid5–1\n Toronto\nFCClub friendly 22,089[119]\nSeptember 2,\n2009\n Benfica 3–1\n  Celtic Club friendly 12,403[120]\nMay 23, 2010\n Panathinaikos0–0\n  Benfica Club friendly 10,603[121]\nJuly 22, 2010\n Bolton\nWanderers1–1\n(a.e.t.)\n4–3 (p)\n Toronto\nFCClub friendly 19,507[122]\nAugust 7, 2013\n  Roma 4–1\n Toronto\nFCClub friendly 18,274[123]\nJuly 23, 2014\n Tottenham\nHotspur3–2\n Toronto\nFCClub friendly 22,591[124]\nJuly 25, 2014\n  Olympiacos3–0\n  Milan2014 International\nChampions Cup10,603[125]"
    ],
    "retrieved_context": "| Date               | Winning Team   | Result   | Losing Team   | Tournament         |   Spectators |\n|:-------------------|:---------------|:---------|:--------------|:-------------------|-------------:|\n| September 19, 2018 | Tigres UANL    | 3–1      | Toronto FC    | 2018 Campeones Cup |        14823 |"
  },
  {
    "id": "qa_159_003",
    "source": "b71ccc88bc2b964767ab729ecf95940b.pdf",
    "page_numbers": [
      9
    ],
    "table_idx": 0,
    "question": "How many spectators attended the 2018 Campeones Cup match between Tigres UANL and Toronto FC?",
    "answer": "14823",
    "retrieved_chunks": [
      "MLS [edit]\nSeasonSeason\naverageHighest\ngateLowest\ngate\n200720,13020,52219,123\n200820,12020,46119,657\n200920,34420,90219,843\n201020,45322,10818,394\n201120,26722,45316,313\n201218,68120,07114,623\n201317,63921,70012,627\n201422,08622,59118,269\n201523,45130,22616,382\n201626,78736,04520,011\n201727,39430,58415,175\n201826,62830,79914,823\n201925,04828,98922,651\n2020 26,1711\n20218,422213,1445,026\n202225,42329,13020,809\n202325,31027,89220,701\nNotes:\n1 One Toronto FC home match played at BMO Field before season postponed, moved, and condensed, due\nto COVID-19 pandemic.\n2 Limited capacity for regular season home matches after Match 13 due to COVID-19 pandemic.\nCFL [edit]\nSeasonSeason\naverageHighest\ngateLowest\ngate\n201616,38033,421112,373\n201713,91324,92911,219\n201814,21118,10410,844"
    ],
    "retrieved_context": "| Date               | Winning Team   | Result   | Losing Team   | Tournament         |   Spectators |\n|:-------------------|:---------------|:---------|:--------------|:-------------------|-------------:|\n| September 19, 2018 | Tigres UANL    | 3–1      | Toronto FC    | 2018 Campeones Cup |        14823 |"
  },
  {
    "id": "qa_159_004",
    "source": "b71ccc88bc2b964767ab729ecf95940b.pdf",
    "page_numbers": [
      9
    ],
    "table_idx": 0,
    "question": "Besides the September 19, 2018, Campeones Cup match, what other matches listed in the document did Toronto FC lose?",
    "answer": "Toronto FC also lost a friendly match against Real Madrid with a score of 5-1 on August 7, 2009, and against Aston Villa with a score of 4-2 on July 25, 2007.",
    "retrieved_chunks": [
      "A game between the New Zealand,\nand Portugal U-20 soccer teams at the\n2007 FIFA U-20 World Cup.On December 9, 2017, BMO Field hosted its second consecutive MLS Cup in 2017: a rematch between\nToronto FC and the Seattle Sounders from the previous edition. This time, Toronto FC defeated Seattle 2–0,\nand became the first MLS team to complete a domestic treble with their win, as well as the first Canadian\nteam to win the MLS Cup.[113]\nOn July 24, 2014, BMO Field hosted the opening match of the 2014 International Champions Cup between\nOlympiacos and A.C. Milan; Olympiacos won the match 3–0.[114]\nOn July 17, 2021, Toronto FC played their first home game at BMO Field since the COVID-19 pandemic\nafter being forced to stay in the United States for the 2020 season and the first half of the 2021 season.\nThey drew 1–1 against Orlando City SC, ironically the team whose stadium they had been previously using.\nOn April 19, 2025, AFC Toronto of the Northern Super League played their inaugural match against Montreal\nRoses FC. Toronto lost 0–1 in front of 14,500 fans.\n2007 FIFA U-20 World Cup [edit]\nBMO Field hosted the 2007 FIFA U-20 World Cup, the first major\ntournament held at the stadium. The stadium saw the Canadian\nUnder-20 squad once. The stadium also saw six knockout stage\ngames including the Final; which was won by Argentina. Due to FIFA\nsponsorship regulations, the venue was referred to as the \"National\nSoccer Stadium\" during the event.\nDate Winning TeamResultLosing TeamTournamentSpectators\nJuly 1, 2007\n  Canada 0–3\n  Chile Group A 20,195\nJuly 2, 2007\n Portugal 2–0\n  New Zealand\nGroup C19,526\n Gambia 0–3\n  Mexico\nJuly 5, 2007\n New Zealand0–1\n  Gambia\n Mexico 2–1\n  Portugal\nJuly 8, 2007\n  Chile 0–0\n  Austria Group A\nJuly 11, 2007\n United States2–1 (a.e.t.)\n Uruguay\nRound of 16\nJuly 12, 2007\n  Argentina 3–1\n  Poland\nJuly 14, 2007\n  Austria 2–1\n  United StatesQuarter-finals\nJuly 19, 2007\n  Chile 0–3\n  ArgentinaSemi-finals"
    ],
    "retrieved_context": "| Date               | Winning Team   | Result   | Losing Team   | Tournament         |   Spectators |\n|:-------------------|:---------------|:---------|:--------------|:-------------------|-------------:|\n| September 19, 2018 | Tigres UANL    | 3–1      | Toronto FC    | 2018 Campeones Cup |        14823 |"
  },
  {
    "id": "qa_159_005",
    "source": "b71ccc88bc2b964767ab729ecf95940b.pdf",
    "page_numbers": [
      9
    ],
    "table_idx": 0,
    "question": "How does the attendance of the Tigres UANL vs Toronto FC match in the 2018 Campeones Cup compare to the attendance of the Paris Saint-Germain vs Benfica friendly match in the 2015 International Champions Cup?",
    "answer": "The match between Tigres UANL and Toronto FC in the 2018 Campeones Cup had 14823 spectators, while the friendly match between Paris Saint-Germain and Benfica in the 2015 International Champions Cup had 17,843 spectators.",
    "retrieved_chunks": [
      "BMO Field set up for Canadian\nfootball during the 104th Grey Cup\nThe stadium's pitch set up for a\nrugby game in June 2013.May 27, 2015\n Manchester City1–0\n Toronto\nFCClub friendly 23,169[126]\nJuly 18, 2015\n Paris Saint-\nGermain3–2\n  Benfica2015 International\nChampions Cup17,843[127]\nCanadian football [edit]\nWith the Argonauts moving to the renovated BMO Field beginning\nwith the 2016 CFL season, the team was awarded on October 1,\n2015, the right to host the 104th Grey Cup at the stadium on\nNovember 27, 2016.[128] On June 11, 2016, the Argonauts played\ntheir first game at the stadium, a preseason (exhibition) game; the\nArgos defeated the Hamilton Tiger-Cats 25–16.[129] On June 23, the\nArgos played their first regular season game at BMO Field; the Ti-\nCats defeated the Argos 42–20.[130] Due to the position of the\nstands, each end zone is only 18 yards deep rather than the standard 20 in Canadian football.\nRugby [edit]\nRugby union [edit]\nBMO Field was a home venue for Canada's national rugby union\nteam. From 2011 to 2016, the team has played at the venue\nregularly.[131][132][133]\nDuring the 2015 Pan American Games, BMO Field hosted the rugby\nsevens competition (soccer events took place at Tim Hortons Field\nin Hamilton). Due to PASO sponsorship regulations, the venue was\nreferred to as \"Exhibition Stadium\" during the event.[134]\nDate AwayScoreHomeAttendance\nAugust 6,\n2011United States \n22–\n28\n Canada10,621\nJune 15,\n2012Italy \n25–\n16\n Canada12,220\nJune 15,\n2013Ireland \n40–\n14\n Canada20,396\nAugust 24,\n2013United States \n11–13\n Canada10,207\nNovember 3,\n2013Māori All\nBlacks \n40–\n15\n Canada22,566"
    ],
    "retrieved_context": "| Date               | Winning Team   | Result   | Losing Team   | Tournament         |   Spectators |\n|:-------------------|:---------------|:---------|:--------------|:-------------------|-------------:|\n| September 19, 2018 | Tigres UANL    | 3–1      | Toronto FC    | 2018 Campeones Cup |        14823 |"
  },
  {
    "id": "qa_427_001",
    "source": "table_extract.pdf",
    "page_numbers": [
      9
    ],
    "table_idx": 0,
    "question": "What was the result of the match between Canada and Guadeloupe on June 27, 2023?",
    "answer": "The match between Canada and Guadeloupe on June 27, 2023, ended in a 2-2 draw.",
    "retrieved_chunks": [],
    "retrieved_context": "| Date          | Winning Team   | Result   | Losing Team   | Tournament   |\n|:--------------|:---------------|:---------|:--------------|:-------------|\n| June 27, 2023 | Canada         | 2–2      | Guadeloupe    | Group D      |"
  },
  {
    "id": "qa_427_002",
    "source": "table_extract.pdf",
    "page_numbers": [
      9
    ],
    "table_idx": 0,
    "question": "In which group did the match between Canada and Guadeloupe take place on June 27, 2023?",
    "answer": "The match between Canada and Guadeloupe on June 27, 2023, took place in Group D.",
    "retrieved_chunks": [],
    "retrieved_context": "| Date          | Winning Team   | Result   | Losing Team   | Tournament   |\n|:--------------|:---------------|:---------|:--------------|:-------------|\n| June 27, 2023 | Canada         | 2–2      | Guadeloupe    | Group D      |"
  },
  {
    "id": "qa_427_003",
    "source": "table_extract.pdf",
    "page_numbers": [
      9
    ],
    "table_idx": 0,
    "question": "Based on the table and the additional text, in which tournament did Canada and Guadeloupe play to a 2-2 draw?",
    "answer": "Canada and Guadeloupe played to a 2-2 draw in the 2023 CONCACAF Gold Cup, as indicated by the table and the 2023 CONCACAF Gold Cup section.",
    "retrieved_chunks": [],
    "retrieved_context": "| Date          | Winning Team   | Result   | Losing Team   | Tournament   |\n|:--------------|:---------------|:---------|:--------------|:-------------|\n| June 27, 2023 | Canada         | 2–2      | Guadeloupe    | Group D      |"
  },
  {
    "id": "qa_427_004",
    "source": "table_extract.pdf",
    "page_numbers": [
      9
    ],
    "table_idx": 0,
    "question": "Which team was the losing team in the match against Canada on June 27, 2023, and what was the result?",
    "answer": "Guadeloupe was the losing team in the match against Canada on June 27, 2023, which ended in a 2-2 draw.",
    "retrieved_chunks": [],
    "retrieved_context": "| Date          | Winning Team   | Result   | Losing Team   | Tournament   |\n|:--------------|:---------------|:---------|:--------------|:-------------|\n| June 27, 2023 | Canada         | 2–2      | Guadeloupe    | Group D      |"
  },
  {
    "id": "qa_427_005",
    "source": "table_extract.pdf",
    "page_numbers": [
      9
    ],
    "table_idx": 0,
    "question": "Considering the table and the 2023 CONCACAF Gold Cup section, what was the attendance at the match between Canada and Guadeloupe on June 27, 2023?",
    "answer": "The match between Canada and Guadeloupe on June 27, 2023, was part of the 2023 CONCACAF Gold Cup and had an attendance of 15,301 as indicated in the 2023 CONCACAF Gold Cup section.",
    "retrieved_chunks": [],
    "retrieved_context": "| Date          | Winning Team   | Result   | Losing Team   | Tournament   |\n|:--------------|:---------------|:---------|:--------------|:-------------|\n| June 27, 2023 | Canada         | 2–2      | Guadeloupe    | Group D      |"
  },
  {
    "id": "qa_427_001",
    "source": "b71ccc88bc2b964767ab729ecf95940b.pdf",
    "page_numbers": [
      10
    ],
    "table_idx": 0,
    "question": "Which group does Canada play in on June 12, 2026, and what is the event for this match?",
    "answer": "The match on June 12, 2026, featuring Canada, is part of Group B in the 2026 FIFA World Cup matches hosted at BMO Field, which will be temporarily renamed to \"Toronto Stadium\" during the event.",
    "retrieved_chunks": [
      "field will be supplemented by 17,756 temporary seats to bring its capacity to 45,736 for the event, to satisfy\na FIFA requirement.[1] On February 4, 2024, it was revealed that the stadium would host the opening match\nfor Canada on June 12, 2026. In total, the stadium will host six matches, five in the group stage and one in\nthe knockout rounds.[116]\nList of 2026 FIFA World Cup matches [edit]\nDateTime Team #1 Res.Team #2 RoundAttendance\nJune 12, 2026--:--\n  Canada –B2 Group B\nJune 17, 2026--:--TBD –TBD Group L\nJune 20, 2026--:--TBD –TBD Group E\nJune 23, 2026--:--TBD –TBD Group L\nJune 26, 2026--:--TBD –TBD Group I\nJuly 2, 2026--:--Runner-up Group K–Runner-up Group LRound of 32\nNotable friendlies [edit]\nBMO Field has hosted a number of friendly soccer matches.\nDate Winning TeamResultLosing\nTeamTournamentSpectators\nMay 23, 2007\n  Toronto FC0–0\n  Benfica Club friendly 18,730[117]\nJuly 25, 2007\n  Aston Villa4–2\n Toronto\nFCClub friendly 20,147[118]\nAugust 7, 2009\n Real Madrid5–1\n Toronto\nFCClub friendly 22,089[119]\nSeptember 2,\n2009\n Benfica 3–1\n  Celtic Club friendly 12,403[120]\nMay 23, 2010\n Panathinaikos0–0\n  Benfica Club friendly 10,603[121]\nJuly 22, 2010\n Bolton\nWanderers1–1\n(a.e.t.)\n4–3 (p)\n Toronto\nFCClub friendly 19,507[122]\nAugust 7, 2013\n  Roma 4–1\n Toronto\nFCClub friendly 18,274[123]\nJuly 23, 2014\n Tottenham\nHotspur3–2\n Toronto\nFCClub friendly 22,591[124]\nJuly 25, 2014\n  Olympiacos3–0\n  Milan2014 International\nChampions Cup10,603[125]"
    ],
    "retrieved_context": "| Date          | Time   | Team #1           | Res.   | Team #2           | Round       | Attendance   |\n|:--------------|:-------|:------------------|:-------|:------------------|:------------|:-------------|\n| June 12, 2026 | --:--  | Canada            | –      | B2                | Group B     |              |\n| June 17, 2026 | --:--  | TBD               | –      | TBD               | Group L     |              |\n| June 20, 2026 | --:--  | TBD               | –      | TBD               | Group E     |              |\n| June 23, 2026 | --:--  | TBD               | –      | TBD               | Group L     |              |\n| June 26, 2026 | --:--  | TBD               | –      | TBD               | Group I     |              |\n| July 2, 2026  | --:--  | Runner-up Group K | –      | Runner-up Group L | Round of 32 |              |"
  },
  {
    "id": "qa_427_002",
    "source": "b71ccc88bc2b964767ab729ecf95940b.pdf",
    "page_numbers": [
      10
    ],
    "table_idx": 0,
    "question": "What round is the match on July 2, 2026, and which teams are playing?",
    "answer": "The match on July 2, 2026, is in the Round of 32 and features Runner-up Group K against Runner-up Group L. BMO Field is set to host several matches during the 2026 FIFA World Cup, and will be temporarily renamed to \"Toronto Stadium\" during the event.",
    "retrieved_chunks": [
      "field will be supplemented by 17,756 temporary seats to bring its capacity to 45,736 for the event, to satisfy\na FIFA requirement.[1] On February 4, 2024, it was revealed that the stadium would host the opening match\nfor Canada on June 12, 2026. In total, the stadium will host six matches, five in the group stage and one in\nthe knockout rounds.[116]\nList of 2026 FIFA World Cup matches [edit]\nDateTime Team #1 Res.Team #2 RoundAttendance\nJune 12, 2026--:--\n  Canada –B2 Group B\nJune 17, 2026--:--TBD –TBD Group L\nJune 20, 2026--:--TBD –TBD Group E\nJune 23, 2026--:--TBD –TBD Group L\nJune 26, 2026--:--TBD –TBD Group I\nJuly 2, 2026--:--Runner-up Group K–Runner-up Group LRound of 32\nNotable friendlies [edit]\nBMO Field has hosted a number of friendly soccer matches.\nDate Winning TeamResultLosing\nTeamTournamentSpectators\nMay 23, 2007\n  Toronto FC0–0\n  Benfica Club friendly 18,730[117]\nJuly 25, 2007\n  Aston Villa4–2\n Toronto\nFCClub friendly 20,147[118]\nAugust 7, 2009\n Real Madrid5–1\n Toronto\nFCClub friendly 22,089[119]\nSeptember 2,\n2009\n Benfica 3–1\n  Celtic Club friendly 12,403[120]\nMay 23, 2010\n Panathinaikos0–0\n  Benfica Club friendly 10,603[121]\nJuly 22, 2010\n Bolton\nWanderers1–1\n(a.e.t.)\n4–3 (p)\n Toronto\nFCClub friendly 19,507[122]\nAugust 7, 2013\n  Roma 4–1\n Toronto\nFCClub friendly 18,274[123]\nJuly 23, 2014\n Tottenham\nHotspur3–2\n Toronto\nFCClub friendly 22,591[124]\nJuly 25, 2014\n  Olympiacos3–0\n  Milan2014 International\nChampions Cup10,603[125]"
    ],
    "retrieved_context": "| Date          | Time   | Team #1           | Res.   | Team #2           | Round       | Attendance   |\n|:--------------|:-------|:------------------|:-------|:------------------|:------------|:-------------|\n| June 12, 2026 | --:--  | Canada            | –      | B2                | Group B     |              |\n| June 17, 2026 | --:--  | TBD               | –      | TBD               | Group L     |              |\n| June 20, 2026 | --:--  | TBD               | –      | TBD               | Group E     |              |\n| June 23, 2026 | --:--  | TBD               | –      | TBD               | Group L     |              |\n| June 26, 2026 | --:--  | TBD               | –      | TBD               | Group I     |              |\n| July 2, 2026  | --:--  | Runner-up Group K | –      | Runner-up Group L | Round of 32 |              |"
  },
  {
    "id": "qa_427_003",
    "source": "b71ccc88bc2b964767ab729ecf95940b.pdf",
    "page_numbers": [
      10
    ],
    "table_idx": 0,
    "question": "Based on the table, how many matches are scheduled at BMO Field during the 2026 FIFA World Cup?",
    "answer": "The table shows six matches scheduled at BMO Field for the 2026 FIFA World Cup. BMO Field is set to host several matches during the 2026 FIFA World Cup, and will be temporarily renamed to \"Toronto Stadium\" during the event.",
    "retrieved_chunks": [
      "field will be supplemented by 17,756 temporary seats to bring its capacity to 45,736 for the event, to satisfy\na FIFA requirement.[1] On February 4, 2024, it was revealed that the stadium would host the opening match\nfor Canada on June 12, 2026. In total, the stadium will host six matches, five in the group stage and one in\nthe knockout rounds.[116]\nList of 2026 FIFA World Cup matches [edit]\nDateTime Team #1 Res.Team #2 RoundAttendance\nJune 12, 2026--:--\n  Canada –B2 Group B\nJune 17, 2026--:--TBD –TBD Group L\nJune 20, 2026--:--TBD –TBD Group E\nJune 23, 2026--:--TBD –TBD Group L\nJune 26, 2026--:--TBD –TBD Group I\nJuly 2, 2026--:--Runner-up Group K–Runner-up Group LRound of 32\nNotable friendlies [edit]\nBMO Field has hosted a number of friendly soccer matches.\nDate Winning TeamResultLosing\nTeamTournamentSpectators\nMay 23, 2007\n  Toronto FC0–0\n  Benfica Club friendly 18,730[117]\nJuly 25, 2007\n  Aston Villa4–2\n Toronto\nFCClub friendly 20,147[118]\nAugust 7, 2009\n Real Madrid5–1\n Toronto\nFCClub friendly 22,089[119]\nSeptember 2,\n2009\n Benfica 3–1\n  Celtic Club friendly 12,403[120]\nMay 23, 2010\n Panathinaikos0–0\n  Benfica Club friendly 10,603[121]\nJuly 22, 2010\n Bolton\nWanderers1–1\n(a.e.t.)\n4–3 (p)\n Toronto\nFCClub friendly 19,507[122]\nAugust 7, 2013\n  Roma 4–1\n Toronto\nFCClub friendly 18,274[123]\nJuly 23, 2014\n Tottenham\nHotspur3–2\n Toronto\nFCClub friendly 22,591[124]\nJuly 25, 2014\n  Olympiacos3–0\n  Milan2014 International\nChampions Cup10,603[125]"
    ],
    "retrieved_context": "| Date          | Time   | Team #1           | Res.   | Team #2           | Round       | Attendance   |\n|:--------------|:-------|:------------------|:-------|:------------------|:------------|:-------------|\n| June 12, 2026 | --:--  | Canada            | –      | B2                | Group B     |              |\n| June 17, 2026 | --:--  | TBD               | –      | TBD               | Group L     |              |\n| June 20, 2026 | --:--  | TBD               | –      | TBD               | Group E     |              |\n| June 23, 2026 | --:--  | TBD               | –      | TBD               | Group L     |              |\n| June 26, 2026 | --:--  | TBD               | –      | TBD               | Group I     |              |\n| July 2, 2026  | --:--  | Runner-up Group K | –      | Runner-up Group L | Round of 32 |              |"
  },
  {
    "id": "qa_427_004",
    "source": "b71ccc88bc2b964767ab729ecf95940b.pdf",
    "page_numbers": [
      10
    ],
    "table_idx": 0,
    "question": "What are the times for all the matches listed in the table?",
    "answer": "All matches listed in the table have a time of \"--:--\", indicating the times are to be determined. BMO Field is set to host several matches during the 2026 FIFA World Cup, and will be temporarily renamed to \"Toronto Stadium\" during the event.",
    "retrieved_chunks": [
      "field will be supplemented by 17,756 temporary seats to bring its capacity to 45,736 for the event, to satisfy\na FIFA requirement.[1] On February 4, 2024, it was revealed that the stadium would host the opening match\nfor Canada on June 12, 2026. In total, the stadium will host six matches, five in the group stage and one in\nthe knockout rounds.[116]\nList of 2026 FIFA World Cup matches [edit]\nDateTime Team #1 Res.Team #2 RoundAttendance\nJune 12, 2026--:--\n  Canada –B2 Group B\nJune 17, 2026--:--TBD –TBD Group L\nJune 20, 2026--:--TBD –TBD Group E\nJune 23, 2026--:--TBD –TBD Group L\nJune 26, 2026--:--TBD –TBD Group I\nJuly 2, 2026--:--Runner-up Group K–Runner-up Group LRound of 32\nNotable friendlies [edit]\nBMO Field has hosted a number of friendly soccer matches.\nDate Winning TeamResultLosing\nTeamTournamentSpectators\nMay 23, 2007\n  Toronto FC0–0\n  Benfica Club friendly 18,730[117]\nJuly 25, 2007\n  Aston Villa4–2\n Toronto\nFCClub friendly 20,147[118]\nAugust 7, 2009\n Real Madrid5–1\n Toronto\nFCClub friendly 22,089[119]\nSeptember 2,\n2009\n Benfica 3–1\n  Celtic Club friendly 12,403[120]\nMay 23, 2010\n Panathinaikos0–0\n  Benfica Club friendly 10,603[121]\nJuly 22, 2010\n Bolton\nWanderers1–1\n(a.e.t.)\n4–3 (p)\n Toronto\nFCClub friendly 19,507[122]\nAugust 7, 2013\n  Roma 4–1\n Toronto\nFCClub friendly 18,274[123]\nJuly 23, 2014\n Tottenham\nHotspur3–2\n Toronto\nFCClub friendly 22,591[124]\nJuly 25, 2014\n  Olympiacos3–0\n  Milan2014 International\nChampions Cup10,603[125]"
    ],
    "retrieved_context": "| Date          | Time   | Team #1           | Res.   | Team #2           | Round       | Attendance   |\n|:--------------|:-------|:------------------|:-------|:------------------|:------------|:-------------|\n| June 12, 2026 | --:--  | Canada            | –      | B2                | Group B     |              |\n| June 17, 2026 | --:--  | TBD               | –      | TBD               | Group L     |              |\n| June 20, 2026 | --:--  | TBD               | –      | TBD               | Group E     |              |\n| June 23, 2026 | --:--  | TBD               | –      | TBD               | Group L     |              |\n| June 26, 2026 | --:--  | TBD               | –      | TBD               | Group I     |              |\n| July 2, 2026  | --:--  | Runner-up Group K | –      | Runner-up Group L | Round of 32 |              |"
  },
  {
    "id": "qa_427_005",
    "source": "b71ccc88bc2b964767ab729ecf95940b.pdf",
    "page_numbers": [
      10
    ],
    "table_idx": 0,
    "question": "Which dates are the Group L matches scheduled for?",
    "answer": "The matches in Group L are scheduled for June 17, 2026 and June 23, 2026, both with TBD teams. BMO Field is set to host several matches during the 2026 FIFA World Cup, and will be temporarily renamed to \"Toronto Stadium\" during the event.",
    "retrieved_chunks": [
      "field will be supplemented by 17,756 temporary seats to bring its capacity to 45,736 for the event, to satisfy\na FIFA requirement.[1] On February 4, 2024, it was revealed that the stadium would host the opening match\nfor Canada on June 12, 2026. In total, the stadium will host six matches, five in the group stage and one in\nthe knockout rounds.[116]\nList of 2026 FIFA World Cup matches [edit]\nDateTime Team #1 Res.Team #2 RoundAttendance\nJune 12, 2026--:--\n  Canada –B2 Group B\nJune 17, 2026--:--TBD –TBD Group L\nJune 20, 2026--:--TBD –TBD Group E\nJune 23, 2026--:--TBD –TBD Group L\nJune 26, 2026--:--TBD –TBD Group I\nJuly 2, 2026--:--Runner-up Group K–Runner-up Group LRound of 32\nNotable friendlies [edit]\nBMO Field has hosted a number of friendly soccer matches.\nDate Winning TeamResultLosing\nTeamTournamentSpectators\nMay 23, 2007\n  Toronto FC0–0\n  Benfica Club friendly 18,730[117]\nJuly 25, 2007\n  Aston Villa4–2\n Toronto\nFCClub friendly 20,147[118]\nAugust 7, 2009\n Real Madrid5–1\n Toronto\nFCClub friendly 22,089[119]\nSeptember 2,\n2009\n Benfica 3–1\n  Celtic Club friendly 12,403[120]\nMay 23, 2010\n Panathinaikos0–0\n  Benfica Club friendly 10,603[121]\nJuly 22, 2010\n Bolton\nWanderers1–1\n(a.e.t.)\n4–3 (p)\n Toronto\nFCClub friendly 19,507[122]\nAugust 7, 2013\n  Roma 4–1\n Toronto\nFCClub friendly 18,274[123]\nJuly 23, 2014\n Tottenham\nHotspur3–2\n Toronto\nFCClub friendly 22,591[124]\nJuly 25, 2014\n  Olympiacos3–0\n  Milan2014 International\nChampions Cup10,603[125]"
    ],
    "retrieved_context": "| Date          | Time   | Team #1           | Res.   | Team #2           | Round       | Attendance   |\n|:--------------|:-------|:------------------|:-------|:------------------|:------------|:-------------|\n| June 12, 2026 | --:--  | Canada            | –      | B2                | Group B     |              |\n| June 17, 2026 | --:--  | TBD               | –      | TBD               | Group L     |              |\n| June 20, 2026 | --:--  | TBD               | –      | TBD               | Group E     |              |\n| June 23, 2026 | --:--  | TBD               | –      | TBD               | Group L     |              |\n| June 26, 2026 | --:--  | TBD               | –      | TBD               | Group I     |              |\n| July 2, 2026  | --:--  | Runner-up Group K | –      | Runner-up Group L | Round of 32 |              |"
  },
  {
    "id": "qa_174_001",
    "source": "b71ccc88bc2b964767ab729ecf95940b.pdf",
    "page_numbers": [
      10
    ],
    "table_idx": 0,
    "question": "On what date did Toronto FC play against Benfica, what was the result, how many spectators were there, and when did Toronto FC play their first game at BMO Field?",
    "answer": "Toronto FC played against Benfica on May 23, 2007, in a Club friendly match with a result of 0-0, and 18,730 spectators. Toronto FC also played their first game at BMO Field on April 28, 2007.",
    "retrieved_chunks": [
      "Broke\ngroundMarch 29, 2006[5]\nOpenedApril 28, 2007\nExpanded2010\n2014–16\nConstruction\ncostCan$62.9 million\n($88.6 million in 2023 dollars[6])\nRenovations:\n2010: $5.5 million\n($7.42 million in 2023 dollars[6])\nExpansions:\n2014–2016: $120 million\n($162 million in 2023 dollars[6])\nArchitectBrisbin Brooks Beynon\nArchitects (BBB Architects),\nGensler (expansion)[7]\nProject\nmanagerPMX, Inc.[8]\nStructural\nengineerHalcrow Yolles[9]\nServices\nengineerThe Mitchell Partnership Inc.[10]\nGeneral\ncontractorPCL Construction[9]\nTenants\nToronto FC (MLS) 2007–present\nCanada soccer team 2007–present\n(intermittent)\nToronto Argonauts (CFL) 2016–present\nToronto Nationals (MLL) 2009\nToronto FC II (USL) 2018\nWebsite\nbmofield.comStands at BMO Field several weeks\nafter it opened in 2007. The stadium\nwas initially built with only 25,000\nseats.president withdrew his support after its cost rose over $100\nmillion.[17][18][19][20]\nLater that year, the\nArgos and CSA\nannounced plans to\nbuild a 25,000-seat,\n$70 million stadium at\nYork University, which\nwould contribute the\nland and $15 million,\nwith the Argos adding\n$20 million to the\ngovernment\nfunding.[17][21] MLSE\nwas not involved in\nthis project.[22] However, the Argos pulled out of the stadium\nafter signing a new 15-year lease at Rogers Centre with\nsignificantly reduced rent.[23]\nIn 2005, the stadium site was moved back to Exhibition Place,\non the location of the demolished Exhibition Stadium and\nthen-existing Sports Hall of Fame building, in a partnership\nbetween MLSE and the CSA. With a total cost of $62.9 million\n(all figures are in Canadian dollars) to build the stadium[24]\n($72.8 million including the land), financial contributions came\nfrom multiple sources.[25] The Canadian Federal Government\ncontributed $27 million, the Government of Ontario added an\nadditional $8 million, and the City of Toronto paid $9.8 million\nand contributed the land for the project (valued at $10\nmillion),[26][27] while retaining ownership of the stadium.[27]\nMLSE contributed $8 million towards construction costs and was responsible for any cost overruns.[27] In\nreturn, they got the management rights for the stadium.[28] MLSE committed to purchase a MLS soccer\nteam to play in the stadium. The remaining funds came from MLSE, which paid $10 million for the naming\nrights of the stadium for the duration of the 20-year management agreement, which they later resold to the\nBank of Montreal (BMO) for $27 million over the first 10 years.[27][29][30]\nThe proposal approved by the City of Toronto was for a stadium that was \"capable of a conversion to a\nfootball format.\"[14][31] The Argonauts attempted to join the project at the last minute, but MLSE, citing\nbudget and time limitations, constructed the stadium such that it could not fit a CFL field without demolition\nand reconstruction of the end zone stands.[31][32][33]"
    ],
    "retrieved_context": "| Date              | Winning Team        | Result               | Losing Team   | Tournament                       | Spectators   |\n|:------------------|:--------------------|:---------------------|:--------------|:---------------------------------|:-------------|\n| May 23, 2007      | Toronto FC          | 0–0                  | Benfica       | Club friendly                    | 18,730[117]  |\n| July 25, 2007     | Aston Villa         | 4–2                  | Toronto FC    | Club friendly                    | 20,147[118]  |\n| August 7, 2009    | Real Madrid         | 5–1                  | Toronto FC    | Club friendly                    | 22,089[119]  |\n| September 2, 2009 | Benfica             | 3–1                  | Celtic        | Club friendly                    | 12,403[120]  |\n| May 23, 2010      | Panathinaikos       | 0–0                  | Benfica       | Club friendly                    | 10,603[121]  |\n| July 22, 2010     | Bolton Wanderers    | 1–1 (a.e.t.) 4–3 (p) | Toronto FC    | Club friendly                    | 19,507[122]  |\n| August 7, 2013    | Roma                | 4–1                  | Toronto FC    | Club friendly                    | 18,274[123]  |\n| July 23, 2014     | Tottenham Hotspur   | 3–2                  | Toronto FC    | Club friendly                    | 22,591[124]  |\n| July 25, 2014     | Olympiacos          | 3–0                  | Milan         | 2014 International Champions Cup | 10,603[125]  |\n| May 27, 2015      | Manchester City     | 1–0                  | Toronto FC    | Club friendly                    | 23,169[126]  |\n| July 18, 2015     | Paris Saint-Germain | 3–2                  | Benfica       | 2015 International Champions Cup | 17,843[127]  |"
  },
  {
    "id": "qa_174_002",
    "source": "b71ccc88bc2b964767ab729ecf95940b.pdf",
    "page_numbers": [
      10
    ],
    "table_idx": 0,
    "question": "How many spectators attended the match between Olympiacos and Milan on July 25, 2014, and is this number the same as any other match listed in the table?",
    "answer": "The match between Olympiacos and Milan on July 25, 2014, during the 2014 International Champions Cup had 10,603 spectators, which is the same number of spectators as the match between Panathinaikos and Benfica on May 23, 2010.",
    "retrieved_chunks": [],
    "retrieved_context": "| Date              | Winning Team        | Result               | Losing Team   | Tournament                       | Spectators   |\n|:------------------|:--------------------|:---------------------|:--------------|:---------------------------------|:-------------|\n| May 23, 2007      | Toronto FC          | 0–0                  | Benfica       | Club friendly                    | 18,730[117]  |\n| July 25, 2007     | Aston Villa         | 4–2                  | Toronto FC    | Club friendly                    | 20,147[118]  |\n| August 7, 2009    | Real Madrid         | 5–1                  | Toronto FC    | Club friendly                    | 22,089[119]  |\n| September 2, 2009 | Benfica             | 3–1                  | Celtic        | Club friendly                    | 12,403[120]  |\n| May 23, 2010      | Panathinaikos       | 0–0                  | Benfica       | Club friendly                    | 10,603[121]  |\n| July 22, 2010     | Bolton Wanderers    | 1–1 (a.e.t.) 4–3 (p) | Toronto FC    | Club friendly                    | 19,507[122]  |\n| August 7, 2013    | Roma                | 4–1                  | Toronto FC    | Club friendly                    | 18,274[123]  |\n| July 23, 2014     | Tottenham Hotspur   | 3–2                  | Toronto FC    | Club friendly                    | 22,591[124]  |\n| July 25, 2014     | Olympiacos          | 3–0                  | Milan         | 2014 International Champions Cup | 10,603[125]  |\n| May 27, 2015      | Manchester City     | 1–0                  | Toronto FC    | Club friendly                    | 23,169[126]  |\n| July 18, 2015     | Paris Saint-Germain | 3–2                  | Benfica       | 2015 International Champions Cup | 17,843[127]  |"
  },
  {
    "id": "qa_174_003",
    "source": "b71ccc88bc2b964767ab729ecf95940b.pdf",
    "page_numbers": [
      10
    ],
    "table_idx": 0,
    "question": "How many club friendly matches did Toronto FC play at BMO Field before the Toronto Argonauts became a tenant?",
    "answer": "Toronto FC played 5 club friendly matches at BMO Field in the years 2007, 2009, 2010, 2013 and 2014 before the Toronto Argonauts became a tenant in 2016.",
    "retrieved_chunks": [
      "Broke\ngroundMarch 29, 2006[5]\nOpenedApril 28, 2007\nExpanded2010\n2014–16\nConstruction\ncostCan$62.9 million\n($88.6 million in 2023 dollars[6])\nRenovations:\n2010: $5.5 million\n($7.42 million in 2023 dollars[6])\nExpansions:\n2014–2016: $120 million\n($162 million in 2023 dollars[6])\nArchitectBrisbin Brooks Beynon\nArchitects (BBB Architects),\nGensler (expansion)[7]\nProject\nmanagerPMX, Inc.[8]\nStructural\nengineerHalcrow Yolles[9]\nServices\nengineerThe Mitchell Partnership Inc.[10]\nGeneral\ncontractorPCL Construction[9]\nTenants\nToronto FC (MLS) 2007–present\nCanada soccer team 2007–present\n(intermittent)\nToronto Argonauts (CFL) 2016–present\nToronto Nationals (MLL) 2009\nToronto FC II (USL) 2018\nWebsite\nbmofield.comStands at BMO Field several weeks\nafter it opened in 2007. The stadium\nwas initially built with only 25,000\nseats.president withdrew his support after its cost rose over $100\nmillion.[17][18][19][20]\nLater that year, the\nArgos and CSA\nannounced plans to\nbuild a 25,000-seat,\n$70 million stadium at\nYork University, which\nwould contribute the\nland and $15 million,\nwith the Argos adding\n$20 million to the\ngovernment\nfunding.[17][21] MLSE\nwas not involved in\nthis project.[22] However, the Argos pulled out of the stadium\nafter signing a new 15-year lease at Rogers Centre with\nsignificantly reduced rent.[23]\nIn 2005, the stadium site was moved back to Exhibition Place,\non the location of the demolished Exhibition Stadium and\nthen-existing Sports Hall of Fame building, in a partnership\nbetween MLSE and the CSA. With a total cost of $62.9 million\n(all figures are in Canadian dollars) to build the stadium[24]\n($72.8 million including the land), financial contributions came\nfrom multiple sources.[25] The Canadian Federal Government\ncontributed $27 million, the Government of Ontario added an\nadditional $8 million, and the City of Toronto paid $9.8 million\nand contributed the land for the project (valued at $10\nmillion),[26][27] while retaining ownership of the stadium.[27]\nMLSE contributed $8 million towards construction costs and was responsible for any cost overruns.[27] In\nreturn, they got the management rights for the stadium.[28] MLSE committed to purchase a MLS soccer\nteam to play in the stadium. The remaining funds came from MLSE, which paid $10 million for the naming\nrights of the stadium for the duration of the 20-year management agreement, which they later resold to the\nBank of Montreal (BMO) for $27 million over the first 10 years.[27][29][30]\nThe proposal approved by the City of Toronto was for a stadium that was \"capable of a conversion to a\nfootball format.\"[14][31] The Argonauts attempted to join the project at the last minute, but MLSE, citing\nbudget and time limitations, constructed the stadium such that it could not fit a CFL field without demolition\nand reconstruction of the end zone stands.[31][32][33]"
    ],
    "retrieved_context": "| Date              | Winning Team        | Result               | Losing Team   | Tournament                       | Spectators   |\n|:------------------|:--------------------|:---------------------|:--------------|:---------------------------------|:-------------|\n| May 23, 2007      | Toronto FC          | 0–0                  | Benfica       | Club friendly                    | 18,730[117]  |\n| July 25, 2007     | Aston Villa         | 4–2                  | Toronto FC    | Club friendly                    | 20,147[118]  |\n| August 7, 2009    | Real Madrid         | 5–1                  | Toronto FC    | Club friendly                    | 22,089[119]  |\n| September 2, 2009 | Benfica             | 3–1                  | Celtic        | Club friendly                    | 12,403[120]  |\n| May 23, 2010      | Panathinaikos       | 0–0                  | Benfica       | Club friendly                    | 10,603[121]  |\n| July 22, 2010     | Bolton Wanderers    | 1–1 (a.e.t.) 4–3 (p) | Toronto FC    | Club friendly                    | 19,507[122]  |\n| August 7, 2013    | Roma                | 4–1                  | Toronto FC    | Club friendly                    | 18,274[123]  |\n| July 23, 2014     | Tottenham Hotspur   | 3–2                  | Toronto FC    | Club friendly                    | 22,591[124]  |\n| July 25, 2014     | Olympiacos          | 3–0                  | Milan         | 2014 International Champions Cup | 10,603[125]  |\n| May 27, 2015      | Manchester City     | 1–0                  | Toronto FC    | Club friendly                    | 23,169[126]  |\n| July 18, 2015     | Paris Saint-Germain | 3–2                  | Benfica       | 2015 International Champions Cup | 17,843[127]  |"
  },
  {
    "id": "qa_174_004",
    "source": "b71ccc88bc2b964767ab729ecf95940b.pdf",
    "page_numbers": [
      10
    ],
    "table_idx": 0,
    "question": "How many matches did Benfica play in, according to the table, and what were the outcomes of those matches?",
    "answer": "Benfica played in 4 matches listed in the table, with the following outcomes: a 0-0 draw against Toronto FC on May 23, 2007, a 3-1 win against Celtic on September 2, 2009, a 0-0 draw against Panathinaikos on May 23, 2010 and a 3-2 loss against Paris Saint-Germain on July 18, 2015.",
    "retrieved_chunks": [],
    "retrieved_context": "| Date              | Winning Team        | Result               | Losing Team   | Tournament                       | Spectators   |\n|:------------------|:--------------------|:---------------------|:--------------|:---------------------------------|:-------------|\n| May 23, 2007      | Toronto FC          | 0–0                  | Benfica       | Club friendly                    | 18,730[117]  |\n| July 25, 2007     | Aston Villa         | 4–2                  | Toronto FC    | Club friendly                    | 20,147[118]  |\n| August 7, 2009    | Real Madrid         | 5–1                  | Toronto FC    | Club friendly                    | 22,089[119]  |\n| September 2, 2009 | Benfica             | 3–1                  | Celtic        | Club friendly                    | 12,403[120]  |\n| May 23, 2010      | Panathinaikos       | 0–0                  | Benfica       | Club friendly                    | 10,603[121]  |\n| July 22, 2010     | Bolton Wanderers    | 1–1 (a.e.t.) 4–3 (p) | Toronto FC    | Club friendly                    | 19,507[122]  |\n| August 7, 2013    | Roma                | 4–1                  | Toronto FC    | Club friendly                    | 18,274[123]  |\n| July 23, 2014     | Tottenham Hotspur   | 3–2                  | Toronto FC    | Club friendly                    | 22,591[124]  |\n| July 25, 2014     | Olympiacos          | 3–0                  | Milan         | 2014 International Champions Cup | 10,603[125]  |\n| May 27, 2015      | Manchester City     | 1–0                  | Toronto FC    | Club friendly                    | 23,169[126]  |\n| July 18, 2015     | Paris Saint-Germain | 3–2                  | Benfica       | 2015 International Champions Cup | 17,843[127]  |"
  },
  {
    "id": "qa_174_005",
    "source": "b71ccc88bc2b964767ab729ecf95940b.pdf",
    "page_numbers": [
      10,
      11
    ],
    "table_idx": 0,
    "question": "When did Toronto FC play against Aston Villa, what type of match was it, and what was the score when Andrea Lombardo scored?",
    "answer": "Toronto FC played against Aston Villa on July 25, 2007, in a Club friendly. Andrea Lombardo scored an equalizer at BMO Field's south end to make it 2–2 before Aston Villa won 4-2.",
    "retrieved_chunks": [
      "View of the stadium immediately\nafter the Toronto FC scored their first\ngoal in club history on June 12, 2007.The first goal at BMO Field scored by a Canadian came at the\nofficial opening on May 11, 2007, in a U-20 friendly between Canada\nand Argentina. David Edgar scored a penalty in a 2–1 defeat for\nCanada, just four minutes after Gómez had scored the first\ninternational goal at the stadium.\nCosta Rica's Víctor Núñez scored the first senior international goal\nin a 1–1 friendly draw with hosts Canada on September 12, 2007,\nshortly before Dwayne De Rosario scored Canada's first senior goal\nat the stadium.\nThe first Toronto FC goal scored by a Canadian at BMO Field was in\na June 25, 2007 friendly against Aston Villa of the English Premier\nLeague. Andrea Lombardo scored an equalizer at BMO Field's south end to make it 2–2 before Aston Villa\nran out 4–2 winners. The first league goal at BMO Field scored by a Canadian came when Miguel Cañizalez\nscored for Toronto FC in the second minute of their 2–1 defeat to the Columbus Crew on September 22,\n2007, snapping an 824-minute MLS goalless streak.\nThe first Toronto FC MLS playoff goal was scored at BMO Field in the 15th minute by Sebastian Giovinco on\nOctober 26, 2016, in front of 21,759. In the same game, the first Toronto FC playoff goal scored by a\nCanadian was by Jonathan Osorio in the 48th minute; the final score was 3–1 over the Philadelphia\nUnion.[111]"
    ],
    "retrieved_context": "| Date              | Winning Team        | Result               | Losing Team   | Tournament                       | Spectators   |\n|:------------------|:--------------------|:---------------------|:--------------|:---------------------------------|:-------------|\n| May 23, 2007      | Toronto FC          | 0–0                  | Benfica       | Club friendly                    | 18,730[117]  |\n| July 25, 2007     | Aston Villa         | 4–2                  | Toronto FC    | Club friendly                    | 20,147[118]  |\n| August 7, 2009    | Real Madrid         | 5–1                  | Toronto FC    | Club friendly                    | 22,089[119]  |\n| September 2, 2009 | Benfica             | 3–1                  | Celtic        | Club friendly                    | 12,403[120]  |\n| May 23, 2010      | Panathinaikos       | 0–0                  | Benfica       | Club friendly                    | 10,603[121]  |\n| July 22, 2010     | Bolton Wanderers    | 1–1 (a.e.t.) 4–3 (p) | Toronto FC    | Club friendly                    | 19,507[122]  |\n| August 7, 2013    | Roma                | 4–1                  | Toronto FC    | Club friendly                    | 18,274[123]  |\n| July 23, 2014     | Tottenham Hotspur   | 3–2                  | Toronto FC    | Club friendly                    | 22,591[124]  |\n| July 25, 2014     | Olympiacos          | 3–0                  | Milan         | 2014 International Champions Cup | 10,603[125]  |\n| May 27, 2015      | Manchester City     | 1–0                  | Toronto FC    | Club friendly                    | 23,169[126]  |\n| July 18, 2015     | Paris Saint-Germain | 3–2                  | Benfica       | 2015 International Champions Cup | 17,843[127]  |"
  },
  {
    "id": "qa_429_001",
    "source": "b71ccc88bc2b964767ab729ecf95940b.pdf",
    "page_numbers": [
      11,
      12
    ],
    "table_idx": 0,
    "question": "What was the highest attendance at a game in the table, and which teams played in that game? How does this attendance relate to rugby events at BMO Field?",
    "answer": "The highest attendance was 22566 on November 3, 2013, when Canada played against Māori All Blacks. This was also the largest crowd for rugby at BMO Field and in Canada.",
    "retrieved_chunks": [
      "8. ^ \"Projects\". PMX Inc. February 26, 2013. Archived from the original on November 26, 2013. Retrieved\nSeptember 10, 2013.\n9. ^ a b \"National Soccer Stadium at Exhibition Place\". PCL Construction. Archived from the original on October\n16, 2006. Retrieved April 20, 2012.\n10. ^ \"BMO Field\". The Mitchell Partnership. Archived from the original (PDF) on May 25, 2018. Retrieved\nSeptember 10, 2013.\n11. ^ \"FIFA announces Toronto and Vancouver as Canadian Host Cities for the FIFA World Cup 2026™\". BMO\nField. June 2022. Retrieved March 16, 2023.\n12. ^ \"Host City Toronto\". FIFA. Retrieved March 6, 2024.\n13. ^ \"Argos, U of T look at Lamport\". The Globe and Mail. April 12, 2001. Retrieved June 3, 2018.\n14. ^ a b \"Soccer Stadium at Exhibition Place\" (PDF). City of Toronto. October 2005. Retrieved January 8, 2014.\n15. ^ \"CSA Releases Details On Proposed National Soccer Stadium\". Canadian Soccer Association. July 21, 2003.\nArchived from the original on August 23, 2018. Retrieved February 27, 2015.\n16. ^ a b c \"New stadium for Argos, Canadian soccer\". CBC News. May 21, 2004. Retrieved January 8, 2014.\n17. ^ a b c Lefko, Perry (November 4, 2004). \"Brick by brick\". Toronto Sun. Archived from the original on January 6,\n2014. Retrieved January 7, 2014.\n18. ^ a b Lefko, Perry (October 1, 2004). \"Sun sets on Varsity\". Toronto Sun. Archived from the original on January\n8, 2014. Retrieved January 8, 2014.\n19. ^ \"Plan for Toronto football stadium crumbles\". CBC News. September 30, 2004. Retrieved January 8, 2014.\n20. ^ Fitz-Gerald, Sean (June 19, 2014). \"Argos need to find a permanent home\". National Post. Retrieved\nMarch 8, 2014. [dead link]\n21. ^ \"A new stadium for York\". York University. October 19, 2004. Retrieved January 8, 2014.\n22. ^ Byers, Jim (October 14, 2004). \"Ex feels jilted by Argos; City's phone calls to CFL team go unanswered\nSources say club to announce York as its new home\". Toronto Star.\n23. ^ Koreen, Mike (May 3, 2005). \"Argos run a reverse\". Toronto Sun. Archived from the original on January 8,\n2014. Retrieved January 8, 2014.\n24. ^ \"BMO Field, MLSE delivers financial return to City of Toronto\". Archived from the original on February 26,\n2011. Retrieved February 23, 2011.\n25. ^ \"Soccer Stadium at Exhibition Place\" (PDF). City of Toronto. October 2005. Retrieved October 1, 2013.\n26. ^ a b c \"Improvements to BMO Field at Exhibition Place\" (PDF). Exhibition Place. March 6, 2014. Archived from\nthe original (PDF) on March 9, 2014. Retrieved March 8, 2014.\n27. ^ a b c d \"Toronto city council approves soccer stadium deal\". CBC News. October 27, 2005. Retrieved\nOctober 1, 2013.\n28. ^ Sandor, Steven (June 3, 2009). \"Grass at BMO remains a contentious issue\". Toronto Sun. Archived from the\noriginal on October 1, 2013.\n29. ^ \"BMO Field to be Home for Toronto FC and Canada's National Soccer Teams\". September 20, 2006.\nRetrieved December 2, 2009.\n30. ^ \"Real Salt Lake negotiating deal for stadium name rights\". Archived from the original on July 4, 2008.\nRetrieved December 2, 2009.\n31. ^ a b Naylor, David (August 13, 2008). \"BMO built with football in mind\". The Globe and Mail. Retrieved\nJanuary 8, 2014.\n32. ^ Peddie, Richard (2013). Dream Job. HarperCollins.\n33. ^ Brunt, Stephen (December 7, 2006). \"No room for Argos at new soccer stadium\". The Globe and Mail.\nRetrieved May 17, 2014.",
      "Association\nfootball portal\nCanada portal201912,78916,7349,819\n2020Season cancelled due to COVID-19\n20218,603221,4926,247\n202211,99921,3319,806\n202315,98426,62012,473\n202415,42020,48710,857\nNotes:\n1 104th Grey Cup game between the Ottawa Redblacks and Calgary Stampeders.\n2 Limited capacity for all regular season games due to COVID-19 pandemic.\nRugby [edit]\nThe largest crowd for rugby at BMO Field and in Canada occurred when the Canada national rugby union\nteam hosted the New Zealand Māori All Blacks before 22,566 people on November 3, 2013.[141] The Maori\nAll Blacks won the match 40–15.\nSee also [edit]\nList of Canadian Football League stadiums\nList of Major League Soccer stadiums\nList of soccer stadiums in Canada\nVenues of the 2015 Pan American and Parapan American Games\nLists of stadiums\nReferences [edit]\n1. ^ a b c \"FIFA26 – BMO Field\". bmofield.com. BMO Field.\n2. ^ Kevin, McGran (January 1, 2017). \"Overtime in Centennial Classic? Naturally\". Toronto Star. Retrieved\nJune 23, 2018.\n3. ^ \"Game Summary\". National Hockey League. Retrieved June 22, 2018.\n4. ^ a b \"Game HQ\". ESPN. Retrieved January 1, 2017.\n5. ^ \"Work Begins on Toronto Soccer Stadium\". Guelph Mercury. March 9, 2006. Archived from the original on\nJanuary 11, 2012.\n6. ^ a b c 1688 to 1923: Geloso, Vincent, A Price Index for Canada, 1688 to 1850 (December 6, 2016).\nAfterwards, Canadian inflation numbers based on Statistics Canada tables 18-10-0005-01 (formerly CANSIM\n326-0021) \"Consumer Price Index, annual average, not seasonally adjusted\". Statistics Canada. Retrieved\nApril 17, 2021. and table 18-10-0004-13 \"Consumer Price Index by product group, monthly, percentage change,\nnot seasonally adjusted, Canada, provinces, Whitehorse, Yellowknife and Iqaluit\". Statistics Canada. Retrieved\nMay 8, 2024.\n7. ^ \"BMO Field | Projects\". Gensler.",
      "Rugby [edit]\nThe largest crowd for rugby at BMO Field and in Canada occurred when the Canada national rugby union\nteam hosted the New Zealand Māori All Blacks before 22,566 people on November 3, 2013.[141] The Maori\nAll Blacks won the match 40–15."
    ],
    "retrieved_context": "| Date             | Away             | Score   | Home   |   Attendance |\n|:-----------------|:-----------------|:--------|:-------|-------------:|\n| August 6, 2011   | United States    | 22–28   | Canada |        10621 |\n| June 15, 2012    | Italy            | 25–16   | Canada |        12220 |\n| June 15, 2013    | Ireland          | 40–14   | Canada |        20396 |\n| August 24, 2013  | United States    | 11–13   | Canada |        10207 |\n| November 3, 2013 | Māori All Blacks | 40–15   | Canada |        22566 |\n| June 14, 2014    | Scotland         | 19–17   | Canada |        18788 |\n| July 29, 2015    | Samoa            | 21–20   | Canada |        11200 |\n| June 26, 2016    | Italy            | 20–18   | Canada |        13125 |"
  },
  {
    "id": "qa_429_002",
    "source": "b71ccc88bc2b964767ab729ecf95940b.pdf",
    "page_numbers": [
      11,
      12
    ],
    "table_idx": 0,
    "question": "According to the table, how many times did Canada play against Italy, and what were the scores? How does this relate to friendly soccer matches hosted at BMO Field?",
    "answer": "Canada played against Italy three times in the table, with scores of 25-16, 20-18, and 20-18. BMO Field has hosted a number of friendly soccer matches, including games against Benfica and Celtic.",
    "retrieved_chunks": [
      "field will be supplemented by 17,756 temporary seats to bring its capacity to 45,736 for the event, to satisfy\na FIFA requirement.[1] On February 4, 2024, it was revealed that the stadium would host the opening match\nfor Canada on June 12, 2026. In total, the stadium will host six matches, five in the group stage and one in\nthe knockout rounds.[116]\nList of 2026 FIFA World Cup matches [edit]\nDateTime Team #1 Res.Team #2 RoundAttendance\nJune 12, 2026--:--\n  Canada –B2 Group B\nJune 17, 2026--:--TBD –TBD Group L\nJune 20, 2026--:--TBD –TBD Group E\nJune 23, 2026--:--TBD –TBD Group L\nJune 26, 2026--:--TBD –TBD Group I\nJuly 2, 2026--:--Runner-up Group K–Runner-up Group LRound of 32\nNotable friendlies [edit]\nBMO Field has hosted a number of friendly soccer matches.\nDate Winning TeamResultLosing\nTeamTournamentSpectators\nMay 23, 2007\n  Toronto FC0–0\n  Benfica Club friendly 18,730[117]\nJuly 25, 2007\n  Aston Villa4–2\n Toronto\nFCClub friendly 20,147[118]\nAugust 7, 2009\n Real Madrid5–1\n Toronto\nFCClub friendly 22,089[119]\nSeptember 2,\n2009\n Benfica 3–1\n  Celtic Club friendly 12,403[120]\nMay 23, 2010\n Panathinaikos0–0\n  Benfica Club friendly 10,603[121]\nJuly 22, 2010\n Bolton\nWanderers1–1\n(a.e.t.)\n4–3 (p)\n Toronto\nFCClub friendly 19,507[122]\nAugust 7, 2013\n  Roma 4–1\n Toronto\nFCClub friendly 18,274[123]\nJuly 23, 2014\n Tottenham\nHotspur3–2\n Toronto\nFCClub friendly 22,591[124]\nJuly 25, 2014\n  Olympiacos3–0\n  Milan2014 International\nChampions Cup10,603[125]"
    ],
    "retrieved_context": "| Date             | Away             | Score   | Home   |   Attendance |\n|:-----------------|:-----------------|:--------|:-------|-------------:|\n| August 6, 2011   | United States    | 22–28   | Canada |        10621 |\n| June 15, 2012    | Italy            | 25–16   | Canada |        12220 |\n| June 15, 2013    | Ireland          | 40–14   | Canada |        20396 |\n| August 24, 2013  | United States    | 11–13   | Canada |        10207 |\n| November 3, 2013 | Māori All Blacks | 40–15   | Canada |        22566 |\n| June 14, 2014    | Scotland         | 19–17   | Canada |        18788 |\n| July 29, 2015    | Samoa            | 21–20   | Canada |        11200 |\n| June 26, 2016    | Italy            | 20–18   | Canada |        13125 |"
  },
  {
    "id": "qa_429_003",
    "source": "b71ccc88bc2b964767ab729ecf95940b.pdf",
    "page_numbers": [
      11,
      12
    ],
    "table_idx": 0,
    "question": "Which game listed in the table had the lowest attendance, and what was the attendance number? How does this compare to attendance at other events held at BMO Field?",
    "answer": "The game with the lowest attendance was on August 24, 2013, against the United States, with an attendance of 10207. BMO Field has hosted events with significantly higher attendance, such as the NHL Centennial Classic, which had an attendance of 40,148.",
    "retrieved_chunks": [
      "Warm-ups at 2017 NHL Centennial\nClassicJune 14, 2014Scotland \n 19–17\n Canada18,788\nJuly 29, 2015 Samoa \n 21–20\n Canada11,200\nJune 26, 2016 Italy \n 20–18\n Canada13,125\nLacrosse [edit]\nIn 2009, the Toronto Nationals of Major League Lacrosse began playing their home games at BMO Field.\nThe team moved to Lamport Stadium for 2010 and to Hamilton in 2011 before folding in 2013.\nHockey [edit]\nOn January 1, 2017, BMO Field hosted an NHL outdoor game, the\nNHL Centennial Classic, in honour of the Toronto Maple Leafs' and\nthe NHL's centennial seasons. The Leafs hosted the Detroit Red\nWings, in a rematch of the 2014 NHL Winter Classic held three\nyears prior.[135] The venue was referred to as \"Exhibition Stadium\"\nfor its duration, as Scotiabank (a direct competitor to BMO), was title\nsponsor of the event.[136]\nDateAway teamResultHome teamSpectators\nDecember\n31, 2016\n Detroit\nRed Wings\nAlumni4–3\n Toronto\nMaple Leafs\nAlumni–\nJanuary 1,\n2017\n Detroit\nRed Wings4–5\n(OT)\n Toronto\nMaple Leafs40,148"
    ],
    "retrieved_context": "| Date             | Away             | Score   | Home   |   Attendance |\n|:-----------------|:-----------------|:--------|:-------|-------------:|\n| August 6, 2011   | United States    | 22–28   | Canada |        10621 |\n| June 15, 2012    | Italy            | 25–16   | Canada |        12220 |\n| June 15, 2013    | Ireland          | 40–14   | Canada |        20396 |\n| August 24, 2013  | United States    | 11–13   | Canada |        10207 |\n| November 3, 2013 | Māori All Blacks | 40–15   | Canada |        22566 |\n| June 14, 2014    | Scotland         | 19–17   | Canada |        18788 |\n| July 29, 2015    | Samoa            | 21–20   | Canada |        11200 |\n| June 26, 2016    | Italy            | 20–18   | Canada |        13125 |"
  },
  {
    "id": "qa_429_004",
    "source": "b71ccc88bc2b964767ab729ecf95940b.pdf",
    "page_numbers": [
      11,
      12
    ],
    "table_idx": 0,
    "question": "How many times did Canada play against the United States in the provided table, and on what dates did these games occur? How does this relate to Canada's future matches at BMO Field?",
    "answer": "In the table, Canada played the United States twice, on August 6, 2011, and August 24, 2013. BMO Field is set to host several matches during the 2026 FIFA World Cup, including the opening match for Canada on June 12, 2026.",
    "retrieved_chunks": [
      "field will be supplemented by 17,756 temporary seats to bring its capacity to 45,736 for the event, to satisfy\na FIFA requirement.[1] On February 4, 2024, it was revealed that the stadium would host the opening match\nfor Canada on June 12, 2026. In total, the stadium will host six matches, five in the group stage and one in\nthe knockout rounds.[116]\nList of 2026 FIFA World Cup matches [edit]\nDateTime Team #1 Res.Team #2 RoundAttendance\nJune 12, 2026--:--\n  Canada –B2 Group B"
    ],
    "retrieved_context": "| Date             | Away             | Score   | Home   |   Attendance |\n|:-----------------|:-----------------|:--------|:-------|-------------:|\n| August 6, 2011   | United States    | 22–28   | Canada |        10621 |\n| June 15, 2012    | Italy            | 25–16   | Canada |        12220 |\n| June 15, 2013    | Ireland          | 40–14   | Canada |        20396 |\n| August 24, 2013  | United States    | 11–13   | Canada |        10207 |\n| November 3, 2013 | Māori All Blacks | 40–15   | Canada |        22566 |\n| June 14, 2014    | Scotland         | 19–17   | Canada |        18788 |\n| July 29, 2015    | Samoa            | 21–20   | Canada |        11200 |\n| June 26, 2016    | Italy            | 20–18   | Canada |        13125 |"
  },
  {
    "id": "qa_429_005",
    "source": "b71ccc88bc2b964767ab729ecf95940b.pdf",
    "page_numbers": [
      11,
      12
    ],
    "table_idx": 0,
    "question": "What is the average attendance for all games listed in the table? How does this compare to the average attendance for Toronto FC's MLS season at BMO Field in 2016?",
    "answer": "The average attendance for the games listed in the table is approximately 14889.25. BMO Field's MLS season average attendance in 2016 was 26,787, which is significantly higher than the average attendance in the table.",
    "retrieved_chunks": [
      "MLS [edit]\nSeasonSeason\naverageHighest\ngateLowest\ngate\n200720,13020,52219,123\n200820,12020,46119,657\n200920,34420,90219,843\n201020,45322,10818,394\n201120,26722,45316,313\n201218,68120,07114,623\n201317,63921,70012,627\n201422,08622,59118,269\n201523,45130,22616,382\n201626,78736,04520,011\n201727,39430,58415,175\n201826,62830,79914,823\n201925,04828,98922,651"
    ],
    "retrieved_context": "| Date             | Away             | Score   | Home   |   Attendance |\n|:-----------------|:-----------------|:--------|:-------|-------------:|\n| August 6, 2011   | United States    | 22–28   | Canada |        10621 |\n| June 15, 2012    | Italy            | 25–16   | Canada |        12220 |\n| June 15, 2013    | Ireland          | 40–14   | Canada |        20396 |\n| August 24, 2013  | United States    | 11–13   | Canada |        10207 |\n| November 3, 2013 | Māori All Blacks | 40–15   | Canada |        22566 |\n| June 14, 2014    | Scotland         | 19–17   | Canada |        18788 |\n| July 29, 2015    | Samoa            | 21–20   | Canada |        11200 |\n| June 26, 2016    | Italy            | 20–18   | Canada |        13125 |"
  },
  {
    "id": "qa_495_001",
    "source": "b71ccc88bc2b964767ab729ecf95940b.pdf",
    "page_numbers": [
      14,
      15
    ],
    "table_idx": 0,
    "question": "What was the highest gate in 2016, and what event might have contributed to it?",
    "answer": "The highest gate in 2016 was 33421, which occurred after the Toronto Argonauts moved to BMO Field.",
    "retrieved_chunks": [
      "Broke\ngroundMarch 29, 2006[5]\nOpenedApril 28, 2007\nExpanded2010\n2014–16\nConstruction\ncostCan$62.9 million\n($88.6 million in 2023 dollars[6])\nRenovations:\n2010: $5.5 million\n($7.42 million in 2023 dollars[6])\nExpansions:\n2014–2016: $120 million\n($162 million in 2023 dollars[6])\nArchitectBrisbin Brooks Beynon\nArchitects (BBB Architects),\nGensler (expansion)[7]\nProject\nmanagerPMX, Inc.[8]\nStructural\nengineerHalcrow Yolles[9]\nServices\nengineerThe Mitchell Partnership Inc.[10]\nGeneral\ncontractorPCL Construction[9]\nTenants\nToronto FC (MLS) 2007–present\nCanada soccer team 2007–present\n(intermittent)\nToronto Argonauts (CFL) 2016–present\nToronto Nationals (MLL) 2009\nToronto FC II (USL) 2018\nWebsite\nbmofield.comStands at BMO Field several weeks\nafter it opened in 2007. The stadium\nwas initially built with only 25,000\nseats.president withdrew his support after its cost rose over $100\nmillion.[17][18][19][20]\nLater that year, the\nArgos and CSA\nannounced plans to\nbuild a 25,000-seat,\n$70 million stadium at\nYork University, which\nwould contribute the\nland and $15 million,\nwith the Argos adding\n$20 million to the\ngovernment\nfunding.[17][21] MLSE\nwas not involved in\nthis project.[22] However, the Argos pulled out of the stadium\nafter signing a new 15-year lease at Rogers Centre with\nsignificantly reduced rent.[23]\nIn 2005, the stadium site was moved back to Exhibition Place,\non the location of the demolished Exhibition Stadium and\nthen-existing Sports Hall of Fame building, in a partnership\nbetween MLSE and the CSA. With a total cost of $62.9 million\n(all figures are in Canadian dollars) to build the stadium[24]\n($72.8 million including the land), financial contributions came\nfrom multiple sources.[25] The Canadian Federal Government\ncontributed $27 million, the Government of Ontario added an\nadditional $8 million, and the City of Toronto paid $9.8 million\nand contributed the land for the project (valued at $10\nmillion),[26][27] while retaining ownership of the stadium.[27]\nMLSE contributed $8 million towards construction costs and was responsible for any cost overruns.[27] In\nreturn, they got the management rights for the stadium.[28] MLSE committed to purchase a MLS soccer\nteam to play in the stadium. The remaining funds came from MLSE, which paid $10 million for the naming\nrights of the stadium for the duration of the 20-year management agreement, which they later resold to the\nBank of Montreal (BMO) for $27 million over the first 10 years.[27][29][30]\nThe proposal approved by the City of Toronto was for a stadium that was \"capable of a conversion to a\nfootball format.\"[14][31] The Argonauts attempted to join the project at the last minute, but MLSE, citing\nbudget and time limitations, constructed the stadium such that it could not fit a CFL field without demolition\nand reconstruction of the end zone stands.[31][32][33]",
      "Privacy policyAbout WikipediaDisclaimersContact WikipediaCode of ConductDevelopersStatisticsCookie statement\nMobile viewThis page was last edited on 25 April 2025, at 03:50 (UTC).\nText is available under the Creative Commons Attribution-ShareAlike 4.0 License; additional terms may apply. By using this site, you agree to the\nTerms of Use and Privacy Policy. Wikipedia® is a registered trademark of the Wikimedia Foundation, Inc., a non-profit organization.[show] V · T · E\n[show]Preceded by\nRogers CentreHome of\nToronto Argonauts\n2016–presentSucceeded by\ncurrent\nPreceded by\nQwest FieldHost of the\nMLS Cup\n2010Succeeded by\nHome Depot Center\nPreceded by\nInvestors Group FieldHost of the\nGrey Cup\n2016Succeeded by\nTD Place Stadium\nPreceded by\nMapfre StadiumHost of the\nMLS Cup\n2016Succeeded by\nBMO Field\nPreceded by\nBMO FieldHost of the\nMLS Cup\n2017Succeeded by\nMercedes-Benz Stadium\nSports venues in Toronto\nLinks to related articles\nAuthority control databases: Geographic \nStructurae · MusicBrainz place · StadiumDB\nCategories: Sports venues completed in 2007National stadiumsSoccer venues in Canada\nMajor League Soccer stadiumsCanadian Football League venuesSoccer venues in Ontario\nSports venues in TorontoFormer Major League Lacrosse venuesMulti-purpose stadiums in Canada\nMaple Leaf Sports & EntertainmentToronto FCToronto ArgonautsToronto FC II\nBank of MontrealRugby union stadiums in OntarioVenues of the 2015 Pan American Games\nExhibition Place2007 establishments in OntarioCanadian football venues in Ontario",
      "Toronto FC crowned as the MLS'\n2017 Eastern Conference champions\nat BMO Field."
    ],
    "retrieved_context": "|   Season | Season average             | Highest gate               | Lowest gate   |\n|---------:|:---------------------------|:---------------------------|:--------------|\n|     2016 | 16380                      | 33421                      | 12373         |\n|     2017 | 13913                      | 24929                      | 11219         |\n|     2018 | 14211                      | 18104                      | 10844         |\n|     2019 | 12789                      | 16734                      |               |\n|     2020 | Season cancelled due to CO | Season cancelled due to CO |               |\n|     2021 | 86032                      | 21492                      |               |\n|     2022 | 11999                      | 21331                      |               |\n|     2023 | 15984                      | 26620                      |               |\n|     2024 | 15420                      | 20487                      |               |"
  },
  {
    "id": "qa_495_002",
    "source": "b71ccc88bc2b964767ab729ecf95940b.pdf",
    "page_numbers": [
      14,
      15
    ],
    "table_idx": 0,
    "question": "What was the lowest gate in 2018?",
    "answer": "The lowest gate in 2018 was 10844.",
    "retrieved_chunks": [],
    "retrieved_context": "|   Season | Season average             | Highest gate               | Lowest gate   |\n|---------:|:---------------------------|:---------------------------|:--------------|\n|     2016 | 16380                      | 33421                      | 12373         |\n|     2017 | 13913                      | 24929                      | 11219         |\n|     2018 | 14211                      | 18104                      | 10844         |\n|     2019 | 12789                      | 16734                      |               |\n|     2020 | Season cancelled due to CO | Season cancelled due to CO |               |\n|     2021 | 86032                      | 21492                      |               |\n|     2022 | 11999                      | 21331                      |               |\n|     2023 | 15984                      | 26620                      |               |\n|     2024 | 15420                      | 20487                      |               |"
  },
  {
    "id": "qa_495_003",
    "source": "b71ccc88bc2b964767ab729ecf95940b.pdf",
    "page_numbers": [
      14,
      15
    ],
    "table_idx": 0,
    "question": "What was the season average in 2021, and why might it be an outlier compared to other years?",
    "answer": "The season average in 2021 was 86032, which is significantly higher than any other season listed in the table, potentially due to games being cancelled in 2020.",
    "retrieved_chunks": [],
    "retrieved_context": "|   Season | Season average             | Highest gate               | Lowest gate   |\n|---------:|:---------------------------|:---------------------------|:--------------|\n|     2016 | 16380                      | 33421                      | 12373         |\n|     2017 | 13913                      | 24929                      | 11219         |\n|     2018 | 14211                      | 18104                      | 10844         |\n|     2019 | 12789                      | 16734                      |               |\n|     2020 | Season cancelled due to CO | Season cancelled due to CO |               |\n|     2021 | 86032                      | 21492                      |               |\n|     2022 | 11999                      | 21331                      |               |\n|     2023 | 15984                      | 26620                      |               |\n|     2024 | 15420                      | 20487                      |               |"
  },
  {
    "id": "qa_495_004",
    "source": "b71ccc88bc2b964767ab729ecf95940b.pdf",
    "page_numbers": [
      14,
      15
    ],
    "table_idx": 0,
    "question": "What is the highest gate listed in the table?",
    "answer": "The highest gate listed in the table is 33421 in 2016.",
    "retrieved_chunks": [],
    "retrieved_context": "|   Season | Season average             | Highest gate               | Lowest gate   |\n|---------:|:---------------------------|:---------------------------|:--------------|\n|     2016 | 16380                      | 33421                      | 12373         |\n|     2017 | 13913                      | 24929                      | 11219         |\n|     2018 | 14211                      | 18104                      | 10844         |\n|     2019 | 12789                      | 16734                      |               |\n|     2020 | Season cancelled due to CO | Season cancelled due to CO |               |\n|     2021 | 86032                      | 21492                      |               |\n|     2022 | 11999                      | 21331                      |               |\n|     2023 | 15984                      | 26620                      |               |\n|     2024 | 15420                      | 20487                      |               |"
  },
  {
    "id": "qa_495_005",
    "source": "b71ccc88bc2b964767ab729ecf95940b.pdf",
    "page_numbers": [
      14,
      15
    ],
    "table_idx": 0,
    "question": "Excluding the cancelled season, what was the lowest average attendance and when did it occur?",
    "answer": "The lowest average attendance, excluding the cancelled season, occurred in 2022 with 11999, after the spike in 2021.",
    "retrieved_chunks": [],
    "retrieved_context": "|   Season | Season average             | Highest gate               | Lowest gate   |\n|---------:|:---------------------------|:---------------------------|:--------------|\n|     2016 | 16380                      | 33421                      | 12373         |\n|     2017 | 13913                      | 24929                      | 11219         |\n|     2018 | 14211                      | 18104                      | 10844         |\n|     2019 | 12789                      | 16734                      |               |\n|     2020 | Season cancelled due to CO | Season cancelled due to CO |               |\n|     2021 | 86032                      | 21492                      |               |\n|     2022 | 11999                      | 21331                      |               |\n|     2023 | 15984                      | 26620                      |               |\n|     2024 | 15420                      | 20487                      |               |"
  },
  {
    "id": "qa_492_001",
    "source": "b71ccc88bc2b964767ab729ecf95940b.pdf",
    "page_numbers": [
      21
    ],
    "table_idx": 0,
    "question": "According to the table, what venue did BMO Field succeed as a FIFA U-20 World Cup rd Final Venue in 2007, and what venue succeeded BMO Field?",
    "answer": "BMO Field succeeded the use of Stadion Galgenwaa Utrecht as a FIFA U-20 World Cup rd Final Venue in 2007, and was itself succeeded by Cairo International Stadium Cairo.",
    "retrieved_chunks": [
      "BMO Field\n 30 languages\nArticleTalk ReadEditView historyTools\nBMO Field\nBMO Field in May 2016\nLocation in Toronto\nLocation in Southern OntarioFrom Wikipedia, the free encyclopedia\nNot to be confused with BMO Stadium in Los Angeles, California.\nBMO Field is an outdoor stadium located at Exhibition Place\nin Toronto, Ontario, Canada. Constructed on the former\nExhibition Stadium site and first opened in 2007, it is the\nhome field of Toronto FC of Major League Soccer (MLS) and\nToronto Argonauts of the Canadian Football League (CFL).\nBMO Field is owned by the City of Toronto and managed by\nMaple Leaf Sports & Entertainment, which owns both Toronto\nFC and the Argonauts. The stadium's naming rights are held\nby the Bank of Montreal, which is commonly branded as\n\"BMO\" (/ˈbiːmoʊ/). It is one of two Canadian stadiums which\nwill host matches of the upcoming 2026 FIFA World Cup. An\nexpansion for the tournament will bring the stadium's capacity\nto 45,736 seats.[11]\nBMO Field was originally constructed as a soccer-specific\nstadium for the 2007 FIFA U-20 World Cup[12] and first home\nfor Toronto FC. It hosted matches during the 2007 FIFA U-20\nWorld Cup and 2014 FIFA U-20 Women's World Cup. In\n2010, when it was still a neutral-site game, BMO Field hosted\nthe MLS Cup. It has since hosted the 2016 and 2017 finals\nfeaturing Toronto FC, under the current practice of giving\nhome field advantage to the side with the better regular-\nseason record. The venue has also hosted rugby union,\nincluding matches of Canada's national team, and rugby\nsevens during the 2015 Pan-American Games.\nFrom 2014 to 2016, the stadium underwent a series of major\nrenovations, which added an upper deck to the east\ngrandstand and a roof over the seating areas, and lengthened\nthe field to make it suitable for hosting Canadian football. The\nlatter allowed for the Toronto Argonauts to move to BMO Field\nBMO Field\nBMO FieldCoordinates: 43°37′59.6″N 79°25′06.9″W\nDonateCreate accountLog in"
    ],
    "retrieved_context": "| Events and tenants                    | Events and tenants                      | Events and tenants                             |\n|:--------------------------------------|:----------------------------------------|:-----------------------------------------------|\n| Preceded by first stadium             | Home of Toronto FC 2007–present         | Succeeded by current                           |\n| Preceded by Stadion Galgenwaa Utrecht | FIFA U-20 World Cup rd Final Venue 2007 | Succeeded by Cairo International Stadium Cairo |\n| Preceded by first stadium             | Home of Toronto Nationals 2009          | Succeeded by Lamport Stadium                   |"
  },
  {
    "id": "qa_492_002",
    "source": "b71ccc88bc2b964767ab729ecf95940b.pdf",
    "page_numbers": [
      21
    ],
    "table_idx": 0,
    "question": "According to the table, since which year has BMO Field been the home of Toronto FC?",
    "answer": "BMO Field has been the home of Toronto FC since 2007.",
    "retrieved_chunks": [
      "BMO Field\n 30 languages\nArticleTalk ReadEditView historyTools\nBMO Field\nBMO Field in May 2016\nLocation in Toronto\nLocation in Southern OntarioFrom Wikipedia, the free encyclopedia\nNot to be confused with BMO Stadium in Los Angeles, California.\nBMO Field is an outdoor stadium located at Exhibition Place\nin Toronto, Ontario, Canada. Constructed on the former\nExhibition Stadium site and first opened in 2007, it is the\nhome field of Toronto FC of Major League Soccer (MLS) and\nToronto Argonauts of the Canadian Football League (CFL).\nBMO Field is owned by the City of Toronto and managed by\nMaple Leaf Sports & Entertainment, which owns both Toronto\nFC and the Argonauts. The stadium's naming rights are held\nby the Bank of Montreal, which is commonly branded as\n\"BMO\" (/ˈbiːmoʊ/). It is one of two Canadian stadiums which\nwill host matches of the upcoming 2026 FIFA World Cup. An\nexpansion for the tournament will bring the stadium's capacity\nto 45,736 seats.[11]\nBMO Field was originally constructed as a soccer-specific\nstadium for the 2007 FIFA U-20 World Cup[12] and first home\nfor Toronto FC. It hosted matches during the 2007 FIFA U-20\nWorld Cup and 2014 FIFA U-20 Women's World Cup. In\n2010, when it was still a neutral-site game, BMO Field hosted\nthe MLS Cup. It has since hosted the 2016 and 2017 finals\nfeaturing Toronto FC, under the current practice of giving\nhome field advantage to the side with the better regular-\nseason record. The venue has also hosted rugby union,\nincluding matches of Canada's national team, and rugby\nsevens during the 2015 Pan-American Games.\nFrom 2014 to 2016, the stadium underwent a series of major\nrenovations, which added an upper deck to the east\ngrandstand and a roof over the seating areas, and lengthened\nthe field to make it suitable for hosting Canadian football. The\nlatter allowed for the Toronto Argonauts to move to BMO Field\nBMO Field\nBMO FieldCoordinates: 43°37′59.6″N 79°25′06.9″W\nDonateCreate accountLog in"
    ],
